Spotting ID,Bee Spotter,Date Added to Site,Year Added to Site,Month Added to Site,Day Added to Site,Number of Days Between Site Launch and Date Added to Site,Title,Date Spotted,Year Spotted,Month Spotted,Day Spotted,Number of Days Between Site Launch and Date Spotted,Number of Days Between Date Spotted and Date Added to Site,Latitude,Longitude,Amateur Species Identification,Expert Species Identification (Primary),Expert Species Identification (Secondary),Protected Species?,Location Obscured?,Gender,Spotting URL
4006,melissarecords,3/15/2015,2015,3,15,2714,Bee on witch hazel,3/11/2015,2015,3,11,2710,4,40.10086295,-88.24776113,Apis mellifera,Apis mellifera,,f,f,female,https://beespotter.org/bee/4006
4016,melabee,4/4/2015,2015,4,4,2734,krohns bee,3/14/2015,2015,3,14,2713,21,39.1153012,-84.4900948,Apis mellifera,Apis mellifera,,f,f,female,https://beespotter.org/bee/4016
4007,SkrentnyJeff,3/17/2015,2015,3,17,2716,LaBagh #1 2015,3/16/2015,2015,3,16,2715,1,41.97939248,-87.74286747,,Apis mellifera,,f,f,female,https://beespotter.org/bee/4007
4019,samlindgren,4/9/2015,2015,4,9,2739,Bee in Crocus,3/19/2015,2015,3,19,2718,21,40.1141338,-88.25767994,Apis mellifera,Apis mellifera,,f,f,female,https://beespotter.org/bee/4019
4052,ZoogaShaka,5/9/2015,2015,5,9,2769,Bumblebee on Atlantic Camas at CRP visitor center prairie,4/9/2015,2015,4,9,2739,30,32.63789319,-96.95782185,Bombus griseocollis,Bombus griseocollis,,f,f,female,https://beespotter.org/bee/4052
4026,twotringas,4/14/2015,2015,4,14,2744,bimaculatus on Pansy,4/14/2015,2015,4,14,2744,0,42.30397562,-89.15714264,Bombus bimaculatus,Bombus bimaculatus,,f,f,female,https://beespotter.org/bee/4026
4027,jmbaldi,4/16/2015,2015,4,16,2746,"Cherry tree, first bloom of 2015",4/16/2015,2015,4,16,2746,0,41.53788,-88.15429688,Bombus auricomus,Apis mellifera,,f,f,female,https://beespotter.org/bee/4027
4029,SkrentnyJeff,4/17/2015,2015,4,17,2747,Large Bumble Bee #1,4/17/2015,2015,4,17,2747,0,41.97876439,-87.74045885,Bombus vagans,Bombus bimaculatus,,f,f,female,https://beespotter.org/bee/4029
4030,SkrentnyJeff,4/17/2015,2015,4,17,2747,Large Bumble Bee #2,4/17/2015,2015,4,17,2747,0,41.97856101,-87.74058491,Bombus vagans,Bombus bimaculatus,Bombus impatiens,f,f,female,https://beespotter.org/bee/4030
4040,SkrentnyJeff,4/27/2015,2015,4,27,2757,MM Honey Bee #2,4/17/2015,2015,4,17,2747,10,41.95719434,-87.71916479,Apis mellifera,Apis mellifera,,f,f,female,https://beespotter.org/bee/4040
4031,beank,4/18/2015,2015,4,18,2748,Bird Bath,4/18/2015,2015,4,18,2748,0,39.20472359,-94.6740818,Apis mellifera,Apis mellifera,,f,f,female,https://beespotter.org/bee/4031
4037,twotringas,4/20/2015,2015,4,20,2750,impatiens on Magnolia,4/18/2015,2015,4,18,2748,2,,,Bombus impatiens,Bombus impatiens,,f,f,female,https://beespotter.org/bee/4037
4032,jmbaldi,4/19/2015,2015,4,19,2749,Bumble in Bolingbrook,4/19/2015,2015,4,19,2749,0,41.69537896,-88.07280064,Bombus fraternus,Bombus bimaculatus,,f,f,female,https://beespotter.org/bee/4032
4063,mmckelve,5/20/2015,2015,5,20,2780,Kevin's bathroom bee,4/19/2015,2015,4,19,2749,31,42.26323225,-85.56394865,Bombus auricomus,Bombus bimaculatus,Bombus griseocollis,f,f,female,https://beespotter.org/bee/4063
4042,Appyjumper,4/28/2015,2015,4,28,2758,Large Lazy Bumble on Yellow Rocket,4/28/2015,2015,4,28,2758,0,38.36641765,-90.5370606,Bombus affinis,Bombus griseocollis,,f,f,female,https://beespotter.org/bee/4042
4044,TER_OR,5/5/2015,2015,5,5,2765,Bimiculatus queen,5/1/2015,2015,5,1,2761,4,42.10146236,-88.27732444,Bombus bimaculatus,Bombus bimaculatus,,f,f,female,https://beespotter.org/bee/4044
4053,twotringas,5/10/2015,2015,5,10,2770,bimaculatus queen,5/4/2015,2015,5,4,2764,6,42.304981,-89.156791,Bombus bimaculatus,Bombus bimaculatus,,f,f,female,https://beespotter.org/bee/4053
4054,twotringas,5/10/2015,2015,5,10,2770,honey bee on Grape Hyacinth,5/4/2015,2015,5,4,2764,6,42.304981,-89.156791,Apis mellifera,Apis mellifera,,f,f,female,https://beespotter.org/bee/4054
4045,ecogarden,5/6/2015,2015,5,6,2766,Bee on Garage,5/6/2015,2015,5,6,2766,0,41.869358,-87.799529,Bombus fervidus,Bombus fervidus,,f,f,female,https://beespotter.org/bee/4045
4048,Dave_K,5/6/2015,2015,5,6,2766,Honeybee on Apple1,5/6/2015,2015,5,6,2766,0,41.9709776,-87.95757294,Apis mellifera,Apis mellifera,,f,f,female,https://beespotter.org/bee/4048
4049,Dave_K,5/6/2015,2015,5,6,2766,Honeybee on Apple2,5/6/2015,2015,5,6,2766,0,41.97008421,-87.9577446,Apis mellifera,Apis mellifera,,f,f,female,https://beespotter.org/bee/4049
4055,twotringas,5/10/2015,2015,5,10,2770,auricomus queen,5/6/2015,2015,5,6,2766,4,42.304981,-89.156791,Bombus auricomus,Bombus auricomus,,f,f,female,https://beespotter.org/bee/4055
4057,SkrentnyJeff,5/14/2015,2015,5,14,2774,LaBagh 2015May14-1,5/14/2015,2015,5,14,2774,0,41.97696783,-87.74164438,Bombus griseocollis,Bombus griseocollis,,f,f,female,https://beespotter.org/bee/4057
4058,kgarcia,5/15/2015,2015,5,15,2775,possible rusty-patched or griseocollis,5/15/2015,2015,5,15,2775,0,38.61417743,-90.25996506,Bombus griseocollis,Bombus griseocollis,,f,f,female,https://beespotter.org/bee/4058
4060,SkrentnyJeff,5/18/2015,2015,5,18,2778,LaBagh 2015May17-1,5/17/2015,2015,5,17,2777,1,41.97948021,-87.7396059,Bombus fervidus,Bombus fervidus,,f,f,female,https://beespotter.org/bee/4060
4100,lfelliott,6/13/2015,2015,6,13,2804,Bombus as Salvia,5/17/2015,2015,5,17,2777,27,38.9467895,-92.4462802,Bombus pensylvanicus,Bombus pensylvanicus,,f,f,female,https://beespotter.org/bee/4100
4059,ecogarden,5/18/2015,2015,5,18,2778,Bombus on Amsonia,5/18/2015,2015,5,18,2778,0,41.869358,-87.799529,Bombus bimaculatus,Bombus griseocollis,,f,f,female,https://beespotter.org/bee/4059
4132,lfelliott,6/21/2015,2015,6,21,2812,on Amorpha fruticosa,5/18/2015,2015,5,18,2778,34,38.9467895,-92.4462802,Bombus griseocollis,Bombus griseocollis,,f,f,female,https://beespotter.org/bee/4132
4065,PepperCreek,5/21/2015,2015,5,21,2781,Large and Fast,5/21/2015,2015,5,21,2781,0,42.239773,-88.97434,Bombus fervidus,Bombus fervidus,,f,f,female,https://beespotter.org/bee/4065
4066,SkrentnyJeff,5/21/2015,2015,5,21,2781,Advocate 2015May21-1,5/21/2015,2015,5,21,2781,0,41.9371123,-87.65388384,Bombus griseocollis,Bombus impatiens,,f,f,female,https://beespotter.org/bee/4066
4137,Monotropa,6/21/2015,2015,6,21,2812,Baptisia-may,5/21/2015,2015,5,21,2781,31,39.10829348,-93.18440169,,Bombus auricomus,,f,f,female,https://beespotter.org/bee/4137
4079,knobren,5/29/2015,2015,5,29,2789,pic320 on raspberry,5/23/2015,2015,5,23,2783,6,40.105089,-88.290995,Bombus bimaculatus,Bombus bimaculatus,,f,f,female,https://beespotter.org/bee/4079
4070,Nolandobgsu,5/25/2015,2015,5,25,2785,Pearl's Bees,5/25/2015,2015,5,25,2785,0,37.88352498,-84.78149414,,Bombus griseocollis,,f,f,,https://beespotter.org/bee/4070
4073,SkrentnyJeff,5/28/2015,2015,5,28,2788,LaBagh 2015May28-1,5/28/2015,2015,5,28,2788,0,41.97629785,-87.74213791,Apis mellifera,Apis mellifera,,f,f,,https://beespotter.org/bee/4073
4075,SkrentnyJeff,5/28/2015,2015,5,28,2788,LaBagh 2015May28-3,5/28/2015,2015,5,28,2788,0,41.97632975,-87.74211645,Apis mellifera,Apis mellifera,,f,f,,https://beespotter.org/bee/4075
4113,ecogarden,6/17/2015,2015,6,17,2808,Bombus on May Night Sage 5/29/15,5/29/2015,2015,5,29,2789,19,41.869358,-87.799529,Bombus bimaculatus,Bombus bimaculatus,,f,f,female,https://beespotter.org/bee/4113
4099,lfelliott,6/13/2015,2015,6,13,2804,Bombus at blacklight,5/30/2015,2015,5,30,2790,14,38.9467895,-92.4462802,Bombus griseocollis,Bombus impatiens,,f,f,female,https://beespotter.org/bee/4099
4089,twotringas,6/4/2015,2015,6,4,2795,Queen auricomus on Baptisia,6/1/2015,2015,6,1,2792,3,42.304981,-89.156791,Bombus auricomus,Bombus auricomus,,f,f,female,https://beespotter.org/bee/4089
4254,annerem,7/4/2015,2015,7,4,2825,Unknown 2015,6/1/2015,2015,6,1,2792,33,42.275127,-89.07354,Bombus impatiens,Bombus impatiens,,f,f,female,https://beespotter.org/bee/4254
4090,twotringas,6/4/2015,2015,6,4,2795,bimaculatus on sage,6/2/2015,2015,6,2,2793,2,,,Bombus bimaculatus,Bombus bimaculatus,,f,f,female,https://beespotter.org/bee/4090
4114,ecogarden,6/17/2015,2015,6,17,2808,Bombus on Nepeta 6/2/15,6/2/2015,2015,6,2,2793,15,41.869358,-87.799529,Bombus griseocollis,Bombus griseocollis,,f,f,female,https://beespotter.org/bee/4114
4115,ecogarden,6/17/2015,2015,6,17,2808,Different Bombus (on May Night Sage) 6/2/15,6/2/2015,2015,6,2,2793,15,41.869358,-87.799529,Bombus griseocollis,Bombus griseocollis,,f,f,female,https://beespotter.org/bee/4115
4093,twotringas,6/7/2015,2015,6,7,2798,queen citrinus on White Clover,6/4/2015,2015,6,4,2795,3,42.304981,-89.156791,Bombus citrinus,Bombus citrinus,,f,f,female,https://beespotter.org/bee/4093
4715,JferSuz,1/30/2016,2016,1,30,3035,2015 swamp milkweed Cinderella,6/5/2015,2015,6,5,2796,239,39.306828,-84.23551,Bombus variabilis,Bombus griseocollis,,f,f,female,https://beespotter.org/bee/4715
4092,twotringas,6/7/2015,2015,6,7,2798,griseocollis on Baptisia,6/6/2015,2015,6,6,2797,1,42.304981,-89.156791,Bombus griseocollis,Bombus griseocollis,,f,f,female,https://beespotter.org/bee/4092
4098,lindapopp,6/12/2015,2015,6,12,2803,female bumble bee,6/7/2015,2015,6,7,2798,5,42.27065467,-88.35396398,Bombus pensylvanicus,Bombus bimaculatus,,f,f,female,https://beespotter.org/bee/4098
4294,cjshields,7/9/2015,2015,7,9,2830,first honeybee of year,6/8/2015,2015,6,8,2799,31,41.6871064,-88.330461,Apis mellifera,Apis mellifera,,f,f,female,https://beespotter.org/bee/4294
4096,SkrentnyJeff,6/11/2015,2015,6,11,2802,Gensburg - Markham Prairie 2015June09-1,6/9/2015,2015,6,9,2800,2,41.60512012,-87.69105524,Bombus pensylvanicus,Bombus pensylvanicus,,f,f,female,https://beespotter.org/bee/4096
4104,twotringas,6/14/2015,2015,6,14,2805,griseocolis on Pale Purple Coneflower,6/13/2015,2015,6,13,2804,1,42.304981,-89.156791,Bombus griseocollis,Bombus griseocollis,,f,f,female,https://beespotter.org/bee/4104
4105,twotringas,6/14/2015,2015,6,14,2805,queen affinis on Pale Purple Coneflower,6/13/2015,2015,6,13,2804,1,42.304981,-89.156791,Bombus affinis,Bombus impatiens,Bombus bimaculatus,f,f,female,https://beespotter.org/bee/4105
4106,twotringas,6/14/2015,2015,6,14,2805,queen citrinus on White Clover,6/13/2015,2015,6,13,2804,1,42.304981,-89.156791,Bombus citrinus,Bombus citrinus,,f,f,female,https://beespotter.org/bee/4106
4107,twotringas,6/14/2015,2015,6,14,2805,queen griseocolis on Pale Purple Coneflower,6/13/2015,2015,6,13,2804,1,42.304981,-89.156791,Bombus griseocollis,Bombus griseocollis,,f,f,female,https://beespotter.org/bee/4107
4116,TER_OR,6/17/2015,2015,6,17,2808,Gris Dixon Tower 1,6/13/2015,2015,6,13,2804,4,41.2160394,-89.32164788,Bombus griseocollis,Bombus griseocollis,,f,f,female,https://beespotter.org/bee/4116
4117,TER_OR,6/17/2015,2015,6,17,2808,Gris Dixon Tower 2,6/13/2015,2015,6,13,2804,4,41.21672136,-89.32183027,Bombus griseocollis,Bombus griseocollis,,f,f,female,https://beespotter.org/bee/4117
4118,TER_OR,6/17/2015,2015,6,17,2808,honeybee dixon tower,6/13/2015,2015,6,13,2804,4,41.21585781,-89.32201803,Apis mellifera,Apis mellifera,,f,f,female,https://beespotter.org/bee/4118
4592,ecogarden,9/11/2015,2015,9,11,2894,Honeybee,6/13/2015,2015,6,13,2804,90,41.869358,-87.799529,Apis mellifera,Apis mellifera,,f,f,female,https://beespotter.org/bee/4592
4103,Ecrable23,6/14/2015,2015,6,14,2805,Honey bee 1,6/14/2015,2015,6,14,2805,0,39.083858,-84.35574,Apis mellifera,Apis mellifera,,f,f,,https://beespotter.org/bee/4103
4108,Slhatch,6/15/2015,2015,6,15,2806,AL's #1,6/14/2015,2015,6,14,2805,1,42.00625881,-87.67623603,Apis mellifera,Apis mellifera,,f,f,female,https://beespotter.org/bee/4108
4119,TER_OR,6/17/2015,2015,6,17,2808,Gris Dixon Oak 1,6/14/2015,2015,6,14,2805,3,41.22281832,-89.34289098,Bombus griseocollis,Bombus griseocollis,,f,f,female,https://beespotter.org/bee/4119
4120,TER_OR,6/17/2015,2015,6,17,2808,Gris Dixon Oak 2,6/14/2015,2015,6,14,2805,3,41.22292322,-89.34247255,Bombus griseocollis,Bombus griseocollis,,f,f,male,https://beespotter.org/bee/4120
4121,TER_OR,6/17/2015,2015,6,17,2808,Auricomis dixon oak 1,6/14/2015,2015,6,14,2805,3,41.22322987,-89.34293389,Bombus auricomus,Bombus auricomus,,f,f,female,https://beespotter.org/bee/4121
4122,TER_OR,6/17/2015,2015,6,17,2808,honeybee dixon oak 1,6/14/2015,2015,6,14,2805,3,41.22353652,-89.34316993,Apis mellifera,Apis mellifera,,f,f,female,https://beespotter.org/bee/4122
4123,TER_OR,6/17/2015,2015,6,17,2808,honeybee dixon oak 2,6/14/2015,2015,6,14,2805,3,41.2233146,-89.33903396,Apis mellifera,Apis mellifera,,f,f,female,https://beespotter.org/bee/4123
4124,TER_OR,6/17/2015,2015,6,17,2808,Gris Dixon Oak 3,6/14/2015,2015,6,14,2805,3,41.22304427,-89.33891058,Bombus griseocollis,Bombus griseocollis,,f,f,female,https://beespotter.org/bee/4124
4125,TER_OR,6/17/2015,2015,6,17,2808,Penn Dixon Oak 1,6/14/2015,2015,6,14,2805,3,41.22316128,-89.33896959,Bombus pensylvanicus,Bombus pensylvanicus,,f,f,female,https://beespotter.org/bee/4125
4154,twotringas,6/21/2015,2015,6,21,2812,Honey Bee on Spiderwort,6/14/2015,2015,6,14,2805,7,42.304981,-89.156791,Apis mellifera,Apis mellifera,,f,f,female,https://beespotter.org/bee/4154
4109,Slhatch,6/15/2015,2015,6,15,2806,Shelby's #1,6/15/2015,2015,6,15,2806,0,42.00612712,-87.67635454,Apis mellifera,Apis mellifera,,f,f,female,https://beespotter.org/bee/4109
4112,jmbaldi,6/16/2015,2015,6,16,2807,Bee at  Bolingbrook Prominade,6/16/2015,2015,6,16,2807,0,41.71839884,-88.04200888,,Bombus bimaculatus,,f,f,,https://beespotter.org/bee/4112
4158,twotringas,6/21/2015,2015,6,21,2812,Vagans on Pale Purple Coneflower,6/16/2015,2015,6,16,2807,5,42.304981,-89.156791,Bombus vagans,Bombus vagans,,f,f,female,https://beespotter.org/bee/4158
4161,knobren,6/21/2015,2015,6,21,2812,lavender,6/18/2015,2015,6,18,2809,3,40.105089,-88.290995,Bombus bimaculatus,Bombus bimaculatus,,f,f,female,https://beespotter.org/bee/4161
4145,Monotropa,6/21/2015,2015,6,21,2812,Monarda-norain,6/20/2015,2015,6,20,2811,1,,,Bombus vagans,Bombus bimaculatus,,f,f,female,https://beespotter.org/bee/4145
4177,mrtorrence,6/22/2015,2015,6,22,2813,7:00 PM,6/20/2015,2015,6,20,2811,2,39.136512,-84.558301,Apis mellifera,Apis mellifera,,f,f,,https://beespotter.org/bee/4177
4130,Lovetheswarm,6/21/2015,2015,6,21,2812,"Forest Park, St. Louis",6/21/2015,2015,6,21,2812,0,38.6452462,-90.2857967,Bombus auricomus,Bombus bimaculatus,Bombus griseocollis,f,f,female,https://beespotter.org/bee/4130
4133,paws,6/21/2015,2015,6,21,2812,Bee062115,6/21/2015,2015,6,21,2812,0,39.23082813,-84.3870763,Bombus variabilis,Bombus impatiens,Bombus bimaculatus,f,f,male,https://beespotter.org/bee/4133
4136,mbees,6/21/2015,2015,6,21,2812,sunning bee,6/21/2015,2015,6,21,2812,0,40.11818696,-88.2654047,,Bombus griseocollis,,f,f,female,https://beespotter.org/bee/4136
4142,Lovetheswarm,6/21/2015,2015,6,21,2812,Two,6/21/2015,2015,6,21,2812,0,38.60399328,-90.3062439,Apis mellifera,Apis mellifera,,f,f,female,https://beespotter.org/bee/4142
4143,RLC42,6/21/2015,2015,6,21,2812,Front yard,6/21/2015,2015,6,21,2812,0,37.96801944,-89.16091919,Apis mellifera,Apis mellifera,,f,f,female,https://beespotter.org/bee/4143
4144,Monotropa,6/21/2015,2015,6,21,2812,Beebalm-rain,6/21/2015,2015,6,21,2812,0,39.10847663,-93.1844312,Bombus bimaculatus,Bombus bimaculatus,,f,f,male,https://beespotter.org/bee/4144
4146,Lovetheswarm,6/21/2015,2015,6,21,2812,Crown vetch,6/21/2015,2015,6,21,2812,0,38.8063052,-89.9470767,Bombus variabilis,Bombus bimaculatus,,f,f,female,https://beespotter.org/bee/4146
4147,Lovetheswarm,6/21/2015,2015,6,21,2812,Monarda,6/21/2015,2015,6,21,2812,0,38.8063052,-89.9470767,Bombus variabilis,Bombus bimaculatus,,f,f,female,https://beespotter.org/bee/4147
4148,Monotropa,6/21/2015,2015,6,21,2812,Monarda-rain-2,6/21/2015,2015,6,21,2812,0,39.10841419,-93.18444461,Bombus bimaculatus,Bombus bimaculatus,,f,f,female,https://beespotter.org/bee/4148
4149,Monotropa,6/21/2015,2015,6,21,2812,Monarda-rain-3,6/21/2015,2015,6,21,2812,0,39.10846831,-93.1844312,Bombus vagans,Bombus vagans,,f,f,female,https://beespotter.org/bee/4149
4150,Ecrable23,6/21/2015,2015,6,21,2812,Bumblebee 1,6/21/2015,2015,6,21,2812,0,39.2383668,-84.3493764,Bombus affinis,Bombus bimaculatus,,f,f,,https://beespotter.org/bee/4150
4151,anneparmley,6/21/2015,2015,6,21,2812,Bee Balm garden,6/21/2015,2015,6,21,2812,0,37.19176132,-88.72480676,Bombus affinis,Bombus bimaculatus,,f,f,female,https://beespotter.org/bee/4151
4152,TER_OR,6/21/2015,2015,6,21,2812,bimaculatus 062115,6/21/2015,2015,6,21,2812,0,42.10124544,-88.2771796,Bombus bimaculatus,Bombus bimaculatus,,f,f,female,https://beespotter.org/bee/4152
4155,twotringas,6/21/2015,2015,6,21,2812,Honey Bee on Pale Purple Coneflower,6/21/2015,2015,6,21,2812,0,42.304981,-89.156791,Apis mellifera,Apis mellifera,,f,f,female,https://beespotter.org/bee/4155
4156,QueenBEE1,6/21/2015,2015,6,21,2812,Bumble on Salvia,6/21/2015,2015,6,21,2812,0,,,Bombus impatiens,Bombus bimaculatus,Bombus griseocollis,f,f,female,https://beespotter.org/bee/4156
4157,twotringas,6/21/2015,2015,6,21,2812,griseocollis on Pale Purple Coneflower,6/21/2015,2015,6,21,2812,0,42.304981,-89.156791,Bombus griseocollis,Bombus griseocollis,,f,f,male,https://beespotter.org/bee/4157
4159,Dave_K,6/21/2015,2015,6,21,2812,Honeybee on Oregano 1,6/21/2015,2015,6,21,2812,0,41.93858391,-88.07732821,Apis mellifera,Apis mellifera,,f,f,female,https://beespotter.org/bee/4159
4160,Dave_K,6/21/2015,2015,6,21,2812,Honeybee on Oregano 2,6/21/2015,2015,6,21,2812,0,41.93855199,-88.07732821,Apis mellifera,Apis mellifera,,f,f,female,https://beespotter.org/bee/4160
4162,Lovetheswarm,6/21/2015,2015,6,21,2812,Clover,6/21/2015,2015,6,21,2812,0,38.8063052,-89.9470767,Apis mellifera,Apis mellifera,,f,f,female,https://beespotter.org/bee/4162
4163,Lovetheswarm,6/21/2015,2015,6,21,2812,Monarda 2,6/21/2015,2015,6,21,2812,0,38.8063052,-89.9470767,Bombus variabilis,Bombus griseocollis,,f,f,female,https://beespotter.org/bee/4163
4164,retiredprof,6/21/2015,2015,6,21,2812,BeeBlitz-01,6/21/2015,2015,6,21,2812,0,40.0773889,-88.16313,,Bombus pensylvanicus,,f,f,female,https://beespotter.org/bee/4164
4165,retiredprof,6/21/2015,2015,6,21,2812,BeeBlitz-02,6/21/2015,2015,6,21,2812,0,40.0773889,-88.16313,,Bombus auricomus,,f,f,female,https://beespotter.org/bee/4165
4166,Diabrotica1,6/21/2015,2015,6,21,2812,Loda Prairie 6-21-15,6/21/2015,2015,6,21,2812,0,40.52748997,-88.07447433,Bombus griseocollis,Bombus griseocollis,,f,f,female,https://beespotter.org/bee/4166
4167,retiredprof,6/21/2015,2015,6,21,2812,BeeBlitz-03,6/21/2015,2015,6,21,2812,0,40.0773889,-88.16313,,Bombus pensylvanicus,,f,f,female,https://beespotter.org/bee/4167
4168,retiredprof,6/21/2015,2015,6,21,2812,BeeBlitz-04,6/21/2015,2015,6,21,2812,0,40.0773889,-88.16313,,Bombus griseocollis,,f,f,female,https://beespotter.org/bee/4168
4169,retiredprof,6/21/2015,2015,6,21,2812,BeeBlitz-05,6/21/2015,2015,6,21,2812,0,40.0773889,-88.16313,,Bombus griseocollis,,f,f,female,https://beespotter.org/bee/4169
4170,retiredprof,6/21/2015,2015,6,21,2812,BeeBlitz-06,6/21/2015,2015,6,21,2812,0,40.0773889,-88.16313,,Bombus griseocollis,,f,f,female,https://beespotter.org/bee/4170
4171,retiredprof,6/21/2015,2015,6,21,2812,BeeBlitz-07,6/21/2015,2015,6,21,2812,0,40.0773889,-88.16313,,Bombus griseocollis,,f,f,female,https://beespotter.org/bee/4171
4172,jjames,6/22/2015,2015,6,22,2813,home 1,6/21/2015,2015,6,21,2812,1,40.1808816,-88.55746508,Bombus griseocollis,Bombus griseocollis,,f,f,female,https://beespotter.org/bee/4172
4173,jjames,6/22/2015,2015,6,22,2813,pollinatarium,6/21/2015,2015,6,21,2812,1,40.08706008,-88.21440518,Bombus griseocollis,Bombus griseocollis,,f,f,female,https://beespotter.org/bee/4173
4174,jjames,6/22/2015,2015,6,22,2813,BT 1,6/21/2015,2015,6,21,2812,1,40.2069429,-88.39729428,Bombus auricomus,Bombus auricomus,,f,f,female,https://beespotter.org/bee/4174
4175,jjames,6/22/2015,2015,6,22,2813,Buffalo Trace 2,6/21/2015,2015,6,21,2812,1,40.2070699,-88.39779854,Bombus fervidus,Bombus fervidus,,f,f,female,https://beespotter.org/bee/4175
4176,jjames,6/22/2015,2015,6,22,2813,Buffalo Trace 3,6/21/2015,2015,6,21,2812,1,40.20725221,-88.40614289,Bombus auricomus,Bombus auricomus,,f,f,female,https://beespotter.org/bee/4176
4218,birder1949,6/30/2015,2015,6,30,2821,BeeBlitz,6/21/2015,2015,6,21,2812,9,40.095342,-88.20019,Bombus auricomus,Bombus impatiens,,f,f,female,https://beespotter.org/bee/4218
4220,Hikingmomma82648,7/1/2015,2015,7,1,2822,Sharp's Crossing 1,6/21/2015,2015,6,21,2812,10,40.21463644,-88.18294287,Apis mellifera,Apis mellifera,,f,f,female,https://beespotter.org/bee/4220
4221,Hikingmomma82648,7/1/2015,2015,7,1,2822,Sharp's Crossing 2,6/21/2015,2015,6,21,2812,10,40.21463644,-88.18307161,Apis mellifera,Apis mellifera,,f,f,female,https://beespotter.org/bee/4221
4180,cjosefson,6/23/2015,2015,6,23,2814,Bumble bee on white salvia,6/23/2015,2015,6,23,2814,0,39.8357408,-88.9861677,Bombus fraternus,Bombus bimaculatus,,f,f,female,https://beespotter.org/bee/4180
4182,jjames,6/24/2015,2015,6,24,2815,Amorpha Robinson,6/23/2015,2015,6,23,2814,1,40.82145094,-89.59723681,Bombus griseocollis,Bombus griseocollis,,f,f,female,https://beespotter.org/bee/4182
4216,twotringas,6/30/2015,2015,6,30,2821,pensylvanicus on White Wild Indigo,6/23/2015,2015,6,23,2814,7,42.304981,-89.156791,Bombus pensylvanicus,Bombus pensylvanicus,,f,f,female,https://beespotter.org/bee/4216
4217,twotringas,6/30/2015,2015,6,30,2821,citrinus on Pale Purple Coneflower,6/23/2015,2015,6,23,2814,7,42.304981,-89.156791,Bombus citrinus,Bombus citrinus,,f,f,,https://beespotter.org/bee/4217
4183,cjosefson,6/24/2015,2015,6,24,2815,bee on veronica,6/24/2015,2015,6,24,2815,0,39.8357408,-88.9861677,Bombus griseocollis,Bombus griseocollis,,f,f,female,https://beespotter.org/bee/4183
4186,Monotropa,6/27/2015,2015,6,27,2818,Honeybee on Sericea-Lespedeza,6/24/2015,2015,6,24,2815,3,39.13360139,-93.18121523,Apis mellifera,Apis mellifera,,f,f,female,https://beespotter.org/bee/4186
4184,cjosefson,6/25/2015,2015,6,25,2816,bumblebee on hosta,6/25/2015,2015,6,25,2816,0,39.8357408,-88.9861677,Bombus affinis,Bombus bimaculatus,Bombus griseocollis,f,f,female,https://beespotter.org/bee/4184
4187,Monotropa,6/27/2015,2015,6,27,2818,Honeybee on White-clover,6/25/2015,2015,6,25,2816,2,39.10845998,-93.18444192,Apis mellifera,Apis mellifera,,f,f,female,https://beespotter.org/bee/4187
4354,hdhuie,7/21/2015,2015,7,21,2842,workshop bee,6/25/2015,2015,6,25,2816,26,41.84079251,-88.26501846,Bombus rufocinctus,Bombus rufocinctus,,f,f,female,https://beespotter.org/bee/4354
4188,Monotropa,6/27/2015,2015,6,27,2818,Bumblebee on buttonbush,6/26/2015,2015,6,26,2817,1,39.10836841,-93.1845063,Bombus bimaculatus,Bombus bimaculatus,,f,f,male,https://beespotter.org/bee/4188
4185,lfelliott,6/27/2015,2015,6,27,2818,on Echinacea,6/27/2015,2015,6,27,2818,0,38.9467895,-92.4462802,Bombus bimaculatus,Bombus bimaculatus,,f,f,male,https://beespotter.org/bee/4185
4190,cjosefson,6/27/2015,2015,6,27,2818,rock springs zinnia,6/27/2015,2015,6,27,2818,0,39.8238186,-89.0116112,Bombus impatiens,Bombus griseocollis,,f,f,female,https://beespotter.org/bee/4190
4191,cjosefson,6/27/2015,2015,6,27,2818,rock springs hollyhock,6/27/2015,2015,6,27,2818,0,39.8238186,-89.0116112,Bombus impatiens,Bombus impatiens,,f,f,female,https://beespotter.org/bee/4191
4192,cjosefson,6/27/2015,2015,6,27,2818,rock springs swamp milkweed,6/27/2015,2015,6,27,2818,0,39.8238186,-89.0116112,Bombus impatiens,Bombus griseocollis,,f,f,female,https://beespotter.org/bee/4192
4193,knobren,6/27/2015,2015,6,27,2818,Sick bee? on grape leaf,6/27/2015,2015,6,27,2818,0,40.105089,-88.290995,Bombus affinis,Bombus griseocollis,,f,f,female,https://beespotter.org/bee/4193
4194,Links56,6/27/2015,2015,6,27,2818,By house,6/27/2015,2015,6,27,2818,0,41.3451346,-91.00959554,Bombus vagans,Bombus impatiens,,f,f,female,https://beespotter.org/bee/4194
4195,knobren,6/27/2015,2015,6,27,2818,yellow white on nightshade,6/27/2015,2015,6,27,2818,0,40.105089,-88.290995,Bombus impatiens,Bombus impatiens,,f,f,female,https://beespotter.org/bee/4195
4200,jjames,6/29/2015,2015,6,29,2820,ferv A 27,6/27/2015,2015,6,27,2818,2,40.181398,-88.55808735,Bombus fervidus,Bombus fervidus,,f,f,female,https://beespotter.org/bee/4200
4201,jjames,6/29/2015,2015,6,29,2820,ferv B 6-27,6/27/2015,2015,6,27,2818,2,40.18246359,-88.5579586,Bombus fervidus,Bombus fervidus,,f,f,female,https://beespotter.org/bee/4201
4203,jjames,6/29/2015,2015,6,29,2820,ferv E 6-27,6/27/2015,2015,6,27,2818,2,40.18523404,-88.5579586,Bombus fervidus,Bombus fervidus,,f,f,female,https://beespotter.org/bee/4203
4206,jjames,6/29/2015,2015,6,29,2820,impat C 6-27,6/27/2015,2015,6,27,2818,2,40.18775849,-88.55787277,Bombus impatiens,Bombus impatiens,,f,f,female,https://beespotter.org/bee/4206
4207,jjames,6/29/2015,2015,6,29,2820,impat D 6-27,6/27/2015,2015,6,27,2818,2,40.18618482,-88.55746508,Bombus impatiens,Bombus impatiens,,f,f,female,https://beespotter.org/bee/4207
4210,jjames,6/29/2015,2015,6,29,2820,impat F 6-27,6/27/2015,2015,6,27,2818,2,40.18715198,-88.55752945,Bombus impatiens,Bombus impatiens,,f,f,female,https://beespotter.org/bee/4210
4197,Monotropa,6/28/2015,2015,6,28,2819,bombus-on-Echinacea_purp,6/28/2015,2015,6,28,2819,0,39.10830597,-93.18457335,Bombus griseocollis,Bombus griseocollis,,f,f,male,https://beespotter.org/bee/4197
4198,pondbug,6/28/2015,2015,6,28,2819,Bee in Front Yard,6/28/2015,2015,6,28,2819,0,38.589054,-89.996247,Bombus affinis,Bombus griseocollis,,f,f,female,https://beespotter.org/bee/4198
4202,jjames,6/29/2015,2015,6,29,2820,ferv B 6-28,6/28/2015,2015,6,28,2819,1,40.18464389,-88.55821609,Bombus fervidus,Bombus fervidus,,f,f,female,https://beespotter.org/bee/4202
4204,jjames,6/29/2015,2015,6,29,2820,ferv E 6-28,6/28/2015,2015,6,28,2819,1,40.18808634,-88.55808735,Bombus fervidus,Bombus fervidus,,f,f,female,https://beespotter.org/bee/4204
4205,jjames,6/29/2015,2015,6,29,2820,gris C 6-28,6/28/2015,2015,6,28,2819,1,40.18854532,-88.55804443,Bombus griseocollis,Bombus griseocollis,,f,f,female,https://beespotter.org/bee/4205
4208,jjames,6/29/2015,2015,6,29,2820,impat D 6-28,6/28/2015,2015,6,28,2819,1,40.1871028,-88.55785131,Bombus impatiens,Bombus impatiens,,f,f,female,https://beespotter.org/bee/4208
4209,jjames,6/29/2015,2015,6,29,2820,impat A 6-28,6/28/2015,2015,6,28,2819,1,40.1868897,-88.55785131,Bombus impatiens,Bombus impatiens,,f,f,female,https://beespotter.org/bee/4209
4212,twotringas,6/30/2015,2015,6,30,2821,Honey Bee on Illinois Rose,6/28/2015,2015,6,28,2819,2,42.304981,-89.156791,Apis mellifera,Apis mellifera,,f,f,female,https://beespotter.org/bee/4212
4460,Wilson,8/2/2015,2015,8,2,2854,Yard Bumble June 15,6/28/2015,2015,6,28,2819,35,39.832089,-88.9290316,Bombus impatiens,Bombus griseocollis,,f,f,female,https://beespotter.org/bee/4460
4211,cjosefson,6/29/2015,2015,6,29,2820,on common milkweed,6/29/2015,2015,6,29,2820,0,39.78673791,-88.93939684,Bombus griseocollis,Bombus griseocollis,,f,f,male,https://beespotter.org/bee/4211
4219,jilla,6/30/2015,2015,6,30,2821,B_fervidus_Monarda2015,6/29/2015,2015,6,29,2820,1,41.88486669,-87.81784058,Bombus fervidus,Bombus fervidus,,f,f,female,https://beespotter.org/bee/4219
4297,rafealfarris,7/10/2015,2015,7,10,2831,back yard,6/29/2015,2015,6,29,2820,11,39.203894,-84.1899786,Apis mellifera,Apis mellifera,,f,f,female,https://beespotter.org/bee/4297
4213,twotringas,6/30/2015,2015,6,30,2821,bimaculatus on Illinois Rose,6/30/2015,2015,6,30,2821,0,42.304981,-89.156791,Bombus bimaculatus,Bombus bimaculatus,,f,f,female,https://beespotter.org/bee/4213
4214,twotringas,6/30/2015,2015,6,30,2821,impatiens on Illinois Rose,6/30/2015,2015,6,30,2821,0,42.304981,-89.156791,Bombus impatiens,Bombus impatiens,,f,f,female,https://beespotter.org/bee/4214
4215,twotringas,6/30/2015,2015,6,30,2821,griseocollis on Illinois Rose,6/30/2015,2015,6,30,2821,0,,,Bombus griseocollis,Bombus griseocollis,,f,f,female,https://beespotter.org/bee/4215
4222,Mabeno,7/1/2015,2015,7,1,2822,070115ColeCenter,7/1/2015,2015,7,1,2822,0,41.772233,-88.311389,Bombus bimaculatus,Bombus griseocollis,,f,f,female,https://beespotter.org/bee/4222
4223,Mabeno,7/1/2015,2015,7,1,2822,070115ColeCenter2,7/1/2015,2015,7,1,2822,0,41.772233,-88.311389,Bombus fervidus,Bombus fervidus,,f,f,female,https://beespotter.org/bee/4223
4224,Mabeno,7/1/2015,2015,7,1,2822,070115ColeCenter3,7/1/2015,2015,7,1,2822,0,41.772233,-88.311389,Bombus griseocollis,Bombus griseocollis,,f,f,female,https://beespotter.org/bee/4224
4225,Mabeno,7/1/2015,2015,7,1,2822,070115ColeCenter7,7/1/2015,2015,7,1,2822,0,41.772233,-88.311389,Bombus griseocollis,Bombus griseocollis,,f,f,female,https://beespotter.org/bee/4225
4226,Mabeno,7/1/2015,2015,7,1,2822,070115ColeCenterbee8,7/1/2015,2015,7,1,2822,0,41.772233,-88.311389,Apis mellifera,Apis mellifera,,f,f,female,https://beespotter.org/bee/4226
4243,Cdepaola,7/3/2015,2015,7,3,2824,Purple Wings,7/1/2015,2015,7,1,2822,2,41.653923,-88.211834,Bombus variabilis,Bombus griseocollis,,f,f,female,https://beespotter.org/bee/4243
4268,Stal82,7/6/2015,2015,7,6,2827,Bee on Coreopsis,7/1/2015,2015,7,1,2822,5,41.36101925,-91.0141325,,Bombus impatiens,,f,f,female,https://beespotter.org/bee/4268
4227,cjosefson,7/2/2015,2015,7,2,2823,bumblebee on raspberry,7/2/2015,2015,7,2,2823,0,39.8357408,-88.9861677,Bombus bimaculatus,Bombus bimaculatus,Bombus griseocollis,f,f,female,https://beespotter.org/bee/4227
4230,cjosefson,7/2/2015,2015,7,2,2823,bumblebess on veronica,7/2/2015,2015,7,2,2823,0,39.8357408,-88.9861677,Bombus bimaculatus,Bombus impatiens,,f,f,female,https://beespotter.org/bee/4230
4231,cjosefson,7/2/2015,2015,7,2,2823,daylily,7/2/2015,2015,7,2,2823,0,39.8357408,-88.9861677,Bombus impatiens,Bombus impatiens,,f,f,female,https://beespotter.org/bee/4231
4233,twotringas,7/2/2015,2015,7,2,2823,Honey Bee on Canada Thistle,7/2/2015,2015,7,2,2823,0,42.35004453,-89.23962593,Apis mellifera,Apis mellifera,,f,f,female,https://beespotter.org/bee/4233
4234,twotringas,7/2/2015,2015,7,2,2823,Honey Bee on Canada Thistle,7/2/2015,2015,7,2,2823,0,42.3497908,-89.23979759,Apis mellifera,Apis mellifera,,f,f,female,https://beespotter.org/bee/4234
4235,twotringas,7/2/2015,2015,7,2,2823,impatiens on Canada Thistle,7/2/2015,2015,7,2,2823,0,42.35010796,-89.23984051,Bombus impatiens,Bombus impatiens,,f,f,female,https://beespotter.org/bee/4235
4236,twotringas,7/2/2015,2015,7,2,2823,rufocinctus on Canada Thistle,7/2/2015,2015,7,2,2823,0,42.3497908,-89.24014091,Bombus rufocinctus,Bombus rufocinctus,,f,f,male,https://beespotter.org/bee/4236
4237,twotringas,7/2/2015,2015,7,2,2823,griseocollis on Canada Thistle,7/2/2015,2015,7,2,2823,0,42.34966393,-89.24014091,Bombus griseocollis,Bombus griseocollis,,f,f,female,https://beespotter.org/bee/4237
4238,twotringas,7/2/2015,2015,7,2,2823,rufocinctus on Canada Thistle,7/2/2015,2015,7,2,2823,0,42.35004453,-89.24031258,Bombus rufocinctus,Bombus rufocinctus,,f,f,male,https://beespotter.org/bee/4238
4239,twotringas,7/2/2015,2015,7,2,2823,rufocinctus on Canada Thistle,7/2/2015,2015,7,2,2823,0,42.3497908,-89.24048424,Bombus rufocinctus,Bombus rufocinctus,,f,f,male,https://beespotter.org/bee/4239
4240,twotringas,7/2/2015,2015,7,2,2823,fervidus on Canada Thistle,7/2/2015,2015,7,2,2823,0,42.35029826,-89.24031258,Bombus fervidus,Bombus fervidus,,f,f,male,https://beespotter.org/bee/4240
4241,twotringas,7/2/2015,2015,7,2,2823,rufocinctus on Canada Thistle,7/2/2015,2015,7,2,2823,0,42.34991766,-89.24014091,Bombus rufocinctus,Bombus rufocinctus,,f,f,female,https://beespotter.org/bee/4241
4242,twotringas,7/2/2015,2015,7,2,2823,vagans on Canada Thistle,7/2/2015,2015,7,2,2823,0,42.34953707,-89.23979759,Bombus vagans,Bombus vagans,,f,f,female,https://beespotter.org/bee/4242
4244,twotringas,7/3/2015,2015,7,3,2824,bimaculatus on New Jersey Tea,7/3/2015,2015,7,3,2824,0,42.304981,-89.156791,Bombus bimaculatus,Bombus bimaculatus,,f,f,female,https://beespotter.org/bee/4244
4245,twotringas,7/3/2015,2015,7,3,2824,Honey Bee on Button Bush,7/3/2015,2015,7,3,2824,0,42.2447959,-89.1130122,Apis mellifera,Apis mellifera,,f,f,female,https://beespotter.org/bee/4245
4246,twotringas,7/3/2015,2015,7,3,2824,griseocollis on Purple Coneflower,7/3/2015,2015,7,3,2824,0,42.2447959,-89.1130122,Bombus griseocollis,Bombus griseocollis,,f,f,female,https://beespotter.org/bee/4246
4247,twotringas,7/3/2015,2015,7,3,2824,rufocinctus,7/3/2015,2015,7,3,2824,0,42.2447959,-89.1130122,Bombus rufocinctus,Bombus rufocinctus,,f,f,female,https://beespotter.org/bee/4247
4248,twotringas,7/3/2015,2015,7,3,2824,rufocinctus on Spirea,7/3/2015,2015,7,3,2824,0,42.2447959,-89.1130122,Bombus rufocinctus,Bombus rufocinctus,,f,f,female,https://beespotter.org/bee/4248
4249,twotringas,7/3/2015,2015,7,3,2824,vagans,7/3/2015,2015,7,3,2824,0,42.2447959,-89.1130122,Bombus vagans,Bombus vagans,,f,f,female,https://beespotter.org/bee/4249
4250,twotringas,7/3/2015,2015,7,3,2824,impatiens on Spirea,7/3/2015,2015,7,3,2824,0,42.2447959,-89.1130122,Bombus impatiens,Bombus impatiens,,f,f,female,https://beespotter.org/bee/4250
4255,Caroline,7/4/2015,2015,7,4,2825,Mom's yellow bumble bee,7/3/2015,2015,7,3,2824,1,41.807931,-87.999201,Bombus fervidus,Bombus fervidus,,f,f,female,https://beespotter.org/bee/4255
4267,jjames,7/6/2015,2015,7,6,2827,A 2015-07-03 gris,7/3/2015,2015,7,3,2824,3,40.17916636,-88.55796933,Bombus griseocollis,Bombus griseocollis,,f,f,female,https://beespotter.org/bee/4267
4269,jjames,7/6/2015,2015,7,6,2827,B 2015-07-03 impat,7/3/2015,2015,7,3,2824,3,40.17916841,-88.55796531,Bombus impatiens,Bombus impatiens,,f,f,female,https://beespotter.org/bee/4269
4270,jjames,7/6/2015,2015,7,6,2827,C 2015-07-03 auri,7/3/2015,2015,7,3,2824,3,40.18232425,-88.55766892,Bombus auricomus,Bombus auricomus,,f,f,female,https://beespotter.org/bee/4270
4271,jjames,7/6/2015,2015,7,6,2827,D 2015-07-03 gris,7/3/2015,2015,7,3,2824,3,40.18277507,-88.55767965,Bombus griseocollis,Bombus griseocollis,,f,f,female,https://beespotter.org/bee/4271
4272,jjames,7/6/2015,2015,7,6,2827,E 2015-07-03 gris,7/3/2015,2015,7,3,2824,3,40.18669299,-88.55772257,Bombus griseocollis,Bombus griseocollis,,f,f,male,https://beespotter.org/bee/4272
4273,jjames,7/6/2015,2015,7,6,2827,F 2015-07-03 gris,7/3/2015,2015,7,3,2824,3,40.18722574,-88.5577333,Bombus griseocollis,Bombus griseocollis,,f,f,female,https://beespotter.org/bee/4273
4274,jjames,7/6/2015,2015,7,6,2827,G 2015-07-03 impat,7/3/2015,2015,7,3,2824,3,40.18719296,-88.55772257,Bombus impatiens,Bombus impatiens,,f,f,female,https://beespotter.org/bee/4274
4275,jjames,7/6/2015,2015,7,6,2827,H 2015-07-03 auri,7/3/2015,2015,7,3,2824,3,40.18755359,-88.5577333,Bombus auricomus,Bombus auricomus,,f,f,female,https://beespotter.org/bee/4275
4276,jjames,7/6/2015,2015,7,6,2827,I 2015-07-03 impat,7/3/2015,2015,7,3,2824,3,40.18726058,-88.55756432,Bombus impatiens,Bombus impatiens,,f,f,female,https://beespotter.org/bee/4276
4251,cjosefson,7/4/2015,2015,7,4,2825,dahlia,7/4/2015,2015,7,4,2825,0,39.8357408,-88.9861677,Bombus bimaculatus,Bombus impatiens,,f,f,female,https://beespotter.org/bee/4251
4252,cjosefson,7/4/2015,2015,7,4,2825,on daylily,7/4/2015,2015,7,4,2825,0,39.8357408,-88.9861677,,Bombus impatiens,,f,f,,https://beespotter.org/bee/4252
4344,Monotropa,7/19/2015,2015,7,19,2840,Bombus-arrowrock,7/4/2015,2015,7,4,2825,15,39.06799267,-92.9421097,Bombus bimaculatus,Bombus bimaculatus,,f,f,female,https://beespotter.org/bee/4344
4257,Archiejoy,7/5/2015,2015,7,5,2826,Trevor's,7/5/2015,2015,7,5,2826,0,42.63799989,-90.8404541,Bombus griseocollis,Bombus griseocollis,,f,f,female,https://beespotter.org/bee/4257
4262,redpath,7/5/2015,2015,7,5,2826,Viola#1,7/5/2015,2015,7,5,2826,0,41.2117203,-90.5830792,Bombus bimaculatus,Bombus griseocollis,,f,f,female,https://beespotter.org/bee/4262
4263,cjosefson,7/5/2015,2015,7,5,2826,swamp milkweed,7/5/2015,2015,7,5,2826,0,39.8238321,-89.0116408,Bombus citrinus,Bombus griseocollis,,f,f,female,https://beespotter.org/bee/4263
4278,Mabeno,7/6/2015,2015,7,6,2827,bbf_honeybee,7/5/2015,2015,7,5,2826,1,41.7648839,-88.3910114,Apis mellifera,Apis mellifera,,f,f,female,https://beespotter.org/bee/4278
4289,twotringas,7/8/2015,2015,7,8,2829,griseocollis on Leadplant,7/5/2015,2015,7,5,2826,3,42.46024113,-89.10509706,Bombus griseocollis,Bombus griseocollis,,f,f,female,https://beespotter.org/bee/4289
4290,twotringas,7/8/2015,2015,7,8,2829,Honey Bee on Purple Coneflower,7/5/2015,2015,7,5,2826,3,42.46008283,-89.10503268,Apis mellifera,Apis mellifera,,f,f,female,https://beespotter.org/bee/4290
4265,mikekr2018,7/6/2015,2015,7,6,2827,bee tree,7/6/2015,2015,7,6,2827,0,41.41801504,-90.36254883,Apis mellifera,Apis mellifera,,f,f,female,https://beespotter.org/bee/4265
4266,jimtcat,7/6/2015,2015,7,6,2827,honeybee spot 1,7/6/2015,2015,7,6,2827,0,41.46787852,-90.45432061,,Apis mellifera,,f,f,female,https://beespotter.org/bee/4266
4277,jimtcat,7/6/2015,2015,7,6,2827,bee spot 2,7/6/2015,2015,7,6,2827,0,41.4678544,-90.45357496,,Apis mellifera,,f,f,female,https://beespotter.org/bee/4277
4279,annerem,7/6/2015,2015,7,6,2827,On hybrid bee balm,7/6/2015,2015,7,6,2827,0,42.275127,-89.07354,Bombus griseocollis,Bombus impatiens,,f,f,female,https://beespotter.org/bee/4279
4282,annerem,7/7/2015,2015,7,7,2828,On hybrid bee balm 2015,7/7/2015,2015,7,7,2828,0,42.275127,-89.07354,,Bombus auricomus,Bombus pensylvanicus,f,f,female,https://beespotter.org/bee/4282
4283,annerem,7/7/2015,2015,7,7,2828,Auricomus 2015,7/7/2015,2015,7,7,2828,0,42.275127,-89.07354,Bombus auricomus,Bombus auricomus,Bombus pensylvanicus,f,f,female,https://beespotter.org/bee/4283
4285,jjames,7/8/2015,2015,7,8,2829,dun gc a gris,7/7/2015,2015,7,7,2828,1,40.84184466,-89.63389724,Bombus griseocollis,Bombus griseocollis,,f,f,female,https://beespotter.org/bee/4285
4286,jjames,7/8/2015,2015,7,8,2829,dun gc b impat,7/7/2015,2015,7,7,2828,1,40.84186191,-89.6338892,Bombus impatiens,Bombus impatiens,,f,f,female,https://beespotter.org/bee/4286
4287,jjames,7/8/2015,2015,7,8,2829,dun gc c gris,7/7/2015,2015,7,7,2828,1,40.84180103,-89.63382483,Bombus griseocollis,Bombus griseocollis,,f,f,female,https://beespotter.org/bee/4287
4364,Erinehmas,7/21/2015,2015,7,21,2842,Front yard shrub,7/7/2015,2015,7,7,2828,14,42.067829,-87.768203,Apis mellifera,Apis mellifera,,f,f,female,https://beespotter.org/bee/4364
4369,Jim,7/22/2015,2015,7,22,2843,7-7-2015 6PM -2 coneflower,7/7/2015,2015,7,7,2828,15,40.88999871,-90.26876998,Bombus affinis,Bombus impatiens,,f,f,female,https://beespotter.org/bee/4369
4370,Jim,7/22/2015,2015,7,22,2843,7-7-2015 3 coneflower,7/7/2015,2015,7,7,2828,15,40.89016741,-90.26792884,Bombus affinis,Bombus griseocollis,,f,f,female,https://beespotter.org/bee/4370
4371,Jim,7/22/2015,2015,7,22,2843,7-7-2015 6PM 1 coneflower,7/7/2015,2015,7,7,2828,15,40.88999871,-90.26823783,Bombus affinis,Bombus griseocollis,,f,f,female,https://beespotter.org/bee/4371
4284,lindapopp,7/8/2015,2015,7,8,2829,Honey Bee,7/8/2015,2015,7,8,2829,0,42.271888,-88.3552557,Apis mellifera,Apis mellifera,,f,f,female,https://beespotter.org/bee/4284
4288,twotringas,7/8/2015,2015,7,8,2829,affinis on Purple Coneflower,7/8/2015,2015,7,8,2829,0,42.30339592,-89.11121551,Bombus affinis,Bombus affinis,,t,t,female,https://beespotter.org/bee/4288
4293,cjshields,7/9/2015,2015,7,9,2830,July 9 blip photo,7/9/2015,2015,7,9,2830,0,41.6871064,-88.330461,Apis mellifera,Apis mellifera,,f,f,female,https://beespotter.org/bee/4293
4295,annerem,7/9/2015,2015,7,9,2830,Vacant field2015,7/9/2015,2015,7,9,2830,0,42.3184775,-88.9992528,Bombus rufocinctus,Bombus rufocinctus,,f,f,,https://beespotter.org/bee/4295
4302,redpath,7/10/2015,2015,7,10,2831,Evening July 10,7/10/2015,2015,7,10,2831,0,41.2117203,-90.5830792,,Bombus bimaculatus,,f,f,male,https://beespotter.org/bee/4302
4303,cjshields,7/10/2015,2015,7,10,2831,2nd day in a row,7/10/2015,2015,7,10,2831,0,41.6871064,-88.330461,Apis mellifera,Apis mellifera,,f,f,female,https://beespotter.org/bee/4303
4304,peterwchen,7/11/2015,2015,7,11,2832,B. auricomus,7/10/2015,2015,7,10,2831,1,41.80075106,-88.17850113,Bombus auricomus,Bombus auricomus,,f,f,female,https://beespotter.org/bee/4304
4310,bebedowney,7/13/2015,2015,7,13,2834,camping,7/10/2015,2015,7,10,2831,3,41.6654045,-90.1473198,Apis mellifera,Apis mellifera,,f,f,female,https://beespotter.org/bee/4310
4313,jjames,7/13/2015,2015,7,13,2834,2015-07-10 bimac,7/10/2015,2015,7,10,2831,3,40.17915714,-88.55807595,Bombus bimaculatus,Bombus bimaculatus,,f,f,female,https://beespotter.org/bee/4313
4519,poppe72,8/21/2015,2015,8,21,2873,Honeybee,7/10/2015,2015,7,10,2831,42,41.546721,-87.654319,Apis mellifera,Apis mellifera,,f,f,female,https://beespotter.org/bee/4519
4521,poppe72,8/21/2015,2015,8,21,2873,Honeybee,7/10/2015,2015,7,10,2831,42,41.546721,-87.654319,Apis mellifera,Apis mellifera,,f,f,female,https://beespotter.org/bee/4521
4314,twotringas,7/13/2015,2015,7,13,2834,affinis on Culver's Root,7/11/2015,2015,7,11,2832,2,42.43896718,-89.24838394,Bombus affinis,Bombus affinis,,t,t,female,https://beespotter.org/bee/4314
4573,Caroline,8/29/2015,2015,8,29,2881,Keiselburg forest,7/11/2015,2015,7,11,2832,49,42.3870437,-89.0012007,Bombus rufocinctus,Bombus rufocinctus,,f,f,,https://beespotter.org/bee/4573
4593,ecogarden,9/11/2015,2015,9,11,2894,Bombus on Culver's Root,7/11/2015,2015,7,11,2832,62,41.869358,-87.799529,Bombus griseocollis,Bombus impatiens,,f,f,,https://beespotter.org/bee/4593
4315,twotringas,7/13/2015,2015,7,13,2834,Honey Bee on Culver's Root,7/12/2015,2015,7,12,2833,1,42.304981,-89.156791,Apis mellifera,Apis mellifera,,f,f,female,https://beespotter.org/bee/4315
4316,twotringas,7/13/2015,2015,7,13,2834,male citrinus on Culver's Root,7/12/2015,2015,7,12,2833,1,42.304981,-89.156791,Bombus citrinus,Bombus citrinus,,f,f,male,https://beespotter.org/bee/4316
4317,twotringas,7/13/2015,2015,7,13,2834,vagans on Culver's Root,7/12/2015,2015,7,12,2833,1,42.304981,-89.156791,Bombus vagans,Bombus vagans,,f,f,female,https://beespotter.org/bee/4317
4346,arebee,7/19/2015,2015,7,19,2840,milk,7/12/2015,2015,7,12,2833,7,40.09125028,-88.29366446,Bombus impatiens,Bombus impatiens,,f,f,female,https://beespotter.org/bee/4346
4378,NHFan,7/24/2015,2015,7,24,2845,Bumble bee #1,7/12/2015,2015,7,12,2833,12,40.68919682,-81.350348,Bombus affinis,Bombus griseocollis,,f,f,female,https://beespotter.org/bee/4378
4461,Wilson,8/2/2015,2015,8,2,2854,Honey Milkweed July,7/12/2015,2015,7,12,2833,21,39.832089,-88.9290316,Apis mellifera,Apis mellifera,,f,f,female,https://beespotter.org/bee/4461
4321,TER_OR,7/14/2015,2015,7,14,2835,vagans 071315,7/13/2015,2015,7,13,2834,1,42.10137479,-88.27705085,Bombus vagans,Bombus vagans,,f,f,male,https://beespotter.org/bee/4321
4322,TER_OR,7/14/2015,2015,7,14,2835,auricomis IP 071115,7/14/2015,2015,7,14,2835,0,41.84311846,-88.26628446,Bombus auricomus,Bombus auricomus,,f,f,female,https://beespotter.org/bee/4322
4323,TER_OR,7/14/2015,2015,7,14,2835,fervidus IP 071115,7/14/2015,2015,7,14,2835,0,41.84299058,-88.26615571,Bombus fervidus,Bombus fervidus,,f,f,female,https://beespotter.org/bee/4323
4327,mFlowers,7/16/2015,2015,7,16,2837,Galena bee #1,7/14/2015,2015,7,14,2835,2,42.40055424,-90.3312193,Bombus variabilis,Bombus vagans,,f,f,female,https://beespotter.org/bee/4327
4594,ecogarden,9/11/2015,2015,9,11,2894,Bombus on M. fistulosa,7/14/2015,2015,7,14,2835,59,41.869358,-87.799529,Bombus bimaculatus,Bombus bimaculatus,,f,f,,https://beespotter.org/bee/4594
4324,lindapopp,7/15/2015,2015,7,15,2836,two bombus on Liatris,7/15/2015,2015,7,15,2836,0,42.271888,-88.3552557,Bombus affinis,Bombus impatiens,,f,f,female,https://beespotter.org/bee/4324
4325,lindapopp,7/15/2015,2015,7,15,2836,Honey bee on poppy,7/15/2015,2015,7,15,2836,0,42.271888,-88.3552557,Apis mellifera,Apis mellifera,,f,f,female,https://beespotter.org/bee/4325
4328,Casadibailey,7/17/2015,2015,7,17,2838,Bee on Hissop,7/15/2015,2015,7,15,2836,2,40.11706,-88.266567,Bombus auricomus,Bombus bimaculatus,,f,f,female,https://beespotter.org/bee/4328
4329,Casadibailey,7/17/2015,2015,7,17,2838,2nd Bee on Hissop,7/15/2015,2015,7,15,2836,2,40.11706,-88.266567,,Apis mellifera,,f,f,female,https://beespotter.org/bee/4329
11192,HHDenver,9/28/2020,2020,9,28,4738,Powell Gardens - MO,7/15/2015,2015,7,15,2836,1902,38.872481,-94.03561197,,Apis mellifera,,f,f,female,https://beespotter.org/bee/11192
4331,Eskimo,7/18/2015,2015,7,18,2839,10 near dock,7/16/2015,2015,7,16,2837,2,45.62017752,-74.69332492,,Bombus impatiens,,f,f,female,https://beespotter.org/bee/4331
4401,knobren,7/26/2015,2015,7,26,2847,honeybee on milkweed vine,7/16/2015,2015,7,16,2837,10,40.105089,-88.290995,Apis mellifera,Apis mellifera,,f,f,female,https://beespotter.org/bee/4401
4334,twotringas,7/18/2015,2015,7,18,2839,unidentified on Hoary Vervain,7/17/2015,2015,7,17,2838,1,42.45951293,-89.1059339,Bombus vagans,Bombus vagans,,f,f,female,https://beespotter.org/bee/4334
4335,twotringas,7/18/2015,2015,7,18,2839,citrinus on Purple Coneflower,7/17/2015,2015,7,17,2838,1,42.304981,-89.156791,Bombus citrinus,Bombus citrinus,,f,f,male,https://beespotter.org/bee/4335
4336,twotringas,7/18/2015,2015,7,18,2839,impatiens on Culver's Root,7/17/2015,2015,7,17,2838,1,42.304981,-89.156791,Bombus impatiens,Bombus impatiens,,f,f,female,https://beespotter.org/bee/4336
4337,twotringas,7/18/2015,2015,7,18,2839,auricomus on Purple Coneflower,7/17/2015,2015,7,17,2838,1,42.304981,-89.156791,Bombus auricomus,Bombus auricomus,,f,f,female,https://beespotter.org/bee/4337
4338,twotringas,7/18/2015,2015,7,18,2839,affinis queen grooming on fence wire,7/17/2015,2015,7,17,2838,1,42.32540917,-89.14550151,Bombus affinis,Bombus affinis,,t,t,female,https://beespotter.org/bee/4338
4339,twotringas,7/18/2015,2015,7,18,2839,affinis on Culver's Root,7/17/2015,2015,7,17,2838,1,42.42513794,-89.08834047,Bombus affinis,Bombus affinis,,t,t,female,https://beespotter.org/bee/4339
4340,twotringas,7/18/2015,2015,7,18,2839,rufocinctus on Gray-headed Coneflower,7/17/2015,2015,7,17,2838,1,42.304981,-89.156791,Bombus rufocinctus,Bombus rufocinctus,,f,f,female,https://beespotter.org/bee/4340
4341,twotringas,7/18/2015,2015,7,18,2839,griseocollis on Purple Coneflower,7/17/2015,2015,7,17,2838,1,42.304981,-89.156791,Bombus griseocollis,Bombus griseocollis,,f,f,female,https://beespotter.org/bee/4341
4342,twotringas,7/18/2015,2015,7,18,2839,vagans on Purple Coneflower,7/17/2015,2015,7,17,2838,1,42.304981,-89.156791,Bombus vagans,Bombus vagans,,f,f,female,https://beespotter.org/bee/4342
4343,twotringas,7/18/2015,2015,7,18,2839,bimaculatus on Culver's Root,7/17/2015,2015,7,17,2838,1,42.304981,-89.156791,Bombus bimaculatus,Bombus bimaculatus,,f,f,female,https://beespotter.org/bee/4343
4347,arebee,7/19/2015,2015,7,19,2840,clv,7/17/2015,2015,7,17,2838,2,40.0815952,-88.20872962,Bombus griseocollis,Bombus griseocollis,,f,f,female,https://beespotter.org/bee/4347
4412,mbees,7/28/2015,2015,7,28,2849,bumblee bee on bee balm,7/18/2015,2015,7,18,2839,10,40.11588965,-88.25463295,,Bombus bimaculatus,,f,f,female,https://beespotter.org/bee/4412
7529,kzfisherman,8/7/2018,2018,8,7,3955,Black-and-gold BB,7/18/2015,2015,7,18,2839,1116,42.2944435,-88.2260537,Bombus auricomus,Bombus auricomus,,f,f,female,https://beespotter.org/bee/7529
4345,arebee,7/19/2015,2015,7,19,2840,pldy,7/19/2015,2015,7,19,2840,0,40.09279166,-88.28941047,Bombus pensylvanicus,Bombus auricomus,,f,f,female,https://beespotter.org/bee/4345
4357,twotringas,7/21/2015,2015,7,21,2842,affinis on Purple Coneflower,7/21/2015,2015,7,21,2842,0,42.31347218,-89.18313616,Bombus affinis,Bombus affinis,,t,t,female,https://beespotter.org/bee/4357
4358,twotringas,7/21/2015,2015,7,21,2842,griseocollis on Purple Coneflower,7/21/2015,2015,7,21,2842,0,42.2447959,-89.1130122,Bombus griseocollis,Bombus griseocollis,,f,f,female,https://beespotter.org/bee/4358
4359,twotringas,7/21/2015,2015,7,21,2842,rufocinctus on Liatris,7/21/2015,2015,7,21,2842,0,42.2447959,-89.1130122,Bombus rufocinctus,Bombus rufocinctus,,f,f,female,https://beespotter.org/bee/4359
4360,twotringas,7/21/2015,2015,7,21,2842,bimaculatus on Bergamot,7/21/2015,2015,7,21,2842,0,42.2447959,-89.1130122,Bombus bimaculatus,Bombus bimaculatus,,f,f,female,https://beespotter.org/bee/4360
4361,Lwhalen,7/21/2015,2015,7,21,2842,b. Auricomus?,7/21/2015,2015,7,21,2842,0,42.19718488,-88.24867845,Bombus auricomus,Bombus auricomus,,f,f,female,https://beespotter.org/bee/4361
4362,Lwhalen,7/21/2015,2015,7,21,2842,Wild Bergamot,7/21/2015,2015,7,21,2842,0,42.19723257,-88.24874818,Bombus griseocollis,Bombus impatiens,,f,f,female,https://beespotter.org/bee/4362
4363,Lwhalen,7/21/2015,2015,7,21,2842,Wild Onion,7/21/2015,2015,7,21,2842,0,42.19722065,-88.24875087,Apis mellifera,Apis mellifera,,f,f,female,https://beespotter.org/bee/4363
4398,knobren,7/26/2015,2015,7,26,2847,Biggest bee I've ever seen,7/21/2015,2015,7,21,2842,5,40.105089,-88.290995,Bombus auricomus,Bombus auricomus,,f,f,female,https://beespotter.org/bee/4398
4399,knobren,7/26/2015,2015,7,26,2847,milkweed vine (2391),7/21/2015,2015,7,21,2842,5,40.105089,-88.290995,Bombus affinis,Bombus griseocollis,,f,f,male,https://beespotter.org/bee/4399
4400,knobren,7/26/2015,2015,7,26,2847,honeybee on milkweed vine,7/21/2015,2015,7,21,2842,5,40.105089,-88.290995,Apis mellifera,Apis mellifera,,f,f,female,https://beespotter.org/bee/4400
4372,Louise,7/23/2015,2015,7,23,2844,GardenClub JLS,7/22/2015,2015,7,22,2843,1,40.11897459,-88.23907614,Bombus vagans,Bombus griseocollis,,f,f,female,https://beespotter.org/bee/4372
4376,annerem,7/23/2015,2015,7,23,2844,Hybrid Bergamot Sunset,7/22/2015,2015,7,22,2843,1,42.275127,-89.07354,,Bombus griseocollis,,f,f,male,https://beespotter.org/bee/4376
4379,Louise,7/24/2015,2015,7,24,2845,Prosperity Garden,7/22/2015,2015,7,22,2843,2,40.11824849,-88.23895544,,Bombus griseocollis,,f,f,female,https://beespotter.org/bee/4379
4410,lpconservancy,7/28/2015,2015,7,28,2849,ACLP Bergamot 7/22,7/22/2015,2015,7,22,2843,6,41.92475573,-87.63380617,,Bombus bimaculatus,Bombus griseocollis,f,f,female,https://beespotter.org/bee/4410
4687,GiantBird,11/8/2015,2015,11,8,2952,summer 2015 botanic garden honeybee,7/22/2015,2015,7,22,2843,109,42.14155828,-87.78930626,Apis mellifera,Apis mellifera,,f,f,female,https://beespotter.org/bee/4687
4688,GiantBird,11/8/2015,2015,11,8,2952,summer 2015 botanic garden bumblebee,7/22/2015,2015,7,22,2843,109,42.14159371,-87.78926969,Bombus fraternus,Bombus fraternus,,f,f,,https://beespotter.org/bee/4688
4373,Jim,7/23/2015,2015,7,23,2844,7-23-15 globe thistle,7/23/2015,2015,7,23,2844,0,40.89018039,-90.26859832,,Bombus griseocollis,,f,f,female,https://beespotter.org/bee/4373
4374,annerem,7/23/2015,2015,7,23,2844,Vacant field,7/23/2015,2015,7,23,2844,0,42.3184878,-88.9996433,Bombus rufocinctus,Bombus rufocinctus,,f,f,female,https://beespotter.org/bee/4374
4377,Jim,7/24/2015,2015,7,24,2845,7-23-15 on cone 1,7/23/2015,2015,7,23,2844,1,40.8901155,-90.2692678,,Bombus griseocollis,,f,f,female,https://beespotter.org/bee/4377
4527,poppe72,8/21/2015,2015,8,21,2873,B bimaculatis,7/23/2015,2015,7,23,2844,29,41.546721,-87.654319,Bombus bimaculatus,Bombus bimaculatus,,f,f,female,https://beespotter.org/bee/4527
4380,Jim,7/25/2015,2015,7,25,2846,hbee 7-24-15 globe thistle 5PM,7/24/2015,2015,7,24,2845,1,40.88993382,-90.26792884,Apis mellifera,Apis mellifera,,f,f,female,https://beespotter.org/bee/4380
4381,Jim,7/25/2015,2015,7,25,2846,h bee 7-24-15 cone flower -1,7/24/2015,2015,7,24,2845,1,40.88993382,-90.26779151,Apis mellifera,Apis mellifera,,f,f,female,https://beespotter.org/bee/4381
4382,Jim,7/25/2015,2015,7,25,2846,h bee 7-24-15 cone flower 5PM -3,7/24/2015,2015,7,24,2845,1,40.88980023,-90.26737118,Apis mellifera,Apis mellifera,,f,f,female,https://beespotter.org/bee/4382
4383,Jim,7/25/2015,2015,7,25,2846,h bee 7-24-15 cone flower 5 pm -4,7/24/2015,2015,7,24,2845,1,40.88975214,-90.26768852,Apis mellifera,Apis mellifera,,f,f,female,https://beespotter.org/bee/4383
4384,Jim,7/25/2015,2015,7,25,2846,h bee 7-24-15 5pm cone flower -5,7/24/2015,2015,7,24,2845,1,40.88964833,-90.26748252,Apis mellifera,Apis mellifera,,f,f,female,https://beespotter.org/bee/4384
4386,Jim,7/25/2015,2015,7,25,2846,h bee 7-24-15 6 PM cone -8,7/24/2015,2015,7,24,2845,1,40.88985596,-90.26775718,Apis mellifera,Apis mellifera,,f,f,female,https://beespotter.org/bee/4386
4387,Jim,7/25/2015,2015,7,25,2846,7-24-15 cone flower 5PM -1,7/24/2015,2015,7,24,2845,1,40.88975214,-90.26789451,Bombus impatiens,Bombus impatiens,,f,f,female,https://beespotter.org/bee/4387
4388,Jim,7/25/2015,2015,7,25,2846,7-24-15 5PM cone flower -2,7/24/2015,2015,7,24,2845,1,40.88975579,-90.26862192,Bombus griseocollis,Bombus griseocollis,,f,f,female,https://beespotter.org/bee/4388
4389,Jim,7/25/2015,2015,7,25,2846,7-24-15 5Pm cone -3,7/24/2015,2015,7,24,2845,1,40.88975214,-90.26863802,,Bombus griseocollis,,f,f,,https://beespotter.org/bee/4389
4390,Jim,7/25/2015,2015,7,25,2846,7-24-15 5 PM cone -4,7/24/2015,2015,7,24,2845,1,40.88975376,-90.26863694,Bombus griseocollis,Bombus griseocollis,,f,f,female,https://beespotter.org/bee/4390
4391,Jim,7/25/2015,2015,7,25,2846,7-24-15 5 PM -5 cone,7/24/2015,2015,7,24,2845,1,40.88974322,-90.26864338,,Bombus griseocollis,,f,f,female,https://beespotter.org/bee/4391
4404,twotringas,7/26/2015,2015,7,26,2847,vagans on Blue Vervain,7/24/2015,2015,7,24,2845,2,42.35036169,-89.238832,Bombus vagans,Bombus vagans,,f,f,,https://beespotter.org/bee/4404
4408,Mabeno,7/27/2015,2015,7,27,2848,North Seeley,7/24/2015,2015,7,24,2845,3,41.9644894,-87.6810365,Bombus griseocollis,Bombus griseocollis,,f,f,male,https://beespotter.org/bee/4408
4409,Mabeno,7/27/2015,2015,7,27,2848,Montrose garden,7/24/2015,2015,7,24,2845,3,41.96887547,-87.68839015,Bombus bimaculatus,Bombus bimaculatus,,f,f,female,https://beespotter.org/bee/4409
4484,Roberta,8/10/2015,2015,8,10,2862,Coneflower,7/24/2015,2015,7,24,2845,17,40.5575084,-89.2513295,Bombus impatiens,Bombus impatiens,,f,f,female,https://beespotter.org/bee/4484
4595,ecogarden,9/11/2015,2015,9,11,2894,Bombus on M. fistulosa,7/24/2015,2015,7,24,2845,49,41.869358,-87.799529,Bombus griseocollis,Bombus vagans,,f,f,,https://beespotter.org/bee/4595
4596,ecogarden,9/11/2015,2015,9,11,2894,Bombus on M didyma,7/24/2015,2015,7,24,2845,49,41.869358,-87.799529,Bombus auricomus,Bombus auricomus,,f,f,female,https://beespotter.org/bee/4596
4597,ecogarden,9/11/2015,2015,9,11,2894,Culver's Root,7/24/2015,2015,7,24,2845,49,41.869358,-87.799529,,Bombus impatiens,,f,f,female,https://beespotter.org/bee/4597
4598,ecogarden,9/11/2015,2015,9,11,2894,Honeybee on cup plant,7/24/2015,2015,7,24,2845,49,41.869358,-87.799529,Apis mellifera,Apis mellifera,,f,f,female,https://beespotter.org/bee/4598
4394,Stargazer43,7/25/2015,2015,7,25,2846,Bombus Auracomus,7/25/2015,2015,7,25,2846,0,42.2416089,-89.046423,Bombus auricomus,Bombus auricomus,,f,f,female,https://beespotter.org/bee/4394
4395,knobren,7/26/2015,2015,7,26,2847,2574 on blue wildflower,7/25/2015,2015,7,25,2846,1,40.105089,-88.290995,Bombus bimaculatus,Bombus bimaculatus,,f,f,female,https://beespotter.org/bee/4395
4396,knobren,7/26/2015,2015,7,26,2847,Rose of Sharon (2547),7/25/2015,2015,7,25,2846,1,40.105089,-88.290995,Bombus griseocollis,Bombus griseocollis,,f,f,,https://beespotter.org/bee/4396
4397,knobren,7/26/2015,2015,7,26,2847,honeybee on mint,7/25/2015,2015,7,25,2846,1,40.105089,-88.290995,Apis mellifera,Apis mellifera,,f,f,female,https://beespotter.org/bee/4397
4407,Mabeno,7/27/2015,2015,7,27,2848,Fabyan forest preserve,7/25/2015,2015,7,25,2846,2,41.86687633,-88.31149578,Bombus griseocollis,Bombus griseocollis,,f,f,female,https://beespotter.org/bee/4407
4574,Caroline,8/29/2015,2015,8,29,2881,Fervidus,7/25/2015,2015,7,25,2846,35,41.807931,-87.999201,Bombus fervidus,Bombus fervidus,,f,f,,https://beespotter.org/bee/4574
4402,Darrow21,7/26/2015,2015,7,26,2847,Honey Bee 1,7/26/2015,2015,7,26,2847,0,41.84784,-88.039289,Apis mellifera,Apis mellifera,,f,f,female,https://beespotter.org/bee/4402
4403,Darrow21,7/26/2015,2015,7,26,2847,Bumble Bee 1,7/26/2015,2015,7,26,2847,0,41.84784,-88.039289,Bombus variabilis,Bombus impatiens,,f,f,female,https://beespotter.org/bee/4403
4405,cjosefson,7/26/2015,2015,7,26,2847,on veronica,7/26/2015,2015,7,26,2847,0,39.8357408,-88.9861677,Bombus bimaculatus,Bombus impatiens,,f,f,female,https://beespotter.org/bee/4405
4406,cjosefson,7/26/2015,2015,7,26,2847,on coneflower,7/26/2015,2015,7,26,2847,0,39.8357408,-88.9861677,Bombus impatiens,Bombus griseocollis,,f,f,female,https://beespotter.org/bee/4406
4415,PepperCreek,7/29/2015,2015,7,29,2850,Black and White,7/26/2015,2015,7,26,2847,3,42.239773,-88.97434,Bombus griseocollis,Bombus impatiens,,f,f,,https://beespotter.org/bee/4415
4428,twotringas,7/31/2015,2015,7,31,2852,rufocinctus on Gray-headed Coneflower,7/26/2015,2015,7,26,2847,5,42.304981,-89.156791,Bombus rufocinctus,Bombus rufocinctus,,f,f,,https://beespotter.org/bee/4428
4424,twotringas,7/31/2015,2015,7,31,2852,vagans on Gray-headed Coneflower,7/27/2015,2015,7,27,2848,4,42.21230873,-89.20537949,Bombus vagans,Bombus vagans,,f,f,female,https://beespotter.org/bee/4424
4425,twotringas,7/31/2015,2015,7,31,2852,impatiens on Bergamot,7/27/2015,2015,7,27,2848,4,42.2125948,-89.20439243,Bombus impatiens,Bombus impatiens,,f,f,female,https://beespotter.org/bee/4425
4426,twotringas,7/31/2015,2015,7,31,2852,Honey bee on Knapweed,7/27/2015,2015,7,27,2848,4,42.21211802,-89.19988632,Apis mellifera,Apis mellifera,,f,f,female,https://beespotter.org/bee/4426
4427,twotringas,7/31/2015,2015,7,31,2852,bimaculatus on Bergamot,7/27/2015,2015,7,27,2848,4,42.21122801,-89.20280457,Bombus bimaculatus,Bombus bimaculatus,,f,f,female,https://beespotter.org/bee/4427
4411,levernier,7/28/2015,2015,7,28,2849,B. affinis,7/28/2015,2015,7,28,2849,0,42.28206324,-88.11944277,Bombus affinis,Bombus affinis,,t,t,male,https://beespotter.org/bee/4411
4418,twotringas,7/31/2015,2015,7,31,2852,griseocollis on Bergamot,7/28/2015,2015,7,28,2849,3,42.289298,-89.058819,Bombus griseocollis,Bombus griseocollis,,f,f,male,https://beespotter.org/bee/4418
4419,twotringas,7/31/2015,2015,7,31,2852,bimaculatus on Bergamot,7/28/2015,2015,7,28,2849,3,42.289298,-89.058819,Bombus bimaculatus,Bombus bimaculatus,,f,f,female,https://beespotter.org/bee/4419
4420,twotringas,7/31/2015,2015,7,31,2852,auricomus on Bergamot,7/28/2015,2015,7,28,2849,3,42.289298,-89.058819,Bombus auricomus,Bombus auricomus,,f,f,female,https://beespotter.org/bee/4420
4421,twotringas,7/31/2015,2015,7,31,2852,rufocinctus on Bergamot,7/28/2015,2015,7,28,2849,3,42.289298,-89.058819,Bombus rufocinctus,Bombus rufocinctus,,f,f,,https://beespotter.org/bee/4421
4422,twotringas,7/31/2015,2015,7,31,2852,vagans on Gray-headed Coneflower,7/28/2015,2015,7,28,2849,3,42.289298,-89.058819,Bombus vagans,Bombus vagans,,f,f,female,https://beespotter.org/bee/4422
4423,twotringas,7/31/2015,2015,7,31,2852,rufocinctus on Gray-headed Coneflower,7/28/2015,2015,7,28,2849,3,42.289298,-89.058819,Bombus rufocinctus,Bombus rufocinctus,,f,f,,https://beespotter.org/bee/4423
4429,twotringas,7/31/2015,2015,7,31,2852,griseocollis on Common Milkweed,7/28/2015,2015,7,28,2849,3,42.31476216,-88.98019195,Bombus griseocollis,Bombus griseocollis,,f,f,female,https://beespotter.org/bee/4429
4430,twotringas,7/31/2015,2015,7,31,2852,impatiens on Zinnia,7/28/2015,2015,7,28,2849,3,42.31483753,-88.98022413,Bombus impatiens,Bombus impatiens,,f,f,female,https://beespotter.org/bee/4430
4431,twotringas,7/31/2015,2015,7,31,2852,rufocinctus on Wild Onion,7/28/2015,2015,7,28,2849,3,42.31479786,-88.98022413,Bombus rufocinctus,Bombus rufocinctus,,f,f,,https://beespotter.org/bee/4431
4432,Lizmo,7/31/2015,2015,7,31,2852,#1 - Bob on a sunflower,7/31/2015,2015,7,31,2852,0,41.4966462,-90.5568365,Bombus griseocollis,Bombus griseocollis,,f,f,female,https://beespotter.org/bee/4432
4523,poppe72,8/21/2015,2015,8,21,2873,Honeybee,7/31/2015,2015,7,31,2852,21,41.546721,-87.654319,Apis mellifera,Apis mellifera,,f,f,female,https://beespotter.org/bee/4523
4525,poppe72,8/21/2015,2015,8,21,2873,B griseocollis,7/31/2015,2015,7,31,2852,21,41.546721,-87.654319,Bombus griseocollis,Bombus griseocollis,,f,f,female,https://beespotter.org/bee/4525
4526,poppe72,8/21/2015,2015,8,21,2873,unidentified,7/31/2015,2015,7,31,2852,21,41.546721,-87.654319,Bombus variabilis,Bombus impatiens,,f,f,female,https://beespotter.org/bee/4526
4435,Lizmo,8/1/2015,2015,8,1,2853,#4 - Camryn on the cucumber plant,8/1/2015,2015,8,1,2853,0,41.4898702,-90.5440559,Bombus griseocollis,Bombus impatiens,,f,f,female,https://beespotter.org/bee/4435
4436,Lizmo,8/1/2015,2015,8,1,2853,#5 - Eleanor on cucumber plant,8/1/2015,2015,8,1,2853,0,41.4898702,-90.5440559,Bombus bimaculatus,Bombus impatiens,,f,f,female,https://beespotter.org/bee/4436
4438,Lizmo,8/1/2015,2015,8,1,2853,#7 - Aria on cucumber plant,8/1/2015,2015,8,1,2853,0,41.4898702,-90.5440559,Bombus impatiens,Bombus impatiens,,f,f,female,https://beespotter.org/bee/4438
4439,Lizmo,8/1/2015,2015,8,1,2853,#8 - Zach on cucumber plant,8/1/2015,2015,8,1,2853,0,41.4898702,-90.5440559,Bombus griseocollis,Bombus impatiens,,f,f,female,https://beespotter.org/bee/4439
4454,knobren,8/2/2015,2015,8,2,2854,2619 Purple wildflower,8/1/2015,2015,8,1,2853,1,40.105089,-88.290995,Bombus impatiens,Bombus impatiens,,f,f,female,https://beespotter.org/bee/4454
4455,knobren,8/2/2015,2015,8,2,2854,2594,8/1/2015,2015,8,1,2853,1,40.105089,-88.290995,Bombus impatiens,Bombus impatiens,,f,f,female,https://beespotter.org/bee/4455
4459,knobren,8/2/2015,2015,8,2,2854,honeybee on rose of Sharon,8/1/2015,2015,8,1,2853,1,40.105089,-88.290995,Apis mellifera,Apis mellifera,,f,f,female,https://beespotter.org/bee/4459
4462,Wilson,8/2/2015,2015,8,2,2854,Yard Bumble August 15,8/1/2015,2015,8,1,2853,1,39.832089,-88.9290316,Bombus variabilis,Bombus vagans,,f,f,female,https://beespotter.org/bee/4462
4456,knobren,8/2/2015,2015,8,2,2854,2686 Rose of Sharon,8/2/2015,2015,8,2,2854,0,40.105089,-88.290995,Bombus impatiens,Bombus impatiens,,f,f,female,https://beespotter.org/bee/4456
4457,knobren,8/2/2015,2015,8,2,2854,2678 Black-eyed Susan,8/2/2015,2015,8,2,2854,0,40.105089,-88.290995,Bombus impatiens,Bombus impatiens,,f,f,female,https://beespotter.org/bee/4457
4458,knobren,8/2/2015,2015,8,2,2854,2683 Black-eyed susan,8/2/2015,2015,8,2,2854,0,40.105089,-88.290995,Bombus impatiens,Bombus impatiens,,f,f,female,https://beespotter.org/bee/4458
4466,Lizmo,8/3/2015,2015,8,3,2855,12 - Margie on the cucumber,8/3/2015,2015,8,3,2855,0,41.4898702,-90.5440559,Bombus bimaculatus,Bombus impatiens,,f,f,female,https://beespotter.org/bee/4466
4467,cjosefson,8/3/2015,2015,8,3,2855,sand creek,8/3/2015,2015,8,3,2855,0,39.8122181,-88.9474057,Bombus impatiens,Bombus griseocollis,,f,f,female,https://beespotter.org/bee/4467
4472,twotringas,8/5/2015,2015,8,5,2857,affinis on Oregano,8/3/2015,2015,8,3,2855,2,42.43944778,-89.13072027,Bombus affinis,Bombus affinis,,t,t,female,https://beespotter.org/bee/4472
4473,twotringas,8/5/2015,2015,8,5,2857,vagans on Wild Onion,8/3/2015,2015,8,3,2855,2,42.304981,-89.156791,Bombus vagans,Bombus vagans,,f,f,female,https://beespotter.org/bee/4473
4599,ecogarden,9/11/2015,2015,9,11,2894,Bombus on P. integrifolium,8/3/2015,2015,8,3,2855,39,41.869358,-87.799529,Bombus griseocollis,Bombus impatiens,,f,f,,https://beespotter.org/bee/4599
4600,ecogarden,9/11/2015,2015,9,11,2894,Honeybee on P. integrifolium,8/3/2015,2015,8,3,2855,39,41.869358,-87.799529,Apis mellifera,Apis mellifera,,f,f,,https://beespotter.org/bee/4600
4470,cjosefson,8/4/2015,2015,8,4,2856,butterflyweed,8/4/2015,2015,8,4,2856,0,39.8357408,-88.9861677,Bombus impatiens,Bombus griseocollis,,f,f,female,https://beespotter.org/bee/4470
4477,knobren,8/6/2015,2015,8,6,2858,2715 Eden's house,8/4/2015,2015,8,4,2856,2,40.126757,-88.30045,Bombus impatiens,Bombus impatiens,,f,f,female,https://beespotter.org/bee/4477
7530,kzfisherman,8/7/2018,2018,8,7,3955,Rusty-patched BB,8/4/2015,2015,8,4,2856,1099,42.34924451,-88.34983247,Bombus affinis,Bombus affinis,,t,t,male,https://beespotter.org/bee/7530
4474,lindapopp,8/5/2015,2015,8,5,2857,Bumble Bee on Cosmos,8/5/2015,2015,8,5,2857,0,,,Bombus variabilis,Bombus griseocollis,,f,f,male,https://beespotter.org/bee/4474
4475,spacedanish,8/5/2015,2015,8,5,2857,honey bee on mint,8/5/2015,2015,8,5,2857,0,41.490473,-90.532444,Apis mellifera,Apis mellifera,,f,f,female,https://beespotter.org/bee/4475
4476,spacedanish,8/5/2015,2015,8,5,2857,bumble bee on mint,8/5/2015,2015,8,5,2857,0,41.490473,-90.532444,Bombus griseocollis,Bombus griseocollis,,f,f,male,https://beespotter.org/bee/4476
4489,TER_OR,8/12/2015,2015,8,12,2864,fervidus NR 080715,8/7/2015,2015,8,7,2859,5,41.83817075,-88.25373173,Bombus fervidus,Bombus fervidus,,f,f,male,https://beespotter.org/bee/4489
4481,poppe72,8/9/2015,2015,8,9,2861,Bombus auricomus on Monards fistulosa,8/8/2015,2015,8,8,2860,1,41.546721,-87.654319,Bombus auricomus,Bombus auricomus,,f,f,female,https://beespotter.org/bee/4481
4483,darkwater64,8/10/2015,2015,8,10,2862,Backyard,8/8/2015,2015,8,8,2860,2,40.50557681,-88.96344423,,Bombus vagans,,f,f,female,https://beespotter.org/bee/4483
4491,TER_OR,8/12/2015,2015,8,12,2864,bimaculatus NR 080715,8/8/2015,2015,8,8,2860,4,41.83893811,-88.25313091,Bombus bimaculatus,Bombus griseocollis,,f,f,female,https://beespotter.org/bee/4491
4482,poppe72,8/9/2015,2015,8,9,2861,Griseocollis on Joe Pye Weed,8/9/2015,2015,8,9,2861,0,41.546721,-87.654319,Bombus griseocollis,Bombus griseocollis,,f,f,male,https://beespotter.org/bee/4482
4485,twotringas,8/11/2015,2015,8,11,2863,affinis on hydrangea,8/11/2015,2015,8,11,2863,0,42.39343032,-88.92910094,Bombus affinis,Bombus affinis,,t,t,female,https://beespotter.org/bee/4485
4486,twotringas,8/11/2015,2015,8,11,2863,queen citrinus on thistle,8/11/2015,2015,8,11,2863,0,42.34866485,-89.2325449,Bombus citrinus,Bombus citrinus,,f,f,female,https://beespotter.org/bee/4486
4487,twotringas,8/11/2015,2015,8,11,2863,griseocollis on Prairie Thistle,8/11/2015,2015,8,11,2863,0,42.21338944,-89.20495033,Bombus griseocollis,Bombus griseocollis,,f,f,male,https://beespotter.org/bee/4487
4515,poppe72,8/21/2015,2015,8,21,2873,B impatiens on Joe Pye Weed,8/11/2015,2015,8,11,2863,10,41.546721,-87.654319,Bombus impatiens,Bombus impatiens,,f,f,female,https://beespotter.org/bee/4515
4488,GinkgoGal,8/12/2015,2015,8,12,2864,Phlox1,8/12/2015,2015,8,12,2864,0,40.42670857,-88.89317894,,Bombus griseocollis,,f,f,female,https://beespotter.org/bee/4488
4490,TER_OR,8/12/2015,2015,8,12,2864,impatiens NR 1 080715,8/12/2015,2015,8,12,2864,0,41.83903403,-88.25293779,Bombus impatiens,Bombus impatiens,,f,f,female,https://beespotter.org/bee/4490
4502,twotringas,8/19/2015,2015,8,19,2871,vagans on Tithonia,8/12/2015,2015,8,12,2864,7,42.304981,-89.156791,Bombus vagans,Bombus vagans,,f,f,male,https://beespotter.org/bee/4502
4702,TER_OR,1/4/2016,2016,1,4,3009,affinis 081415,8/14/2015,2015,8,14,2866,143,42.17039467,-88.21886841,Bombus affinis,Bombus affinis,,t,t,female,https://beespotter.org/bee/4702
4703,TER_OR,1/4/2016,2016,1,4,3009,rufocinctus male 081514,8/14/2015,2015,8,14,2866,143,42.10122355,-88.27720374,Bombus rufocinctus,Bombus rufocinctus,,f,f,male,https://beespotter.org/bee/4703
4494,JacobDixon,8/15/2015,2015,8,15,2867,Bumble on Coler,8/15/2015,2015,8,15,2867,0,40.10929062,-88.21574762,Bombus auricomus,Bombus auricomus,,f,f,female,https://beespotter.org/bee/4494
4503,twotringas,8/19/2015,2015,8,19,2871,affinis on Clethra,8/15/2015,2015,8,15,2867,4,42.23076868,-89.21002109,Bombus affinis,Bombus affinis,,t,t,female,https://beespotter.org/bee/4503
4504,twotringas,8/19/2015,2015,8,19,2871,citrinus on Rosinweed,8/15/2015,2015,8,15,2867,4,42.4603282,-89.10542965,Bombus citrinus,Bombus citrinus,,f,f,,https://beespotter.org/bee/4504
4505,twotringas,8/19/2015,2015,8,19,2871,affinis on hydrangea,8/17/2015,2015,8,17,2869,2,42.22496771,-88.93142561,Bombus affinis,Bombus affinis,,t,t,female,https://beespotter.org/bee/4505
4506,twotringas,8/19/2015,2015,8,19,2871,honey bee on hydrangea,8/17/2015,2015,8,17,2869,2,42.289298,-89.058819,Apis mellifera,Apis mellifera,,f,f,female,https://beespotter.org/bee/4506
4514,poppe72,8/21/2015,2015,8,21,2873,b auricomus on blue lobelia,8/17/2015,2015,8,17,2869,4,41.546721,-87.654319,Bombus auricomus,Bombus auricomus,,f,f,female,https://beespotter.org/bee/4514
4680,Dave_K,10/24/2015,2015,10,24,2937,Bee on Asclepias,8/17/2015,2015,8,17,2869,68,41.938744,-88.077184,,Bombus impatiens,,f,f,male,https://beespotter.org/bee/4680
4546,twotringas,8/24/2015,2015,8,24,2876,vagans with Harvestman,8/18/2015,2015,8,18,2870,6,42.304981,-89.156791,Bombus vagans,Bombus vagans,Bombus impatiens,f,f,male,https://beespotter.org/bee/4546
4501,lpconservancy,8/19/2015,2015,8,19,2871,8.19 Honey,8/19/2015,2015,8,19,2871,0,41.92522716,-87.63428004,,Apis mellifera,,f,f,female,https://beespotter.org/bee/4501
4539,Slimeybee,8/22/2015,2015,8,22,2874,First Flight,8/19/2015,2015,8,19,2871,3,40.13104018,-82.93826938,Bombus griseocollis,Bombus impatiens,,f,f,female,https://beespotter.org/bee/4539
4686,GiantBird,11/8/2015,2015,11,8,2952,summer 2015 algonquin,8/19/2015,2015,8,19,2871,81,42.16631579,-88.32134256,Apis mellifera,Apis mellifera,,f,f,female,https://beespotter.org/bee/4686
4512,twotringas,8/20/2015,2015,8,20,2872,fervidus on Prairie Thistle,8/20/2015,2015,8,20,2872,0,42.30445964,-89.15616632,Bombus fervidus,Bombus fervidus,,f,f,female,https://beespotter.org/bee/4512
4547,twotringas,8/24/2015,2015,8,24,2876,2 impatiens on Tithonia,8/20/2015,2015,8,20,2872,4,42.304981,-89.156791,Bombus impatiens,Bombus impatiens,,f,f,,https://beespotter.org/bee/4547
4513,cjosefson,8/21/2015,2015,8,21,2873,on butterflyweed,8/21/2015,2015,8,21,2873,0,39.8357408,-88.9861677,Bombus griseocollis,Bombus griseocollis,,f,f,female,https://beespotter.org/bee/4513
4516,poppe72,8/21/2015,2015,8,21,2873,B affinis,8/21/2015,2015,8,21,2873,0,41.55928502,-87.58935929,Bombus affinis,Bombus affinis,,t,t,female,https://beespotter.org/bee/4516
4517,poppe72,8/21/2015,2015,8,21,2873,B griseocollis,8/21/2015,2015,8,21,2873,0,41.546721,-87.654319,Bombus griseocollis,Bombus griseocollis,,f,f,female,https://beespotter.org/bee/4517
4518,poppe72,8/21/2015,2015,8,21,2873,Can't identify,8/21/2015,2015,8,21,2873,0,41.546721,-87.654319,Bombus perplexus,Bombus bimaculatus,,f,f,male,https://beespotter.org/bee/4518
4520,poppe72,8/21/2015,2015,8,21,2873,Honeybee,8/21/2015,2015,8,21,2873,0,41.546721,-87.654319,Apis mellifera,Apis mellifera,,f,f,female,https://beespotter.org/bee/4520
4522,poppe72,8/21/2015,2015,8,21,2873,Honeybee,8/21/2015,2015,8,21,2873,0,41.546721,-87.654319,Apis mellifera,Apis mellifera,,f,f,female,https://beespotter.org/bee/4522
4524,poppe72,8/21/2015,2015,8,21,2873,Honeybee,8/21/2015,2015,8,21,2873,0,41.546721,-87.654319,Apis mellifera,Apis mellifera,,f,f,female,https://beespotter.org/bee/4524
4572,Caroline,8/29/2015,2015,8,29,2881,"Black & gold, mom's bee",8/21/2015,2015,8,21,2873,8,41.807931,-87.999201,Bombus auricomus,Bombus auricomus,,f,f,female,https://beespotter.org/bee/4572
4651,twotringas,9/29/2015,2015,9,29,2912,affinis on Joe Pye Weed,8/21/2015,2015,8,21,2873,39,42.18783422,-89.2005661,Bombus affinis,Bombus affinis,,t,t,,https://beespotter.org/bee/4651
4528,jjames,8/22/2015,2015,8,22,2874,male penn? on thistle,8/22/2015,2015,8,22,2874,0,40.17899012,-88.55843134,Bombus pensylvanicus,Bombus pensylvanicus,,f,f,male,https://beespotter.org/bee/4528
4529,jjames,8/22/2015,2015,8,22,2874,B,8/22/2015,2015,8,22,2874,0,40.18548301,-88.55758175,Bombus fervidus,Bombus fervidus,,f,f,female,https://beespotter.org/bee/4529
4530,jjames,8/22/2015,2015,8,22,2874,C,8/22/2015,2015,8,22,2874,0,40.18569509,-88.55757773,Bombus impatiens,Bombus impatiens,,f,f,female,https://beespotter.org/bee/4530
4531,jjames,8/22/2015,2015,8,22,2874,D,8/22/2015,2015,8,22,2874,0,40.18643481,-88.55756164,Bombus bimaculatus,Bombus bimaculatus,,f,f,male,https://beespotter.org/bee/4531
4532,jjames,8/22/2015,2015,8,22,2874,E,8/22/2015,2015,8,22,2874,0,40.18457013,-88.55756164,Bombus auricomus,Bombus auricomus,,f,f,female,https://beespotter.org/bee/4532
4533,jjames,8/22/2015,2015,8,22,2874,F,8/22/2015,2015,8,22,2874,0,40.1853283,-88.55755627,Bombus fervidus,Bombus fervidus,,f,f,female,https://beespotter.org/bee/4533
4534,jjames,8/22/2015,2015,8,22,2874,G,8/22/2015,2015,8,22,2874,0,40.17909054,-88.55824023,Bombus griseocollis,Bombus griseocollis,,f,f,female,https://beespotter.org/bee/4534
4535,jjames,8/22/2015,2015,8,22,2874,H,8/22/2015,2015,8,22,2874,0,40.17960696,-88.55777085,Bombus fervidus,Bombus fervidus,,f,f,female,https://beespotter.org/bee/4535
4536,jjames,8/22/2015,2015,8,22,2874,I,8/22/2015,2015,8,22,2874,0,40.18040207,-88.55754018,Bombus auricomus,Bombus auricomus,,f,f,female,https://beespotter.org/bee/4536
4537,jjames,8/22/2015,2015,8,22,2874,J,8/22/2015,2015,8,22,2874,0,40.18153325,-88.55755627,Bombus auricomus,Bombus pensylvanicus,,f,f,,https://beespotter.org/bee/4537
4538,jjames,8/22/2015,2015,8,22,2874,K,8/22/2015,2015,8,22,2874,0,40.17904136,-88.55846822,Bombus fervidus,Bombus fervidus,,f,f,female,https://beespotter.org/bee/4538
4540,cjosefson,8/23/2015,2015,8,23,2875,balloon flower bee,8/23/2015,2015,8,23,2875,0,39.8357408,-88.9861677,Bombus bimaculatus,Bombus impatiens,,f,f,,https://beespotter.org/bee/4540
4541,jjames,8/24/2015,2015,8,24,2876,A gris,8/23/2015,2015,8,23,2875,1,40.17898603,-88.55843537,Bombus griseocollis,Bombus griseocollis,,f,f,,https://beespotter.org/bee/4541
4542,jjames,8/24/2015,2015,8,24,2876,B ferv or pen,8/23/2015,2015,8,23,2875,1,40.1789932,-88.55840988,Bombus fervidus,Bombus pensylvanicus,,f,f,male,https://beespotter.org/bee/4542
4543,jjames,8/24/2015,2015,8,24,2876,C,8/23/2015,2015,8,23,2875,1,40.17900754,-88.55837367,Bombus fervidus,Bombus fervidus,,f,f,female,https://beespotter.org/bee/4543
4544,jjames,8/24/2015,2015,8,24,2876,D,8/23/2015,2015,8,23,2875,1,40.17899422,-88.55841257,Bombus fervidus,Bombus fervidus,,f,f,,https://beespotter.org/bee/4544
4545,jjames,8/24/2015,2015,8,24,2876,E ferv or pen,8/23/2015,2015,8,23,2875,1,40.17901369,-88.55841659,Bombus fervidus,Bombus pensylvanicus,,f,f,male,https://beespotter.org/bee/4545
4563,knobren,8/27/2015,2015,8,27,2879,2783 on coreosis,8/24/2015,2015,8,24,2876,3,40.105089,-88.290995,Bombus impatiens,Bombus impatiens,,f,f,male,https://beespotter.org/bee/4563
4564,knobren,8/27/2015,2015,8,27,2879,2781 coreopsis,8/24/2015,2015,8,24,2876,3,40.105089,-88.290995,Bombus griseocollis,Bombus impatiens,,f,f,,https://beespotter.org/bee/4564
4565,knobren,8/27/2015,2015,8,27,2879,2777 on black-eyed Susan,8/24/2015,2015,8,24,2876,3,40.105089,-88.290995,Bombus impatiens,Bombus impatiens,,f,f,,https://beespotter.org/bee/4565
4566,knobren,8/27/2015,2015,8,27,2879,"Honeybee on white flower, 2763",8/24/2015,2015,8,24,2876,3,40.105089,-88.290995,Apis mellifera,Apis mellifera,,f,f,female,https://beespotter.org/bee/4566
4567,knobren,8/27/2015,2015,8,27,2879,2751 sunflower,8/24/2015,2015,8,24,2876,3,40.105089,-88.290995,Bombus impatiens,Bombus impatiens,,f,f,,https://beespotter.org/bee/4567
4553,twotringas,8/25/2015,2015,8,25,2877,impatiens mating,8/25/2015,2015,8,25,2877,0,42.304981,-89.156791,Bombus impatiens,Bombus impatiens,,f,f,both,https://beespotter.org/bee/4553
4554,twotringas,8/25/2015,2015,8,25,2877,fervidus on Prairie Thistle,8/25/2015,2015,8,25,2877,0,42.34871243,-89.23275948,Bombus fervidus,Bombus fervidus,,f,f,female,https://beespotter.org/bee/4554
4556,knobren,8/27/2015,2015,8,27,2879,2856 Squash,8/26/2015,2015,8,26,2878,1,40.105089,-88.290995,Bombus impatiens,Bombus impatiens,,f,f,,https://beespotter.org/bee/4556
4557,knobren,8/27/2015,2015,8,27,2879,2824 mint,8/26/2015,2015,8,26,2878,1,40.105089,-88.290995,Bombus impatiens,Bombus impatiens,,f,f,female,https://beespotter.org/bee/4557
4558,knobren,8/27/2015,2015,8,27,2879,"honeybee on mint, 2829",8/26/2015,2015,8,26,2878,1,40.105089,-88.290995,Apis mellifera,Apis mellifera,,f,f,female,https://beespotter.org/bee/4558
4559,knobren,8/27/2015,2015,8,27,2879,"Honeybee on white flower, 2826",8/26/2015,2015,8,26,2878,1,40.105089,-88.290995,Apis mellifera,Apis mellifera,,f,f,female,https://beespotter.org/bee/4559
4560,knobren,8/27/2015,2015,8,27,2879,2809 on white flowers,8/26/2015,2015,8,26,2878,1,40.105089,-88.290995,Bombus impatiens,Bombus impatiens,,f,f,male,https://beespotter.org/bee/4560
4561,knobren,8/27/2015,2015,8,27,2879,2801 purple flower,8/26/2015,2015,8,26,2878,1,40.105089,-88.290995,Bombus impatiens,Bombus impatiens,,f,f,female,https://beespotter.org/bee/4561
4562,knobren,8/27/2015,2015,8,27,2879,2806 milkweed vine,8/26/2015,2015,8,26,2878,1,40.105089,-88.290995,Bombus impatiens,Bombus impatiens,,f,f,male,https://beespotter.org/bee/4562
4578,KP,8/30/2015,2015,8,30,2882,Thistle/bumble,8/26/2015,2015,8,26,2878,4,40.29496086,-87.94701576,,Bombus pensylvanicus,,f,f,male,https://beespotter.org/bee/4578
4583,buffy3kins,9/1/2015,2015,9,1,2884,bee in sage flowers,8/26/2015,2015,8,26,2878,6,37.6937815,-97.2444487,Apis mellifera,Apis mellifera,,f,f,female,https://beespotter.org/bee/4583
4568,lindapopp,8/28/2015,2015,8,28,2880,Bombus on heleanthus,8/27/2015,2015,8,27,2879,1,42.271888,-88.3552557,Bombus bimaculatus,Bombus impatiens,,f,f,male,https://beespotter.org/bee/4568
4569,lindapopp,8/28/2015,2015,8,28,2880,Bombus on Heleanthus 2,8/28/2015,2015,8,28,2880,0,42.271888,-88.3552557,Bombus bimaculatus,Bombus impatiens,,f,f,male,https://beespotter.org/bee/4569
4575,Caroline,8/29/2015,2015,8,29,2881,Mystery bee (tricolor?),8/28/2015,2015,8,28,2880,1,41.8372729,-87.9028307,Bombus rufocinctus,Bombus rufocinctus,,f,f,male,https://beespotter.org/bee/4575
4579,bbaker4,8/30/2015,2015,8,30,2882,backyard 1,8/30/2015,2015,8,30,2882,0,39.71217659,-84.26196588,Bombus auricomus,Bombus affinis,Bombus fraternus,t,t,,https://beespotter.org/bee/4579
4580,Caroline,8/30/2015,2015,8,30,2882,Fervidus on gentian,8/30/2015,2015,8,30,2882,0,41.7612405,-88.0039408,Bombus fervidus,Bombus fervidus,,f,f,female,https://beespotter.org/bee/4580
4585,twotringas,9/4/2015,2015,9,4,2887,auricomus on Prairie Thistle,9/4/2015,2015,9,4,2887,0,42.35020311,-89.24035549,Bombus auricomus,Bombus auricomus,,f,f,female,https://beespotter.org/bee/4585
4586,twotringas,9/4/2015,2015,9,4,2887,vagans on Prairie Thistle,9/4/2015,2015,9,4,2887,0,42.30459453,-89.15583909,Bombus vagans,Bombus vagans,Bombus impatiens,f,f,male,https://beespotter.org/bee/4586
4587,Sgtklose,9/5/2015,2015,9,5,2888,9/5/2015 Cinci zoo,9/5/2015,2015,9,5,2888,0,39.1430444,-84.50858,Bombus vagans,Bombus impatiens,,f,f,,https://beespotter.org/bee/4587
4601,Monotropa,9/11/2015,2015,9,11,2894,bomb-on-NEaster,9/11/2015,2015,9,11,2894,0,39.10843501,-93.18446338,Bombus pensylvanicus,Bombus pensylvanicus,,f,f,male,https://beespotter.org/bee/4601
4603,jbusch,9/12/2015,2015,9,12,2895,Bumblebee w/ load of pollen,9/12/2015,2015,9,12,2895,0,39.915588,-82.8162229,Bombus affinis,Bombus impatiens,Bombus griseocollis,f,f,female,https://beespotter.org/bee/4603
4614,peterwchen,9/17/2015,2015,9,17,2900,Bombus griseocollis,9/12/2015,2015,9,12,2895,5,41.83873428,-88.07488739,Bombus griseocollis,Bombus impatiens,Bombus griseocollis,f,f,female,https://beespotter.org/bee/4614
4693,redoak1,11/26/2015,2015,11,26,2970,Bee on Sedum spectabile,9/12/2015,2015,9,12,2895,75,41.60716404,-89.55634117,Bombus impatiens,Bombus impatiens,,f,f,male,https://beespotter.org/bee/4693
4700,Leclairj,12/30/2015,2015,12,30,3004,Backyard Bees,9/12/2015,2015,9,12,2895,109,41.957101,-87.766306,,Bombus impatiens,,f,f,female,https://beespotter.org/bee/4700
4605,lindapopp,9/13/2015,2015,9,13,2896,13-Sep-15,9/13/2015,2015,9,13,2896,0,,,,Bombus impatiens,,f,f,,https://beespotter.org/bee/4605
4606,lindapopp,9/13/2015,2015,9,13,2896,Bumblebee Grison Tithonia,9/13/2015,2015,9,13,2896,0,42.23567571,-88.32038815,,Bombus impatiens,,f,f,,https://beespotter.org/bee/4606
4607,lindapopp,9/13/2015,2015,9,13,2896,Honey Bee on Sedum,9/13/2015,2015,9,13,2896,0,,,,Bombus impatiens,,f,f,male,https://beespotter.org/bee/4607
4608,Madeline,9/14/2015,2015,9,14,2897,Prairie Honeybee on Goldenrod,9/13/2015,2015,9,13,2896,1,38.48195628,-90.82402825,Apis mellifera,Apis mellifera,,f,f,female,https://beespotter.org/bee/4608
4609,Madeline,9/14/2015,2015,9,14,2897,Wetland Honeybee on Goldenrod,9/13/2015,2015,9,13,2896,1,38.48179612,-90.82431851,Apis mellifera,Apis mellifera,,f,f,female,https://beespotter.org/bee/4609
4633,knobren,9/26/2015,2015,9,26,2909,3231 midflight,9/13/2015,2015,9,13,2896,13,40.105089,-88.290995,Bombus impatiens,Bombus impatiens,,f,f,male,https://beespotter.org/bee/4633
4634,knobren,9/26/2015,2015,9,26,2909,3236 on blue flowers,9/13/2015,2015,9,13,2896,13,40.105089,-88.290995,Bombus griseocollis,Bombus impatiens,,f,f,male,https://beespotter.org/bee/4634
4636,knobren,9/26/2015,2015,9,26,2909,3240 on garlic chives?,9/13/2015,2015,9,13,2896,13,40.105089,-88.290995,Bombus griseocollis,Bombus impatiens,,f,f,male,https://beespotter.org/bee/4636
4637,knobren,9/26/2015,2015,9,26,2909,3272 on aster,9/13/2015,2015,9,13,2896,13,40.105089,-88.290995,Bombus impatiens,Bombus impatiens,,f,f,,https://beespotter.org/bee/4637
4638,knobren,9/26/2015,2015,9,26,2909,3279 on lavender,9/13/2015,2015,9,13,2896,13,40.105089,-88.290995,Bombus impatiens,Bombus impatiens,,f,f,,https://beespotter.org/bee/4638
4611,lindapopp,9/14/2015,2015,9,14,2897,Bumbles on Autumn Joy Sedum,9/14/2015,2015,9,14,2897,0,42.3439139,-88.4403883,,Bombus impatiens,,f,f,male,https://beespotter.org/bee/4611
4612,Madeline,9/15/2015,2015,9,15,2898,Wetland Goldenrod 2,9/15/2015,2015,9,15,2898,0,38.48162815,-90.82401811,Apis mellifera,Apis mellifera,,f,f,female,https://beespotter.org/bee/4612
4617,colstabler,9/20/2015,2015,9,20,2903,KHS Spotting one,9/15/2015,2015,9,15,2898,5,38.5917394,-90.4220917,Bombus pensylvanicus,Apis mellifera,,f,f,female,https://beespotter.org/bee/4617
4689,GiantBird,11/8/2015,2015,11,8,2952,lagoon bumblebee,9/18/2015,2015,9,18,2901,51,42.05540296,-87.67310053,Bombus impatiens,Bombus impatiens,,f,f,male,https://beespotter.org/bee/4689
4640,twotringas,9/27/2015,2015,9,27,2910,vagans on Tithonia,9/20/2015,2015,9,20,2903,7,42.304981,-89.156791,Bombus vagans,Bombus vagans,,f,f,female,https://beespotter.org/bee/4640
4743,beeboy,4/11/2016,2016,4,11,3107,Volunteer Sunflower 2,9/20/2015,2015,9,20,2903,204,42.0374627,-87.690229,,Bombus impatiens,,f,f,male,https://beespotter.org/bee/4743
4744,beeboy,4/11/2016,2016,4,11,3107,Evening Primrose 2,9/20/2015,2015,9,20,2903,204,42.0374627,-87.690229,,Bombus impatiens,,f,f,female,https://beespotter.org/bee/4744
4745,beeboy,4/11/2016,2016,4,11,3107,Volunteer Sunflower 3,9/20/2015,2015,9,20,2903,204,42.0374627,-87.690229,,Bombus impatiens,,f,f,female,https://beespotter.org/bee/4745
4746,beeboy,4/11/2016,2016,4,11,3107,Ragweed 3,9/20/2015,2015,9,20,2903,204,42.0374627,-87.690229,,Bombus impatiens,,f,f,male,https://beespotter.org/bee/4746
4628,knobren,9/25/2015,2015,9,25,2908,3302 on golden rod,9/21/2015,2015,9,21,2904,4,40.105089,-88.290995,Bombus impatiens,Bombus impatiens,,f,f,male,https://beespotter.org/bee/4628
4629,knobren,9/26/2015,2015,9,26,2909,3325 on golden rod,9/21/2015,2015,9,21,2904,5,40.105089,-88.290995,Bombus variabilis,Bombus impatiens,,f,f,male,https://beespotter.org/bee/4629
4630,knobren,9/26/2015,2015,9,26,2909,3334 on golden rod,9/21/2015,2015,9,21,2904,5,40.105089,-88.290995,Bombus griseocollis,Bombus impatiens,,f,f,male,https://beespotter.org/bee/4630
4631,knobren,9/26/2015,2015,9,26,2909,3367 on blue flowers,9/21/2015,2015,9,21,2904,5,40.105089,-88.290995,Bombus impatiens,Bombus impatiens,,f,f,male,https://beespotter.org/bee/4631
4632,knobren,9/26/2015,2015,9,26,2909,3372 on blue flowers,9/21/2015,2015,9,21,2904,5,40.105089,-88.290995,Bombus impatiens,Bombus impatiens,,f,f,,https://beespotter.org/bee/4632
4641,twotringas,9/27/2015,2015,9,27,2910,impatiens mating,9/21/2015,2015,9,21,2904,6,42.304981,-89.156791,Bombus impatiens,Bombus impatiens,,f,f,both,https://beespotter.org/bee/4641
4741,beeboy,4/11/2016,2016,4,11,3107,Ragweed2,9/21/2015,2015,9,21,2904,203,42.0374627,-87.690229,,Bombus impatiens,,f,f,male,https://beespotter.org/bee/4741
4742,beeboy,4/11/2016,2016,4,11,3107,Volunteer Sunflower,9/21/2015,2015,9,21,2904,203,42.0374627,-87.690229,,Bombus impatiens,,f,f,female,https://beespotter.org/bee/4742
4642,twotringas,9/27/2015,2015,9,27,2910,Honey Bee on New England Aster,9/22/2015,2015,9,22,2905,5,42.304981,-89.156791,Apis mellifera,Apis mellifera,,f,f,,https://beespotter.org/bee/4642
4643,twotringas,9/27/2015,2015,9,27,2910,Honey Bee on New England Aster,9/22/2015,2015,9,22,2905,5,42.304981,-89.156791,Apis mellifera,Apis mellifera,,f,f,female,https://beespotter.org/bee/4643
4739,beeboy,4/11/2016,2016,4,11,3107,Evanston,9/22/2015,2015,9,22,2905,202,42.0374627,-87.690229,,Bombus impatiens,,f,f,female,https://beespotter.org/bee/4739
4621,geofry93,9/23/2015,2015,9,23,2906,Bath Slough Pature,9/23/2015,2015,9,23,2906,0,49.18439632,-123.0726242,Apis mellifera,Apis mellifera,,f,f,female,https://beespotter.org/bee/4621
4624,Prairiegal,9/25/2015,2015,9,25,2908,Bee on asters,9/24/2015,2015,9,24,2907,1,39.97684057,-88.12550068,,Bombus impatiens,,f,f,male,https://beespotter.org/bee/4624
4626,knobren,9/25/2015,2015,9,25,2908,3415 on golden rod,9/24/2015,2015,9,24,2907,1,40.105089,-88.290995,Bombus impatiens,Bombus impatiens,,f,f,male,https://beespotter.org/bee/4626
4627,knobren,9/25/2015,2015,9,25,2908,3460 on golden rod,9/24/2015,2015,9,24,2907,1,40.105089,-88.290995,Bombus griseocollis,Bombus impatiens,,f,f,male,https://beespotter.org/bee/4627
4623,Julia17,9/25/2015,2015,9,25,2908,apis mellifera,9/25/2015,2015,9,25,2908,0,38.5083865,-90.3228941,Apis mellifera,Apis mellifera,,f,f,female,https://beespotter.org/bee/4623
4644,twotringas,9/27/2015,2015,9,27,2910,citrinus found dead,9/26/2015,2015,9,26,2909,1,41.8905695,-89.49403882,Bombus citrinus,Bombus citrinus,,f,f,male,https://beespotter.org/bee/4644
4646,twotringas,9/28/2015,2015,9,28,2911,affinis on New England Aster,9/28/2015,2015,9,28,2911,0,42.44324993,-89.30226155,Bombus affinis,Bombus affinis,,t,t,,https://beespotter.org/bee/4646
4647,twotringas,9/28/2015,2015,9,28,2911,impatiens on New England Aster,9/28/2015,2015,9,28,2911,0,42.304981,-89.156791,Bombus impatiens,Bombus impatiens,,f,f,,https://beespotter.org/bee/4647
4648,twotringas,9/28/2015,2015,9,28,2911,queen citrinus on Tithonia,9/28/2015,2015,9,28,2911,0,42.304981,-89.156791,Bombus citrinus,Bombus citrinus,,f,f,female,https://beespotter.org/bee/4648
4649,twotringas,9/28/2015,2015,9,28,2911,vagans on Tithonia,9/28/2015,2015,9,28,2911,0,42.304981,-89.156791,Bombus vagans,Bombus vagans,,f,f,,https://beespotter.org/bee/4649
4650,twotringas,9/28/2015,2015,9,28,2911,queen vagans on Tithonia,9/28/2015,2015,9,28,2911,0,42.304981,-89.156791,Bombus vagans,Bombus vagans,,f,f,female,https://beespotter.org/bee/4650
4663,twotringas,10/12/2015,2015,10,12,2925,affinis on New England Aster,10/1/2015,2015,10,1,2914,11,42.43672406,-89.19582334,Bombus affinis,Bombus affinis,,t,t,female,https://beespotter.org/bee/4663
4664,twotringas,10/12/2015,2015,10,12,2925,vagans on Tithonia,10/2/2015,2015,10,2,2915,10,42.304981,-89.156791,Bombus vagans,Bombus vagans,,f,f,female,https://beespotter.org/bee/4664
4656,peterwchen,10/4/2015,2015,10,4,2917,male B. impatiens,10/3/2015,2015,10,3,2916,1,41.84043282,-88.07585835,Bombus impatiens,Bombus impatiens,,f,f,male,https://beespotter.org/bee/4656
4657,lfelliott,10/4/2015,2015,10,4,2917,on Symphytrichum novae-angliae,10/4/2015,2015,10,4,2917,0,38.9467895,-92.4462802,Bombus griseocollis,Bombus impatiens,,f,f,male,https://beespotter.org/bee/4657
4665,twotringas,10/12/2015,2015,10,12,2925,honey bee on New England Aster,10/7/2015,2015,10,7,2920,5,42.304981,-89.156791,Apis mellifera,Apis mellifera,,f,f,female,https://beespotter.org/bee/4665
4672,lpconservancy,10/16/2015,2015,10,16,2929,10.7 aster,10/7/2015,2015,10,7,2920,9,41.92757748,-87.6371938,,Apis mellifera,,f,f,female,https://beespotter.org/bee/4672
4683,kgarcia,10/29/2015,2015,10,29,2942,Bumble on aster,10/8/2015,2015,10,8,2921,21,38.61412503,-90.25982827,Bombus impatiens,Bombus impatiens,,f,f,female,https://beespotter.org/bee/4683
4661,mhare6830,10/10/2015,2015,10,10,2923,exterior of a tree,10/10/2015,2015,10,10,2923,0,30.9201995,-93.9965759,,Apis mellifera,,f,f,,https://beespotter.org/bee/4661
4666,twotringas,10/12/2015,2015,10,12,2925,affinis queen on Tithonia,10/12/2015,2015,10,12,2925,0,42.24416366,-89.07260558,Bombus affinis,Bombus affinis,,t,t,female,https://beespotter.org/bee/4666
4671,lpconservancy,10/16/2015,2015,10,16,2929,10.14 gold,10/14/2015,2015,10,14,2927,2,41.92442246,-87.63390943,,Bombus impatiens,,f,f,,https://beespotter.org/bee/4671
4673,Monotropa,10/17/2015,2015,10,17,2930,bomb_S_oblongifolium,10/15/2015,2015,10,15,2928,2,39.10837257,-93.18451166,Bombus impatiens,Bombus impatiens,,f,f,male,https://beespotter.org/bee/4673
4676,cjosefson,10/20/2015,2015,10,20,2933,starved rock 1,10/18/2015,2015,10,18,2931,2,41.3184471,-88.9946866,Bombus griseocollis,Bombus impatiens,,f,f,male,https://beespotter.org/bee/4676
4677,cjosefson,10/20/2015,2015,10,20,2933,starved rock 2,10/18/2015,2015,10,18,2931,2,41.3184471,-88.9946866,Bombus fervidus,Bombus impatiens,,f,f,male,https://beespotter.org/bee/4677
4679,Dave_K,10/24/2015,2015,10,24,2937,Honeybee on Hyssop,10/20/2015,2015,10,20,2933,4,41.9382966,-88.07842255,Apis mellifera,Apis mellifera,,f,f,female,https://beespotter.org/bee/4679
4684,jjames,11/4/2015,2015,11,4,2948,Apis on sedum,11/4/2015,2015,11,4,2948,0,40.49871184,-89.02231202,Apis mellifera,Apis mellifera,,f,f,female,https://beespotter.org/bee/4684
4685,jjames,11/4/2015,2015,11,4,2948,Helenium,11/4/2015,2015,11,4,2948,0,40.49872714,-89.02231671,Bombus impatiens,Bombus impatiens,,f,f,female,https://beespotter.org/bee/4685
4701,Leclairj,12/31/2015,2015,12,31,3005,In My House,12/31/2015,2015,12,31,3005,0,41.957101,-87.766306,,Bombus impatiens,,f,f,female,https://beespotter.org/bee/4701
4726,ken_dallmier,2/28/2016,2016,2,28,3064,Bee at bird feeder,2/27/2016,2016,2,27,3063,1,40.218176,-88.385088,Apis mellifera,Apis mellifera,,f,f,female,https://beespotter.org/bee/4726
4731,twotringas,3/7/2016,2016,3,7,3072,Honey Bee on Vernal Witch Hazel,3/7/2016,2016,3,7,3072,0,42.304981,-89.156791,Apis mellifera,Apis mellifera,,f,f,,https://beespotter.org/bee/4731
4732,twotringas,3/8/2016,2016,3,8,3073,Honey Bee on Vernal Witch Hazel,3/8/2016,2016,3,8,3073,0,42.304981,-89.156791,Apis mellifera,Apis mellifera,,f,f,,https://beespotter.org/bee/4732
4735,mrsshippy,3/27/2016,2016,3,27,3092,Easter bee,3/27/2016,2016,3,27,3092,0,39.27478966,-84.8683548,Bombus affinis,Apis mellifera,,f,f,female,https://beespotter.org/bee/4735
4747,lindapopp,4/14/2016,2016,4,14,3110,Apis Melliferis,4/14/2016,2016,4,14,3110,0,42.271888,-88.355256,,Apis mellifera,,f,f,female,https://beespotter.org/bee/4747
4748,jbusch,4/14/2016,2016,4,14,3110,bee in garage,4/14/2016,2016,4,14,3110,0,39.915588,-82.8162229,Bombus variabilis,Bombus griseocollis,,f,f,female,https://beespotter.org/bee/4748
4750,Missy-beeluv,4/15/2016,2016,4,15,3111,Bumble1,4/15/2016,2016,4,15,3111,0,39.32345896,-84.49267387,Apis mellifera,Apis mellifera,,f,f,female,https://beespotter.org/bee/4750
4751,Missy-beeluv,4/15/2016,2016,4,15,3111,Bumble 2,4/15/2016,2016,4,15,3111,0,39.32354196,-84.49228764,Apis mellifera,Apis mellifera,,f,f,female,https://beespotter.org/bee/4751
4752,jbusch,4/16/2016,2016,4,16,3112,Basement Bumble,4/16/2016,2016,4,16,3112,0,39.915588,-82.8162229,Bombus variabilis,Bombus griseocollis,,f,f,female,https://beespotter.org/bee/4752
4756,Monotropa,4/23/2016,2016,4,23,3119,1sthoney2016,4/22/2016,2016,4,22,3118,1,39.10838506,-93.1844151,Apis mellifera,Apis mellifera,,f,f,female,https://beespotter.org/bee/4756
4758,Kdavis,4/24/2016,2016,4,24,3120,Home Depot,4/24/2016,2016,4,24,3120,0,39.3920011,-84.5068227,,Bombus fervidus,,f,f,female,https://beespotter.org/bee/4758
4765,xtqjanth,5/3/2016,2016,5,3,3129,Enclosed field,4/25/2016,2016,4,25,3121,8,42.47656698,-89.09646034,Bombus impatiens,Bombus impatiens,,f,f,female,https://beespotter.org/bee/4765
4763,twotringas,5/3/2016,2016,5,3,3129,impatiens queen,5/2/2016,2016,5,2,3128,1,42.304981,-89.156791,Bombus impatiens,Bombus impatiens,,f,f,female,https://beespotter.org/bee/4763
4762,twotringas,5/3/2016,2016,5,3,3129,impatiens queen,5/3/2016,2016,5,3,3129,0,42.35353322,-89.23683643,Bombus impatiens,Bombus impatiens,,f,f,female,https://beespotter.org/bee/4762
4764,twotringas,5/3/2016,2016,5,3,3129,honey bee on Dandelion,5/3/2016,2016,5,3,3129,0,42.35261349,-89.2353344,Apis mellifera,Apis mellifera,,f,f,female,https://beespotter.org/bee/4764
4767,Dave_K,5/5/2016,2016,5,5,3131,Honeybee on apple,5/5/2016,2016,5,5,3131,0,41.97021183,-87.95312047,Apis mellifera,Apis mellifera,,f,f,female,https://beespotter.org/bee/4767
4795,twotringas,5/26/2016,2016,5,26,3152,bimaculatus on blueberry,5/6/2016,2016,5,6,3132,20,42.476392,-89.095039,Bombus bimaculatus,Bombus bimaculatus,,f,f,female,https://beespotter.org/bee/4795
4780,lfelliott,5/16/2016,2016,5,16,3142,on Physocarpus,5/15/2016,2016,5,15,3141,1,38.94606336,-92.44656998,Bombus impatiens,Bombus impatiens,,f,f,female,https://beespotter.org/bee/4780
4794,twotringas,5/26/2016,2016,5,26,3152,auricomus on Shooting Star,5/16/2016,2016,5,16,3142,10,42.304981,-89.156791,Bombus auricomus,Bombus auricomus,,f,f,female,https://beespotter.org/bee/4794
4786,emma_paigeee_,5/19/2016,2016,5,19,3145,5/19/16,5/19/2016,2016,5,19,3145,0,39.96080666,-82.37926483,Bombus affinis,Bombus griseocollis,,f,f,female,https://beespotter.org/bee/4786
4793,twotringas,5/26/2016,2016,5,26,3152,unidentified Bumble Bee on Shooting Star,5/20/2016,2016,5,20,3146,6,42.30382088,-89.15646404,,Bombus bimaculatus,,f,f,male,https://beespotter.org/bee/4793
4790,KristinChicago,5/23/2016,2016,5,23,3149,North Pond1,5/22/2016,2016,5,22,3148,1,41.9298562,-87.6374395,Apis mellifera,Apis mellifera,,f,f,female,https://beespotter.org/bee/4790
4830,AMB,6/9/2016,2016,6,9,3166,Central Park Conservatory Gardens,5/23/2016,2016,5,23,3149,17,40.7930513,-73.9525795,,Apis mellifera,,f,f,female,https://beespotter.org/bee/4830
4796,twotringas,5/27/2016,2016,5,27,3153,auricomus,5/26/2016,2016,5,26,3152,1,42.304981,-89.156791,Bombus auricomus,Bombus auricomus,,f,f,female,https://beespotter.org/bee/4796
4797,twotringas,5/27/2016,2016,5,27,3153,griseocollis on Baptisia,5/26/2016,2016,5,26,3152,1,42.304981,-89.156791,Bombus griseocollis,Bombus griseocollis,,f,f,female,https://beespotter.org/bee/4797
4800,lfelliott,5/29/2016,2016,5,29,3155,on Tradescantia,5/28/2016,2016,5,28,3154,1,38.9467893,-92.4462803,Bombus impatiens,Bombus impatiens,,f,f,female,https://beespotter.org/bee/4800
4801,twotringas,5/29/2016,2016,5,29,3155,queen griseocollis on Baptisia,5/29/2016,2016,5,29,3155,0,42.304981,-89.156791,Bombus griseocollis,Bombus griseocollis,,f,f,female,https://beespotter.org/bee/4801
4802,twotringas,5/31/2016,2016,5,31,3157,queen griseocollis on red clover,5/29/2016,2016,5,29,3155,2,42.35310508,-89.23679352,Bombus griseocollis,Bombus griseocollis,,f,f,female,https://beespotter.org/bee/4802
4804,bkarendt,6/2/2016,2016,6,2,3159,honey bee in Lincoln Park,6/2/2016,2016,6,2,3159,0,41.91179345,-87.63006484,Apis mellifera,Apis mellifera,,f,f,female,https://beespotter.org/bee/4804
4805,SRFdoesnot,6/2/2016,2016,6,2,3159,6/2/16 Spot,6/2/2016,2016,6,2,3159,0,41.893297,-87.7803496,Apis mellifera,Apis mellifera,,f,f,female,https://beespotter.org/bee/4805
4812,twotringas,6/5/2016,2016,6,5,3162,queen affinis,6/2/2016,2016,6,2,3159,3,42.27272463,-89.25297042,Bombus affinis,Bombus affinis,,t,t,female,https://beespotter.org/bee/4812
4807,twotringas,6/5/2016,2016,6,5,3162,impatiens,6/4/2016,2016,6,4,3161,1,42.45778738,-89.10755396,Bombus impatiens,Bombus impatiens,,f,f,female,https://beespotter.org/bee/4807
4808,twotringas,6/5/2016,2016,6,5,3162,griseocollis on White Wild Indigo,6/4/2016,2016,6,4,3161,1,42.4594971,-89.10569787,Bombus griseocollis,Bombus griseocollis,,f,f,female,https://beespotter.org/bee/4808
4809,twotringas,6/5/2016,2016,6,5,3162,vagans on Cow Vetch,6/4/2016,2016,6,4,3161,1,42.45625176,-89.10683513,Bombus vagans,Bombus vagans,,f,f,female,https://beespotter.org/bee/4809
4810,twotringas,6/5/2016,2016,6,5,3162,bimaculatus on garden sage,6/4/2016,2016,6,4,3161,1,42.304981,-89.156791,Bombus bimaculatus,Bombus bimaculatus,,f,f,female,https://beespotter.org/bee/4810
4811,twotringas,6/5/2016,2016,6,5,3162,bimaculatus on White Wild Indigo,6/4/2016,2016,6,4,3161,1,42.4595248,-89.1057542,Bombus bimaculatus,Bombus bimaculatus,,f,f,female,https://beespotter.org/bee/4811
4813,bkarendt,6/6/2016,2016,6,6,3163,Bee at Pulaski Woods,6/5/2016,2016,6,5,3162,1,41.7090231,-87.8917917,Bombus affinis,Bombus bimaculatus,,f,f,female,https://beespotter.org/bee/4813
4814,knobren,6/6/2016,2016,6,6,3163,honeybee on clover,6/5/2016,2016,6,5,3162,1,40.105089,-88.290995,Apis mellifera,Apis mellifera,,f,f,female,https://beespotter.org/bee/4814
4815,knobren,6/6/2016,2016,6,6,3163,honeybee on raspberry,6/5/2016,2016,6,5,3162,1,40.105089,-88.290995,Apis mellifera,Apis mellifera,,f,f,female,https://beespotter.org/bee/4815
4816,knobren,6/6/2016,2016,6,6,3163,impatiens on clover,6/5/2016,2016,6,5,3162,1,40.105089,-88.290995,Bombus impatiens,Bombus impatiens,,f,f,,https://beespotter.org/bee/4816
4817,knobren,6/6/2016,2016,6,6,3163,impatiens on raspberry,6/5/2016,2016,6,5,3162,1,40.105089,-88.290995,,Bombus impatiens,,f,f,female,https://beespotter.org/bee/4817
4818,knobren,6/6/2016,2016,6,6,3163,"impatiens on raspberry, 2",6/5/2016,2016,6,5,3162,1,40.105089,-88.290995,Bombus impatiens,Bombus impatiens,,f,f,female,https://beespotter.org/bee/4818
4819,twotringas,6/6/2016,2016,6,6,3163,queen rufocinctus,6/5/2016,2016,6,5,3162,1,42.304981,-89.156791,Bombus rufocinctus,Bombus rufocinctus,,f,f,female,https://beespotter.org/bee/4819
4820,twotringas,6/6/2016,2016,6,6,3163,queen citrinus on coreopsis,6/6/2016,2016,6,6,3163,0,42.304981,-89.156791,Bombus citrinus,Bombus citrinus,,f,f,female,https://beespotter.org/bee/4820
4821,twotringas,6/6/2016,2016,6,6,3163,auricomus (queen?) on White Wild Indigo,6/6/2016,2016,6,6,3163,0,42.35426265,-89.23362851,Bombus auricomus,Bombus auricomus,,f,f,female,https://beespotter.org/bee/4821
5198,ruth hoak,8/17/2016,2016,8,17,3235,Liatris,6/6/2016,2016,6,6,3163,72,37.6175501,-89.2089717,,Bombus griseocollis,,f,f,male,https://beespotter.org/bee/5198
4826,lindapopp,6/7/2016,2016,6,7,3164,bombus Bic,6/7/2016,2016,6,7,3164,0,42.26956455,-88.35401466,,Bombus bimaculatus,,f,f,female,https://beespotter.org/bee/4826
4827,lindapopp,6/7/2016,2016,6,7,3164,bombus b,6/7/2016,2016,6,7,3164,0,,,,Bombus impatiens,,f,f,female,https://beespotter.org/bee/4827
5113,ruth hoak,8/9/2016,2016,8,9,3227,more bumble bees,6/7/2016,2016,6,7,3164,63,37.6175501,-89.2089717,,Bombus griseocollis,,f,f,female,https://beespotter.org/bee/5113
4837,twotringas,6/16/2016,2016,6,16,3173,impatiens on Red Clover,6/8/2016,2016,6,8,3165,8,42.33802291,-89.07126904,Bombus impatiens,Bombus impatiens,,f,f,female,https://beespotter.org/bee/4837
4895,SRFdoesnot,6/28/2016,2016,6,28,3185,6/8 Spot,6/8/2016,2016,6,8,3165,20,41.8849639,-87.7966859,Apis mellifera,Apis mellifera,,f,f,female,https://beespotter.org/bee/4895
5385,SkrentnyJeff,12/19/2016,2016,12,19,3359,Bumble Bee Waters Bio Blitz,6/8/2016,2016,6,8,3165,194,41.96369931,-87.69206509,Bombus affinis,Bombus griseocollis,,f,f,female,https://beespotter.org/bee/5385
4834,SkrentnyJeff,6/13/2016,2016,6,13,3170,Palos Breeding Survey #2,6/9/2016,2016,6,9,3166,4,41.65479177,-87.92165011,Bombus fervidus,Bombus fervidus,,f,f,female,https://beespotter.org/bee/4834
4839,twotringas,6/16/2016,2016,6,16,3173,affinis,6/12/2016,2016,6,12,3169,4,42.23463392,-89.08907723,Bombus affinis,Bombus affinis,,t,t,female,https://beespotter.org/bee/4839
4840,twotringas,6/16/2016,2016,6,16,3173,honey bee on Spiderwort,6/12/2016,2016,6,12,3169,4,42.30449931,-89.15589809,Apis mellifera,Apis mellifera,,f,f,female,https://beespotter.org/bee/4840
4841,twotringas,6/16/2016,2016,6,16,3173,griseocollis on sage,6/15/2016,2016,6,15,3172,1,42.24436838,-89.11271453,Bombus griseocollis,Bombus griseocollis,,f,f,,https://beespotter.org/bee/4841
4842,twotringas,6/16/2016,2016,6,16,3173,bimaculatus on sage,6/15/2016,2016,6,15,3172,1,42.2444523,-89.1125402,Bombus bimaculatus,Bombus bimaculatus,,f,f,female,https://beespotter.org/bee/4842
