Spotting ID,Bee Spotter,Date Added to Site,Year Added to Site,Month Added to Site,Day Added to Site,Number of Days Between Site Launch and Date Added to Site,Title,Date Spotted,Year Spotted,Month Spotted,Day Spotted,Number of Days Between Site Launch and Date Spotted,Number of Days Between Date Spotted and Date Added to Site,Latitude,Longitude,Amateur Species Identification,Expert Species Identification (Primary),Expert Species Identification (Secondary),Protected Species?,Location Obscured?,Gender,Spotting URL
2012,John Dahlstedt,3/18/2011,2011,3,18,1256,Bee 514 Champaign Cty,3/16/2011,2011,3,16,1254,2,40.07986002,-88.20841447,Apis mellifera,Apis mellifera,,f,f,female,https://beespotter.org/bee/2012
2018,REAC,3/21/2011,2011,3,21,1259,20110319 01 bumble bee,3/19/2011,2011,3,19,1257,2,38.1176093,-89.7054505,Bombus impatiens,Bombus impatiens,,f,f,female,https://beespotter.org/bee/2018
2013,John Dahlstedt,3/20/2011,2011,3,20,1258,Bee 515 Champaign Cty,3/20/2011,2011,3,20,1258,0,40.07981692,-88.20844933,Apis mellifera,Apis mellifera,,f,f,female,https://beespotter.org/bee/2013
2014,John Dahlstedt,3/20/2011,2011,3,20,1258,Bee 516 Champaign Cty,3/20/2011,2011,3,20,1258,0,40.07980563,-88.20845068,Apis mellifera,Apis mellifera,,f,f,female,https://beespotter.org/bee/2014
2015,John Dahlstedt,3/20/2011,2011,3,20,1258,Bee 517 Champaign Cty,3/20/2011,2011,3,20,1258,0,40.07986002,-88.20841044,Apis mellifera,Apis mellifera,,f,f,female,https://beespotter.org/bee/2015
2016,John Dahlstedt,3/20/2011,2011,3,20,1258,Bee 518 Champaign Cty,3/20/2011,2011,3,20,1258,0,40.07981795,-88.20834607,Apis mellifera,Apis mellifera,,f,f,female,https://beespotter.org/bee/2016
2017,John Dahlstedt,3/20/2011,2011,3,20,1258,Bee 519 Champaign Cty,3/20/2011,2011,3,20,1258,0,40.08013195,-88.20813417,Apis mellifera,Apis mellifera,,f,f,female,https://beespotter.org/bee/2017
2020,John Dahlstedt,3/23/2011,2011,3,23,1261,Bee 520 Champaign Cty,3/23/2011,2011,3,23,1261,0,40.07987131,-88.20839837,Apis mellifera,Apis mellifera,,f,f,female,https://beespotter.org/bee/2020
2021,John Dahlstedt,4/3/2011,2011,4,3,1272,Bee 521 Champaign Cty,4/3/2011,2011,4,3,1272,0,40.0869308,-88.20103168,Apis mellifera,Apis mellifera,,f,f,female,https://beespotter.org/bee/2021
2022,John Dahlstedt,4/3/2011,2011,4,3,1272,Bee 522 Champaign Cty,4/3/2011,2011,4,3,1272,0,40.08696569,-88.20104778,Apis mellifera,Apis mellifera,,f,f,female,https://beespotter.org/bee/2022
2023,John Dahlstedt,4/5/2011,2011,4,5,1274,Bee 523 Champaign Cty,4/5/2011,2011,4,5,1274,0,40.07986104,-88.2084024,Apis mellifera,Apis mellifera,,f,f,female,https://beespotter.org/bee/2023
2024,John Dahlstedt,4/6/2011,2011,4,6,1275,Bee 524 Champaign Cty,4/6/2011,2011,4,6,1275,0,40.08025303,-88.20824683,Apis mellifera,Apis mellifera,,f,f,female,https://beespotter.org/bee/2024
2025,John Dahlstedt,4/6/2011,2011,4,6,1275,Bee 525 Champaign Cty,4/6/2011,2011,4,6,1275,0,40.07991646,-88.20834875,Apis mellifera,Apis mellifera,,f,f,female,https://beespotter.org/bee/2025
2026,John Dahlstedt,4/6/2011,2011,4,6,1275,Bee 526 Champaign Cty,4/6/2011,2011,4,6,1275,0,40.07992672,-88.20833534,Bombus impatiens,Bombus impatiens,,f,f,female,https://beespotter.org/bee/2026
2027,John Dahlstedt,4/11/2011,2011,4,11,1280,Bee 527 Champaign Cty,4/11/2011,2011,4,11,1280,0,40.07985078,-88.20844799,Apis mellifera,Apis mellifera,,f,f,female,https://beespotter.org/bee/2027
2028,John Dahlstedt,4/11/2011,2011,4,11,1280,Bee 528 Champaign Cty,4/11/2011,2011,4,11,1280,0,40.08025816,-88.20835814,Bombus impatiens,Bombus impatiens,,f,f,female,https://beespotter.org/bee/2028
2048,PepperCreek,5/31/2011,2011,5,31,1330,4/13/2011 11:52:13 AM,4/13/2011,2011,4,13,1282,48,42.239776,-88.974344,Bombus vagans,Bombus impatiens,Bombus impatiens,f,f,female,https://beespotter.org/bee/2048
2031,John Dahlstedt,4/17/2011,2011,4,17,1286,Bee 529 Champaign Cty,4/17/2011,2011,4,17,1286,0,40.07986002,-88.20845068,Apis mellifera,Apis mellifera,,f,f,female,https://beespotter.org/bee/2031
2032,John Dahlstedt,4/17/2011,2011,4,17,1286,Bee 530 Champaign Cty,4/17/2011,2011,4,17,1286,0,40.0802715,-88.20835009,Apis mellifera,Apis mellifera,,f,f,female,https://beespotter.org/bee/2032
2033,John Dahlstedt,4/17/2011,2011,4,17,1286,Bee 531 Champaign Cty,4/17/2011,2011,4,17,1286,0,40.08024995,-88.20834607,Apis mellifera,Apis mellifera,,f,f,female,https://beespotter.org/bee/2033
2034,John Dahlstedt,4/21/2011,2011,4,21,1290,Bee 532 Champaign Cty,4/21/2011,2011,4,21,1290,0,40.07980769,-88.20841849,Apis mellifera,Apis mellifera,,f,f,female,https://beespotter.org/bee/2034
2035,John Dahlstedt,4/23/2011,2011,4,23,1292,Bee 533 Champaign Cty,4/23/2011,2011,4,23,1292,0,40.08692773,-88.20082113,Apis mellifera,Apis mellifera,,f,f,female,https://beespotter.org/bee/2035
2036,TER_OR,5/1/2011,2011,5,1,1300,Bimiculatus queen fox trail,4/30/2011,2011,4,30,1299,1,42.09223564,-88.27334404,Bombus bimaculatus,Bombus bimaculatus,,f,f,female,https://beespotter.org/bee/2036
2037,John Dahlstedt,5/6/2011,2011,5,6,1305,Bee 534 Champaign Cty,5/6/2011,2011,5,6,1305,0,40.07984873,-88.20844799,Apis mellifera,Apis mellifera,,f,f,female,https://beespotter.org/bee/2037
2218,joshuallen,8/22/2011,2011,8,22,1413,Bombus CU,5/6/2011,2011,5,6,1305,108,40.090271,-88.239243,Bombus affinis,Bombus impatiens,,f,f,female,https://beespotter.org/bee/2218
2038,John Dahlstedt,5/7/2011,2011,5,7,1306,Bee 535 Champaign Cty,5/7/2011,2011,5,7,1306,0,40.07987028,-88.20840374,Apis mellifera,Apis mellifera,,f,f,female,https://beespotter.org/bee/2038
2039,John Dahlstedt,5/7/2011,2011,5,7,1306,Bee 536 Champaign Cty,5/7/2011,2011,5,7,1306,0,40.07981487,-88.20844531,Apis mellifera,Apis mellifera,,f,f,female,https://beespotter.org/bee/2039
2040,John Dahlstedt,5/7/2011,2011,5,7,1306,Bee 537 Champaign Cty,5/7/2011,2011,5,7,1306,0,40.07806835,-88.20871219,Apis mellifera,Apis mellifera,,f,f,female,https://beespotter.org/bee/2040
2041,WidowOfLaPorte,5/10/2011,2011,5,10,1309,First Bee Spotting of May '11,5/10/2011,2011,5,10,1309,0,42.0811009,-88.026643,Bombus bimaculatus,Bombus bimaculatus,,f,f,female,https://beespotter.org/bee/2041
2047,John Dahlstedt,5/31/2011,2011,5,31,1330,Bee 538 Champaign Cty,5/31/2011,2011,5,31,1330,0,40.07996776,-88.20353687,Bombus fervidus,Bombus fervidus,,f,f,female,https://beespotter.org/bee/2047
2049,janher,6/1/2011,2011,6,1,1331,Millenium1,5/31/2011,2011,5,31,1330,1,41.88162369,-87.62225926,Apis mellifera,Apis mellifera,,f,f,female,https://beespotter.org/bee/2049
2062,maybee,6/5/2011,2011,6,5,1335,Perkins Road bumble bee,5/31/2011,2011,5,31,1330,5,40.1264238,-88.17687035,Bombus pensylvanicus,Bombus pensylvanicus,,f,f,,https://beespotter.org/bee/2062
2050,QuantumKing,6/1/2011,2011,6,1,1331,Bombus Bimaculatus 1,6/1/2011,2011,6,1,1331,0,40.933968,-72.993104,Bombus griseocollis,Bombus impatiens,,f,f,female,https://beespotter.org/bee/2050
2057,janher,6/4/2011,2011,6,4,1334,msi1,6/3/2011,2011,6,3,1333,1,41.79297654,-87.58069038,Apis mellifera,Apis mellifera,,f,f,female,https://beespotter.org/bee/2057
2060,shorinbb,6/5/2011,2011,6,5,1335,June 5th,6/5/2011,2011,6,5,1335,0,40.105907,-88.199453,Apis mellifera,Apis mellifera,,f,f,female,https://beespotter.org/bee/2060
2065,John Dahlstedt,6/14/2011,2011,6,14,1344,Bee 539 Champaign Cty,6/14/2011,2011,6,14,1344,0,40.07994006,-88.20831925,Bombus impatiens,Bombus impatiens,,f,f,female,https://beespotter.org/bee/2065
2066,John Dahlstedt,6/15/2011,2011,6,15,1345,Bee 539 Champaign Cty,6/14/2011,2011,6,14,1344,1,40.07996263,-88.20830181,Bombus impatiens,Bombus impatiens,,f,f,female,https://beespotter.org/bee/2066
2067,John Dahlstedt,6/15/2011,2011,6,15,1345,Bee 540 Champaign Cty,6/14/2011,2011,6,14,1344,1,40.07992261,-88.20833132,Apis mellifera,Apis mellifera,,f,f,female,https://beespotter.org/bee/2067
2068,PepperCreek,6/15/2011,2011,6,15,1345,out back,6/14/2011,2011,6,14,1344,1,42.239776,-88.974344,Bombus bimaculatus,Bombus bimaculatus,,f,f,female,https://beespotter.org/bee/2068
2069,PepperCreek,6/15/2011,2011,6,15,1345,Front walk,6/15/2011,2011,6,15,1345,0,42.239776,-88.974344,Bombus bimaculatus,Bombus bimaculatus,,f,f,female,https://beespotter.org/bee/2069
2070,PepperCreek,6/16/2011,2011,6,16,1346,back coneflower,6/16/2011,2011,6,16,1346,0,42.239776,-88.974344,Bombus impatiens,Bombus impatiens,,f,f,female,https://beespotter.org/bee/2070
2071,PepperCreek,6/16/2011,2011,6,16,1346,Penstemon,6/16/2011,2011,6,16,1346,0,42.239776,-88.974344,Bombus bimaculatus,Bombus bimaculatus,,f,f,female,https://beespotter.org/bee/2071
2072,John Dahlstedt,6/16/2011,2011,6,16,1346,Bee 541 Champaign Cty,6/16/2011,2011,6,16,1346,0,40.08011963,-88.20817173,Apis mellifera,Apis mellifera,,f,f,female,https://beespotter.org/bee/2072
2073,John Dahlstedt,6/16/2011,2011,6,16,1346,Bee 542 Champaign Cty,6/16/2011,2011,6,16,1346,0,40.07996366,-88.20827901,Apis mellifera,Apis mellifera,,f,f,female,https://beespotter.org/bee/2073
2074,John Dahlstedt,6/16/2011,2011,6,16,1346,Bee 543 Champaign Cty,6/16/2011,2011,6,16,1346,0,40.07995032,-88.20832193,Apis mellifera,Apis mellifera,,f,f,female,https://beespotter.org/bee/2074
2076,John Dahlstedt,6/16/2011,2011,6,16,1346,Bee 545 Champaign Cty,6/16/2011,2011,6,16,1346,0,40.07995545,-88.2083112,Bombus bimaculatus,Bombus bimaculatus,,f,f,female,https://beespotter.org/bee/2076
2077,John Dahlstedt,6/16/2011,2011,6,16,1346,Bee 546 Champaign Cty,6/16/2011,2011,6,16,1346,0,40.08000265,-88.20838228,Bombus bimaculatus,Bombus bimaculatus,,f,f,female,https://beespotter.org/bee/2077
2078,John Dahlstedt,6/16/2011,2011,6,16,1346,Bee 547 Champaign Cty,6/16/2011,2011,6,16,1346,0,40.07994929,-88.20839167,Bombus griseocollis,Bombus griseocollis,,f,f,female,https://beespotter.org/bee/2078
2079,PepperCreek,6/18/2011,2011,6,18,1348,Front walk,6/18/2011,2011,6,18,1348,0,42.239776,-88.974344,Bombus impatiens,Bombus impatiens,,f,f,female,https://beespotter.org/bee/2079
2080,jennraber,6/18/2011,2011,6,18,1348,Graceland 6-18-11,6/18/2011,2011,6,18,1348,0,41.96132505,-87.66051292,Apis mellifera,Apis mellifera,,f,f,female,https://beespotter.org/bee/2080
2081,steverhayes908,6/25/2011,2011,6,25,1355,24-Jun,6/24/2011,2011,6,24,1354,1,38.6796522,-89.9746344,Bombus vagans,Bombus bimaculatus,,f,f,male,https://beespotter.org/bee/2081
2082,steverhayes908,6/25/2011,2011,6,25,1355,25-Jun,6/25/2011,2011,6,25,1355,0,38.6796522,-89.9746344,Bombus bimaculatus,Bombus bimaculatus,,f,f,female,https://beespotter.org/bee/2082
2084,John Dahlstedt,6/25/2011,2011,6,25,1355,Bee 548 Champaign Cty,6/25/2011,2011,6,25,1355,0,40.08106778,-88.20298433,Bombus griseocollis,Bombus griseocollis,,f,f,female,https://beespotter.org/bee/2084
2085,John Dahlstedt,6/25/2011,2011,6,25,1355,Bee 549 Champaign Cty,6/25/2011,2011,6,25,1355,0,40.07995955,-88.2083796,Apis mellifera,Apis mellifera,,f,f,female,https://beespotter.org/bee/2085
2086,John Dahlstedt,6/25/2011,2011,6,25,1355,Bee 550 Champaign Cty,6/25/2011,2011,6,25,1355,0,40.07993698,-88.20837289,Bombus bimaculatus,Bombus bimaculatus,,f,f,female,https://beespotter.org/bee/2086
2087,mary,6/26/2011,2011,6,26,1356,"honey bee on monarda, 3:30 pm, MB",6/26/2011,2011,6,26,1356,0,38.626345,-90.29762,Apis mellifera,Apis mellifera,,f,f,female,https://beespotter.org/bee/2087
2099,mary,7/3/2011,2011,7,3,1363,"1 honey bee on calamint, 3:30 pm, MB",6/26/2011,2011,6,26,1356,7,38.626345,-90.29762,Apis mellifera,Apis mellifera,,f,f,female,https://beespotter.org/bee/2099
2100,mary,7/3/2011,2011,7,3,1363,"13 honey bees on white clover, 3:30 -4:30 pm, MB",6/26/2011,2011,6,26,1356,7,38.626345,-90.29762,Apis mellifera,Apis mellifera,,f,f,female,https://beespotter.org/bee/2100
2101,mary,7/3/2011,2011,7,3,1363,"2 honeybees on blackeyed susans, 3:30pm, MB",6/26/2011,2011,6,26,1356,7,38.626345,-90.29762,Apis mellifera,Apis mellifera,,f,f,female,https://beespotter.org/bee/2101
2102,mary,7/3/2011,2011,7,3,1363,"1 honey bee on pink primrose, 3:30 pm. MB",6/26/2011,2011,6,26,1356,7,38.626345,-90.29762,Apis mellifera,Apis mellifera,,f,f,female,https://beespotter.org/bee/2102
2103,mary,7/3/2011,2011,7,3,1363,"30 honey bees on onions, 3:30-4:30 pm.,MB",6/26/2011,2011,6,26,1356,7,38.626345,-90.29762,Apis mellifera,Apis mellifera,,f,f,female,https://beespotter.org/bee/2103
2104,mary,7/3/2011,2011,7,3,1363,1 honeybee on wild geranium. 3:30-4:30 pm. MB,6/26/2011,2011,6,26,1356,7,38.626345,-90.29762,Apis mellifera,Apis mellifera,,f,f,female,https://beespotter.org/bee/2104
2105,mary,7/3/2011,2011,7,3,1363,"4 honey bees on echinacea, 3:30 pm, MB",6/26/2011,2011,6,26,1356,7,38.626345,-90.29762,Apis mellifera,Apis mellifera,,f,f,female,https://beespotter.org/bee/2105
2106,mary,7/3/2011,2011,7,3,1363,"1 honeybee on salvia, 3:30 pm, MB",6/26/2011,2011,6,26,1356,7,38.626345,-90.29762,Apis mellifera,Apis mellifera,,f,f,female,https://beespotter.org/bee/2106
2107,mary,7/3/2011,2011,7,3,1363,"1 sick disoriented honey bee in grass, 3:30 p,. MB",6/26/2011,2011,6,26,1356,7,38.626345,-90.29762,Apis mellifera,Apis mellifera,,f,f,female,https://beespotter.org/bee/2107
2088,janher,6/27/2011,2011,6,27,1357,sunkengarden1,6/27/2011,2011,6,27,1357,0,41.78692904,-87.58553982,Apis mellifera,Apis mellifera,,f,f,female,https://beespotter.org/bee/2088
2090,janher,6/29/2011,2011,6,29,1359,uchicago 1,6/29/2011,2011,6,29,1359,0,41.78744102,-87.59906888,Bombus fervidus,Bombus fervidus,,f,f,female,https://beespotter.org/bee/2090
2091,janher,6/29/2011,2011,6,29,1359,uchicago 2,6/29/2011,2011,6,29,1359,0,41.78960089,-87.60003448,Bombus griseocollis,Bombus griseocollis,,f,f,female,https://beespotter.org/bee/2091
5150,BeeSpotterParticipants,8/12/2016,2016,8,12,3230,TAP-In 2011 Student #2 - Spotting #1,6/29/2011,2011,6,29,1359,1871,40.08704871,-88.2144092,,Apis mellifera,,f,f,female,https://beespotter.org/bee/5150
5151,BeeSpotterParticipants,8/12/2016,2016,8,12,3230,TAP-In 2011 Student #3 - Spotting #1,6/29/2011,2011,6,29,1359,1871,40.08723154,-88.21436159,,Bombus griseocollis,,f,f,female,https://beespotter.org/bee/5151
5152,BeeSpotterParticipants,8/12/2016,2016,8,12,3230,TAP-In 2011 Student #3 - Spotting #2,6/29/2011,2011,6,29,1359,1871,40.08678172,-88.21442328,,Apis mellifera,,f,f,female,https://beespotter.org/bee/5152
5153,BeeSpotterParticipants,8/12/2016,2016,8,12,3230,TAP-In 2011 Student #5 - Spotting #1,6/29/2011,2011,6,29,1359,1871,40.08719091,-88.21429588,,Bombus griseocollis,,f,f,female,https://beespotter.org/bee/5153
5154,BeeSpotterParticipants,8/12/2016,2016,8,12,3230,TAP-In 2011 Student #5 - Spotting #2,6/29/2011,2011,6,29,1359,1871,40.08600977,-88.21471229,,Apis mellifera,,f,f,female,https://beespotter.org/bee/5154
5155,BeeSpotterParticipants,8/12/2016,2016,8,12,3230,TAP-In 2011 Student #6 - Spotting #1,6/29/2011,2011,6,29,1359,1871,40.08725186,-88.21426369,,Bombus griseocollis,,f,f,female,https://beespotter.org/bee/5155
5156,BeeSpotterParticipants,8/12/2016,2016,8,12,3230,TAP-In 2011 Student #6 - Spotting #2,6/29/2011,2011,6,29,1359,1871,40.08684847,-88.21440786,,Apis mellifera,,f,f,female,https://beespotter.org/bee/5156
5159,BeeSpotterParticipants,8/12/2016,2016,8,12,3230,TAP-In 2011 Student #7 - Spotting #1,6/29/2011,2011,6,29,1359,1871,40.08716189,-88.21429923,,Bombus griseocollis,,f,f,female,https://beespotter.org/bee/5159
5160,BeeSpotterParticipants,8/12/2016,2016,8,12,3230,TAP-In 2011 Student #7 - Spotting #2,6/29/2011,2011,6,29,1359,1871,40.08692392,-88.21436092,,Apis mellifera,,f,f,female,https://beespotter.org/bee/5160
5161,BeeSpotterParticipants,8/12/2016,2016,8,12,3230,TAP-In 2011 Student #7 - Spotting #3,6/29/2011,2011,6,29,1359,1871,40.08673529,-88.2145004,,Bombus griseocollis,,f,f,female,https://beespotter.org/bee/5161
5162,BeeSpotterParticipants,8/12/2016,2016,8,12,3230,TAP-In 2011 Student #7 - Spotting #4,6/29/2011,2011,6,29,1359,1871,40.08656842,-88.21445949,,Apis mellifera,,f,f,female,https://beespotter.org/bee/5162
5163,BeeSpotterParticipants,8/12/2016,2016,8,12,3230,TAP-In 2011 Student #7 - Spotting #5,6/29/2011,2011,6,29,1359,1871,40.08603589,-88.2147257,,Apis mellifera,,f,f,female,https://beespotter.org/bee/5163
5164,BeeSpotterParticipants,8/12/2016,2016,8,12,3230,TAP-In 2011 Student #10 - Spotting #1,6/29/2011,2011,6,29,1359,1871,40.08680784,-88.21439579,,Apis mellifera,,f,f,female,https://beespotter.org/bee/5164
5165,BeeSpotterParticipants,8/12/2016,2016,8,12,3230,TAP-In 2011 Student #10 - Spotting #2,6/29/2011,2011,6,29,1359,1871,40.0864712,-88.21432337,,Apis mellifera,,f,f,female,https://beespotter.org/bee/5165
5166,BeeSpotterParticipants,8/12/2016,2016,8,12,3230,TAP-In 2011 Student #10 - Spotting #3,6/29/2011,2011,6,29,1359,1871,40.08598655,-88.21473911,,Apis mellifera,,f,f,female,https://beespotter.org/bee/5166
5167,BeeSpotterParticipants,8/12/2016,2016,8,12,3230,TAP-In 2011 Student #10 - Spotting #4,6/29/2011,2011,6,29,1359,1871,40.08689781,-88.2148625,,Bombus griseocollis,,f,f,female,https://beespotter.org/bee/5167
5168,BeeSpotterParticipants,8/12/2016,2016,8,12,3230,TAP-In 2011 Student #11 - Spotting #1,6/29/2011,2011,6,29,1359,1871,40.08703856,-88.21432941,,Apis mellifera,,f,f,female,https://beespotter.org/bee/5168
5169,BeeSpotterParticipants,8/12/2016,2016,8,12,3230,TAP-In 2011 Student #11 - Spotting #2,6/29/2011,2011,6,29,1359,1871,40.08704146,-88.21428381,,Bombus griseocollis,,f,f,female,https://beespotter.org/bee/5169
5171,BeeSpotterParticipants,8/12/2016,2016,8,12,3230,TAP-In 2011 Student #11 - Spotting #4,6/29/2011,2011,6,29,1359,1871,40.08653214,-88.21485981,,Apis mellifera,,f,f,female,https://beespotter.org/bee/5171
2095,John Dahlstedt,7/2/2011,2011,7,2,1362,Bee 551 Champaign Cty,6/30/2011,2011,6,30,1360,2,40.08047673,-88.20287704,Bombus auricomus,Bombus auricomus,,f,f,female,https://beespotter.org/bee/2095
2096,John Dahlstedt,7/2/2011,2011,7,2,1362,Bee 552 Champaign Cty,6/30/2011,2011,6,30,1360,2,40.08016478,-88.2034564,Bombus griseocollis,Bombus griseocollis,,f,f,female,https://beespotter.org/bee/2096
2092,PepperCreek,7/1/2011,2011,7,1,1361,hydrangea,7/1/2011,2011,7,1,1361,0,42.239776,-88.974344,Bombus griseocollis,Bombus griseocollis,,f,f,female,https://beespotter.org/bee/2092
2093,wscovill,7/1/2011,2011,7,1,1361,Clover bee,7/1/2011,2011,7,1,1361,0,41.7269859,-88.266828,Bombus bimaculatus,Bombus bimaculatus,,f,f,male,https://beespotter.org/bee/2093
2097,wscovill,7/3/2011,2011,7,3,1363,Clover070311,7/3/2011,2011,7,3,1363,0,41.7269859,-88.266828,Bombus bimaculatus,Bombus bimaculatus,,f,f,female,https://beespotter.org/bee/2097
2098,wscovill,7/3/2011,2011,7,3,1363,Clover070311secondbee,7/3/2011,2011,7,3,1363,0,41.7269859,-88.266828,Bombus bimaculatus,Bombus bimaculatus,,f,f,female,https://beespotter.org/bee/2098
2108,John Dahlstedt,7/4/2011,2011,7,4,1364,Bee 553 Champaign Cty,7/3/2011,2011,7,3,1363,1,40.08078046,-88.20476532,Bombus griseocollis,Bombus griseocollis,,f,f,female,https://beespotter.org/bee/2108
2109,John Dahlstedt,7/4/2011,2011,7,4,1364,Bee 554 Champaign Cty,7/3/2011,2011,7,3,1363,1,40.0797728,-88.20843726,Bombus bimaculatus,Bombus bimaculatus,,f,f,male,https://beespotter.org/bee/2109
2110,wscovill,7/4/2011,2011,7,4,1364,clover070411,7/4/2011,2011,7,4,1364,0,41.7269859,-88.266828,Bombus vagans,Bombus bimaculatus,,f,f,male,https://beespotter.org/bee/2110
4253,annerem,7/4/2015,2015,7,4,2825,Unknown,7/4/2011,2011,7,4,1364,1461,42.275127,-89.07354,Bombus rufocinctus,Bombus rufocinctus,,f,f,,https://beespotter.org/bee/4253
2111,PepperCreek,7/5/2011,2011,7,5,1365,Rosebush,7/5/2011,2011,7,5,1365,0,42.239776,-88.974344,Bombus bimaculatus,Bombus bimaculatus,,f,f,female,https://beespotter.org/bee/2111
2112,wscovill,7/5/2011,2011,7,5,1365,Clover070511,7/5/2011,2011,7,5,1365,0,41.7269859,-88.266828,Bombus bimaculatus,Bombus bimaculatus,,f,f,female,https://beespotter.org/bee/2112
2120,John Dahlstedt,7/11/2011,2011,7,11,1371,Bee 555 Champaign Cty,7/7/2011,2011,7,7,1367,4,40.07995545,-88.20832193,Bombus bimaculatus,Bombus bimaculatus,,f,f,female,https://beespotter.org/bee/2120
2121,John Dahlstedt,7/11/2011,2011,7,11,1371,Bee 556 Champaign Cty,7/7/2011,2011,7,7,1367,4,40.08644446,-88.20081711,Bombus impatiens,Bombus impatiens,,f,f,female,https://beespotter.org/bee/2121
2333,janher,11/2/2011,2011,11,2,1485,Skyscraper bee,7/7/2011,2011,7,7,1367,118,41.793512,-87.583201,Bombus griseocollis,Bombus griseocollis,,f,f,male,https://beespotter.org/bee/2333
2116,wscovill,7/8/2011,2011,7,8,1368,clover070811bee1,7/8/2011,2011,7,8,1368,0,41.7269859,-88.266828,Bombus vagans,Bombus bimaculatus,,f,f,male,https://beespotter.org/bee/2116
2117,wscovill,7/8/2011,2011,7,8,1368,clover070811bee2,7/8/2011,2011,7,8,1368,0,41.7269859,-88.266828,Apis mellifera,Apis mellifera,,f,f,female,https://beespotter.org/bee/2117
2118,wscovill,7/8/2011,2011,7,8,1368,penstemon070811bee3,7/8/2011,2011,7,8,1368,0,41.7269859,-88.266828,Bombus bimaculatus,Bombus impatiens,,f,f,female,https://beespotter.org/bee/2118
2119,wscovill,7/9/2011,2011,7,9,1369,Clover,7/9/2011,2011,7,9,1369,0,41.7269859,-88.266828,Apis mellifera,Apis mellifera,,f,f,female,https://beespotter.org/bee/2119
2122,John Dahlstedt,7/11/2011,2011,7,11,1371,Bee 557 Champaign Cty,7/10/2011,2011,7,10,1370,1,40.07988772,-88.20836484,Bombus griseocollis,Bombus griseocollis,,f,f,female,https://beespotter.org/bee/2122
2123,John Dahlstedt,7/11/2011,2011,7,11,1371,Bee 558 Champaign Cty,7/10/2011,2011,7,10,1370,1,40.0802715,-88.20322037,Bombus auricomus,Bombus auricomus,,f,f,female,https://beespotter.org/bee/2123
2124,wscovill,7/12/2011,2011,7,12,1372,Penstemon071211,7/12/2011,2011,7,12,1372,0,41.7269859,-88.266828,Bombus bimaculatus,Bombus impatiens,,f,f,female,https://beespotter.org/bee/2124
2125,tahtorakk,7/13/2011,2011,7,13,1373,Tap in spottings,7/13/2011,2011,7,13,1373,0,40.08503261,-88.215065,,Apis mellifera,,f,f,female,https://beespotter.org/bee/2125
2126,barajudeh,7/13/2011,2011,7,13,1373,My first bee spotting,7/13/2011,2011,7,13,1373,0,40.08680563,-88.21523666,Bombus griseocollis,Apis mellifera,,f,f,female,https://beespotter.org/bee/2126
2128,beingme,7/13/2011,2011,7,13,1373,sring gueen,7/13/2011,2011,7,13,1373,0,40.08644446,-88.21455002,Bombus affinis,Bombus griseocollis,,f,f,female,https://beespotter.org/bee/2128
2131,skullcandy999,7/13/2011,2011,7,13,1373,magic bee,7/13/2011,2011,7,13,1373,0,40.08713396,-88.2142067,Bombus affinis,Apis mellifera,,f,f,female,https://beespotter.org/bee/2131
2132,beegirlsweet,7/13/2011,2011,7,13,1373,beesgonewild,7/13/2011,2011,7,13,1373,0,40.08805328,-88.20991516,Bombus griseocollis,Bombus griseocollis,,f,f,female,https://beespotter.org/bee/2132
2133,jsizzle3,7/13/2011,2011,7,13,1373,beespoters,7/13/2011,2011,7,13,1373,0,40.08555795,-88.21549416,,Bombus griseocollis,,f,f,female,https://beespotter.org/bee/2133
2135,wscovill,7/13/2011,2011,7,13,1373,Penstemon071311bee1,7/13/2011,2011,7,13,1373,0,41.7269859,-88.266828,Bombus bimaculatus,Bombus impatiens,,f,f,female,https://beespotter.org/bee/2135
2136,wscovill,7/13/2011,2011,7,13,1373,Penstemon071311bee2,7/13/2011,2011,7,13,1373,0,,,Bombus bimaculatus,Bombus impatiens,,f,f,female,https://beespotter.org/bee/2136
2137,annerem,7/15/2011,2011,7,15,1375,Front garden 7/15/11,7/15/2011,2011,7,15,1375,0,42.27527655,-89.0739727,Bombus auricomus,Bombus auricomus,,f,f,female,https://beespotter.org/bee/2137
2138,wscovill,7/15/2011,2011,7,15,1375,Penstemon,7/15/2011,2011,7,15,1375,0,41.7269859,-88.266828,Bombus bimaculatus,Bombus impatiens,,f,f,female,https://beespotter.org/bee/2138
2140,wscovill,7/16/2011,2011,7,16,1376,Penstemon,7/16/2011,2011,7,16,1376,0,41.7269859,-88.266828,Bombus bimaculatus,Bombus impatiens,,f,f,female,https://beespotter.org/bee/2140
2143,TheFotoFairy,7/19/2011,2011,7,19,1379,Napping Bumble,7/16/2011,2011,7,16,1376,3,40.114618,-88.262933,Bombus variabilis,Bombus impatiens,,f,f,female,https://beespotter.org/bee/2143
2148,rosebudlls,7/23/2011,2011,7,23,1383,foxtail,7/16/2011,2011,7,16,1376,7,42.3444999,-87.9822049,Bombus citrinus,Apis mellifera,,f,f,female,https://beespotter.org/bee/2148
2141,wscovill,7/17/2011,2011,7,17,1377,Pumpkin,7/17/2011,2011,7,17,1377,0,41.7269859,-88.266828,Bombus griseocollis,Bombus impatiens,,f,f,female,https://beespotter.org/bee/2141
2142,wscovill,7/18/2011,2011,7,18,1378,Penstemon,7/18/2011,2011,7,18,1378,0,41.7269859,-88.266828,Bombus griseocollis,Bombus impatiens,,f,f,female,https://beespotter.org/bee/2142
2144,wscovill,7/19/2011,2011,7,19,1379,Penstemon,7/19/2011,2011,7,19,1379,0,41.7269859,-88.266828,Bombus bimaculatus,Bombus impatiens,,f,f,female,https://beespotter.org/bee/2144
2145,John Dahlstedt,7/22/2011,2011,7,22,1382,Bee 559 Champaign Cty,7/20/2011,2011,7,20,1380,2,40.08188867,-88.20252836,Bombus bimaculatus,Bombus bimaculatus,,f,f,female,https://beespotter.org/bee/2145
2146,John Dahlstedt,7/22/2011,2011,7,22,1382,Bee 560 Champaign Cty,7/20/2011,2011,7,20,1380,2,40.08079688,-88.20373535,Bombus pensylvanicus,Bombus pensylvanicus,Bombus auricomus,f,f,male,https://beespotter.org/bee/2146
2217,joshuallen,8/22/2011,2011,8,22,1413,Honey CU,7/20/2011,2011,7,20,1380,33,40.090271,-88.239243,Apis mellifera,Apis mellifera,,f,f,female,https://beespotter.org/bee/2217
2149,John Dahlstedt,7/24/2011,2011,7,24,1384,Bee 561 Champaign Cty,7/23/2011,2011,7,23,1383,1,40.08082151,-88.20352077,Bombus auricomus,Bombus auricomus,,f,f,female,https://beespotter.org/bee/2149
2150,John Dahlstedt,7/24/2011,2011,7,24,1384,Bee 562 Champaign Cty,7/23/2011,2011,7,23,1383,1,40.08070658,-88.20465803,Apis mellifera,Apis mellifera,,f,f,female,https://beespotter.org/bee/2150
2151,John Dahlstedt,7/24/2011,2011,7,24,1384,Bee 563 Champaign Cty,7/23/2011,2011,7,23,1383,1,40.08082972,-88.20474386,Apis mellifera,Apis mellifera,,f,f,female,https://beespotter.org/bee/2151
2152,atintari,7/24/2011,2011,7,24,1384,Purple Cone Flower,7/24/2011,2011,7,24,1384,0,41.568412,-87.666752,Apis mellifera,Apis mellifera,,f,f,female,https://beespotter.org/bee/2152
2166,twotringas,8/1/2011,2011,8,1,1392,impatiens - yard,7/24/2011,2011,7,24,1384,8,42.305172,-89.156867,Bombus impatiens,Bombus impatiens,,f,f,female,https://beespotter.org/bee/2166
2153,John Dahlstedt,7/26/2011,2011,7,26,1386,Bee 564 Champaign Cty,7/25/2011,2011,7,25,1385,1,40.08232374,-88.20253372,Bombus bimaculatus,Bombus bimaculatus,,f,f,female,https://beespotter.org/bee/2153
2154,John Dahlstedt,7/26/2011,2011,7,26,1386,Bee 565 Champaign Cty,7/25/2011,2011,7,25,1385,1,40.08079688,-88.20343494,Bombus pensylvanicus,Bombus pensylvanicus,,f,f,female,https://beespotter.org/bee/2154
2155,John Dahlstedt,7/26/2011,2011,7,26,1386,Bee 566 Champaign Cty,7/25/2011,2011,7,25,1385,1,40.08080509,-88.20470095,Apis mellifera,Apis mellifera,,f,f,female,https://beespotter.org/bee/2155
2159,DavidSiegfried,7/27/2011,2011,7,27,1387,Bumble Bee on Coneflower,7/26/2011,2011,7,26,1386,1,41.957304,-87.720037,Bombus griseocollis,Bombus griseocollis,,f,f,female,https://beespotter.org/bee/2159
2160,janher,7/29/2011,2011,7,29,1389,sunkengarden2,7/29/2011,2011,7,29,1389,0,41.78686504,-87.58566856,Bombus griseocollis,Bombus griseocollis,,f,f,female,https://beespotter.org/bee/2160
2163,wscovill,7/31/2011,2011,7,31,1391,Penstemon,7/29/2011,2011,7,29,1389,2,41.7269859,-88.266828,Bombus impatiens,Bombus impatiens,,f,f,female,https://beespotter.org/bee/2163
2167,twotringas,8/1/2011,2011,8,1,1392,yard,7/29/2011,2011,7,29,1389,3,42.305172,-89.156867,Bombus griseocollis,Bombus griseocollis,,f,f,female,https://beespotter.org/bee/2167
2168,twotringas,8/1/2011,2011,8,1,1392,yard b,7/29/2011,2011,7,29,1389,3,42.305172,-89.156867,Bombus auricomus,Bombus auricomus,,f,f,female,https://beespotter.org/bee/2168
2161,twotringas,7/30/2011,2011,7,30,1390,30-Jul-11,7/30/2011,2011,7,30,1390,0,42.43809421,-89.11442639,Bombus affinis,Bombus affinis,,t,t,female,https://beespotter.org/bee/2161
2162,twotringas,7/30/2011,2011,7,30,1390,"July 30, 2011 b",7/30/2011,2011,7,30,1390,0,42.26313571,-89.11034428,Bombus affinis,Bombus affinis,,t,t,,https://beespotter.org/bee/2162
2164,wscovill,7/31/2011,2011,7,31,1391,Pensteom,7/30/2011,2011,7,30,1390,1,41.7269859,-88.266828,Bombus griseocollis,Bombus impatiens,,f,f,female,https://beespotter.org/bee/2164
2165,wscovill,7/31/2011,2011,7,31,1391,Sunflower,7/30/2011,2011,7,30,1390,1,41.7269859,-88.266828,Bombus bimaculatus,Bombus impatiens,,f,f,,https://beespotter.org/bee/2165
2216,joshuallen,8/22/2011,2011,8,22,1413,Bombus 1,7/30/2011,2011,7,30,1390,23,40.1219395,-87.7357298,Bombus griseocollis,Bombus griseocollis,,f,f,female,https://beespotter.org/bee/2216
2374,philo,3/27/2012,2012,3,27,1631,Backyard Bees,7/30/2011,2011,7,30,1390,241,41.7944682,-87.5841552,Bombus griseocollis,Bombus griseocollis,,f,f,female,https://beespotter.org/bee/2374
2376,philo,3/27/2012,2012,3,27,1631,Bees on St johns wort,7/30/2011,2011,7,30,1390,241,41.7944682,-87.5841552,Bombus affinis,Bombus vagans,,f,f,,https://beespotter.org/bee/2376
2198,TER_OR,8/16/2011,2011,8,16,1407,B. Fervidus,7/31/2011,2011,7,31,1391,16,42.1020753,-88.27806473,Bombus pensylvanicus,Bombus fervidus,,f,f,female,https://beespotter.org/bee/2198
2190,twotringas,8/15/2011,2011,8,15,1406,affinis - coneflower,8/1/2011,2011,8,1,1392,14,42.305172,-89.156867,Bombus affinis,Bombus citrinus,,f,f,male,https://beespotter.org/bee/2190
2169,Gloria,8/2/2011,2011,8,2,1393,brown belt,8/2/2011,2011,8,2,1393,0,41.73494179,-87.77526855,Bombus griseocollis,Bombus griseocollis,,f,f,male,https://beespotter.org/bee/2169
2197,TER_OR,8/16/2011,2011,8,16,1407,Bimiculatus,8/3/2011,2011,8,3,1394,13,42.101304,-88.277343,Bombus bimaculatus,Bombus bimaculatus,,f,f,male,https://beespotter.org/bee/2197
2170,wscovill,8/4/2011,2011,8,4,1395,PenstemonGround,8/4/2011,2011,8,4,1395,0,41.7269859,-88.266828,Bombus bimaculatus,Bombus impatiens,,f,f,female,https://beespotter.org/bee/2170
2171,wscovill,8/9/2011,2011,8,9,1400,RFSunflower,8/6/2011,2011,8,6,1397,3,41.7269859,-88.266828,Apis mellifera,Apis mellifera,,f,f,female,https://beespotter.org/bee/2171
2172,wscovill,8/9/2011,2011,8,9,1400,RFSunflower,8/7/2011,2011,8,7,1398,2,41.7269859,-88.266828,Bombus impatiens,Bombus impatiens,,f,f,female,https://beespotter.org/bee/2172
2173,wscovill,8/9/2011,2011,8,9,1400,PenstemonBee2,8/7/2011,2011,8,7,1398,2,41.7269859,-88.266828,Bombus impatiens,Bombus impatiens,,f,f,female,https://beespotter.org/bee/2173
2175,twotringas,8/14/2011,2011,8,14,1405,affinis,8/12/2011,2011,8,12,1403,2,42.189014,-89.14919614,Bombus affinis,Bombus affinis,,t,t,female,https://beespotter.org/bee/2175
2191,twotringas,8/15/2011,2011,8,15,1406,affinis - cosmos,8/12/2011,2011,8,12,1403,3,42.305172,-89.156867,Bombus affinis,Bombus citrinus,,f,f,male,https://beespotter.org/bee/2191
2196,TER_OR,8/16/2011,2011,8,16,1407,Impatiens male maybe,8/12/2011,2011,8,12,1403,4,42.101304,-88.277343,Bombus bimaculatus,Apis mellifera,,f,f,female,https://beespotter.org/bee/2196
2176,twotringas,8/14/2011,2011,8,14,1405,honeybee - vervain,8/14/2011,2011,8,14,1405,0,42.305172,-89.156867,Apis mellifera,Apis mellifera,,f,f,female,https://beespotter.org/bee/2176
2177,twotringas,8/14/2011,2011,8,14,1405,citrinus 1,8/14/2011,2011,8,14,1405,0,42.305172,-89.156867,Bombus citrinus,Bombus citrinus,,f,f,female,https://beespotter.org/bee/2177
2178,twotringas,8/14/2011,2011,8,14,1405,citrinus - rosinweed,8/14/2011,2011,8,14,1405,0,42.305172,-89.156867,Bombus citrinus,Bombus citrinus,,f,f,female,https://beespotter.org/bee/2178
2179,twotringas,8/14/2011,2011,8,14,1405,impatiens - rosinweed,8/14/2011,2011,8,14,1405,0,42.305172,-89.156867,Bombus impatiens,Bombus impatiens,,f,f,female,https://beespotter.org/bee/2179
2184,wscovill,8/15/2011,2011,8,15,1406,Penstemonbee1,8/14/2011,2011,8,14,1405,1,41.7269859,-88.266828,Bombus fervidus,Bombus impatiens,,f,f,female,https://beespotter.org/bee/2184
2185,wscovill,8/15/2011,2011,8,15,1406,Penstemonbee2,8/14/2011,2011,8,14,1405,1,41.7269859,-88.266828,Bombus impatiens,Bombus impatiens,,f,f,female,https://beespotter.org/bee/2185
2186,wscovill,8/15/2011,2011,8,15,1406,RFSunflowerbee3,8/14/2011,2011,8,14,1405,1,41.7269859,-88.266828,Bombus bimaculatus,Bombus bimaculatus,,f,f,female,https://beespotter.org/bee/2186
2192,twotringas,8/16/2011,2011,8,16,1407,auricomus - rosinweed 1,8/14/2011,2011,8,14,1405,2,42.305172,-89.156867,Bombus auricomus,Bombus auricomus,,f,f,male,https://beespotter.org/bee/2192
2213,dlanier,8/21/2011,2011,8,21,1412,Bee 1 8-14,8/14/2011,2011,8,14,1405,7,40.4631231,-88.9325135,Bombus fraternus,Bombus impatiens,,f,f,female,https://beespotter.org/bee/2213
2180,twotringas,8/15/2011,2011,8,15,1406,unident 1-5,8/15/2011,2011,8,15,1406,0,42.305172,-89.156867,,Bombus rufocinctus,,f,f,male,https://beespotter.org/bee/2180
2187,wscovill,8/15/2011,2011,8,15,1406,Insectarybee1,8/15/2011,2011,8,15,1406,0,41.7269859,-88.266828,Bombus bimaculatus,Bombus bimaculatus,Bombus griseocollis,f,f,female,https://beespotter.org/bee/2187
2188,wscovill,8/15/2011,2011,8,15,1406,RFSunflowerbee2,8/15/2011,2011,8,15,1406,0,41.7269859,-88.266828,Bombus bimaculatus,Bombus bimaculatus,,f,f,female,https://beespotter.org/bee/2188
2193,Nelcyn,8/16/2011,2011,8,16,1407,Backyard Garden,8/16/2011,2011,8,16,1407,0,42.00848902,-88.28613281,Bombus griseocollis,Bombus impatiens,,f,f,female,https://beespotter.org/bee/2193
2195,TER_OR,8/16/2011,2011,8,16,1407,Bombus ruffocintus,8/16/2011,2011,8,16,1407,0,42.101304,-88.277343,Bombus griseocollis,Bombus rufocinctus,,f,f,male,https://beespotter.org/bee/2195
2203,melodycarroll,8/17/2011,2011,8,17,1408,cosmos,8/16/2011,2011,8,16,1407,1,41.9093676,-88.4285903,Bombus auricomus,Bombus auricomus,,f,f,male,https://beespotter.org/bee/2203
2206,melodycarroll,8/17/2011,2011,8,17,1408,coneflower,8/16/2011,2011,8,16,1407,1,41.90898435,-88.42809677,Bombus auricomus,Bombus auricomus,,f,f,male,https://beespotter.org/bee/2206
2230,twotringas,8/24/2011,2011,8,24,1415,citrinus - severson,8/16/2011,2011,8,16,1407,8,42.20957511,-89.19988632,,Bombus citrinus,,f,f,male,https://beespotter.org/bee/2230
2231,twotringas,8/24/2011,2011,8,24,1415,griseocollis - severson,8/16/2011,2011,8,16,1407,8,42.20957511,-89.20022964,Bombus griseocollis,Bombus griseocollis,,f,f,female,https://beespotter.org/bee/2231
2232,twotringas,8/24/2011,2011,8,24,1415,impatiens - severson,8/16/2011,2011,8,16,1407,8,42.20957511,-89.19988632,Bombus impatiens,Bombus impatiens,,f,f,female,https://beespotter.org/bee/2232
2233,twotringas,8/24/2011,2011,8,24,1415,citrinus - severson,8/16/2011,2011,8,16,1407,8,42.20944796,-89.20005798,Bombus citrinus,Bombus citrinus,,f,f,female,https://beespotter.org/bee/2233
2234,twotringas,8/24/2011,2011,8,24,1415,auricomus - severson,8/16/2011,2011,8,16,1407,8,42.20868506,-89.20125961,,Bombus auricomus,,f,f,female,https://beespotter.org/bee/2234
2895,twotringas,6/12/2013,2013,6,12,2073,pensylvanicus on thistle,8/16/2011,2011,8,16,1407,666,42.20804931,-89.20246124,Bombus pensylvanicus,Bombus pensylvanicus,,f,f,female,https://beespotter.org/bee/2895
2208,TER_OR,8/17/2011,2011,8,17,1408,Affinis,8/17/2011,2011,8,17,1408,0,41.95358623,-88.21994287,Bombus affinis,Bombus affinis,,t,t,female,https://beespotter.org/bee/2208
2209,wscovill,8/17/2011,2011,8,17,1408,RFSunflower,8/17/2011,2011,8,17,1408,0,41.7269859,-88.266828,Bombus bimaculatus,Bombus bimaculatus,,f,f,female,https://beespotter.org/bee/2209
2681,twotringas,9/2/2012,2012,9,2,1790,unknown on Liatris,8/18/2011,2011,8,18,1409,381,42.304981,-89.156791,Bombus impatiens,Bombus bimaculatus,,f,f,male,https://beespotter.org/bee/2681
2211,Gloria,8/19/2011,2011,8,19,1410,honeybee raingarden,8/19/2011,2011,8,19,1410,0,41.72605429,-87.79138327,Apis mellifera,Apis mellifera,,f,f,female,https://beespotter.org/bee/2211
2225,Dave_K,8/23/2011,2011,8,23,1414,two bumbles on Sunflower,8/19/2011,2011,8,19,1410,4,41.93867968,-88.07790756,,Bombus impatiens,,f,f,both,https://beespotter.org/bee/2225
2219,joshuallen,8/22/2011,2011,8,22,1413,Honey CU 2,8/22/2011,2011,8,22,1413,0,40.090271,-88.239243,Apis mellifera,Apis mellifera,,f,f,female,https://beespotter.org/bee/2219
2220,joshuallen,8/22/2011,2011,8,22,1413,Honey CU White,8/22/2011,2011,8,22,1413,0,40.090271,-88.239243,Apis mellifera,Apis mellifera,,f,f,female,https://beespotter.org/bee/2220
2221,dlanier,8/22/2011,2011,8,22,1413,Probable B Griseocollis on Purple Salvia approx 6:50p,8/22/2011,2011,8,22,1413,0,40.4631231,-88.9325135,Bombus griseocollis,Bombus impatiens,,f,f,female,https://beespotter.org/bee/2221
2228,twotringas,8/24/2011,2011,8,24,1415,fervidus - prairie thistle,8/22/2011,2011,8,22,1413,2,42.305172,-89.156867,Bombus fervidus,Bombus fervidus,,f,f,male,https://beespotter.org/bee/2228
2222,wscovill,8/23/2011,2011,8,23,1414,MSunflowerBee1,8/23/2011,2011,8,23,1414,0,41.7269859,-88.266828,Bombus impatiens,Bombus impatiens,,f,f,female,https://beespotter.org/bee/2222
2223,wscovill,8/23/2011,2011,8,23,1414,PenstemonBee2,8/23/2011,2011,8,23,1414,0,41.7269859,-88.266828,Bombus impatiens,Bombus impatiens,,f,f,female,https://beespotter.org/bee/2223
2224,wscovill,8/23/2011,2011,8,23,1414,PenstemonBee3,8/23/2011,2011,8,23,1414,0,41.7269859,-88.266828,Bombus impatiens,Bombus impatiens,,f,f,female,https://beespotter.org/bee/2224
2227,twotringas,8/24/2011,2011,8,24,1415,affinis - Village Green Nursery,8/23/2011,2011,8,23,1414,1,42.21837619,-88.9332218,Bombus affinis,Bombus affinis,,t,t,female,https://beespotter.org/bee/2227
2235,TER_OR,8/24/2011,2011,8,24,1415,Affinis Male,8/23/2011,2011,8,23,1414,1,42.19602222,-88.39150685,Bombus affinis,Bombus affinis,,t,t,male,https://beespotter.org/bee/2235
2236,wscovill,8/25/2011,2011,8,25,1416,RFSunflowerbee1,8/25/2011,2011,8,25,1416,0,41.7269859,-88.266828,Bombus impatiens,Bombus impatiens,,f,f,female,https://beespotter.org/bee/2236
2237,wscovill,8/25/2011,2011,8,25,1416,MSunflowerbee2,8/25/2011,2011,8,25,1416,0,41.7269859,-88.266828,Bombus impatiens,Bombus impatiens,,f,f,female,https://beespotter.org/bee/2237
2238,wscovill,8/25/2011,2011,8,25,1416,MSunflowerbee3,8/25/2011,2011,8,25,1416,0,41.7269859,-88.266828,Apis mellifera,Apis mellifera,,f,f,female,https://beespotter.org/bee/2238
2239,wscovill,8/25/2011,2011,8,25,1416,MSunflowerbee4,8/25/2011,2011,8,25,1416,0,41.7269859,-88.266828,Apis mellifera,Apis mellifera,,f,f,female,https://beespotter.org/bee/2239
2241,twotringas,8/27/2011,2011,8,27,1418,unident - prairie thistle,8/26/2011,2011,8,26,1417,1,42.305172,-89.156867,,Bombus rufocinctus,,f,f,female,https://beespotter.org/bee/2241
2240,twotringas,8/27/2011,2011,8,27,1418,vagans - rosinweed,8/27/2011,2011,8,27,1418,0,42.305172,-89.156867,Bombus vagans,Bombus vagans,,f,f,male,https://beespotter.org/bee/2240
3420,suel8159,9/4/2013,2013,9,4,2157,Camppinebee1,8/28/2011,2011,8,28,1419,738,42.07940038,-87.88678408,,Apis mellifera,,f,f,female,https://beespotter.org/bee/3420
2243,twotringas,8/29/2011,2011,8,29,1420,honeybee -goldenrod,8/29/2011,2011,8,29,1420,0,42.305172,-89.156867,Apis mellifera,Apis mellifera,,f,f,female,https://beespotter.org/bee/2243
2244,twotringas,8/29/2011,2011,8,29,1420,honeybee - goldenrod,8/29/2011,2011,8,29,1420,0,42.305172,-89.156867,Apis mellifera,Apis mellifera,,f,f,female,https://beespotter.org/bee/2244
2245,twotringas,8/29/2011,2011,8,29,1420,honeybee - prairie dock,8/29/2011,2011,8,29,1420,0,42.305172,-89.156867,Apis mellifera,Apis mellifera,,f,f,female,https://beespotter.org/bee/2245
2246,twotringas,8/29/2011,2011,8,29,1420,honeybee - goldenrod,8/29/2011,2011,8,29,1420,0,42.305172,-89.156867,Apis mellifera,Apis mellifera,,f,f,female,https://beespotter.org/bee/2246
2253,TER_OR,9/5/2011,2011,9,5,1427,B Affinis Dundee 83111,8/31/2011,2011,8,31,1422,5,42.15177059,-88.18886765,Bombus affinis,Bombus affinis,,t,t,female,https://beespotter.org/bee/2253
2256,twotringas,9/7/2011,2011,9,7,1429,honeybee - goldenrod,8/31/2011,2011,8,31,1422,7,42.305172,-89.156867,Apis mellifera,Apis mellifera,,f,f,female,https://beespotter.org/bee/2256
2252,oakland1,9/5/2011,2011,9,5,1427,bumble bee? front yard,9/4/2011,2011,9,4,1426,1,40.103547,-88.307879,Bombus auricomus,Bombus fervidus,,f,f,female,https://beespotter.org/bee/2252
2257,twotringas,9/7/2011,2011,9,7,1429,honeybee - sedum,9/4/2011,2011,9,4,1426,3,42.305172,-89.156867,Apis mellifera,Apis mellifera,,f,f,female,https://beespotter.org/bee/2257
2255,twotringas,9/7/2011,2011,9,7,1429,pensylvanicus - prairie thistle,9/6/2011,2011,9,6,1428,1,42.305172,-89.156867,,Bombus fervidus,Bombus pensylvanicus,f,f,male,https://beespotter.org/bee/2255
2260,Gloria,9/9/2011,2011,9,9,1431,Sept bee,9/9/2011,2011,9,9,1431,0,41.74826273,-87.78359413,Bombus impatiens,Bombus impatiens,,f,f,male,https://beespotter.org/bee/2260
2261,Gloria,9/9/2011,2011,9,9,1431,Sept bee 2,9/9/2011,2011,9,9,1431,0,41.74823071,-87.78372288,Bombus impatiens,Bombus impatiens,,f,f,female,https://beespotter.org/bee/2261
2289,twotringas,9/23/2011,2011,9,23,1445,honeybee - sedum,9/9/2011,2011,9,9,1431,14,42.305172,-89.156867,Apis mellifera,Apis mellifera,,f,f,female,https://beespotter.org/bee/2289
2290,twotringas,9/23/2011,2011,9,23,1445,honeybee - Sedum,9/9/2011,2011,9,9,1431,14,42.305172,-89.156867,Apis mellifera,Apis mellifera,,f,f,female,https://beespotter.org/bee/2290
2291,twotringas,9/23/2011,2011,9,23,1445,honeybee - Sedum,9/9/2011,2011,9,9,1431,14,42.305172,-89.156867,Apis mellifera,Apis mellifera,,f,f,female,https://beespotter.org/bee/2291
4023,metterh,4/10/2015,2015,4,10,2740,ruth bee,9/9/2011,2011,9,9,1431,1309,41.98833257,-87.76900291,,Apis mellifera,,f,f,female,https://beespotter.org/bee/4023
4024,metterh,4/10/2015,2015,4,10,2740,ruth-bee,9/9/2011,2011,9,9,1431,1309,41.98788599,-87.76853085,,Bombus impatiens,,f,f,,https://beespotter.org/bee/4024
4025,metterh,4/10/2015,2015,4,10,2740,ruth-bee,9/9/2011,2011,9,9,1431,1309,41.991467,-87.774544,,Apis mellifera,,f,f,female,https://beespotter.org/bee/4025
3419,suel8159,9/4/2013,2013,9,4,2157,bspotballardfield,9/10/2011,2011,9,10,1432,725,42.04491069,-87.87191391,,Apis mellifera,,f,f,female,https://beespotter.org/bee/3419
2263,twotringas,9/11/2011,2011,9,11,1433,Vagans - goldenrod,9/11/2011,2011,9,11,1433,0,42.305172,-89.156867,Bombus vagans,Bombus vagans,,f,f,female,https://beespotter.org/bee/2263
2265,John Dahlstedt,9/13/2011,2011,9,13,1435,Bee 567 Champaign Cty,9/11/2011,2011,9,11,1433,2,40.08244688,-88.20164323,Bombus pensylvanicus,Bombus pensylvanicus,,f,f,female,https://beespotter.org/bee/2265
2266,John Dahlstedt,9/13/2011,2011,9,13,1435,Bee 568 Champaign Cty,9/11/2011,2011,9,11,1433,2,40.082373,-88.20191145,Apis mellifera,Apis mellifera,,f,f,female,https://beespotter.org/bee/2266
2267,John Dahlstedt,9/13/2011,2011,9,13,1435,Bee 569 Champaign Cty,9/11/2011,2011,9,11,1433,2,40.08186405,-88.20180416,,Bombus fervidus,,f,f,male,https://beespotter.org/bee/2267
2268,John Dahlstedt,9/13/2011,2011,9,13,1435,Bee 570 Champaign Cty,9/11/2011,2011,9,11,1433,2,40.08094464,-88.20199728,Bombus griseocollis,Bombus griseocollis,,f,f,female,https://beespotter.org/bee/2268
2269,John Dahlstedt,9/13/2011,2011,9,13,1435,Bee 571 Champaign Cty,9/11/2011,2011,9,11,1433,2,40.08041926,-88.20318818,Bombus fervidus,Bombus fervidus,,f,f,female,https://beespotter.org/bee/2269
2270,John Dahlstedt,9/13/2011,2011,9,13,1435,Bee 572 Champaign Cty,9/11/2011,2011,9,11,1433,2,40.08168345,-88.20188999,Bombus fervidus,Bombus fervidus,,f,f,male,https://beespotter.org/bee/2270
2271,wscovill,9/15/2011,2011,9,15,1437,LicoriceMintBee1,9/11/2011,2011,9,11,1433,4,41.7269859,-88.266828,Bombus impatiens,Bombus impatiens,,f,f,female,https://beespotter.org/bee/2271
2272,wscovill,9/15/2011,2011,9,15,1437,CosmoBee2,9/11/2011,2011,9,11,1433,4,41.7269859,-88.266828,Bombus impatiens,Bombus impatiens,,f,f,female,https://beespotter.org/bee/2272
2273,wscovill,9/15/2011,2011,9,15,1437,FlowerBee3,9/11/2011,2011,9,11,1433,4,41.7269859,-88.266828,Bombus impatiens,Bombus impatiens,,f,f,female,https://beespotter.org/bee/2273
2292,twotringas,9/23/2011,2011,9,23,1445,Honeybee - sedum,9/11/2011,2011,9,11,1433,12,42.305172,-89.156867,Apis mellifera,Apis mellifera,,f,f,female,https://beespotter.org/bee/2292
3421,suel8159,9/4/2013,2013,9,4,2157,bspot1,9/11/2011,2011,9,11,1433,724,42.05723912,-87.87382364,,Apis mellifera,,f,f,female,https://beespotter.org/bee/3421
2264,jmyers,9/12/2011,2011,9,12,1434,Hive fell in my front yard,9/12/2011,2011,9,12,1434,0,40.1946439,-88.414197,Apis mellifera,Apis mellifera,,f,f,female,https://beespotter.org/bee/2264
3422,suel8159,9/4/2013,2013,9,4,2157,bspot,9/14/2011,2011,9,14,1436,721,42.05722718,-87.87395239,,Apis mellifera,,f,f,female,https://beespotter.org/bee/3422
2274,Dave_K,9/17/2011,2011,9,17,1439,Bumble on Zinnia,9/17/2011,2011,9,17,1439,0,41.93880737,-88.07756424,,Bombus impatiens,,f,f,female,https://beespotter.org/bee/2274
2276,joshuallen,9/17/2011,2011,9,17,1439,Yellow Bumblebee,9/17/2011,2011,9,17,1439,0,40.08020583,-88.20890665,Bombus auricomus,Bombus fervidus,,f,f,female,https://beespotter.org/bee/2276
2306,wscovill,10/3/2011,2011,10,3,1455,091711CloverBee1,9/17/2011,2011,9,17,1439,16,41.7269859,-88.266828,Bombus impatiens,Bombus impatiens,,f,f,female,https://beespotter.org/bee/2306
2307,wscovill,10/3/2011,2011,10,3,1455,091711LicoriceMintBee2,9/17/2011,2011,9,17,1439,16,41.7269859,-88.266828,Bombus impatiens,Bombus impatiens,,f,f,female,https://beespotter.org/bee/2307
2277,John Dahlstedt,9/20/2011,2011,9,20,1442,Bee 573 Champaign Cty,9/20/2011,2011,9,20,1442,0,40.08238121,-88.20164859,Bombus auricomus,Bombus auricomus,,f,f,female,https://beespotter.org/bee/2277
2278,John Dahlstedt,9/20/2011,2011,9,20,1442,Bee 574 Champaign Cty,9/20/2011,2011,9,20,1442,0,40.08174091,-88.20180416,,Bombus fervidus,,f,f,male,https://beespotter.org/bee/2278
2279,John Dahlstedt,9/20/2011,2011,9,20,1442,Bee 575 Champaign Cty,9/20/2011,2011,9,20,1442,0,40.08059165,-88.20259809,Bombus griseocollis,Bombus griseocollis,,f,f,female,https://beespotter.org/bee/2279
2280,John Dahlstedt,9/20/2011,2011,9,20,1442,Bee 576 Champaign Cty,9/20/2011,2011,9,20,1442,0,40.08074763,-88.20478678,Bombus impatiens,Bombus impatiens,,f,f,female,https://beespotter.org/bee/2280
2281,John Dahlstedt,9/20/2011,2011,9,20,1442,Bee 577 Champaign Cty,9/20/2011,2011,9,20,1442,0,40.08069016,-88.20457757,Apis mellifera,Apis mellifera,,f,f,female,https://beespotter.org/bee/2281
2293,twotringas,9/23/2011,2011,9,23,1445,honeybee - sedum,9/20/2011,2011,9,20,1442,3,42.305172,-89.156867,Apis mellifera,Apis mellifera,,f,f,female,https://beespotter.org/bee/2293
2282,Gloria,9/21/2011,2011,9,21,1443,Double bee,9/21/2011,2011,9,21,1443,0,41.74829475,-87.78380871,Bombus impatiens,Bombus impatiens,,f,f,both,https://beespotter.org/bee/2282
2286,janher,9/22/2011,2011,9,22,1444,honeybee56,9/21/2011,2011,9,21,1443,1,41.7932485,-87.59358108,Apis mellifera,Apis mellifera,,f,f,female,https://beespotter.org/bee/2286
2294,twotringas,9/23/2011,2011,9,23,1445,affinis - goldenrod,9/22/2011,2011,9,22,1444,1,42.17965889,-89.11793953,Bombus affinis,Bombus affinis,,t,t,male,https://beespotter.org/bee/2294
2295,twotringas,9/23/2011,2011,9,23,1445,honey bee - sedum,9/22/2011,2011,9,22,1444,1,42.305172,-89.156867,Apis mellifera,Apis mellifera,,f,f,female,https://beespotter.org/bee/2295
2296,twotringas,9/23/2011,2011,9,23,1445,honeybee - sedum,9/22/2011,2011,9,22,1444,1,42.305172,-89.156867,Apis mellifera,Apis mellifera,,f,f,female,https://beespotter.org/bee/2296
2297,twotringas,9/23/2011,2011,9,23,1445,impatiens - sedum,9/22/2011,2011,9,22,1444,1,42.305172,-89.156867,Bombus impatiens,Bombus impatiens,,f,f,male,https://beespotter.org/bee/2297
2298,twotringas,9/23/2011,2011,9,23,1445,vagans - new england aster,9/23/2011,2011,9,23,1445,0,42.305172,-89.156867,Bombus vagans,Bombus vagans,,f,f,male,https://beespotter.org/bee/2298
2308,wscovill,10/3/2011,2011,10,3,1455,092411FrontBee1,9/24/2011,2011,9,24,1446,9,41.7269859,-88.266828,Bombus impatiens,Bombus impatiens,,f,f,female,https://beespotter.org/bee/2308
2301,John Dahlstedt,10/3/2011,2011,10,3,1455,Bee 578 Champaign Cty,10/2/2011,2011,10,2,1454,1,40.08174912,-88.20238352,Apis mellifera,Apis mellifera,,f,f,female,https://beespotter.org/bee/2301
2302,John Dahlstedt,10/3/2011,2011,10,3,1455,Bee 579 Champaign Cty,10/2/2011,2011,10,2,1454,1,40.08155211,-88.20244789,Apis mellifera,Apis mellifera,,f,f,female,https://beespotter.org/bee/2302
2303,John Dahlstedt,10/3/2011,2011,10,3,1455,Bee 580 Champaign Cty,10/2/2011,2011,10,2,1454,1,40.07706167,-88.2084775,Bombus auricomus,Bombus auricomus,,f,f,female,https://beespotter.org/bee/2303
2305,John Dahlstedt,10/3/2011,2011,10,3,1455,Bee 581 Champaign Cty,10/2/2011,2011,10,2,1454,1,40.07692211,-88.2084775,Bombus impatiens,Bombus impatiens,,f,f,male,https://beespotter.org/bee/2305
2310,wscovill,10/3/2011,2011,10,3,1455,100211Penstemon,10/2/2011,2011,10,2,1454,1,41.7269859,-88.266828,Bombus impatiens,Bombus impatiens,,f,f,female,https://beespotter.org/bee/2310
2309,wscovill,10/3/2011,2011,10,3,1455,092411FrontBee2,10/3/2011,2011,10,3,1455,0,41.7269859,-88.266828,Apis mellifera,Apis mellifera,,f,f,female,https://beespotter.org/bee/2309
2311,John Dahlstedt,10/6/2011,2011,10,6,1458,Bee 582 Champaign Cty,10/6/2011,2011,10,6,1458,0,40.08229091,-88.20454001,Apis mellifera,Apis mellifera,,f,f,female,https://beespotter.org/bee/2311
2312,wscovill,10/7/2011,2011,10,7,1459,Penstemon,10/6/2011,2011,10,6,1458,1,41.7269859,-88.266828,Bombus impatiens,Bombus impatiens,,f,f,female,https://beespotter.org/bee/2312
2313,wscovill,10/7/2011,2011,10,7,1459,LicoriceMint,10/7/2011,2011,10,7,1459,0,41.7269859,-88.266828,Bombus impatiens,Bombus impatiens,,f,f,female,https://beespotter.org/bee/2313
2314,John Dahlstedt,10/8/2011,2011,10,8,1460,Bee 583 Vermilion Cty,10/8/2011,2011,10,8,1460,0,40.20816377,-87.65019178,Apis mellifera,Apis mellifera,,f,f,female,https://beespotter.org/bee/2314
2315,John Dahlstedt,10/9/2011,2011,10,9,1461,Bee 584 Champaign Cty,10/9/2011,2011,10,9,1461,0,40.08287373,-88.20162177,Bombus impatiens,Bombus impatiens,,f,f,male,https://beespotter.org/bee/2315
2316,John Dahlstedt,10/9/2011,2011,10,9,1461,Bee 585 Champaign Cty,10/9/2011,2011,10,9,1461,0,40.08278344,-88.20154667,Apis mellifera,Apis mellifera,,f,f,female,https://beespotter.org/bee/2316
2317,John Dahlstedt,10/9/2011,2011,10,9,1461,Bee 586 Champaign Cty,10/9/2011,2011,10,9,1461,0,40.08205285,-88.20255518,Apis mellifera,Apis mellifera,,f,f,female,https://beespotter.org/bee/2317
2318,wscovill,10/11/2011,2011,10,11,1463,LicoriceMint,10/9/2011,2011,10,9,1461,2,41.7269859,-88.266828,Apis mellifera,Apis mellifera,,f,f,female,https://beespotter.org/bee/2318
2319,wscovill,10/11/2011,2011,10,11,1463,LicoriceMintbee1,10/10/2011,2011,10,10,1462,1,41.7269859,-88.266828,Apis mellifera,Apis mellifera,,f,f,female,https://beespotter.org/bee/2319
2320,wscovill,10/11/2011,2011,10,11,1463,PenstemonBee2,10/10/2011,2011,10,10,1462,1,41.7269859,-88.266828,Bombus impatiens,Bombus impatiens,,f,f,,https://beespotter.org/bee/2320
2321,wscovill,10/11/2011,2011,10,11,1463,DillBee1,10/11/2011,2011,10,11,1463,0,41.7269859,-88.266828,Bombus impatiens,Bombus impatiens,,f,f,male,https://beespotter.org/bee/2321
2322,wscovill,10/11/2011,2011,10,11,1463,DillBee2,10/11/2011,2011,10,11,1463,0,41.7269859,-88.266828,Bombus impatiens,Bombus impatiens,,f,f,,https://beespotter.org/bee/2322
2323,wscovill,10/11/2011,2011,10,11,1463,DillBee3,10/11/2011,2011,10,11,1463,0,41.7269859,-88.266828,Bombus impatiens,Bombus impatiens,,f,f,female,https://beespotter.org/bee/2323
2324,wscovill,10/11/2011,2011,10,11,1463,DillBee4,10/11/2011,2011,10,11,1463,0,41.7269859,-88.266828,Bombus impatiens,Bombus impatiens,,f,f,female,https://beespotter.org/bee/2324
2352,peewee42,2/18/2012,2012,2,18,1593,Bee #1,2/1/2012,2012,2,1,1576,17,40.110976,-88.270962,Apis mellifera,Apis mellifera,,f,f,female,https://beespotter.org/bee/2352
4080,knobren,5/29/2015,2015,5,29,2789,honeybee on snowdrop,2/1/2012,2012,2,1,1576,1213,39.4882247,-88.1720587,Apis mellifera,Apis mellifera,,f,f,,https://beespotter.org/bee/4080
2358,John Dahlstedt,3/10/2012,2012,3,10,1614,Bee 587 Champaign Cty,3/10/2012,2012,3,10,1614,0,40.0869226,-88.20102364,Apis mellifera,Apis mellifera,,f,f,female,https://beespotter.org/bee/2358
2359,TER_OR,3/13/2012,2012,3,13,1617,Honeybee West Dundee,3/11/2012,2012,3,11,1615,2,42.09545201,-88.27724934,Apis mellifera,Apis mellifera,,f,f,female,https://beespotter.org/bee/2359
2360,mayemil1,3/15/2012,2012,3,15,1619,Apis mellifera,3/14/2012,2012,3,14,1618,1,42.7211643,-84.47413445,Apis mellifera,Apis mellifera,,f,f,female,https://beespotter.org/bee/2360
2361,John Dahlstedt,3/15/2012,2012,3,15,1619,Bee 588 Champaign Cty,3/15/2012,2012,3,15,1619,0,40.08028689,-88.20838496,Apis mellifera,Apis mellifera,,f,f,female,https://beespotter.org/bee/2361
2362,Gloria,3/18/2012,2012,3,18,1622,First bee 2012,3/18/2012,2012,3,18,1622,0,41.748969,-87.783562,Bombus impatiens,Bombus impatiens,,f,f,female,https://beespotter.org/bee/2362
2363,Gloria,3/18/2012,2012,3,18,1622,Bumble on Nanking cherry,3/18/2012,2012,3,18,1622,0,41.748969,-87.783562,Bombus impatiens,Bombus impatiens,,f,f,female,https://beespotter.org/bee/2363
2364,joshuallen,3/18/2012,2012,3,18,1622,Bee,3/18/2012,2012,3,18,1622,0,40.0786625,-88.20776939,Bombus vagans,Bombus griseocollis,Bombus bimaculatus,f,f,female,https://beespotter.org/bee/2364
2365,John Dahlstedt,3/20/2012,2012,3,20,1624,Bee 589 Champaign Cty,3/18/2012,2012,3,18,1622,2,40.07996366,-88.20830181,Bombus bimaculatus,Bombus bimaculatus,,f,f,female,https://beespotter.org/bee/2365
2366,John Dahlstedt,3/20/2012,2012,3,20,1624,Bee 590 Champaign Cty,3/18/2012,2012,3,18,1622,2,40.0798867,-88.20835814,Bombus bimaculatus,Bombus bimaculatus,,f,f,female,https://beespotter.org/bee/2366
2370,mayemil1,3/22/2012,2012,3,22,1626,B. bimaculatus TNRC,3/20/2012,2012,3,20,1624,2,42.60336521,-86.15471005,Bombus bimaculatus,Bombus bimaculatus,,f,f,female,https://beespotter.org/bee/2370
2367,twotringas,3/21/2012,2012,3,21,1625,bimaculatus,3/21/2012,2012,3,21,1625,0,42.304981,-89.156791,Bombus bimaculatus,Bombus bimaculatus,,f,f,female,https://beespotter.org/bee/2367
2371,wscovill,3/25/2012,2012,3,25,1629,Flower,3/24/2012,2012,3,24,1628,1,41.726962,-88.266828,Bombus bimaculatus,Bombus bimaculatus,,f,f,female,https://beespotter.org/bee/2371
2373,bennat8,3/25/2012,2012,3,25,1629,Winfield0325,3/25/2012,2012,3,25,1629,0,41.88362063,-88.1470871,Bombus bimaculatus,Bombus bimaculatus,,f,f,female,https://beespotter.org/bee/2373
2378,John Dahlstedt,3/28/2012,2012,3,28,1632,Bee 591 Champaign Cty,3/27/2012,2012,3,27,1631,1,40.08693286,-88.20101157,Apis mellifera,Apis mellifera,,f,f,female,https://beespotter.org/bee/2378
2379,John Dahlstedt,3/28/2012,2012,3,28,1632,Bee 592 Champaign Cty,3/28/2012,2012,3,28,1632,0,40.08018633,-88.20798129,Apis mellifera,Apis mellifera,,f,f,female,https://beespotter.org/bee/2379
2380,TER_OR,3/28/2012,2012,3,28,1632,B. Bimiculatus 032812,3/28/2012,2012,3,28,1632,0,42.1013019,-88.277347,Bombus bimaculatus,Bombus bimaculatus,,f,f,female,https://beespotter.org/bee/2380
2381,John Dahlstedt,3/30/2012,2012,3,30,1634,Bee 593 Champaign Cty,3/30/2012,2012,3,30,1634,0,40.08026021,-88.20832998,Apis mellifera,Apis mellifera,,f,f,female,https://beespotter.org/bee/2381
2382,John Dahlstedt,3/30/2012,2012,3,30,1634,Bee 594 Champaign Cty,3/30/2012,2012,3,30,1634,0,40.07985284,-88.20845202,Apis mellifera,Apis mellifera,,f,f,female,https://beespotter.org/bee/2382
2385,tpresnell,4/8/2012,2012,4,8,1643,bumble1,4/7/2012,2012,4,7,1642,1,39.3731892,-89.10100937,Bombus griseocollis,Bombus impatiens,,f,f,female,https://beespotter.org/bee/2385
2386,John Dahlstedt,4/9/2012,2012,4,9,1644,Bee 595 Champaign Cty,4/9/2012,2012,4,9,1644,0,40.07988362,-88.20841312,Apis mellifera,Apis mellifera,,f,f,female,https://beespotter.org/bee/2386
2387,twotringas,4/15/2012,2012,4,15,1650,griseocollis on Prairie Crab,4/15/2012,2012,4,15,1650,0,42.304981,-89.156791,Bombus griseocollis,Bombus griseocollis,,f,f,female,https://beespotter.org/bee/2387
2388,John Dahlstedt,4/17/2012,2012,4,17,1652,Bee 596 Champaign Cty,4/17/2012,2012,4,17,1652,0,40.07985899,-88.20845336,Apis mellifera,Apis mellifera,,f,f,female,https://beespotter.org/bee/2388
2390,joshuallen,4/24/2012,2012,4,24,1659,Yellow Abdomen,4/24/2012,2012,4,24,1659,0,40.09009913,-88.23882937,Bombus fervidus,Bombus fervidus,,f,f,female,https://beespotter.org/bee/2390
2393,tpresnell,4/26/2012,2012,4,26,1661,Honey,4/24/2012,2012,4,24,1659,2,39.372334,-89.10119,Apis mellifera,Apis mellifera,,f,f,female,https://beespotter.org/bee/2393
2391,tpresnell,4/26/2012,2012,4,26,1661,Honey1,4/26/2012,2012,4,26,1661,0,39.372334,-89.10119,Apis mellifera,Apis mellifera,,f,f,female,https://beespotter.org/bee/2391
2392,tpresnell,4/26/2012,2012,4,26,1661,Honey2,4/26/2012,2012,4,26,1661,0,39.372334,-89.10119,Apis mellifera,Apis mellifera,,f,f,female,https://beespotter.org/bee/2392
2394,janher,4/30/2012,2012,4,30,1665,nature museum 1,4/29/2012,2012,4,29,1664,1,41.92618059,-87.63495684,Apis mellifera,Apis mellifera,,f,f,female,https://beespotter.org/bee/2394
2395,TER_OR,4/30/2012,2012,4,30,1665,Bimiculatus fox trail,4/29/2012,2012,4,29,1664,1,42.10634187,-88.28619719,Bombus bimaculatus,Bombus bimaculatus,,f,f,female,https://beespotter.org/bee/2395
2396,tpresnell,5/2/2012,2012,5,2,1667,Bees on Salvia,5/2/2012,2012,5,2,1667,0,39.372334,-89.10119,Bombus affinis,Bombus griseocollis,,f,f,female,https://beespotter.org/bee/2396
2397,tpresnell,5/2/2012,2012,5,2,1667,Honey on Salvia,5/2/2012,2012,5,2,1667,0,39.372334,-89.10119,Apis mellifera,Apis mellifera,,f,f,female,https://beespotter.org/bee/2397
2398,joshuallen,5/2/2012,2012,5,2,1667,Very large bombus,5/2/2012,2012,5,2,1667,0,40.09005604,-88.23888302,Bombus auricomus,Bombus auricomus,,f,f,female,https://beespotter.org/bee/2398
2399,John Dahlstedt,5/7/2012,2012,5,7,1672,Bee 597 Champaign Cty,5/3/2012,2012,5,3,1668,4,40.08319388,-88.20162177,Apis mellifera,Apis mellifera,,f,f,female,https://beespotter.org/bee/2399
2400,John Dahlstedt,5/7/2012,2012,5,7,1672,Bee 598 Champaign Cty,5/3/2012,2012,5,3,1668,4,40.08047673,-88.20572019,Apis mellifera,Apis mellifera,,f,f,female,https://beespotter.org/bee/2400
2418,twotringas,5/14/2012,2012,5,14,1679,auricomus,5/4/2012,2012,5,4,1669,10,42.304981,-89.156791,Bombus auricomus,Bombus auricomus,,f,f,female,https://beespotter.org/bee/2418
2402,John Dahlstedt,5/8/2012,2012,5,8,1673,Bee 599 Champaign Cty,5/8/2012,2012,5,8,1673,0,40.08014836,-88.20360661,Apis mellifera,Apis mellifera,,f,f,female,https://beespotter.org/bee/2402
2403,John Dahlstedt,5/8/2012,2012,5,8,1673,Bee 600 Champaign Cty,5/8/2012,2012,5,8,1673,0,40.07995955,-88.20585966,Apis mellifera,Apis mellifera,,f,f,female,https://beespotter.org/bee/2403
2404,janher,5/8/2012,2012,5,8,1673,tunnel1,5/8/2012,2012,5,8,1673,0,41.79262459,-87.58043289,Apis mellifera,Apis mellifera,,f,f,female,https://beespotter.org/bee/2404
2405,janher,5/8/2012,2012,5,8,1673,Chestnut 1,5/8/2012,2012,5,8,1673,0,41.7958741,-87.58057773,Apis mellifera,Apis mellifera,,f,f,female,https://beespotter.org/bee/2405
2407,joshuallen,5/10/2012,2012,5,10,1675,Lobed,5/10/2012,2012,5,10,1675,0,40.09007245,-88.23890448,Bombus bimaculatus,Bombus bimaculatus,,f,f,female,https://beespotter.org/bee/2407
2409,argonnebees,5/10/2012,2012,5,10,1675,Hawthorns 51012,5/10/2012,2012,5,10,1675,0,42.3249564,-87.8573097,,Apis mellifera,,f,f,female,https://beespotter.org/bee/2409
2410,wscovill,5/10/2012,2012,5,10,1675,BB1,5/10/2012,2012,5,10,1675,0,41.726962,-88.266828,Bombus bimaculatus,Bombus impatiens,,f,f,female,https://beespotter.org/bee/2410
2411,wscovill,5/10/2012,2012,5,10,1675,BB2,5/10/2012,2012,5,10,1675,0,41.726962,-88.266828,Bombus bimaculatus,Bombus impatiens,,f,f,female,https://beespotter.org/bee/2411
2412,wscovill,5/10/2012,2012,5,10,1675,BB3,5/10/2012,2012,5,10,1675,0,41.726962,-88.266828,Bombus bimaculatus,Bombus impatiens,,f,f,female,https://beespotter.org/bee/2412
2413,wscovill,5/10/2012,2012,5,10,1675,BB4,5/10/2012,2012,5,10,1675,0,41.726962,-88.266828,,Bombus impatiens,,f,f,female,https://beespotter.org/bee/2413
2416,John Dahlstedt,5/14/2012,2012,5,14,1679,Bee 601 Champaign Cty,5/12/2012,2012,5,12,1677,2,40.12732618,-88.21249008,,Bombus griseocollis,,f,f,female,https://beespotter.org/bee/2416
2417,John Dahlstedt,5/14/2012,2012,5,14,1679,Bee 602 Champaign Cty,5/12/2012,2012,5,12,1677,2,40.12724415,-88.21294069,Bombus bimaculatus,Bombus bimaculatus,,f,f,female,https://beespotter.org/bee/2417
2415,wscovill,5/14/2012,2012,5,14,1679,BB1,5/13/2012,2012,5,13,1678,1,41.726962,-88.266828,Bombus impatiens,Bombus impatiens,,f,f,female,https://beespotter.org/bee/2415
2419,twotringas,5/14/2012,2012,5,14,1679,honeybee on Baptisia,5/13/2012,2012,5,13,1678,1,42.304981,-89.156791,Apis mellifera,Apis mellifera,,f,f,female,https://beespotter.org/bee/2419
2449,philo,6/1/2012,2012,6,1,1697,5:21,5/13/2012,2012,5,13,1678,19,41.7944682,-87.5841552,Bombus griseocollis,Bombus impatiens,,f,f,female,https://beespotter.org/bee/2449
2420,twotringas,5/14/2012,2012,5,14,1679,fervidus on Baptisia,5/14/2012,2012,5,14,1679,0,42.304981,-89.156791,Bombus fervidus,Bombus fervidus,,f,f,female,https://beespotter.org/bee/2420
2421,twotringas,5/14/2012,2012,5,14,1679,auricomus on Baptisia,5/14/2012,2012,5,14,1679,0,42.304981,-89.156791,Bombus auricomus,Bombus auricomus,,f,f,female,https://beespotter.org/bee/2421
2422,twotringas,5/14/2012,2012,5,14,1679,auricomus on Baptisia,5/14/2012,2012,5,14,1679,0,42.304981,-89.156791,Bombus auricomus,Bombus auricomus,,f,f,female,https://beespotter.org/bee/2422
2426,John Dahlstedt,5/18/2012,2012,5,18,1683,Bee 603 Champaign Cty,5/16/2012,2012,5,16,1681,2,40.07723407,-88.20450783,Bombus bimaculatus,Bombus bimaculatus,,f,f,female,https://beespotter.org/bee/2426
2423,wscovill,5/17/2012,2012,5,17,1682,SmallBB1,5/17/2012,2012,5,17,1682,0,41.726962,-88.266828,Bombus bimaculatus,Bombus bimaculatus,,f,f,female,https://beespotter.org/bee/2423
2424,wscovill,5/17/2012,2012,5,17,1682,LBB1,5/17/2012,2012,5,17,1682,0,41.726962,-88.266828,Bombus impatiens,Bombus impatiens,,f,f,female,https://beespotter.org/bee/2424
2425,wscovill,5/17/2012,2012,5,17,1682,LBB2,5/17/2012,2012,5,17,1682,0,41.726962,-88.266828,Bombus impatiens,Bombus impatiens,,f,f,female,https://beespotter.org/bee/2425
2591,twotringas,7/4/2012,2012,7,4,1730,griseocollis on Baptisia,5/17/2012,2012,5,17,1682,48,42.304981,-89.156791,Bombus griseocollis,Bombus griseocollis,,f,f,female,https://beespotter.org/bee/2591
2441,DavidSiegfried,5/29/2012,2012,5,29,1694,Giant Yellow Bumblebee,5/19/2012,2012,5,19,1684,10,41.95730405,-87.7202189,Bombus fervidus,Bombus fervidus,,f,f,female,https://beespotter.org/bee/2441
2429,John Dahlstedt,5/24/2012,2012,5,24,1689,Bee 604 Champaign Cty,5/20/2012,2012,5,20,1685,4,40.08227449,-88.20236206,,Bombus fervidus,,f,f,female,https://beespotter.org/bee/2429
2430,John Dahlstedt,5/24/2012,2012,5,24,1689,Bee 605 Champaign Cty,5/20/2012,2012,5,20,1685,4,40.08004165,-88.20367098,Bombus bimaculatus,Bombus bimaculatus,,f,f,male,https://beespotter.org/bee/2430
2442,twotringas,5/29/2012,2012,5,29,1694,griseocollis on milkweed,5/21/2012,2012,5,21,1686,8,37.40698278,-89.37292099,Bombus griseocollis,Bombus griseocollis,,f,f,female,https://beespotter.org/bee/2442
2443,twotringas,5/29/2012,2012,5,29,1694,griseocollis on thistle,5/21/2012,2012,5,21,1686,8,37.40643735,-89.36777115,Bombus griseocollis,Bombus griseocollis,,f,f,female,https://beespotter.org/bee/2443
2445,twotringas,5/29/2012,2012,5,29,1694,in LaRue Pine hills,5/21/2012,2012,5,21,1686,8,37.56648729,-89.43918228,Bombus bimaculatus,Bombus bimaculatus,,f,f,male,https://beespotter.org/bee/2445
2589,twotringas,7/4/2012,2012,7,4,1730,unident. on Thistle,5/21/2012,2012,5,21,1686,44,37.4084827,-89.37111855,Bombus vagans,Bombus vagans,,f,f,,https://beespotter.org/bee/2589
2431,John Dahlstedt,5/24/2012,2012,5,24,1689,Bee 606 Champaign Cty,5/23/2012,2012,5,23,1688,1,40.08279575,-88.2414633,Bombus griseocollis,Bombus griseocollis,,f,f,female,https://beespotter.org/bee/2431
2432,John Dahlstedt,5/24/2012,2012,5,24,1689,Bee 607 Champaign Cty,5/23/2012,2012,5,23,1688,1,40.08234837,-88.23944628,Apis mellifera,Apis mellifera,,f,f,female,https://beespotter.org/bee/2432
2433,John Dahlstedt,5/24/2012,2012,5,24,1689,Bee 608 Champaign Cty,5/23/2012,2012,5,23,1688,1,40.08173681,-88.24014902,Bombus bimaculatus,Bombus bimaculatus,,f,f,female,https://beespotter.org/bee/2433
2434,John Dahlstedt,5/24/2012,2012,5,24,1689,Bee 609 Champaign Cty,5/23/2012,2012,5,23,1688,1,40.08173681,-88.24015439,Apis mellifera,Apis mellifera,,f,f,female,https://beespotter.org/bee/2434
2468,Earth,6/7/2012,2012,6,7,1703,at CSU prairie garden,5/23/2012,2012,5,23,1688,15,41.720942,-87.613606,Bombus variabilis,Bombus bimaculatus,Bombus griseocollis,f,f,female,https://beespotter.org/bee/2468
2469,Earth,6/7/2012,2012,6,7,1703,CSU prairie garden,5/25/2012,2012,5,25,1690,13,41.720942,-87.613606,Bombus citrinus,Bombus impatiens,,f,f,female,https://beespotter.org/bee/2469
2437,WillBDunn,5/28/2012,2012,5,28,1693,Bee1,5/28/2012,2012,5,28,1693,0,42.383534,-88.236912,Apis mellifera,Apis mellifera,,f,f,female,https://beespotter.org/bee/2437
2438,WillBDunn,5/28/2012,2012,5,28,1693,Bee2,5/28/2012,2012,5,28,1693,0,42.383534,-88.236912,Bombus griseocollis,Bombus griseocollis,,f,f,female,https://beespotter.org/bee/2438
2444,twotringas,5/29/2012,2012,5,29,1694,bimaculatus on sage,5/28/2012,2012,5,28,1693,1,42.304981,-89.156791,Bombus bimaculatus,Bombus bimaculatus,,f,f,female,https://beespotter.org/bee/2444
2446,John Dahlstedt,5/30/2012,2012,5,30,1695,Bee 610 Champaign Cty,5/30/2012,2012,5,30,1695,0,40.07993903,-88.20832193,Apis mellifera,Apis mellifera,,f,f,female,https://beespotter.org/bee/2446
2447,John Dahlstedt,5/30/2012,2012,5,30,1695,Bee 611 Champaign Cty,5/30/2012,2012,5,30,1695,0,40.07989285,-88.2083635,Apis mellifera,Apis mellifera,,f,f,female,https://beespotter.org/bee/2447
2553,twotringas,6/27/2012,2012,6,27,1723,bimaculatus on Sage,5/30/2012,2012,5,30,1695,28,42.304981,-89.156791,Bombus bimaculatus,Bombus bimaculatus,,f,f,female,https://beespotter.org/bee/2553
2452,John Dahlstedt,6/2/2012,2012,6,2,1698,Bee 612 Champaign Cty,6/1/2012,2012,6,1,1697,1,40.07992877,-88.20832193,Apis mellifera,Apis mellifera,,f,f,female,https://beespotter.org/bee/2452
2453,John Dahlstedt,6/2/2012,2012,6,2,1698,Bee 613 Champaign Cty,6/1/2012,2012,6,1,1697,1,40.07991748,-88.20834473,Bombus bimaculatus,Bombus bimaculatus,,f,f,female,https://beespotter.org/bee/2453
2466,WillBDunn,6/5/2012,2012,6,5,1701,Bee3,6/1/2012,2012,6,1,1697,4,42.383534,-88.236912,Bombus griseocollis,Bombus impatiens,,f,f,female,https://beespotter.org/bee/2466
2454,John Dahlstedt,6/3/2012,2012,6,3,1699,Bee 614,6/3/2012,2012,6,3,1699,0,40.08215136,-88.23971987,Bombus griseocollis,Bombus griseocollis,,f,f,female,https://beespotter.org/bee/2454
2455,John Dahlstedt,6/3/2012,2012,6,3,1699,Bee 615 Champaign Cty,6/3/2012,2012,6,3,1699,0,40.08175733,-88.24010611,Apis mellifera,Apis mellifera,,f,f,female,https://beespotter.org/bee/2455
2456,John Dahlstedt,6/3/2012,2012,6,3,1699,Bee 616 Champaign Cty,6/3/2012,2012,6,3,1699,0,40.08214315,-88.23974133,Apis mellifera,Apis mellifera,,f,f,female,https://beespotter.org/bee/2456
2457,John Dahlstedt,6/3/2012,2012,6,3,1699,Bee 617 Champaign Cty,6/3/2012,2012,6,3,1699,0,40.0821924,-88.23952675,Bombus bimaculatus,Bombus bimaculatus,,f,f,female,https://beespotter.org/bee/2457
2458,John Dahlstedt,6/3/2012,2012,6,3,1699,Bee 618 Champaign Cty,6/3/2012,2012,6,3,1699,0,40.08233195,-88.23945165,Bombus impatiens,Bombus impatiens,,f,f,female,https://beespotter.org/bee/2458
2459,John Dahlstedt,6/3/2012,2012,6,3,1699,Bee 619 Champaign Cty,6/3/2012,2012,6,3,1699,0,40.07990004,-88.20836082,Apis mellifera,Apis mellifera,,f,f,female,https://beespotter.org/bee/2459
2460,John Dahlstedt,6/3/2012,2012,6,3,1699,Bee 620 Champaign Cty,6/3/2012,2012,6,3,1699,0,40.07986925,-88.20838898,Apis mellifera,Apis mellifera,,f,f,female,https://beespotter.org/bee/2460
2461,John Dahlstedt,6/3/2012,2012,6,3,1699,Bee 621 Champaign Cty,6/3/2012,2012,6,3,1699,0,40.07985899,-88.20840776,Apis mellifera,Apis mellifera,,f,f,female,https://beespotter.org/bee/2461
2462,John Dahlstedt,6/3/2012,2012,6,3,1699,Bee 622 Champaign Cty,6/3/2012,2012,6,3,1699,0,40.07990312,-88.20839301,Bombus griseocollis,Bombus griseocollis,,f,f,female,https://beespotter.org/bee/2462
2463,John Dahlstedt,6/3/2012,2012,6,3,1699,Bee 623 Champaign Cty,6/3/2012,2012,6,3,1699,0,40.07995032,-88.20837423,Apis mellifera,Apis mellifera,,f,f,female,https://beespotter.org/bee/2463
2464,John Dahlstedt,6/3/2012,2012,6,3,1699,Bee 624 Champaign Cty,6/3/2012,2012,6,3,1699,0,40.08018428,-88.20784986,Apis mellifera,Apis mellifera,,f,f,female,https://beespotter.org/bee/2464
2465,John Dahlstedt,6/3/2012,2012,6,3,1699,Bee 625 Champaign Cty,6/3/2012,2012,6,3,1699,0,40.07994108,-88.20837155,Bombus bimaculatus,Bombus bimaculatus,,f,f,female,https://beespotter.org/bee/2465
2571,twotringas,7/2/2012,2012,7,2,1728,bimaculatus on Baptisia,6/3/2012,2012,6,3,1699,29,42.304981,-89.156791,Bombus bimaculatus,Bombus bimaculatus,,f,f,female,https://beespotter.org/bee/2571
2584,twotringas,7/3/2012,2012,7,3,1729,citrinus on clover,6/3/2012,2012,6,3,1699,30,42.304981,-89.156791,Bombus citrinus,Bombus citrinus,,f,f,female,https://beespotter.org/bee/2584
2467,twotringas,6/6/2012,2012,6,6,1702,affinis on sage,6/5/2012,2012,6,5,1701,1,42.18719313,-89.02439007,Bombus affinis,Bombus affinis,,t,t,female,https://beespotter.org/bee/2467
2470,janher,6/8/2012,2012,6,8,1704,subwayrose1,6/8/2012,2012,6,8,1704,0,41.79264858,-87.5806582,Bombus griseocollis,Bombus griseocollis,,f,f,female,https://beespotter.org/bee/2470
2473,TER_OR,6/10/2012,2012,6,10,1706,dead auricomis,6/10/2012,2012,6,10,1706,0,42.10409718,-88.27767849,Bombus auricomus,Bombus auricomus,,f,f,female,https://beespotter.org/bee/2473
2474,bchapman,6/13/2012,2012,6,13,1709,Lots of Bees,6/13/2012,2012,6,13,1709,0,40.11474097,-88.22512865,,Apis mellifera,,f,f,female,https://beespotter.org/bee/2474
2476,TER_OR,6/13/2012,2012,6,13,1709,bombus rufocinctus 061312,6/13/2012,2012,6,13,1709,0,42.10127927,-88.27729225,Bombus variabilis,Apis mellifera,,f,f,female,https://beespotter.org/bee/2476
2670,garysibio,8/24/2012,2012,8,24,1781,2012-06-13 15-29-31,6/13/2012,2012,6,13,1709,72,42.43841574,-90.45031775,Bombus affinis,Bombus griseocollis,,f,f,,https://beespotter.org/bee/2670
2479,Girlsdoscience,6/15/2012,2012,6,15,1711,Chloe and Hope,6/15/2012,2012,6,15,1711,0,40.08509828,-88.21429253,Bombus affinis,Apis mellifera,,f,f,female,https://beespotter.org/bee/2479
2480,Girlsdoscience,6/15/2012,2012,6,15,1711,prairie bee,6/15/2012,2012,6,15,1711,0,,,Bombus variabilis,Apis mellifera,,f,f,female,https://beespotter.org/bee/2480
2481,Girlsdoscience,6/15/2012,2012,6,15,1711,Tyliahs bee,6/15/2012,2012,6,15,1711,0,40.08227449,-88.20940018,Bombus griseocollis,Bombus griseocollis,,f,f,female,https://beespotter.org/bee/2481
2482,Girlsdoscience,6/15/2012,2012,6,15,1711,daijohna,6/15/2012,2012,6,15,1711,0,40.08450726,-88.21669579,Bombus variabilis,Bombus griseocollis,,f,f,female,https://beespotter.org/bee/2482
2483,Girlsdoscience,6/15/2012,2012,6,15,1711,bumble bee,6/15/2012,2012,6,15,1711,0,40.08700263,-88.21369171,,Bombus fervidus,,f,f,female,https://beespotter.org/bee/2483
2485,Girlsdoscience,6/15/2012,2012,6,15,1711,brianna@polly,6/15/2012,2012,6,15,1711,0,40.08634596,-88.21669579,Bombus fervidus,Bombus fervidus,,f,f,female,https://beespotter.org/bee/2485
2486,Girlsdoscience,6/15/2012,2012,6,15,1711,found bee at Polly,6/15/2012,2012,6,15,1711,0,40.08437592,-88.21103096,Apis mellifera,Apis mellifera,,f,f,female,https://beespotter.org/bee/2486
2487,Girlsdoscience,6/15/2012,2012,6,15,1711,Morgan,6/15/2012,2012,6,15,1711,0,40.08677279,-88.215065,Apis mellifera,Apis mellifera,,f,f,female,https://beespotter.org/bee/2487
2488,Girlsdoscience,6/15/2012,2012,6,15,1711,daijohna,6/15/2012,2012,6,15,1711,0,40.08696979,-88.21504354,Apis mellifera,Bombus griseocollis,,f,f,female,https://beespotter.org/bee/2488
2489,Girlsdoscience,6/15/2012,2012,6,15,1711,bree100,6/15/2012,2012,6,15,1711,0,40.07447381,-88.18720818,Bombus vagans,Bombus fervidus,,f,f,female,https://beespotter.org/bee/2489
2490,Girlsdoscience,6/15/2012,2012,6,15,1711,Tyliahs bee2,6/15/2012,2012,6,15,1711,0,40.08680563,-88.21605206,Bombus griseocollis,Bombus griseocollis,,f,f,female,https://beespotter.org/bee/2490
2492,bchapman,6/15/2012,2012,6,15,1711,Bee with proboscis,6/15/2012,2012,6,15,1711,0,40.0837172,-88.2110459,,Apis mellifera,,f,f,female,https://beespotter.org/bee/2492
2493,joshuallen,6/15/2012,2012,6,15,1711,6/15/12_1,6/15/2012,2012,6,15,1711,0,40.09008887,-88.23891521,Bombus griseocollis,Bombus griseocollis,,f,f,male,https://beespotter.org/bee/2493
2495,janher,6/15/2012,2012,6,15,1711,Nicol1,6/15/2012,2012,6,15,1711,0,,,Apis mellifera,Apis mellifera,,f,f,female,https://beespotter.org/bee/2495
2551,twotringas,6/27/2012,2012,6,27,1723,bimaculatus on NJ Tea,6/17/2012,2012,6,17,1713,10,,,Bombus bimaculatus,Bombus bimaculatus,,f,f,female,https://beespotter.org/bee/2551
2592,twotringas,7/4/2012,2012,7,4,1730,griseocollis on NJ Tea,6/17/2012,2012,6,17,1713,17,42.304981,-89.156791,Bombus griseocollis,Bombus griseocollis,,f,f,female,https://beespotter.org/bee/2592
2497,John Dahlstedt,6/19/2012,2012,6,19,1715,Bee 626 Champaign Cty,6/18/2012,2012,6,18,1714,1,40.07996776,-88.20837826,Apis mellifera,Apis mellifera,,f,f,female,https://beespotter.org/bee/2497
2498,John Dahlstedt,6/19/2012,2012,6,19,1715,Bee 627 Champaign Cty,6/18/2012,2012,6,18,1714,1,40.07980974,-88.20839167,Bombus griseocollis,Bombus griseocollis,,f,f,female,https://beespotter.org/bee/2498
2499,John Dahlstedt,6/19/2012,2012,6,19,1715,Bee 628 Champaign Cty,6/18/2012,2012,6,18,1714,1,40.0798908,-88.20833534,Bombus bimaculatus,Bombus bimaculatus,,f,f,female,https://beespotter.org/bee/2499
2500,John Dahlstedt,6/19/2012,2012,6,19,1715,Bee 629 Champaign Cty,6/18/2012,2012,6,18,1714,1,40.07980153,-88.20840105,Apis mellifera,Apis mellifera,,f,f,female,https://beespotter.org/bee/2500
2501,John Dahlstedt,6/19/2012,2012,6,19,1715,Bee 630 Champaign Cty,6/18/2012,2012,6,18,1714,1,40.07992467,-88.2083863,Apis mellifera,Apis mellifera,,f,f,female,https://beespotter.org/bee/2501
2502,DiscoveryCenter,6/19/2012,2012,6,19,1715,Test 1,6/19/2012,2012,6,19,1715,0,42.27680072,-89.08882141,Bombus vagans,Bombus griseocollis,,f,f,female,https://beespotter.org/bee/2502
2577,swende,7/2/2012,2012,7,2,1728,bee 2,6/21/2012,2012,6,21,1717,11,41.6773586,-87.7996745,Bombus auricomus,Bombus impatiens,,f,f,female,https://beespotter.org/bee/2577
2507,wscovill,6/22/2012,2012,6,22,1718,PenstemonBee1,6/22/2012,2012,6,22,1718,0,41.726962,-88.266828,Bombus citrinus,Bombus bimaculatus,,f,f,male,https://beespotter.org/bee/2507
2508,wscovill,6/22/2012,2012,6,22,1718,PenstemonBee2a,6/22/2012,2012,6,22,1718,0,41.726962,-88.266828,Bombus bimaculatus,Bombus impatiens,,f,f,female,https://beespotter.org/bee/2508
2509,JaqAccetta,6/22/2012,2012,6,22,1718,Day1a,6/22/2012,2012,6,22,1718,0,42.30493,-89.02472,Apis mellifera,Apis mellifera,,f,f,female,https://beespotter.org/bee/2509
2510,JaqAccetta,6/22/2012,2012,6,22,1718,Day1b,6/22/2012,2012,6,22,1718,0,42.30493,-89.02472,Apis mellifera,Apis mellifera,,f,f,female,https://beespotter.org/bee/2510
2513,John Dahlstedt,6/24/2012,2012,6,24,1720,Bee 631 Champaign Cty,6/22/2012,2012,6,22,1718,2,40.08664556,-88.20070446,Apis mellifera,Apis mellifera,,f,f,female,https://beespotter.org/bee/2513
2514,John Dahlstedt,6/24/2012,2012,6,24,1720,Bee 632 Champaign Cty,6/22/2012,2012,6,22,1718,2,40.08097748,-88.20313454,Bombus griseocollis,Bombus griseocollis,,f,f,male,https://beespotter.org/bee/2514
2515,John Dahlstedt,6/24/2012,2012,6,24,1720,Bee 633 Champaign Cty,6/22/2012,2012,6,22,1718,2,40.08079688,-88.20344567,Bombus griseocollis,Bombus griseocollis,,f,f,male,https://beespotter.org/bee/2515
2516,John Dahlstedt,6/24/2012,2012,6,24,1720,Bee 634 Champaign Cty,6/22/2012,2012,6,22,1718,2,40.08073942,-88.20361733,Bombus griseocollis,Bombus griseocollis,,f,f,female,https://beespotter.org/bee/2516
2517,John Dahlstedt,6/24/2012,2012,6,24,1720,Bee 635 Champaign Cty,6/22/2012,2012,6,22,1718,2,40.08073121,-88.20470095,Bombus fervidus,Bombus fervidus,,f,f,female,https://beespotter.org/bee/2517
2519,John Dahlstedt,6/24/2012,2012,6,24,1720,Bee 637 Champaign Cty,6/22/2012,2012,6,22,1718,2,40.07990722,-88.20835546,Apis mellifera,Apis mellifera,,f,f,female,https://beespotter.org/bee/2519
2520,John Dahlstedt,6/24/2012,2012,6,24,1720,Bee 638 Champaign Cty,6/22/2012,2012,6,22,1718,2,40.07980769,-88.20839435,Apis mellifera,Apis mellifera,,f,f,female,https://beespotter.org/bee/2520
2521,John Dahlstedt,6/24/2012,2012,6,24,1720,Bee 639 Champaign Cty,6/22/2012,2012,6,22,1718,2,40.07748856,-88.20731878,Apis mellifera,Apis mellifera,,f,f,female,https://beespotter.org/bee/2521
2522,John Dahlstedt,6/24/2012,2012,6,24,1720,Bee 640 Champaign Cty,6/22/2012,2012,6,22,1718,2,40.07750498,-88.20724368,Bombus impatiens,Bombus impatiens,,f,f,male,https://beespotter.org/bee/2522
2523,John Dahlstedt,6/24/2012,2012,6,24,1720,Bee 641 Champaign Cty,6/22/2012,2012,6,22,1718,2,40.07728332,-88.20462584,Bombus griseocollis,Bombus griseocollis,,f,f,male,https://beespotter.org/bee/2523
2524,John Dahlstedt,6/24/2012,2012,6,24,1720,Bee 642 Champaign Cty,6/22/2012,2012,6,22,1718,2,40.07722586,-88.20394993,Bombus impatiens,Bombus impatiens,,f,f,female,https://beespotter.org/bee/2524
2525,John Dahlstedt,6/24/2012,2012,6,24,1720,Bee 643 Champaign Cty,6/22/2012,2012,6,22,1718,2,40.07977895,-88.20352077,Bombus auricomus,Bombus auricomus,,f,f,female,https://beespotter.org/bee/2525
2511,Dave_K,6/23/2012,2012,6,23,1719,Monarda 1,6/23/2012,2012,6,23,1719,0,41.9382966,-88.07722092,,Bombus bimaculatus,,f,f,female,https://beespotter.org/bee/2511
2512,Dave_K,6/23/2012,2012,6,23,1719,Monarda 2,6/23/2012,2012,6,23,1719,0,41.93919045,-88.07739258,,Bombus bimaculatus,,f,f,female,https://beespotter.org/bee/2512
2518,John Dahlstedt,6/24/2012,2012,6,24,1720,Bee 636 Champaign Cty,6/24/2012,2012,6,24,1720,0,40.07986412,-88.20839703,Apis mellifera,Apis mellifera,,f,f,female,https://beespotter.org/bee/2518
2526,JaqAccetta,6/24/2012,2012,6,24,1720,Day2a,6/24/2012,2012,6,24,1720,0,42.27680072,-89.08847809,Apis mellifera,Bombus bimaculatus,,f,f,male,https://beespotter.org/bee/2526
2527,JaqAccetta,6/24/2012,2012,6,24,1720,Day2b,6/24/2012,2012,6,24,1720,0,42.27680072,-89.08942223,Apis mellifera,Apis mellifera,,f,f,female,https://beespotter.org/bee/2527
2528,JaqAccetta,6/24/2012,2012,6,24,1720,Day2c,6/24/2012,2012,6,24,1720,0,42.27680072,-89.08847809,Apis mellifera,Apis mellifera,,f,f,female,https://beespotter.org/bee/2528
2529,JaqAccetta,6/24/2012,2012,6,24,1720,Day2d,6/24/2012,2012,6,24,1720,0,42.26971936,-89.04976845,Bombus griseocollis,Bombus impatiens,,f,f,female,https://beespotter.org/bee/2529
2552,twotringas,6/27/2012,2012,6,27,1723,bimaculatus on Butterflyweed,6/24/2012,2012,6,24,1720,3,42.304981,-89.156791,Bombus bimaculatus,Bombus bimaculatus,,f,f,male,https://beespotter.org/bee/2552
2530,DiscoveryCenter,6/25/2012,2012,6,25,1721,Emily1,6/25/2012,2012,6,25,1721,0,42.276737,-89.08953,Apis mellifera,Apis mellifera,,f,f,female,https://beespotter.org/bee/2530
2531,DiscoveryCenter,6/25/2012,2012,6,25,1721,Emily2,6/25/2012,2012,6,25,1721,0,42.276737,-89.08953,Apis mellifera,Apis mellifera,,f,f,female,https://beespotter.org/bee/2531
2532,DiscoveryCenter,6/25/2012,2012,6,25,1721,marilyn1,6/25/2012,2012,6,25,1721,0,42.276737,-89.08953,Apis mellifera,Apis mellifera,,f,f,female,https://beespotter.org/bee/2532
2533,DiscoveryCenter,6/25/2012,2012,6,25,1721,Brooklyn !,6/25/2012,2012,6,25,1721,0,42.27680072,-89.08882141,Apis mellifera,Apis mellifera,,f,f,female,https://beespotter.org/bee/2533
2534,DiscoveryCenter,6/25/2012,2012,6,25,1721,Emily3,6/25/2012,2012,6,25,1721,0,42.276737,-89.08953,Apis mellifera,Apis mellifera,,f,f,female,https://beespotter.org/bee/2534
2535,DiscoveryCenter,6/25/2012,2012,6,25,1721,brooklyn 2,6/25/2012,2012,6,25,1721,0,42.276737,-89.08953,Bombus auricomus,Apis mellifera,,f,f,female,https://beespotter.org/bee/2535
2536,DiscoveryCenter,6/25/2012,2012,6,25,1721,Emily4,6/25/2012,2012,6,25,1721,0,42.276737,-89.08953,Bombus citrinus,Bombus impatiens,,f,f,female,https://beespotter.org/bee/2536
2537,DiscoveryCenter,6/25/2012,2012,6,25,1721,Daisy4,6/25/2012,2012,6,25,1721,0,42.276737,-89.08953,Bombus variabilis,Bombus griseocollis,,f,f,female,https://beespotter.org/bee/2537
2538,DiscoveryCenter,6/25/2012,2012,6,25,1721,marilyn2,6/25/2012,2012,6,25,1721,0,42.276737,-89.08953,Bombus impatiens,Bombus griseocollis,,f,f,male,https://beespotter.org/bee/2538
2539,DiscoveryCenter,6/25/2012,2012,6,25,1721,Daisy4,6/25/2012,2012,6,25,1721,0,42.276737,-89.08953,Bombus affinis,Bombus griseocollis,,f,f,female,https://beespotter.org/bee/2539
2540,DiscoveryCenter,6/25/2012,2012,6,25,1721,Emily5,6/25/2012,2012,6,25,1721,0,42.276737,-89.08953,Bombus citrinus,Bombus bimaculatus,Bombus griseocollis,f,f,female,https://beespotter.org/bee/2540
2541,DiscoveryCenter,6/25/2012,2012,6,25,1721,Daisy4,6/25/2012,2012,6,25,1721,0,42.276737,-89.08953,Apis mellifera,Apis mellifera,,f,f,female,https://beespotter.org/bee/2541
2578,janher,7/3/2012,2012,7,3,1729,Nichols2,6/25/2012,2012,6,25,1721,8,41.79812767,-87.59390831,Apis mellifera,Apis mellifera,,f,f,female,https://beespotter.org/bee/2578
2543,DiscoveryCenter,6/26/2012,2012,6,26,1722,marilyn3,6/26/2012,2012,6,26,1722,0,42.276737,-89.08953,Bombus variabilis,Bombus impatiens,,f,f,female,https://beespotter.org/bee/2543
2544,DiscoveryCenter,6/26/2012,2012,6,26,1722,Daisy6,6/26/2012,2012,6,26,1722,0,42.276737,-89.08953,Bombus affinis,Bombus impatiens,,f,f,female,https://beespotter.org/bee/2544
2545,ckhuber1,6/26/2012,2012,6,26,1722,front yard,6/26/2012,2012,6,26,1722,0,26.261826,-81.808136,Bombus auricomus,Apis mellifera,,f,f,female,https://beespotter.org/bee/2545
2554,twotringas,6/27/2012,2012,6,27,1723,impatiens on Butterflyweed,6/26/2012,2012,6,26,1722,1,42.304981,-89.156791,Bombus impatiens,Bombus impatiens,,f,f,female,https://beespotter.org/bee/2554
2550,twotringas,6/27/2012,2012,6,27,1723,auricomus at nest,6/27/2012,2012,6,27,1723,0,42.304981,-89.156791,Bombus auricomus,Bombus auricomus,,f,f,female,https://beespotter.org/bee/2550
2556,DiscoveryCenter,6/28/2012,2012,6,28,1724,Daisy4,6/28/2012,2012,6,28,1724,0,42.276737,-89.08953,Bombus variabilis,Bombus impatiens,,f,f,female,https://beespotter.org/bee/2556
2557,DiscoveryCenter,6/28/2012,2012,6,28,1724,Emily6,6/28/2012,2012,6,28,1724,0,42.276737,-89.08953,,Bombus griseocollis,,f,f,female,https://beespotter.org/bee/2557
2558,twotringas,6/28/2012,2012,6,28,1724,affinis on Mountain Mint,6/28/2012,2012,6,28,1724,0,42.27954132,-89.11438614,Bombus affinis,Bombus affinis,,t,t,female,https://beespotter.org/bee/2558
2559,twotringas,6/28/2012,2012,6,28,1724,griseocollis on Mountain Mint,6/28/2012,2012,6,28,1724,0,42.304981,-89.156791,Bombus griseocollis,Bombus griseocollis,,f,f,female,https://beespotter.org/bee/2559
2585,MyBeeGarden,7/3/2012,2012,7,3,1729,Pollen Collector,6/28/2012,2012,6,28,1724,5,41.628216,-87.832139,,Bombus griseocollis,,f,f,male,https://beespotter.org/bee/2585
2693,SonnyBee,9/11/2012,2012,9,11,1799,BumbleBee 6-28-2012,6/28/2012,2012,6,28,1724,75,38.9241859,-90.0242836,Bombus affinis,Bombus griseocollis,,f,f,female,https://beespotter.org/bee/2693
2560,TER_OR,6/29/2012,2012,6,29,1725,Affinis 062912,6/29/2012,2012,6,29,1725,0,42.18080286,-88.38000783,Bombus affinis,Bombus affinis,,t,t,male,https://beespotter.org/bee/2560
2561,TER_OR,6/29/2012,2012,6,29,1725,Bimiculatus 062912,6/29/2012,2012,6,29,1725,0,42.10134295,-88.27707767,Bombus bimaculatus,Bombus bimaculatus,,f,f,female,https://beespotter.org/bee/2561
2562,Dave_K,6/29/2012,2012,6,29,1725,Bumble on Hollyhock,6/29/2012,2012,6,29,1725,0,41.93867968,-88.07636261,,Bombus bimaculatus,,f,f,male,https://beespotter.org/bee/2562
2563,Dave_K,6/29/2012,2012,6,29,1725,Bumble on Hollyhock 2,6/29/2012,2012,6,29,1725,0,41.93867968,-88.07670593,,Bombus bimaculatus,,f,f,,https://beespotter.org/bee/2563
2564,Dave_K,6/29/2012,2012,6,29,1725,Bumble on Hollyhock 3,6/29/2012,2012,6,29,1725,0,41.93842429,-88.07756424,,Bombus griseocollis,,f,f,,https://beespotter.org/bee/2564
2580,twotringas,7/3/2012,2012,7,3,1729,honeybee on Bergamot,6/29/2012,2012,6,29,1725,4,42.304981,-89.156791,Apis mellifera,Apis mellifera,,f,f,female,https://beespotter.org/bee/2580
2581,twotringas,7/3/2012,2012,7,3,1729,honeybee on vervain,6/29/2012,2012,6,29,1725,4,42.304981,-89.156791,Apis mellifera,Apis mellifera,,f,f,female,https://beespotter.org/bee/2581
2582,twotringas,7/3/2012,2012,7,3,1729,bimaculatus on Bergamot,6/29/2012,2012,6,29,1725,4,42.304981,-89.156791,Bombus bimaculatus,Bombus bimaculatus,,f,f,male,https://beespotter.org/bee/2582
2583,twotringas,7/3/2012,2012,7,3,1729,vagans on Bergamot,6/29/2012,2012,6,29,1725,4,42.304981,-89.156791,Bombus vagans,Bombus vagans,,f,f,female,https://beespotter.org/bee/2583
2565,Steven0703,7/1/2012,2012,7,1,1727,Queen Anne's Bee,6/30/2012,2012,6,30,1726,1,42.0085369,-87.679586,Bombus affinis,Bombus griseocollis,,f,f,female,https://beespotter.org/bee/2565
2566,Steven0703,7/1/2012,2012,7,1,1727,South Pond bee,6/30/2012,2012,6,30,1726,1,41.91703219,-87.63291836,Bombus impatiens,Bombus griseocollis,,f,f,female,https://beespotter.org/bee/2566
2593,jldavidsun,7/4/2012,2012,7,4,1730,monarda-1,6/30/2012,2012,6,30,1726,4,39.75774803,-88.3190918,,Apis mellifera,,f,f,female,https://beespotter.org/bee/2593
2594,jldavidsun,7/4/2012,2012,7,4,1730,monarda-1,6/30/2012,2012,6,30,1726,4,39.75603245,-88.31840515,,Apis mellifera,,f,f,female,https://beespotter.org/bee/2594
2567,wscovill,7/1/2012,2012,7,1,1727,Clover,7/1/2012,2012,7,1,1727,0,41.726962,-88.266828,Bombus fervidus,Bombus fervidus,,f,f,female,https://beespotter.org/bee/2567
2568,wscovill,7/1/2012,2012,7,1,1727,GardenBee1,7/1/2012,2012,7,1,1727,0,41.726962,-88.266828,Bombus bimaculatus,Bombus bimaculatus,,f,f,female,https://beespotter.org/bee/2568
2569,wscovill,7/1/2012,2012,7,1,1727,SmallerGardenBee,7/1/2012,2012,7,1,1727,0,41.726962,-88.266828,Bombus bimaculatus,Bombus impatiens,,f,f,,https://beespotter.org/bee/2569
2572,John Dahlstedt,7/2/2012,2012,7,2,1728,Bee 644 Champaign Cty,7/1/2012,2012,7,1,1727,1,40.08352222,-88.20313454,Bombus auricomus,Bombus auricomus,,f,f,female,https://beespotter.org/bee/2572
2573,John Dahlstedt,7/2/2012,2012,7,2,1728,Bee 645 Champaign Cty,7/1/2012,2012,7,1,1727,1,40.08355506,-88.20358515,Bombus griseocollis,Bombus griseocollis,,f,f,female,https://beespotter.org/bee/2573
2574,John Dahlstedt,7/2/2012,2012,7,2,1728,Bee 646 Champaign Cty,7/1/2012,2012,7,1,1727,1,40.08357969,-88.20421815,Bombus fervidus,Bombus fervidus,,f,f,female,https://beespotter.org/bee/2574
2575,John Dahlstedt,7/2/2012,2012,7,2,1728,Bee 647 Champaign Cty,7/1/2012,2012,7,1,1727,1,40.08258643,-88.20455074,Bombus auricomus,Bombus auricomus,,f,f,female,https://beespotter.org/bee/2575
2602,hviola,7/8/2012,2012,7,8,1734,On Purple Coneflower,7/1/2012,2012,7,1,1727,7,39.59748779,-88.16579819,Bombus griseocollis,Bombus griseocollis,,f,f,male,https://beespotter.org/bee/2602
2586,MyBeeGarden,7/3/2012,2012,7,3,1729,Bombus on Butterfly Bush Blossom,7/2/2012,2012,7,2,1728,1,41.628216,-87.832139,,Bombus bimaculatus,,f,f,male,https://beespotter.org/bee/2586
2579,janher,7/3/2012,2012,7,3,1729,harold1,7/3/2012,2012,7,3,1729,0,41.80115096,-87.58217096,Bombus griseocollis,Bombus griseocollis,,f,f,male,https://beespotter.org/bee/2579
2596,MyBeeGarden,7/4/2012,2012,7,4,1730,Honey Color Apis Mellifera,7/4/2012,2012,7,4,1730,0,41.628216,-87.832139,Apis mellifera,Apis mellifera,,f,f,female,https://beespotter.org/bee/2596
2598,twotringas,7/5/2012,2012,7,5,1731,affinis on coneflower,7/4/2012,2012,7,4,1730,1,42.41771443,-89.14613052,Bombus affinis,Bombus affinis,,t,t,female,https://beespotter.org/bee/2598
2597,twotringas,7/5/2012,2012,7,5,1731,griseocollis on coneflower,7/5/2012,2012,7,5,1731,0,42.304981,-89.156791,Bombus griseocollis,Bombus griseocollis,,f,f,male,https://beespotter.org/bee/2597
2599,joshuallen,7/5/2012,2012,7,5,1731,Snapshot,7/5/2012,2012,7,5,1731,0,40.09059776,-88.23993444,Bombus variabilis,Bombus auricomus,,f,f,female,https://beespotter.org/bee/2599
2606,MyBeeGarden,7/9/2012,2012,7,9,1735,Resting Bee,7/5/2012,2012,7,5,1731,4,41.628216,-87.832139,,Bombus griseocollis,,f,f,male,https://beespotter.org/bee/2606
2600,twotringas,7/7/2012,2012,7,7,1733,impatiens on Coneflower,7/6/2012,2012,7,6,1732,1,42.304981,-89.156791,Bombus impatiens,Bombus impatiens,,f,f,female,https://beespotter.org/bee/2600
2601,twotringas,7/7/2012,2012,7,7,1733,vagans on Bergamot,7/6/2012,2012,7,6,1732,1,42.304981,-89.156791,Bombus vagans,Bombus vagans,,f,f,female,https://beespotter.org/bee/2601
2603,twotringas,7/8/2012,2012,7,8,1734,rufocinctus on coneflower,7/8/2012,2012,7,8,1734,0,42.304981,-89.156791,,Bombus rufocinctus,,f,f,female,https://beespotter.org/bee/2603
2604,twotringas,7/8/2012,2012,7,8,1734,Honey bee on Prairie Milkweed,7/8/2012,2012,7,8,1734,0,42.304981,-89.156791,Apis mellifera,Apis mellifera,,f,f,female,https://beespotter.org/bee/2604
2607,MyBeeGarden,7/9/2012,2012,7,9,1735,Honey Bee on White Salvia,7/8/2012,2012,7,8,1734,1,41.628216,-87.832139,Apis mellifera,Apis mellifera,,f,f,female,https://beespotter.org/bee/2607
2610,twotringas,7/13/2012,2012,7,13,1739,bimaculatus on Bergamot,7/8/2012,2012,7,8,1734,5,42.304981,-89.156791,Bombus bimaculatus,Bombus bimaculatus,,f,f,female,https://beespotter.org/bee/2610
2605,janher,7/9/2012,2012,7,9,1735,milkweed,7/9/2012,2012,7,9,1735,0,41.80868459,-87.58712769,Bombus griseocollis,Bombus griseocollis,,f,f,male,https://beespotter.org/bee/2605
2611,twotringas,7/13/2012,2012,7,13,1739,citrinus on Bergamot,7/9/2012,2012,7,9,1735,4,42.304981,-89.156791,Bombus citrinus,Bombus citrinus,,f,f,,https://beespotter.org/bee/2611
2612,twotringas,7/13/2012,2012,7,13,1739,impatiens on Bergamot,7/9/2012,2012,7,9,1735,4,42.304981,-89.156791,Bombus impatiens,Bombus impatiens,,f,f,female,https://beespotter.org/bee/2612
2991,tkdesign,7/7/2013,2013,7,7,2098,bee-2012,7/9/2012,2012,7,9,1735,363,41.1108521,-87.8587389,Bombus griseocollis,Bombus impatiens,,f,f,female,https://beespotter.org/bee/2991
2613,twotringas,7/13/2012,2012,7,13,1739,auricomus on Purple Coneflower,7/10/2012,2012,7,10,1736,3,42.304981,-89.156791,Bombus auricomus,Bombus auricomus,,f,f,female,https://beespotter.org/bee/2613
2615,twotringas,7/15/2012,2012,7,15,1741,citrinus on coneflower,7/10/2012,2012,7,10,1736,5,42.304981,-89.156791,Bombus citrinus,Bombus citrinus,,f,f,,https://beespotter.org/bee/2615
2616,twotringas,7/15/2012,2012,7,15,1741,vagans on bergamot,7/10/2012,2012,7,10,1736,5,42.304981,-89.156791,Bombus vagans,Bombus vagans,,f,f,male,https://beespotter.org/bee/2616
2627,John Dahlstedt,7/22/2012,2012,7,22,1748,Bee 648 Champaign Cty,7/10/2012,2012,7,10,1736,12,40.07981589,-88.20844933,Bombus griseocollis,Bombus griseocollis,,f,f,female,https://beespotter.org/bee/2627
2617,twotringas,7/15/2012,2012,7,15,1741,auricomus on bergamot,7/11/2012,2012,7,11,1737,4,42.304981,-89.156791,Bombus auricomus,Bombus auricomus,,f,f,female,https://beespotter.org/bee/2617
2618,twotringas,7/15/2012,2012,7,15,1741,impatiens on vervain,7/12/2012,2012,7,12,1738,3,42.45968707,-89.10547256,Bombus impatiens,Bombus impatiens,,f,f,female,https://beespotter.org/bee/2618
2774,rdlp18,1/21/2013,2013,1,21,1931,My Garden Honey Bees,7/12/2012,2012,7,12,1738,193,41.9579778,-87.7004466,Apis mellifera,Apis mellifera,,f,f,female,https://beespotter.org/bee/2774
2614,Caroline,7/15/2012,2012,7,15,1741,Unknown bee in yard,7/13/2012,2012,7,13,1739,2,41.76625347,-87.96349657,Bombus affinis,Bombus affinis,,t,t,female,https://beespotter.org/bee/2614
2619,twotringas,7/15/2012,2012,7,15,1741,fervidus on bergamot,7/14/2012,2012,7,14,1740,1,42.45804068,-89.10942078,Bombus fervidus,Bombus fervidus,,f,f,female,https://beespotter.org/bee/2619
2620,twotringas,7/15/2012,2012,7,15,1741,auricomus on bergamot,7/14/2012,2012,7,14,1740,1,42.45816732,-89.10890579,Bombus auricomus,Bombus auricomus,,f,f,female,https://beespotter.org/bee/2620
2621,twotringas,7/15/2012,2012,7,15,1741,auricomus on begamot,7/14/2012,2012,7,14,1740,1,42.45816732,-89.10821915,Bombus auricomus,Bombus auricomus,,f,f,female,https://beespotter.org/bee/2621
2623,twotringas,7/16/2012,2012,7,16,1742,citrinus on bergamot,7/15/2012,2012,7,15,1741,1,42.304981,-89.156791,Bombus citrinus,Bombus citrinus,,f,f,female,https://beespotter.org/bee/2623
2624,hornet_swagg,7/17/2012,2012,7,17,1743,bee spotting,7/16/2012,2012,7,16,1742,1,40.11454405,-88.22725296,Bombus affinis,Bombus fervidus,,f,f,female,https://beespotter.org/bee/2624
2629,retiredprof,7/24/2012,2012,7,24,1750,large bumblebee,7/24/2012,2012,7,24,1750,0,,,Bombus auricomus,Bombus auricomus,,f,f,female,https://beespotter.org/bee/2629
2632,retiredprof,7/28/2012,2012,7,28,1754,Thursday bee 1,7/26/2012,2012,7,26,1752,2,,,Bombus griseocollis,Bombus griseocollis,,f,f,male,https://beespotter.org/bee/2632
2633,retiredprof,7/28/2012,2012,7,28,1754,Thursday bee 2,7/26/2012,2012,7,26,1752,2,,,Bombus affinis,Bombus bimaculatus,,f,f,female,https://beespotter.org/bee/2633
2634,jeffb,7/28/2012,2012,7,28,1754,Meadowbrook Park Monarda Bee,7/28/2012,2012,7,28,1754,0,40.0799103,-88.20356369,Bombus auricomus,Bombus auricomus,,f,f,female,https://beespotter.org/bee/2634
2635,MyBeeGarden,7/29/2012,2012,7,29,1755,Sun Flower & Bombus,7/29/2012,2012,7,29,1755,0,41.628216,-87.832139,,Bombus impatiens,,f,f,male,https://beespotter.org/bee/2635
8058,BrittanyBuckles,1/17/2019,2019,1,17,4118,Sugar Island RPBB,7/29/2012,2012,7,29,1755,2363,43.1107645,-88.43801735,Bombus affinis,Bombus affinis,,t,t,,https://beespotter.org/bee/8058
2642,MyBeeGarden,8/4/2012,2012,8,4,1761,Bombus on Nodding Onion,7/31/2012,2012,7,31,1757,4,41.628216,-87.832139,,Bombus impatiens,,f,f,male,https://beespotter.org/bee/2642
2643,MyBeeGarden,8/4/2012,2012,8,4,1761,Apis mellifera on Russian Sage,7/31/2012,2012,7,31,1757,4,41.628216,-87.832139,Apis mellifera,Apis mellifera,,f,f,female,https://beespotter.org/bee/2643
2636,imgazelle,8/2/2012,2012,8,2,1759,Burnham Bee,8/1/2012,2012,8,1,1758,1,,,,Bombus griseocollis,,f,f,,https://beespotter.org/bee/2636
2638,imgazelle,8/2/2012,2012,8,2,1759,Tajj's Bee,8/1/2012,2012,8,1,1758,1,41.8675994,-87.6140141,Apis mellifera,Apis mellifera,,f,f,female,https://beespotter.org/bee/2638
2640,imgazelle,8/2/2012,2012,8,2,1759,Burnham Park Bombus!,8/1/2012,2012,8,1,1758,1,41.82250192,-87.59742737,Bombus pensylvanicus,Bombus pensylvanicus,Bombus fervidus,f,f,male,https://beespotter.org/bee/2640
2644,MyBeeGarden,8/4/2012,2012,8,4,1761,Apis mellifera on White Salvia,8/3/2012,2012,8,3,1760,1,41.628216,-87.832139,Apis mellifera,Apis mellifera,,f,f,female,https://beespotter.org/bee/2644
2647,John Dahlstedt,8/7/2012,2012,8,7,1764,Bee 649 Champaign Cty,8/7/2012,2012,8,7,1764,0,40.079977,-88.20824549,Bombus impatiens,Bombus impatiens,,f,f,,https://beespotter.org/bee/2647
2648,John Dahlstedt,8/7/2012,2012,8,7,1764,Bee 650 Champaign Cty,8/7/2012,2012,8,7,1764,0,40.07980358,-88.20831656,Apis mellifera,Apis mellifera,,f,f,female,https://beespotter.org/bee/2648
2649,John Dahlstedt,8/7/2012,2012,8,7,1764,Bee 651 Champaign Cty,8/7/2012,2012,8,7,1764,0,40.08111293,-88.20184171,Bombus bimaculatus,Bombus bimaculatus,,f,f,female,https://beespotter.org/bee/2649
2650,danz,8/8/2012,2012,8,8,1765,First Bee - Joe Pye Weed,8/8/2012,2012,8,8,1765,0,42.03708618,-87.72231102,Bombus bimaculatus,Bombus impatiens,,f,f,male,https://beespotter.org/bee/2650
2653,twotringas,8/15/2012,2012,8,15,1772,impatiens on Rosinweed,8/14/2012,2012,8,14,1771,1,42.304981,-89.156791,Bombus impatiens,Bombus impatiens,,f,f,male,https://beespotter.org/bee/2653
2654,twotringas,8/15/2012,2012,8,15,1772,auricomus on liatris,8/14/2012,2012,8,14,1771,1,42.304981,-89.156791,Bombus auricomus,Bombus auricomus,,f,f,female,https://beespotter.org/bee/2654
2655,twotringas,8/15/2012,2012,8,15,1772,affinis on liatris,8/14/2012,2012,8,14,1771,1,42.24349343,-89.30553835,Bombus affinis,Bombus affinis,,t,t,male,https://beespotter.org/bee/2655
2652,twotringas,8/15/2012,2012,8,15,1772,citrinus on Prairie Thistle,8/15/2012,2012,8,15,1772,0,42.304981,-89.156791,Bombus citrinus,Bombus citrinus,,f,f,,https://beespotter.org/bee/2652
2657,twotringas,8/19/2012,2012,8,19,1776,vagans on Prairie Thistle,8/17/2012,2012,8,17,1774,2,42.304981,-89.156791,Bombus vagans,Bombus vagans,,f,f,male,https://beespotter.org/bee/2657
2658,twotringas,8/19/2012,2012,8,19,1776,honey bee on Rosinweed,8/17/2012,2012,8,17,1774,2,42.304981,-89.156791,Apis mellifera,Apis mellifera,,f,f,female,https://beespotter.org/bee/2658
2659,twotringas,8/19/2012,2012,8,19,1776,citrinus on Rosinweed,8/17/2012,2012,8,17,1774,2,42.304981,-89.156791,Bombus citrinus,Bombus citrinus,,f,f,,https://beespotter.org/bee/2659
2660,twotringas,8/19/2012,2012,8,19,1776,griseocollis on liatris,8/18/2012,2012,8,18,1775,1,42.304981,-89.156791,Bombus griseocollis,Bombus griseocollis,,f,f,male,https://beespotter.org/bee/2660
2661,twotringas,8/19/2012,2012,8,19,1776,honey bee on Cosmos,8/18/2012,2012,8,18,1775,1,42.304981,-89.156791,Apis mellifera,Apis mellifera,,f,f,female,https://beespotter.org/bee/2661
2662,twotringas,8/19/2012,2012,8,19,1776,bimaculatus on Prairie Thistle,8/18/2012,2012,8,18,1775,1,42.304981,-89.156791,Bombus bimaculatus,Bombus bimaculatus,,f,f,female,https://beespotter.org/bee/2662
2663,twotringas,8/19/2012,2012,8,19,1776,vagans on liatris,8/18/2012,2012,8,18,1775,1,42.304981,-89.156791,Bombus vagans,Bombus vagans,,f,f,male,https://beespotter.org/bee/2663
2656,danz,8/19/2012,2012,8,19,1776,Bee002 - Bee on Salvia,8/19/2012,2012,8,19,1776,0,42.035023,-87.723552,Bombus impatiens,Bombus impatiens,,f,f,male,https://beespotter.org/bee/2656
2664,twotringas,8/19/2012,2012,8,19,1776,griseocollis found dead on Cup Plant,8/19/2012,2012,8,19,1776,0,42.45842062,-89.10942078,Bombus griseocollis,Bombus griseocollis,,f,f,male,https://beespotter.org/bee/2664
2665,twotringas,8/19/2012,2012,8,19,1776,honey bee on Sneezeweed,8/19/2012,2012,8,19,1776,0,42.4589272,-89.10873413,Apis mellifera,Apis mellifera,,f,f,female,https://beespotter.org/bee/2665
2666,twotringas,8/19/2012,2012,8,19,1776,impatiens on Sneezeweed,8/19/2012,2012,8,19,1776,0,42.45867391,-89.10924911,Bombus impatiens,Bombus impatiens,,f,f,female,https://beespotter.org/bee/2666
2667,twotringas,8/20/2012,2012,8,20,1777,fervidus or pensylvanicus on Prairie Thistle,8/20/2012,2012,8,20,1777,0,42.304981,-89.156791,Bombus fervidus,Bombus fervidus,Bombus pensylvanicus,f,f,male,https://beespotter.org/bee/2667
2669,twotringas,8/24/2012,2012,8,24,1781,griseocollis on Prairie Thistle,8/23/2012,2012,8,23,1780,1,42.304981,-89.156791,Bombus griseocollis,Bombus griseocollis,,f,f,female,https://beespotter.org/bee/2669
2671,danz,8/26/2012,2012,8,26,1783,Bee003-Bee at Home Depot (on Stonecrop),8/26/2012,2012,8,26,1783,0,42.0265233,-87.7058398,Bombus impatiens,Bombus impatiens,,f,f,,https://beespotter.org/bee/2671
2672,twotringas,8/26/2012,2012,8,26,1783,vagans on Prairie Thistle,8/26/2012,2012,8,26,1783,0,42.304981,-89.156791,Bombus vagans,Bombus vagans,,f,f,male,https://beespotter.org/bee/2672
2673,twotringas,8/26/2012,2012,8,26,1783,vagans on Prairie Thistle,8/26/2012,2012,8,26,1783,0,42.304981,-89.156791,Bombus vagans,Bombus vagans,,f,f,female,https://beespotter.org/bee/2673
1971,tsw,9/30/2010,2010,9,30,1087,Apis mellifera on Russian Sage,8/30/2012,2012,8,30,1787,-699,42.0333636,-87.7333934,Apis mellifera,Apis mellifera,,f,f,female,https://beespotter.org/bee/1971
2683,tsw,9/3/2012,2012,9,3,1791,Apis mellifera on  garlic chive (Allium tuberosum),8/30/2012,2012,8,30,1787,4,42.0333636,-87.7333934,Apis mellifera,Apis mellifera,,f,f,female,https://beespotter.org/bee/2683
2682,twotringas,9/2/2012,2012,9,2,1790,vagans (?) on Prairie Thistle,8/31/2012,2012,8,31,1788,2,42.24082508,-89.12084688,Bombus vagans,Bombus vagans,Bombus affinis,t,t,female,https://beespotter.org/bee/2682
2677,danz,9/1/2012,2012,9,1,1789,Bee004 - Bee on Stiff Goldenrod,9/1/2012,2012,9,1,1789,0,42.035023,-87.723552,Bombus impatiens,Bombus impatiens,,f,f,,https://beespotter.org/bee/2677
2680,samjohns,9/2/2012,2012,9,2,1790,Having Honey Bees Around The Hoouse,9/2/2012,2012,9,2,1790,0,40.10446761,-88.17137718,Bombus affinis,Apis mellifera,,f,f,female,https://beespotter.org/bee/2680
5116,mmckelve,8/10/2016,2016,8,10,3228,2012-09-03,9/3/2012,2012,9,3,1791,1437,40.10714109,-88.2517878,Bombus griseocollis,Apis mellifera,,f,f,female,https://beespotter.org/bee/5116
2772,rdlp18,1/21/2013,2013,1,21,1931,My Garden Bumbles,9/4/2012,2012,9,4,1792,139,41.9579778,-87.7004466,Bombus fervidus,Bombus fervidus,,f,f,female,https://beespotter.org/bee/2772
5117,mmckelve,8/10/2016,2016,8,10,3228,2012-09-04,9/4/2012,2012,9,4,1792,1436,40.10736449,-88.25176902,Bombus griseocollis,Bombus griseocollis,,f,f,female,https://beespotter.org/bee/5117
2688,danz,9/9/2012,2012,9,9,1797,Bee005 - Listless Bee on Stiff Goldenrod,9/9/2012,2012,9,9,1797,0,42.035023,-87.723552,Bombus impatiens,Bombus impatiens,,f,f,male,https://beespotter.org/bee/2688
2689,danz,9/9/2012,2012,9,9,1797,Bee006 - Bee on Stiff Goldenrod,9/9/2012,2012,9,9,1797,0,42.035023,-87.723552,Bombus impatiens,Bombus impatiens,,f,f,,https://beespotter.org/bee/2689
2690,danz,9/9/2012,2012,9,9,1797,Bee007 - 2nd bee on Stiff Golden Rod,9/9/2012,2012,9,9,1797,0,42.035023,-87.723552,Bombus impatiens,Bombus impatiens,,f,f,male,https://beespotter.org/bee/2690
2691,danz,9/9/2012,2012,9,9,1797,Bee008 - Bee on Stiff Golden Rod (location of listless bee),9/9/2012,2012,9,9,1797,0,42.035023,-87.723552,Bombus impatiens,Bombus impatiens,,f,f,male,https://beespotter.org/bee/2691
2694,SonnyBee,9/11/2012,2012,9,11,1799,BumbleBees_6-28-2012 9-50-16 AM,9/11/2012,2012,9,11,1799,0,38.9241859,-90.0242836,Bombus affinis,Bombus griseocollis,,f,f,female,https://beespotter.org/bee/2694
2800,jbates,4/13/2013,2013,4,13,2013,Fall Evanston,9/12/2012,2012,9,12,1800,213,42.02076673,-87.68903017,,Bombus impatiens,,f,f,female,https://beespotter.org/bee/2800
2695,janher,9/14/2012,2012,9,14,1802,burnham1,9/14/2012,2012,9,14,1802,0,41.79857557,-87.58008957,Apis mellifera,Apis mellifera,,f,f,female,https://beespotter.org/bee/2695
2696,janher,9/14/2012,2012,9,14,1802,burnham2,9/14/2012,2012,9,14,1802,0,41.80331037,-87.58081913,Apis mellifera,Apis mellifera,,f,f,female,https://beespotter.org/bee/2696
2697,danz,9/16/2012,2012,9,16,1804,Bee009 - Honeybee on Stiff Goldenrod,9/15/2012,2012,9,15,1803,1,42.035023,-87.723552,Apis mellifera,Apis mellifera,,f,f,female,https://beespotter.org/bee/2697
2698,John Dahlstedt,9/16/2012,2012,9,16,1804,Bee 652 Champaign Cty,9/16/2012,2012,9,16,1804,0,40.08158494,-88.20188999,Apis mellifera,Apis mellifera,,f,f,female,https://beespotter.org/bee/2698
2699,John Dahlstedt,9/16/2012,2012,9,16,1804,Bee 653 Champaign Cty,9/16/2012,2012,9,16,1804,0,40.07978408,-88.2083112,Bombus impatiens,Bombus impatiens,,f,f,female,https://beespotter.org/bee/2699
2700,janher,9/16/2012,2012,9,16,1804,boneset,9/16/2012,2012,9,16,1804,0,41.92910205,-87.63793945,Apis mellifera,Apis mellifera,,f,f,female,https://beespotter.org/bee/2700
2702,danz,9/16/2012,2012,9,16,1804,Bee010 - Bee on aster,9/16/2012,2012,9,16,1804,0,42.035023,-87.723552,Bombus impatiens,Bombus impatiens,,f,f,,https://beespotter.org/bee/2702
2703,danz,9/16/2012,2012,9,16,1804,Bee011- anotther Bee on Aster,9/16/2012,2012,9,16,1804,0,42.035023,-87.723552,Bombus impatiens,Bombus impatiens,,f,f,female,https://beespotter.org/bee/2703
2704,danz,9/16/2012,2012,9,16,1804,Bee012 - Bee on Jerusalem Artichoke,9/16/2012,2012,9,16,1804,0,42.035023,-87.723552,Bombus impatiens,Bombus impatiens,,f,f,female,https://beespotter.org/bee/2704
2705,danz,9/16/2012,2012,9,16,1804,Bee013 - Bee on Smooth Aster,9/16/2012,2012,9,16,1804,0,42.035023,-87.723552,Bombus impatiens,Bombus bimaculatus,,f,f,,https://beespotter.org/bee/2705
2713,twotringas,9/24/2012,2012,9,24,1812,impatiens on Prairie Thistle,9/22/2012,2012,9,22,1810,2,38.65535411,-89.32914734,Bombus impatiens,Bombus impatiens,,f,f,female,https://beespotter.org/bee/2713
2714,twotringas,9/24/2012,2012,9,24,1812,fervidus on Prairie Thistle,9/22/2012,2012,9,22,1810,2,38.6714387,-89.32571411,Bombus fervidus,Bombus fervidus,,f,f,male,https://beespotter.org/bee/2714
2715,twotringas,9/24/2012,2012,9,24,1812,fraternus on Prairie Thistle,9/22/2012,2012,9,22,1810,2,38.65522005,-89.329319,Bombus fraternus,Bombus fraternus,,f,f,male,https://beespotter.org/bee/2715
2776,ngoldber,2/5/2013,2013,2,5,1946,Unidentified Bee from IOS Carlyle Lake trip,9/22/2012,2012,9,22,1810,136,38.67117066,-89.32262421,,Bombus impatiens,,f,f,female,https://beespotter.org/bee/2776
2709,danz,9/23/2012,2012,9,23,1811,Bee014 - Bee on smooth aster,9/23/2012,2012,9,23,1811,0,42.035023,-87.723552,Bombus impatiens,Bombus impatiens,,f,f,male,https://beespotter.org/bee/2709
2710,danz,9/23/2012,2012,9,23,1811,Bee015 - Bee on New England Aster,9/23/2012,2012,9,23,1811,0,42.035023,-87.723552,Bombus impatiens,Bombus impatiens,,f,f,male,https://beespotter.org/bee/2710
2711,danz,9/23/2012,2012,9,23,1811,Bee016 - On Jerusalem Artichoke,9/23/2012,2012,9,23,1811,0,42.035023,-87.723552,Bombus impatiens,Bombus impatiens,,f,f,male,https://beespotter.org/bee/2711
2712,twotringas,9/24/2012,2012,9,24,1812,fraternus (?) on Prairie Thistle,9/23/2012,2012,9,23,1811,1,38.66044795,-89.32760239,Bombus fraternus,Bombus fraternus,,f,f,male,https://beespotter.org/bee/2712
2716,twotringas,9/24/2012,2012,9,24,1812,auricomus on Prairie Thistle,9/23/2012,2012,9,23,1811,1,,,Bombus auricomus,Bombus auricomus,,f,f,female,https://beespotter.org/bee/2716
2717,twotringas,9/24/2012,2012,9,24,1812,griseocollis on Prairie Thistle,9/23/2012,2012,9,23,1811,1,38.66111817,-89.32725906,Bombus griseocollis,Bombus griseocollis,,f,f,female,https://beespotter.org/bee/2717
2718,danz,9/30/2012,2012,9,30,1818,Bee017 - Bee on New England Aster,9/30/2012,2012,9,30,1818,0,42.035023,-87.723552,Bombus impatiens,Bombus impatiens,,f,f,male,https://beespotter.org/bee/2718
2719,danz,9/30/2012,2012,9,30,1818,Bee018 - Another Bee - New England Aster,9/30/2012,2012,9,30,1818,0,42.035023,-87.723552,Bombus impatiens,Bombus impatiens,,f,f,female,https://beespotter.org/bee/2719
2720,danz,9/30/2012,2012,9,30,1818,Bee019 - Bees love New England Aster,9/30/2012,2012,9,30,1818,0,42.035023,-87.723552,Bombus impatiens,Bombus impatiens,,f,f,,https://beespotter.org/bee/2720
2721,danz,9/30/2012,2012,9,30,1818,Bee020 - Bee on Smooth Aster,9/30/2012,2012,9,30,1818,0,42.035023,-87.723552,Bombus impatiens,Bombus impatiens,,f,f,male,https://beespotter.org/bee/2721
2722,twotringas,9/30/2012,2012,9,30,1818,griseocollis on aster,9/30/2012,2012,9,30,1818,0,42.30321386,-89.32262421,Bombus griseocollis,Bombus griseocollis,,f,f,female,https://beespotter.org/bee/2722
2723,twotringas,9/30/2012,2012,9,30,1818,honeybee on aster,9/30/2012,2012,9,30,1818,0,42.30219818,-89.32296753,Apis mellifera,Apis mellifera,,f,f,female,https://beespotter.org/bee/2723
2732,twotringas,10/18/2012,2012,10,18,1836,honeybee,10/1/2012,2012,10,1,1819,17,42.304981,-89.156791,Apis mellifera,Apis mellifera,,f,f,female,https://beespotter.org/bee/2732
2733,twotringas,10/18/2012,2012,10,18,1836,honeybee,10/2/2012,2012,10,2,1820,16,42.304981,-89.156791,Apis mellifera,Apis mellifera,,f,f,female,https://beespotter.org/bee/2733
2734,twotringas,10/18/2012,2012,10,18,1836,impatiens,10/3/2012,2012,10,3,1821,15,42.304981,-89.156791,Bombus impatiens,Bombus impatiens,,f,f,female,https://beespotter.org/bee/2734
2726,danz,10/7/2012,2012,10,7,1825,Bee021 - Bee on Smooth Aster,10/7/2012,2012,10,7,1825,0,42.035023,-87.723552,Bombus impatiens,Bombus impatiens,,f,f,male,https://beespotter.org/bee/2726
2727,danz,10/7/2012,2012,10,7,1825,Bee022 - another one on smooth aster,10/7/2012,2012,10,7,1825,0,42.035023,-87.723552,Bombus impatiens,Bombus impatiens,,f,f,,https://beespotter.org/bee/2727
2728,danz,10/7/2012,2012,10,7,1825,Bee023 - bee that loves smooth aster,10/7/2012,2012,10,7,1825,0,42.035023,-87.723552,Bombus impatiens,Bombus impatiens,,f,f,female,https://beespotter.org/bee/2728
2729,John Dahlstedt,10/16/2012,2012,10,16,1834,Bee 654 Champaign Cty,10/11/2012,2012,10,11,1829,5,40.0829394,-88.20208311,Apis mellifera,Apis mellifera,,f,f,female,https://beespotter.org/bee/2729
2730,John Dahlstedt,10/16/2012,2012,10,16,1834,Bee 655 Champaign Cty,10/15/2012,2012,10,15,1833,1,40.08252896,-88.20226014,Bombus impatiens,Bombus impatiens,,f,f,male,https://beespotter.org/bee/2730
2731,John Dahlstedt,10/16/2012,2012,10,16,1834,Bee 656 Champaign Cty,10/15/2012,2012,10,15,1833,1,40.08337857,-88.20208311,Bombus impatiens,Bombus impatiens,,f,f,female,https://beespotter.org/bee/2731
2737,danz,10/21/2012,2012,10,21,1839,Bee024 - Bee on Smooth Aster,10/21/2012,2012,10,21,1839,0,42.035023,-87.723552,Bombus impatiens,Bombus impatiens,,f,f,male,https://beespotter.org/bee/2737
2739,John Dahlstedt,10/25/2012,2012,10,25,1843,Bee 657 Champaign Cty,10/24/2012,2012,10,24,1842,1,40.07989388,-88.20833266,Apis mellifera,Apis mellifera,,f,f,female,https://beespotter.org/bee/2739
2740,John Dahlstedt,10/25/2012,2012,10,25,1843,Bee 658 Champaign Cty,10/24/2012,2012,10,24,1842,1,40.07988465,-88.20833266,Apis mellifera,Apis mellifera,,f,f,female,https://beespotter.org/bee/2740
2741,John Dahlstedt,10/25/2012,2012,10,25,1843,Bee 659 Champaign Cty,10/24/2012,2012,10,24,1842,1,40.07985694,-88.20841581,Apis mellifera,Apis mellifera,,f,f,female,https://beespotter.org/bee/2741
2742,John Dahlstedt,10/25/2012,2012,10,25,1843,Bee 660 Champaign Cty,10/24/2012,2012,10,24,1842,1,40.07985489,-88.20841983,Apis mellifera,Apis mellifera,,f,f,female,https://beespotter.org/bee/2742
2766,vanessam0124,12/27/2012,2012,12,27,1906,Diminishing Bee Populations,12/27/2012,2012,12,27,1906,0,40.10171028,-88.22399139,,Apis mellifera,,f,f,female,https://beespotter.org/bee/2766
2792,John Dahlstedt,3/29/2013,2013,3,29,1998,Bee 661 Champaign Cty,3/29/2013,2013,3,29,1998,0,,,Apis mellifera,Apis mellifera,,f,f,female,https://beespotter.org/bee/2792
2793,John Dahlstedt,3/29/2013,2013,3,29,1998,Bee 662 Champaign Cty,3/29/2013,2013,3,29,1998,0,40.07996161,-88.20830718,Apis mellifera,Apis mellifera,,f,f,female,https://beespotter.org/bee/2793
2795,John Dahlstedt,4/5/2013,2013,4,5,2005,Bee 663 Champaign Cty,4/5/2013,2013,4,5,2005,0,,,Apis mellifera,Apis mellifera,,f,f,female,https://beespotter.org/bee/2795
2796,John Dahlstedt,4/5/2013,2013,4,5,2005,Bee 664 Champaign Cty,4/5/2013,2013,4,5,2005,0,,,Apis mellifera,Apis mellifera,,f,f,female,https://beespotter.org/bee/2796
2797,John Dahlstedt,4/5/2013,2013,4,5,2005,Bee 665 Champaign Cty,4/5/2013,2013,4,5,2005,0,,,Apis mellifera,Apis mellifera,,f,f,female,https://beespotter.org/bee/2797
2812,tharriso,4/17/2013,2013,4,17,2017,Honey_bees,4/14/2013,2013,4,14,2014,3,39.50243473,-88.17511082,Apis mellifera,Apis mellifera,,f,f,female,https://beespotter.org/bee/2812
2821,John Dahlstedt,4/18/2013,2013,4,18,2018,Bee 666 Champaign Cty,4/14/2013,2013,4,14,2014,4,40.08024277,-88.20823073,Apis mellifera,Apis mellifera,,f,f,female,https://beespotter.org/bee/2821
2822,John Dahlstedt,4/18/2013,2013,4,18,2018,Bee 667 Champaign Cty,4/14/2013,2013,4,14,2014,4,40.08032383,-88.20839703,Apis mellifera,Apis mellifera,,f,f,female,https://beespotter.org/bee/2822
2823,John Dahlstedt,4/18/2013,2013,4,18,2018,Bee 668 Champaign Cty,4/14/2013,2013,4,14,2014,4,40.07980563,-88.20842654,Bombus impatiens,Bombus impatiens,,f,f,female,https://beespotter.org/bee/2823
2824,John Dahlstedt,4/18/2013,2013,4,18,2018,Bee 669 Champaign Cty,4/14/2013,2013,4,14,2014,4,40.0798631,-88.2083568,Bombus impatiens,Bombus impatiens,,f,f,female,https://beespotter.org/bee/2824
2825,John Dahlstedt,4/18/2013,2013,4,18,2018,Bee 670 Champaign Cty,4/14/2013,2013,4,14,2014,4,40.08034128,-88.20840508,Bombus impatiens,Bombus impatiens,,f,f,female,https://beespotter.org/bee/2825
2826,John Dahlstedt,4/18/2013,2013,4,18,2018,Bee 671 Champaign Cty,4/14/2013,2013,4,14,2014,4,40.08034333,-88.20841044,Apis mellifera,Apis mellifera,,f,f,female,https://beespotter.org/bee/2826
2827,John Dahlstedt,4/18/2013,2013,4,18,2018,Bee 672 Champaign Cty,4/14/2013,2013,4,14,2014,4,40.08034949,-88.20842385,Apis mellifera,Apis mellifera,,f,f,female,https://beespotter.org/bee/2827
2833,amusablejer,4/25/2013,2013,4,25,2025,bombus bimaculatus,4/23/2013,2013,4,23,2023,2,41.46479131,-88.1848526,Bombus bimaculatus,Bombus bimaculatus,,f,f,female,https://beespotter.org/bee/2833
2834,John Dahlstedt,4/27/2013,2013,4,27,2027,Bee 673 Champaign Cty,4/26/2013,2013,4,26,2026,1,40.0869267,-88.20077688,Apis mellifera,Apis mellifera,,f,f,female,https://beespotter.org/bee/2834
2835,twotringas,4/29/2013,2013,4,29,2029,Honeybee on Bloodroot,4/29/2013,2013,4,29,2029,0,42.304981,-89.156791,Apis mellifera,Apis mellifera,,f,f,female,https://beespotter.org/bee/2835
2836,twotringas,4/29/2013,2013,4,29,2029,bimaculatus on Daffodil,4/29/2013,2013,4,29,2029,0,42.304981,-89.156791,Bombus bimaculatus,Bombus bimaculatus,,f,f,female,https://beespotter.org/bee/2836
2837,John Dahlstedt,4/29/2013,2013,4,29,2029,Bee 674 Champaign Cty,4/29/2013,2013,4,29,2029,0,40.08024482,-88.20841178,Bombus bimaculatus,Bombus bimaculatus,,f,f,female,https://beespotter.org/bee/2837
2838,wscovill,5/2/2013,2013,5,2,2032,Rhodo,5/2/2013,2013,5,2,2032,0,41.726962,-88.266828,Bombus bimaculatus,Bombus bimaculatus,,f,f,female,https://beespotter.org/bee/2838
2854,TER_OR,5/13/2013,2013,5,13,2043,Bimiculatus queen 050513,5/3/2013,2013,5,3,2033,10,42.1013019,-88.277347,Bombus bimaculatus,Bombus bimaculatus,,f,f,female,https://beespotter.org/bee/2854
2898,lasersohn,6/13/2013,2013,6,13,2074,1,5/6/2013,2013,5,6,2036,38,40.10526826,-88.21734202,,Bombus impatiens,,f,f,female,https://beespotter.org/bee/2898
2845,John Dahlstedt,5/8/2013,2013,5,8,2038,Bee 675 Champaign Cty,5/7/2013,2013,5,7,2037,1,40.08022635,-88.20807517,Apis mellifera,Apis mellifera,,f,f,female,https://beespotter.org/bee/2845
2846,John Dahlstedt,5/8/2013,2013,5,8,2038,Bee 676 Champaign Cty,5/7/2013,2013,5,7,2037,1,40.07978203,-88.20834607,Bombus bimaculatus,Bombus bimaculatus,,f,f,female,https://beespotter.org/bee/2846
2847,John Dahlstedt,5/8/2013,2013,5,8,2038,Bee 677 Champaign Cty,5/7/2013,2013,5,7,2037,1,40.07977793,-88.2083407,Bombus griseocollis,Bombus griseocollis,,f,f,female,https://beespotter.org/bee/2847
2848,John Dahlstedt,5/8/2013,2013,5,8,2038,Bee 678 Champaign Cty,5/7/2013,2013,5,7,2037,1,40.07954704,-88.20817709,Apis mellifera,Apis mellifera,,f,f,female,https://beespotter.org/bee/2848
2850,John Dahlstedt,5/9/2013,2013,5,9,2039,Bee 679 Champaign Cty,5/8/2013,2013,5,8,2038,1,40.1269037,-88.20939481,Apis mellifera,Apis mellifera,,f,f,female,https://beespotter.org/bee/2850
2859,Nekbeis,5/16/2013,2013,5,16,2046,Bumblebee,5/12/2013,2013,5,12,2042,4,40.955033,-90.3933289,Bombus affinis,Bombus griseocollis,,f,f,female,https://beespotter.org/bee/2859
2852,tvelat,5/13/2013,2013,5,13,2043,WF_spot1,5/13/2013,2013,5,13,2043,0,41.68757564,-88.00199032,Bombus bimaculatus,Bombus bimaculatus,,f,f,female,https://beespotter.org/bee/2852
2853,tvelat,5/13/2013,2013,5,13,2043,WF_spot2,5/13/2013,2013,5,13,2043,0,41.68755962,-88.00192595,Bombus impatiens,Bombus impatiens,,f,f,female,https://beespotter.org/bee/2853
2861,John Dahlstedt,5/18/2013,2013,5,18,2048,Bee 680 Champaign Cty,5/16/2013,2013,5,16,2046,2,40.08028176,-88.20829779,Apis mellifera,Apis mellifera,,f,f,female,https://beespotter.org/bee/2861
2862,John Dahlstedt,5/18/2013,2013,5,18,2048,Bee 681 Champaign Cty,5/16/2013,2013,5,16,2046,2,40.08029202,-88.20832059,Apis mellifera,Apis mellifera,,f,f,both,https://beespotter.org/bee/2862
2860,jjames,5/17/2013,2013,5,17,2047,B fervidus on Baptisia,5/17/2013,2013,5,17,2047,0,40.84201206,-89.63413596,Bombus fervidus,Bombus fervidus,,f,f,female,https://beespotter.org/bee/2860
2863,lifeonthecutoff,5/18/2013,2013,5,18,2048,Bumblebee in tree peony,5/18/2013,2013,5,18,2048,0,41.756603,-87.873862,Bombus affinis,Bombus impatiens,,f,f,female,https://beespotter.org/bee/2863
2865,jbates,5/19/2013,2013,5,19,2049,"Jackson Park, Cook Co.",5/18/2013,2013,5,18,2048,1,41.78578827,-87.58224607,Bombus fervidus,Bombus fervidus,,f,f,female,https://beespotter.org/bee/2865
2864,meist99,5/19/2013,2013,5,19,2049,HorseChestnut20130519,5/19/2013,2013,5,19,2049,0,41.82470858,-88.52832556,Bombus fervidus,Bombus fervidus,,f,f,female,https://beespotter.org/bee/2864
3447,purpletramp,9/17/2013,2013,9,17,2170,bee in Annapolis Royal Heritage Gardens,5/20/2013,2013,5,20,2050,120,44.742226,-65.515822,,Bombus impatiens,,f,f,female,https://beespotter.org/bee/3447
2867,Misty,5/25/2013,2013,5,25,2055,Bee on peony,5/25/2013,2013,5,25,2055,0,38.71589548,-89.7666049,,Bombus impatiens,,f,f,female,https://beespotter.org/bee/2867
2868,Misty,5/25/2013,2013,5,25,2055,Bee on peony,5/25/2013,2013,5,25,2055,0,38.7156572,-89.7657846,Bombus variabilis,Bombus impatiens,,f,f,female,https://beespotter.org/bee/2868
2897,lasersohn,6/13/2013,2013,6,13,2074,2,5/26/2013,2013,5,26,2056,18,40.105279,-88.2150209,,Apis mellifera,,f,f,female,https://beespotter.org/bee/2897
3500,Geldverdienen,9/21/2013,2013,9,21,2174,Apis melifera,5/29/2013,2013,5,29,2059,115,36.58107369,-85.79378128,Apis mellifera,Apis mellifera,,f,f,female,https://beespotter.org/bee/3500
2877,peterwchen,5/31/2013,2013,5,31,2061,at the Arb,5/31/2013,2013,5,31,2061,0,41.82002334,-88.08047175,,Bombus impatiens,,f,f,female,https://beespotter.org/bee/2877
2878,kmayo,6/3/2013,2013,6,3,2064,Bees in tree hole,6/2/2013,2013,6,2,2063,1,42.125042,-87.973921,Apis mellifera,Apis mellifera,,f,f,female,https://beespotter.org/bee/2878
2882,John Dahlstedt,6/4/2013,2013,6,4,2065,Bee 682 Champaign Cty,6/3/2013,2013,6,3,2064,1,40.07841622,-88.20911586,Apis mellifera,Apis mellifera,,f,f,female,https://beespotter.org/bee/2882
2883,John Dahlstedt,6/4/2013,2013,6,4,2065,Bee 683 Champaign Cty,6/3/2013,2013,6,3,2064,1,40.07727922,-88.20490479,Bombus griseocollis,Bombus griseocollis,,f,f,female,https://beespotter.org/bee/2883
2880,janher,6/4/2013,2013,6,4,2065,Ihouse,6/4/2013,2013,6,4,2065,0,41.79288055,-87.58056164,Apis mellifera,Apis mellifera,,f,f,female,https://beespotter.org/bee/2880
2881,janher,6/4/2013,2013,6,4,2065,Beach,6/4/2013,2013,6,4,2065,0,41.79182468,-87.57981062,Apis mellifera,Apis mellifera,,f,f,female,https://beespotter.org/bee/2881
2886,joshuallen,6/7/2013,2013,6,7,2068,backyar,6/6/2013,2013,6,6,2067,1,40.09067984,-88.20633173,Bombus bimaculatus,Bombus bimaculatus,,f,f,female,https://beespotter.org/bee/2886
2894,twotringas,6/10/2013,2013,6,10,2071,bimaculatus queen on sage,6/7/2013,2013,6,7,2068,3,42.304981,-89.156791,Bombus bimaculatus,Bombus bimaculatus,,f,f,female,https://beespotter.org/bee/2894
2887,lifeonthecutoff,6/8/2013,2013,6,8,2069,Fuchsia through window,6/8/2013,2013,6,8,2069,0,41.756603,-87.873862,Bombus impatiens,Bombus impatiens,,f,f,female,https://beespotter.org/bee/2887
2888,Dave_K,6/8/2013,2013,6,8,2069,Bumble on William Baffin Rose,6/8/2013,2013,6,8,2069,0,41.93804122,-88.07722092,,Bombus impatiens,,f,f,female,https://beespotter.org/bee/2888
2893,twotringas,6/10/2013,2013,6,10,2071,bimaculatus on sage,6/8/2013,2013,6,8,2069,2,42.304981,-89.156791,Bombus bimaculatus,Bombus bimaculatus,,f,f,female,https://beespotter.org/bee/2893
2950,TER_OR,6/20/2013,2013,6,20,2081,Bimiculatus 060813,6/8/2013,2013,6,8,2069,12,42.10455886,-88.28008175,Bombus bimaculatus,Bombus bimaculatus,,f,f,female,https://beespotter.org/bee/2950
2892,twotringas,6/10/2013,2013,6,10,2071,bimaculatus queen on sage,6/9/2013,2013,6,9,2070,1,42.304981,-89.156791,Bombus bimaculatus,Bombus bimaculatus,,f,f,female,https://beespotter.org/bee/2892
2924,daveweth,6/15/2013,2013,6,15,2076,honey bee,6/9/2013,2013,6,9,2070,6,40.34811407,-89.13295984,Apis mellifera,Apis mellifera,,f,f,female,https://beespotter.org/bee/2924
3444,mmckelve,9/13/2013,2013,9,13,2166,Bee wearing flower as a hat,6/9/2013,2013,6,9,2070,96,40.10762487,-88.25215593,Bombus griseocollis,Bombus bimaculatus,Bombus griseocollis,f,f,female,https://beespotter.org/bee/3444
2899,John Dahlstedt,6/13/2013,2013,6,13,2074,Bee 684 Champaign Cty,6/10/2013,2013,6,10,2071,3,40.07999239,-88.20352077,Apis mellifera,Apis mellifera,,f,f,female,https://beespotter.org/bee/2899
2900,John Dahlstedt,6/13/2013,2013,6,13,2074,Bee 685 Champaign Cty,6/10/2013,2013,6,10,2071,3,40.07723407,-88.2049799,Apis mellifera,Apis mellifera,,f,f,female,https://beespotter.org/bee/2900
2942,Caroline,6/18/2013,2013,6,18,2079,Bumble Bee with Orange on it,6/10/2013,2013,6,10,2071,8,41.807931,-87.999201,Bombus griseocollis,Bombus griseocollis,,f,f,female,https://beespotter.org/bee/2942
2902,celestia,6/13/2013,2013,6,13,2074,Backyard (1),6/12/2013,2013,6,12,2073,1,41.887061,-87.958958,,Bombus bimaculatus,,f,f,female,https://beespotter.org/bee/2902
2903,celestia,6/13/2013,2013,6,13,2074,Red Sides,6/13/2013,2013,6,13,2074,0,41.887061,-87.958958,Bombus griseocollis,Bombus bimaculatus,,f,f,female,https://beespotter.org/bee/2903
2906,rimah2004,6/14/2013,2013,6,14,2075,CAMP BEE SPOTTING,6/14/2013,2013,6,14,2075,0,40.09184944,-88.21747899,Bombus affinis,Apis mellifera,,f,f,female,https://beespotter.org/bee/2906
2907,jtangen13,6/14/2013,2013,6,14,2075,girls do science,6/14/2013,2013,6,14,2075,0,40.08673996,-88.21360588,,Apis mellifera,,f,f,female,https://beespotter.org/bee/2907
2910,ella123,6/14/2013,2013,6,14,2075,girls do science,6/14/2013,2013,6,14,2075,0,40.08516395,-88.21532249,,Apis mellifera,,f,f,female,https://beespotter.org/bee/2910
2911,nessa7,6/14/2013,2013,6,14,2075,girl bee,6/14/2013,2013,6,14,2075,0,40.08709292,-88.21439981,Bombus affinis,Apis mellifera,,f,f,female,https://beespotter.org/bee/2911
2915,sarah123,6/14/2013,2013,6,14,2075,girls do science,6/14/2013,2013,6,14,2075,0,40.08568929,-88.21274757,,Apis mellifera,,f,f,female,https://beespotter.org/bee/2915
2916,charleyd,6/14/2013,2013,6,14,2075,insect camp,6/14/2013,2013,6,14,2075,0,40.08647729,-88.21343422,Apis mellifera,Apis mellifera,,f,f,female,https://beespotter.org/bee/2916
2918,Rain226,6/14/2013,2013,6,14,2075,Rain226spottng2,6/14/2013,2013,6,14,2075,0,40.08319388,-88.21866989,Bombus affinis,Apis mellifera,,f,f,female,https://beespotter.org/bee/2918
2919,505pie,6/14/2013,2013,6,14,2075,bees girlsdoscience,6/14/2013,2013,6,14,2075,0,40.0835306,-88.2188445,Bombus vagans,Apis mellifera,,f,f,female,https://beespotter.org/bee/2919
2920,Rain226,6/14/2013,2013,6,14,2075,beespotting3,6/14/2013,2013,6,14,2075,0,40.0835306,-88.2188445,Bombus griseocollis,Apis mellifera,,f,f,female,https://beespotter.org/bee/2920
2922,ella123,6/14/2013,2013,6,14,2075,girls do science,6/14/2013,2013,6,14,2075,0,40.08460576,-88.21470022,,Apis mellifera,,f,f,female,https://beespotter.org/bee/2922
2927,twotringas,6/16/2013,2013,6,16,2077,griseocollis on sage,6/15/2013,2013,6,15,2076,1,42.304981,-89.156791,Bombus griseocollis,Bombus griseocollis,,f,f,female,https://beespotter.org/bee/2927
2929,twotringas,6/16/2013,2013,6,16,2077,vagans on coreopsis,6/15/2013,2013,6,15,2076,1,42.304981,-89.156791,Bombus vagans,Bombus vagans,,f,f,female,https://beespotter.org/bee/2929
2926,twotringas,6/16/2013,2013,6,16,2077,citrinus on sage,6/16/2013,2013,6,16,2077,0,42.304981,-89.156791,Bombus citrinus,Bombus citrinus,,f,f,female,https://beespotter.org/bee/2926
2932,twotringas,6/18/2013,2013,6,18,2079,Griseocollis on Pale Purple Coneflower,6/17/2013,2013,6,17,2078,1,,,Bombus griseocollis,Bombus griseocollis,,f,f,female,https://beespotter.org/bee/2932
2933,twotringas,6/18/2013,2013,6,18,2079,honey bee on Dogbane,6/17/2013,2013,6,17,2078,1,41.21740331,-89.32331085,Apis mellifera,Apis mellifera,,f,f,female,https://beespotter.org/bee/2933
2934,twotringas,6/18/2013,2013,6,18,2079,honeybee on dogbane,6/17/2013,2013,6,17,2078,1,41.21624116,-89.32348251,Apis mellifera,Apis mellifera,,f,f,female,https://beespotter.org/bee/2934
2936,twotringas,6/18/2013,2013,6,18,2079,honey bee on Butterflyweed,6/17/2013,2013,6,17,2078,1,41.21675768,-89.32313919,Apis mellifera,Apis mellifera,,f,f,female,https://beespotter.org/bee/2936
2937,John Dahlstedt,6/18/2013,2013,6,18,2079,Bee 686 Champaign Cty,6/18/2013,2013,6,18,2079,0,40.07985489,-88.20834741,Apis mellifera,Apis mellifera,,f,f,female,https://beespotter.org/bee/2937
2938,John Dahlstedt,6/18/2013,2013,6,18,2079,Bee 687 Champaign Cty,6/18/2013,2013,6,18,2079,0,40.07980563,-88.20840508,Apis mellifera,Apis mellifera,,f,f,female,https://beespotter.org/bee/2938
2939,John Dahlstedt,6/18/2013,2013,6,18,2079,Bee 688 Champaign Cty,6/18/2013,2013,6,18,2079,0,40.07988772,-88.20841447,Apis mellifera,Apis mellifera,,f,f,female,https://beespotter.org/bee/2939
2940,John Dahlstedt,6/18/2013,2013,6,18,2079,Bee 689 Champaign Cty,6/18/2013,2013,6,18,2079,0,40.07985899,-88.20841044,Apis mellifera,Apis mellifera,,f,f,female,https://beespotter.org/bee/2940
2941,John Dahlstedt,6/18/2013,2013,6,18,2079,Bee 690 Champaign Cty,6/18/2013,2013,6,18,2079,0,40.07997187,-88.20844799,Apis mellifera,Apis mellifera,,f,f,female,https://beespotter.org/bee/2941
2948,wscovill,6/19/2013,2013,6,19,2080,PenstemonBB,6/18/2013,2013,6,18,2079,1,41.726962,-88.266828,Bombus bimaculatus,Bombus impatiens,,f,f,female,https://beespotter.org/bee/2948
2944,celestia,6/19/2013,2013,6,19,2080,Wilder Park (1),6/19/2013,2013,6,19,2080,0,41.8942546,-87.9448634,,Bombus pensylvanicus,,f,f,female,https://beespotter.org/bee/2944
2949,daveweth,6/20/2013,2013,6,20,2081,honey bee 2,6/19/2013,2013,6,19,2080,1,40.63792524,-89.03423309,Apis mellifera,Apis mellifera,,f,f,female,https://beespotter.org/bee/2949
2952,nessa7,6/24/2013,2013,6,24,2085,Bee,6/24/2013,2013,6,24,2085,0,40.073864,-88.284869,Bombus fraternus,Bombus bimaculatus,,f,f,female,https://beespotter.org/bee/2952
2953,twotringas,6/24/2013,2013,6,24,2085,griseocollis on Yellow Coneflower,6/24/2013,2013,6,24,2085,0,42.304981,-89.156791,Bombus griseocollis,Bombus griseocollis,,f,f,female,https://beespotter.org/bee/2953
2954,twotringas,6/24/2013,2013,6,24,2085,Auricomus on Pale Purple Coneflower,6/24/2013,2013,6,24,2085,0,42.304981,-89.156791,Bombus auricomus,Bombus auricomus,,f,f,female,https://beespotter.org/bee/2954
2955,twotringas,6/24/2013,2013,6,24,2085,impatiens on Pale Purple Coneflower,6/24/2013,2013,6,24,2085,0,42.304981,-89.156791,Bombus impatiens,Bombus impatiens,,f,f,female,https://beespotter.org/bee/2955
2956,twotringas,6/24/2013,2013,6,24,2085,auricomus on Pale Purple Coneflower,6/24/2013,2013,6,24,2085,0,42.304981,-89.156791,Bombus auricomus,Bombus auricomus,,f,f,female,https://beespotter.org/bee/2956
2957,twotringas,6/25/2013,2013,6,25,2086,auricomus on Pale Purple Coneflower,6/24/2013,2013,6,24,2085,1,42.304981,-89.156791,Bombus auricomus,Bombus auricomus,,f,f,female,https://beespotter.org/bee/2957
2958,twotringas,6/25/2013,2013,6,25,2086,griseocollis on Pale Purple Coneflower,6/24/2013,2013,6,24,2085,1,42.304981,-89.156791,Bombus griseocollis,Bombus griseocollis,,f,f,male,https://beespotter.org/bee/2958
2960,dlakows,6/25/2013,2013,6,25,2086,The Hive,6/25/2013,2013,6,25,2086,0,42.237545,-88.266349,Apis mellifera,Apis mellifera,,f,f,female,https://beespotter.org/bee/2960
2992,mcarrmar,7/7/2013,2013,7,7,2098,Bee on entrance reducer,6/25/2013,2013,6,25,2086,12,40.07127579,-88.06876928,Bombus impatiens,Bombus griseocollis,,f,f,female,https://beespotter.org/bee/2992
2961,John Dahlstedt,6/26/2013,2013,6,26,2087,Bee 691 Champaign Cty,6/26/2013,2013,6,26,2087,0,40.07994724,-88.20827365,Apis mellifera,Apis mellifera,,f,f,female,https://beespotter.org/bee/2961
2962,John Dahlstedt,6/26/2013,2013,6,26,2087,Bee 692 Champaign Cty,6/26/2013,2013,6,26,2087,0,40.07993954,-88.20837021,Apis mellifera,Apis mellifera,,f,f,female,https://beespotter.org/bee/2962
2963,meist99,6/28/2013,2013,6,28,2089,CrownVetch20130627,6/27/2013,2013,6,27,2088,1,41.82808238,-88.04505587,Bombus fraternus,Bombus auricomus,,f,f,female,https://beespotter.org/bee/2963
2964,TER_OR,6/28/2013,2013,6,28,2089,affinis 062813,6/28/2013,2013,6,28,2089,0,42.1013019,-88.277347,Bombus affinis,Bombus griseocollis,,f,f,female,https://beespotter.org/bee/2964
2965,TER_OR,6/28/2013,2013,6,28,2089,bimiculatus 062813,6/28/2013,2013,6,28,2089,0,42.10381062,-88.28379393,Bombus bimaculatus,Bombus bimaculatus,,f,f,female,https://beespotter.org/bee/2965
2968,celestia,6/28/2013,2013,6,28,2089,Bee on Salvia,6/28/2013,2013,6,28,2089,0,41.887061,-87.958958,,Bombus bimaculatus,,f,f,female,https://beespotter.org/bee/2968
2969,janher,6/29/2013,2013,6,29,2090,Lucas,6/29/2013,2013,6,29,2090,0,41.793779,-87.583259,Bombus griseocollis,Bombus griseocollis,,f,f,female,https://beespotter.org/bee/2969
2993,mcarrmar,7/7/2013,2013,7,7,2098,Bee stealing from feral honey bee colony,6/29/2013,2013,6,29,2090,8,40.13259462,-88.1656225,Bombus impatiens,Bombus impatiens,,f,f,female,https://beespotter.org/bee/2993
2998,jbates,7/9/2013,2013,7,9,2100,Heartland Ice Arena,6/30/2013,2013,6,30,2091,9,42.01440185,-87.74396181,Bombus affinis,Bombus impatiens,,f,f,female,https://beespotter.org/bee/2998
3171,apjasper,7/27/2013,2013,7,27,2118,Lavender,6/30/2013,2013,6,30,2091,27,42.217214,-88.235933,Bombus griseocollis,Bombus impatiens,,f,f,female,https://beespotter.org/bee/3171
3243,debs,8/6/2013,2013,8,6,2128,Big bumble,7/3/2013,2013,7,3,2094,34,38.64253208,-88.00598145,,Bombus impatiens,,f,f,female,https://beespotter.org/bee/3243
2985,daveweth,7/7/2013,2013,7,7,2098,honey bee 3,7/4/2013,2013,7,4,2095,3,40.3482776,-89.13150072,Apis mellifera,Apis mellifera,,f,f,female,https://beespotter.org/bee/2985
3192,Travis_Mahan,7/28/2013,2013,7,28,2119,affinis or gris?,7/4/2013,2013,7,4,2095,24,39.87284523,-88.89417971,,Bombus affinis,,t,t,male,https://beespotter.org/bee/3192
5118,mmckelve,8/10/2016,2016,8,10,3228,Honeybee on Hydrangeas,7/4/2013,2013,7,4,2095,1133,40.10765501,-88.25169681,Apis mellifera,Apis mellifera,,f,f,female,https://beespotter.org/bee/5118
2973,John Dahlstedt,7/5/2013,2013,7,5,2096,Bee 693 Champaign Cty,7/5/2013,2013,7,5,2096,0,40.07985591,-88.20841312,Apis mellifera,Apis mellifera,,f,f,female,https://beespotter.org/bee/2973
2974,John Dahlstedt,7/5/2013,2013,7,5,2096,Bee 694 Champaign Cty,7/5/2013,2013,7,5,2096,0,40.07980974,-88.20842385,Apis mellifera,Apis mellifera,,f,f,female,https://beespotter.org/bee/2974
2975,John Dahlstedt,7/5/2013,2013,7,5,2096,Bee 695 Champaign Cty,7/5/2013,2013,7,5,2096,0,40.07986104,-88.20842117,Bombus bimaculatus,Bombus bimaculatus,,f,f,female,https://beespotter.org/bee/2975
2976,John Dahlstedt,7/5/2013,2013,7,5,2096,Bee 696 Champaign Cty,7/5/2013,2013,7,5,2096,0,40.07985284,-88.20841044,Apis mellifera,Apis mellifera,,f,f,female,https://beespotter.org/bee/2976
2977,John Dahlstedt,7/5/2013,2013,7,5,2096,Bee 697 Champaign Cty,7/5/2013,2013,7,5,2096,0,40.07977895,-88.20842922,Apis mellifera,Apis mellifera,,f,f,female,https://beespotter.org/bee/2977
2978,John Dahlstedt,7/5/2013,2013,7,5,2096,Bee 698 Champaign Cty,7/5/2013,2013,7,5,2096,0,40.07977639,-88.20831254,Bombus griseocollis,Bombus griseocollis,,f,f,female,https://beespotter.org/bee/2978
2979,John Dahlstedt,7/5/2013,2013,7,5,2096,Bee 699 Champaign Cty,7/5/2013,2013,7,5,2096,0,40.07988772,-88.20842922,Apis mellifera,Apis mellifera,,f,f,female,https://beespotter.org/bee/2979
2980,John Dahlstedt,7/5/2013,2013,7,5,2096,Bee 700 Champaign Cty,7/5/2013,2013,7,5,2096,0,40.07999444,-88.20821732,Apis mellifera,Apis mellifera,,f,f,female,https://beespotter.org/bee/2980
2981,John Dahlstedt,7/5/2013,2013,7,5,2096,Bee 701 Champaign Cty,7/5/2013,2013,7,5,2096,0,40.07998469,-88.20822403,Apis mellifera,Apis mellifera,,f,f,female,https://beespotter.org/bee/2981
2982,John Dahlstedt,7/5/2013,2013,7,5,2096,Bee 702 Champaign Cty,7/5/2013,2013,7,5,2096,0,40.08004575,-88.20006609,Bombus griseocollis,Bombus griseocollis,,f,f,female,https://beespotter.org/bee/2982
2994,tvelat,7/8/2013,2013,7,8,2099,3,7/5/2013,2013,7,5,2096,3,41.69932032,-87.98469543,Bombus griseocollis,Bombus griseocollis,,f,f,female,https://beespotter.org/bee/2994
2995,tvelat,7/8/2013,2013,7,8,2099,4,7/5/2013,2013,7,5,2096,3,41.69882366,-87.98418045,Bombus auricomus,Bombus auricomus,Bombus pensylvanicus,f,f,female,https://beespotter.org/bee/2995
2983,kayote,7/6/2013,2013,7,6,2097,Butterfly Weed 1,7/6/2013,2013,7,6,2097,0,40.09286309,-88.19561362,Apis mellifera,Apis mellifera,,f,f,female,https://beespotter.org/bee/2983
2984,kayote,7/6/2013,2013,7,6,2097,Butterfly Weed 2,7/6/2013,2013,7,6,2097,0,40.09278101,-88.1957531,Apis mellifera,Apis mellifera,,f,f,female,https://beespotter.org/bee/2984
3382,WendyJG,8/29/2013,2013,8,29,2151,CBG Honeybee 1,7/6/2013,2013,7,6,2097,54,42.148623,-87.7887714,Apis mellifera,Apis mellifera,,f,f,female,https://beespotter.org/bee/3382
3383,WendyJG,8/29/2013,2013,8,29,2151,CBG Honeybee 2,7/6/2013,2013,7,6,2097,54,42.148623,-87.7887714,Apis mellifera,Apis mellifera,,f,f,female,https://beespotter.org/bee/3383
2986,celestia,7/7/2013,2013,7,7,2098,Bee on hydrangea (1),7/7/2013,2013,7,7,2098,0,41.8165735,-88.0690224,,Bombus auricomus,Bombus pensylvanicus,f,f,female,https://beespotter.org/bee/2986
2987,celestia,7/7/2013,2013,7,7,2098,Bee on hydrangea (2),7/7/2013,2013,7,7,2098,0,41.8165735,-88.0690224,,Bombus griseocollis,,f,f,female,https://beespotter.org/bee/2987
2988,celestia,7/7/2013,2013,7,7,2098,Bee on hydrangea (3),7/7/2013,2013,7,7,2098,0,41.8165735,-88.0690224,,Bombus pensylvanicus,,f,f,female,https://beespotter.org/bee/2988
2989,celestia,7/7/2013,2013,7,7,2098,Bee on olgae single clematis,7/7/2013,2013,7,7,2098,0,41.8165735,-88.0690224,,Bombus fervidus,,f,f,female,https://beespotter.org/bee/2989
3019,Caroline,7/12/2013,2013,7,12,2103,Brown Belted?,7/7/2013,2013,7,7,2098,5,41.807931,-87.999201,Bombus griseocollis,Bombus griseocollis,,f,f,female,https://beespotter.org/bee/3019
2996,janher,7/9/2013,2013,7,9,2100,mating bees,7/9/2013,2013,7,9,2100,0,41.793779,-87.583259,Bombus griseocollis,Bombus griseocollis,,f,f,both,https://beespotter.org/bee/2996
2997,meist99,7/9/2013,2013,7,9,2100,Monarda20130709,7/9/2013,2013,7,9,2100,0,41.82480178,-88.52875337,Bombus bimaculatus,Bombus griseocollis,,f,f,female,https://beespotter.org/bee/2997
3000,Travis_Mahan,7/9/2013,2013,7,9,2100,Bethany Railroad Prairie Restoration (Moultrie Co),7/9/2013,2013,7,9,2100,0,39.63658772,-88.72140974,Bombus pensylvanicus,Bombus pensylvanicus,,f,f,female,https://beespotter.org/bee/3000
3001,Travis_Mahan,7/9/2013,2013,7,9,2100,Bethany Railroad Prairie Restoration (Moultrie Co),7/9/2013,2013,7,9,2100,0,39.63688062,-88.72223586,Bombus bimaculatus,Bombus bimaculatus,,f,f,female,https://beespotter.org/bee/3001
3002,Travis_Mahan,7/9/2013,2013,7,9,2100,Bethany Railroad Prairie Restoration (Moultrie Co),7/9/2013,2013,7,9,2100,0,39.63691714,-88.72227609,Bombus impatiens,Bombus impatiens,,f,f,female,https://beespotter.org/bee/3002
3010,Travis_Mahan,7/10/2013,2013,7,10,2101,Bethany Railroad Prairie Restoration (Moultrie Co),7/9/2013,2013,7,9,2100,1,39.63700076,-88.72256711,Bombus griseocollis,Bombus griseocollis,,f,f,female,https://beespotter.org/bee/3010
3011,Travis_Mahan,7/10/2013,2013,7,10,2101,Bethany Railroad Prairie Restoration (Moultrie Co),7/9/2013,2013,7,9,2100,1,39.63695085,-88.72241288,Bombus bimaculatus,Bombus bimaculatus,,f,f,male,https://beespotter.org/bee/3011
3005,meist99,7/10/2013,2013,7,10,2101,HoaryVervain20130710,7/10/2013,2013,7,10,2101,0,41.82478597,-88.52876812,Bombus griseocollis,Bombus griseocollis,,f,f,male,https://beespotter.org/bee/3005
3006,Travis_Mahan,7/10/2013,2013,7,10,2101,Coneflower Hill Prairie (Moultrie Co),7/10/2013,2013,7,10,2101,0,39.55050632,-88.57508451,Bombus bimaculatus,Bombus bimaculatus,,f,f,male,https://beespotter.org/bee/3006
3007,Travis_Mahan,7/10/2013,2013,7,10,2101,Coneflower Hill Prairie (Moultrie Co),7/10/2013,2013,7,10,2101,0,39.55051393,-88.57515156,Bombus bimaculatus,Bombus bimaculatus,,f,f,male,https://beespotter.org/bee/3007
3008,Travis_Mahan,7/10/2013,2013,7,10,2101,Coneflower Hill Prairie (Moultrie Co),7/10/2013,2013,7,10,2101,0,39.55047952,-88.57517838,Apis mellifera,Apis mellifera,,f,f,female,https://beespotter.org/bee/3008
3009,Travis_Mahan,7/10/2013,2013,7,10,2101,Coneflower Hill Prairie (Moultrie Co),7/10/2013,2013,7,10,2101,0,39.55055182,-88.57515961,Bombus griseocollis,Bombus griseocollis,,f,f,female,https://beespotter.org/bee/3009
3012,janher,7/11/2013,2013,7,11,2102,nicols1,7/10/2013,2013,7,10,2101,1,41.79819165,-87.59395123,Bombus bimaculatus,Bombus bimaculatus,,f,f,male,https://beespotter.org/bee/3012
3013,peterwchen,7/12/2013,2013,7,12,2103,COD campus,7/11/2013,2013,7,11,2102,1,41.8421593,-88.07542384,Bombus griseocollis,Bombus griseocollis,,f,f,female,https://beespotter.org/bee/3013
3018,Caroline,7/12/2013,2013,7,12,2103,Black & Gold OR American?,7/11/2013,2013,7,11,2102,1,41.829447,-88.007702,Bombus auricomus,Bombus auricomus,,f,f,female,https://beespotter.org/bee/3018
3047,tvelat,7/15/2013,2013,7,15,2106,5,7/11/2013,2013,7,11,2102,4,41.99075678,-88.0475235,Bombus vagans,Bombus impatiens,,f,f,female,https://beespotter.org/bee/3047
3014,meist99,7/12/2013,2013,7,12,2103,Monarda20130712a,7/12/2013,2013,7,12,2103,0,41.80775693,-88.49238396,Bombus bimaculatus,Bombus bimaculatus,,f,f,female,https://beespotter.org/bee/3014
3015,meist99,7/12/2013,2013,7,12,2103,Monarda20130712b,7/12/2013,2013,7,12,2103,0,,,Bombus auricomus,Bombus auricomus,,f,f,female,https://beespotter.org/bee/3015
3016,meist99,7/12/2013,2013,7,12,2103,Monarda20130712c,7/12/2013,2013,7,12,2103,0,,,Bombus variabilis,Bombus impatiens,,f,f,female,https://beespotter.org/bee/3016
3017,meist99,7/12/2013,2013,7,12,2103,Monarda20130712d,7/12/2013,2013,7,12,2103,0,,,Apis mellifera,Apis mellifera,,f,f,female,https://beespotter.org/bee/3017
3020,Caroline,7/12/2013,2013,7,12,2103,Striped bee - unknown.,7/12/2013,2013,7,12,2103,0,41.807931,-87.999201,Bombus citrinus,Bombus bimaculatus,,f,f,male,https://beespotter.org/bee/3020
3022,robo_mantis,7/12/2013,2013,7,12,2103,confirmed bombus affinis,7/12/2013,2013,7,12,2103,0,41.29912203,-87.50794273,Bombus affinis,Bombus affinis,,t,t,female,https://beespotter.org/bee/3022
3023,Travis_Mahan,7/13/2013,2013,7,13,2104,Margaret Guzy Pothole Wetlands L&WR (Shelby Co),7/12/2013,2013,7,12,2103,1,39.54521132,-88.80891681,Bombus fraternus,Bombus fraternus,,f,f,female,https://beespotter.org/bee/3023
3024,Travis_Mahan,7/13/2013,2013,7,13,2104,Margaret Guzy Pothole Wetlands L&WR (Shelby Co),7/12/2013,2013,7,12,2103,1,39.54525103,-88.80898118,Bombus auricomus,Bombus auricomus,,f,f,female,https://beespotter.org/bee/3024
3025,Travis_Mahan,7/13/2013,2013,7,13,2104,Margaret Guzy Pothole Wetlands L&WR (Shelby Co),7/12/2013,2013,7,12,2103,1,39.54511998,-88.8088578,Bombus bimaculatus,Bombus bimaculatus,,f,f,female,https://beespotter.org/bee/3025
3026,Travis_Mahan,7/13/2013,2013,7,13,2104,Margaret Guzy Pothole Wetlands L&WR (Shelby Co),7/12/2013,2013,7,12,2103,1,39.54528147,-88.80899191,Bombus bimaculatus,Bombus bimaculatus,,f,f,female,https://beespotter.org/bee/3026
3027,Travis_Mahan,7/13/2013,2013,7,13,2104,Margaret Guzy Pothole Wetlands L&WR (Shelby Co),7/12/2013,2013,7,12,2103,1,39.54528147,-88.80899191,Bombus griseocollis,Bombus griseocollis,,f,f,female,https://beespotter.org/bee/3027
3028,Travis_Mahan,7/13/2013,2013,7,13,2104,Margaret Guzy Pothole Wetlands L&WR (Shelby Co),7/12/2013,2013,7,12,2103,1,39.54531457,-88.80890608,Bombus griseocollis,Bombus griseocollis,,f,f,female,https://beespotter.org/bee/3028
3029,Travis_Mahan,7/13/2013,2013,7,13,2104,Margaret Guzy Pothole Wetlands L&WR (Shelby Co),7/12/2013,2013,7,12,2103,1,39.54534766,-88.80890608,Bombus pensylvanicus,Bombus pensylvanicus,,f,f,female,https://beespotter.org/bee/3029
3030,Travis_Mahan,7/13/2013,2013,7,13,2104,Margaret Guzy Pothole Wetlands L&WR (Shelby Co),7/12/2013,2013,7,12,2103,1,39.54523448,-88.80887389,Bombus pensylvanicus,Bombus pensylvanicus,,f,f,female,https://beespotter.org/bee/3030
3031,Travis_Mahan,7/13/2013,2013,7,13,2104,Margaret Guzy Pothole Wetlands L&WR (Shelby Co),7/12/2013,2013,7,12,2103,1,39.54518484,-88.80891681,Bombus pensylvanicus,Bombus pensylvanicus,,f,f,female,https://beespotter.org/bee/3031
3051,tvelat,7/16/2013,2013,7,16,2107,6,7/12/2013,2013,7,12,2103,4,41.69967279,-87.99847126,Bombus griseocollis,Bombus griseocollis,,f,f,female,https://beespotter.org/bee/3051
3058,Barrs,7/16/2013,2013,7,16,2107,On the way to the Creek,7/12/2013,2013,7,12,2103,4,39.3676156,-89.96227741,Bombus bimaculatus,Bombus bimaculatus,,f,f,female,https://beespotter.org/bee/3058
3059,Barrs,7/16/2013,2013,7,16,2107,By the pond,7/12/2013,2013,7,12,2103,4,39.36698523,-89.96536732,Bombus griseocollis,Bombus griseocollis,,f,f,female,https://beespotter.org/bee/3059
3033,lora1987,7/13/2013,2013,7,13,2104,bumblebee,7/13/2013,2013,7,13,2104,0,39.8995617,-88.8696378,Bombus bimaculatus,Bombus bimaculatus,Bombus griseocollis,f,f,female,https://beespotter.org/bee/3033
3034,veghed6,7/13/2013,2013,7,13,2104,Bee1,7/13/2013,2013,7,13,2104,0,38.45436,-90.096203,,Bombus impatiens,,f,f,female,https://beespotter.org/bee/3034
3035,veghed6,7/13/2013,2013,7,13,2104,Bee 2,7/13/2013,2013,7,13,2104,0,38.45436,-90.096203,,Bombus bimaculatus,,f,f,female,https://beespotter.org/bee/3035
3036,veghed6,7/13/2013,2013,7,13,2104,Bee_3,7/13/2013,2013,7,13,2104,0,38.45436,-90.096203,,Bombus auricomus,,f,f,female,https://beespotter.org/bee/3036
3037,veghed6,7/13/2013,2013,7,13,2104,Bee 4,7/13/2013,2013,7,13,2104,0,38.45436,-90.096203,,Bombus impatiens,,f,f,male,https://beespotter.org/bee/3037
3038,veghed6,7/13/2013,2013,7,13,2104,Bee 5,7/13/2013,2013,7,13,2104,0,38.45436,-90.096203,,Bombus griseocollis,,f,f,,https://beespotter.org/bee/3038
3039,Travis_Mahan,7/13/2013,2013,7,13,2104,Friends Creek County Park (Macon Co),7/13/2013,2013,7,13,2104,0,40.03230053,-88.78578812,Bombus auricomus,Bombus auricomus,,f,f,female,https://beespotter.org/bee/3039
3040,Travis_Mahan,7/13/2013,2013,7,13,2104,Friends Creek County Park (Macon Co),7/13/2013,2013,7,13,2104,0,40.03240946,-88.78589272,Bombus auricomus,Bombus auricomus,,f,f,female,https://beespotter.org/bee/3040
3041,Travis_Mahan,7/13/2013,2013,7,13,2104,Friends Creek County Park (Macon Co),7/13/2013,2013,7,13,2104,0,40.01755274,-88.80272627,Bombus griseocollis,Bombus griseocollis,,f,f,male,https://beespotter.org/bee/3041
3042,Travis_Mahan,7/13/2013,2013,7,13,2104,Friends Creek County Park (Macon Co),7/13/2013,2013,7,13,2104,0,40.03242654,-88.78581762,Bombus bimaculatus,Bombus bimaculatus,,f,f,female,https://beespotter.org/bee/3042
3043,Travis_Mahan,7/13/2013,2013,7,13,2104,Friends Creek County Park (Macon Co),7/13/2013,2013,7,13,2104,0,40.0278517,-88.79359603,Bombus impatiens,Bombus impatiens,,f,f,female,https://beespotter.org/bee/3043
3044,Travis_Mahan,7/13/2013,2013,7,13,2104,Friends Creek County Park (Macon Co),7/13/2013,2013,7,13,2104,0,40.03242589,-88.78580689,Bombus impatiens,Bombus impatiens,,f,f,male,https://beespotter.org/bee/3044
3045,Travis_Mahan,7/13/2013,2013,7,13,2104,Friends Creek County Park (Macon Co),7/13/2013,2013,7,13,2104,0,40.03244232,-88.78580689,Bombus pensylvanicus,Bombus pensylvanicus,,f,f,male,https://beespotter.org/bee/3045
3046,Travis_Mahan,7/13/2013,2013,7,13,2104,Friends Creek County Park (Macon Co),7/13/2013,2013,7,13,2104,0,40.03239303,-88.78584981,Bombus pensylvanicus,Bombus pensylvanicus,,f,f,female,https://beespotter.org/bee/3046
3078,Barrs,7/17/2013,2013,7,17,2108,Cress Pond,7/13/2013,2013,7,13,2104,4,39.38503992,-89.89584446,Bombus bimaculatus,Bombus bimaculatus,,f,f,female,https://beespotter.org/bee/3078
3080,Barrs,7/17/2013,2013,7,17,2108,campsite,7/13/2013,2013,7,13,2104,4,39.36739165,-89.96547461,Bombus impatiens,Bombus bimaculatus,Bombus griseocollis,f,f,female,https://beespotter.org/bee/3080
3113,cory_born,7/23/2013,2013,7,23,2114,Sunflower,7/13/2013,2013,7,13,2104,10,42.243777,-88.159384,,Bombus impatiens,,f,f,female,https://beespotter.org/bee/3113
3053,twotringas,7/16/2013,2013,7,16,2107,bimaculatus on bergamot,7/14/2013,2013,7,14,2105,2,42.304981,-89.156791,Bombus bimaculatus,Bombus bimaculatus,,f,f,female,https://beespotter.org/bee/3053
3183,Travis_Mahan,7/28/2013,2013,7,28,2119,Pea Cemetery (Moultrie Co),7/14/2013,2013,7,14,2105,14,39.66327712,-88.66695821,Apis mellifera,Apis mellifera,,f,f,both,https://beespotter.org/bee/3183
3184,Travis_Mahan,7/28/2013,2013,7,28,2119,Margaret Guzy Pothole Wetlands L&WR (Shelby Co),7/14/2013,2013,7,14,2105,14,39.54544694,-88.80903482,Apis mellifera,Apis mellifera,,f,f,female,https://beespotter.org/bee/3184
3185,Travis_Mahan,7/28/2013,2013,7,28,2119,Margaret Guzy Pothole Wetlands L&WR (Shelby Co),7/14/2013,2013,7,14,2105,14,39.54567329,-88.80905628,Bombus auricomus,Bombus auricomus,,f,f,female,https://beespotter.org/bee/3185
3186,Travis_Mahan,7/28/2013,2013,7,28,2119,Margaret Guzy Pothole Wetlands L&WR (Shelby Co),7/14/2013,2013,7,14,2105,14,39.5453834,-88.80891681,Bombus impatiens,Bombus impatiens,,f,f,female,https://beespotter.org/bee/3186
3187,Travis_Mahan,7/28/2013,2013,7,28,2119,Margaret Guzy Pothole Wetlands L&WR (Shelby Co),7/14/2013,2013,7,14,2105,14,39.54534766,-88.80894899,Bombus pensylvanicus,Bombus pensylvanicus,,f,f,female,https://beespotter.org/bee/3187
3195,danz,7/29/2013,2013,7,29,2120,Bee025-bee on butterfly weed,7/14/2013,2013,7,14,2105,15,42.035023,-87.723552,Bombus impatiens,Bombus impatiens,,f,f,female,https://beespotter.org/bee/3195
3396,WendyJG,8/29/2013,2013,8,29,2151,Bumblebee,7/14/2013,2013,7,14,2105,46,42.2447609,-89.113131,Bombus auricomus,Bombus auricomus,,f,f,female,https://beespotter.org/bee/3396
3054,twotringas,7/16/2013,2013,7,16,2107,griseocollis on Mountain Mint,7/15/2013,2013,7,15,2106,1,42.304981,-89.156791,Bombus griseocollis,Bombus griseocollis,,f,f,male,https://beespotter.org/bee/3054
3055,twotringas,7/16/2013,2013,7,16,2107,honey bee on butterflyweed,7/15/2013,2013,7,15,2106,1,42.304981,-89.156791,Apis mellifera,Apis mellifera,,f,f,female,https://beespotter.org/bee/3055
3049,celestia,7/16/2013,2013,7,16,2107,Bee on wildflower,7/16/2013,2013,7,16,2107,0,41.887061,-87.958958,,Bombus impatiens,,f,f,female,https://beespotter.org/bee/3049
3050,MyBeeGarden,7/16/2013,2013,7,16,2107,First Frenzy of Activity for 2013,7/16/2013,2013,7,16,2107,0,41.628216,-87.832139,Apis mellifera,Apis mellifera,,f,f,female,https://beespotter.org/bee/3050
3052,tvelat,7/16/2013,2013,7,16,2107,7,7/16/2013,2013,7,16,2107,0,41.82211815,-88.00649643,Bombus bimaculatus,Bombus bimaculatus,,f,f,female,https://beespotter.org/bee/3052
3056,twotringas,7/16/2013,2013,7,16,2107,affinis (?) at rest,7/16/2013,2013,7,16,2107,0,42.304981,-89.156791,Bombus affinis,Bombus citrinus,,f,f,male,https://beespotter.org/bee/3056
3057,twotringas,7/16/2013,2013,7,16,2107,vagans on Purple Coneflower,7/16/2013,2013,7,16,2107,0,42.304981,-89.156791,Bombus vagans,Bombus vagans,,f,f,male,https://beespotter.org/bee/3057
3060,John Dahlstedt,7/17/2013,2013,7,17,2108,Bee 703 Champaign Cty,7/16/2013,2013,7,16,2107,1,40.08055882,-88.20268393,Bombus griseocollis,Bombus griseocollis,,f,f,female,https://beespotter.org/bee/3060
3061,John Dahlstedt,7/17/2013,2013,7,17,2108,Bee 704 Champaign Cty,7/16/2013,2013,7,16,2107,1,40.08014836,-88.20339203,Bombus griseocollis,Bombus griseocollis,,f,f,female,https://beespotter.org/bee/3061
3063,John Dahlstedt,7/17/2013,2013,7,17,2108,Bee 705 Champaign Cty,7/16/2013,2013,7,16,2107,1,40.07879385,-88.2038641,Apis mellifera,Apis mellifera,,f,f,female,https://beespotter.org/bee/3063
3064,John Dahlstedt,7/17/2013,2013,7,17,2108,Bee 706 Champaign Cty,7/16/2013,2013,7,16,2107,1,40.08055882,-88.20246935,Bombus pensylvanicus,Bombus pensylvanicus,,f,f,female,https://beespotter.org/bee/3064
3065,John Dahlstedt,7/17/2013,2013,7,17,2108,Bee 707 Champaign Cty,7/16/2013,2013,7,16,2107,1,40.0794588,-88.20351005,Bombus auricomus,Bombus auricomus,,f,f,female,https://beespotter.org/bee/3065
3066,John Dahlstedt,7/17/2013,2013,7,17,2108,Bee 708 Champaign Cty,7/16/2013,2013,7,16,2107,1,40.07858862,-88.20388556,Apis mellifera,Apis mellifera,,f,f,female,https://beespotter.org/bee/3066
3067,John Dahlstedt,7/17/2013,2013,7,17,2108,Bee 709 Champaign Cty,7/16/2013,2013,7,16,2107,1,40.07722586,-88.20448637,Apis mellifera,Apis mellifera,,f,f,female,https://beespotter.org/bee/3067
3068,John Dahlstedt,7/17/2013,2013,7,17,2108,Bee 710 Champaign Cty,7/16/2013,2013,7,16,2107,1,40.07873638,-88.20905685,Apis mellifera,Apis mellifera,,f,f,female,https://beespotter.org/bee/3068
3069,John Dahlstedt,7/17/2013,2013,7,17,2108,Bee 711 Champaign Cty,7/16/2013,2013,7,16,2107,1,40.07985797,-88.2084024,Apis mellifera,Apis mellifera,,f,f,female,https://beespotter.org/bee/3069
3070,John Dahlstedt,7/17/2013,2013,7,17,2108,Bee 712 Champaign Cty,7/16/2013,2013,7,16,2107,1,40.07985078,-88.20840776,Apis mellifera,Apis mellifera,,f,f,female,https://beespotter.org/bee/3070
3071,John Dahlstedt,7/17/2013,2013,7,17,2108,Bee 713 Champaign Cty,7/16/2013,2013,7,16,2107,1,40.07985899,-88.20841849,Apis mellifera,Apis mellifera,,f,f,female,https://beespotter.org/bee/3071
3072,John Dahlstedt,7/17/2013,2013,7,17,2108,Bee 714 Champaign Cty,7/16/2013,2013,7,16,2107,1,40.07986104,-88.20835412,Apis mellifera,Apis mellifera,,f,f,female,https://beespotter.org/bee/3072
3073,John Dahlstedt,7/17/2013,2013,7,17,2108,Bee 715  Champaign Cty,7/16/2013,2013,7,16,2107,1,40.10289201,-88.23566437,Apis mellifera,Apis mellifera,,f,f,female,https://beespotter.org/bee/3073
3074,John Dahlstedt,7/17/2013,2013,7,17,2108,Bee 716 Champaign Cty,7/16/2013,2013,7,16,2107,1,40.08096927,-88.20302725,Apis mellifera,Apis mellifera,,f,f,female,https://beespotter.org/bee/3074
3103,gaem,7/20/2013,2013,7,20,2111,Diane's Garden,7/16/2013,2013,7,16,2107,4,37.36906578,-88.65692139,Bombus variabilis,Bombus griseocollis,,f,f,male,https://beespotter.org/bee/3103
3105,twotringas,7/22/2013,2013,7,22,2113,griseocollis on Purple Coneflower,7/16/2013,2013,7,16,2107,6,42.304981,-89.156791,Bombus griseocollis,Bombus griseocollis,,f,f,male,https://beespotter.org/bee/3105
3076,brigitastic,7/17/2013,2013,7,17,2108,Conservation science class,7/17/2013,2013,7,17,2108,0,41.9012438,-87.8234616,Bombus affinis,Apis mellifera,,f,f,female,https://beespotter.org/bee/3076
3077,twotringas,7/17/2013,2013,7,17,2108,blurry (sorry) rufocinctus on Purple Prairie Clover,7/17/2013,2013,7,17,2108,0,41.8911126,-89.3121314,,Bombus rufocinctus,,f,f,female,https://beespotter.org/bee/3077
3081,peterwchen,7/17/2013,2013,7,17,2108,Bombus auricomus?,7/17/2013,2013,7,17,2108,0,41.83936574,-88.07669789,Bombus auricomus,Bombus auricomus,,f,f,female,https://beespotter.org/bee/3081
3082,wscovill,7/17/2013,2013,7,17,2108,GardenBee,7/17/2013,2013,7,17,2108,0,41.7267908,-88.2667391,Bombus auricomus,Bombus auricomus,,f,f,male,https://beespotter.org/bee/3082
3198,levernier,7/30/2013,2013,7,30,2121,1_on Monarda fistulosa,7/17/2013,2013,7,17,2108,13,42.429796,-88.17454755,Bombus bimaculatus,Bombus bimaculatus,,f,f,female,https://beespotter.org/bee/3198
3083,janher,7/18/2013,2013,7,18,2109,harold1,7/18/2013,2013,7,18,2109,0,41.80126293,-87.58212805,Bombus griseocollis,Bombus griseocollis,,f,f,male,https://beespotter.org/bee/3083
3084,meist99,7/18/2013,2013,7,18,2109,Monarda20130718a,7/18/2013,2013,7,18,2109,0,41.85166206,-88.19390774,Bombus auricomus,Bombus auricomus,,f,f,female,https://beespotter.org/bee/3084
3085,meist99,7/18/2013,2013,7,18,2109,Monarda20130718b,7/18/2013,2013,7,18,2109,0,41.85127047,-88.19366097,Bombus impatiens,Bombus impatiens,,f,f,female,https://beespotter.org/bee/3085
3086,meist99,7/18/2013,2013,7,18,2109,Monarda20130718c,7/18/2013,2013,7,18,2109,0,41.85097478,-88.19386482,Bombus fraternus,Bombus impatiens,,f,f,female,https://beespotter.org/bee/3086
3087,meist99,7/18/2013,2013,7,18,2109,Monarda20130718d,7/18/2013,2013,7,18,2109,0,41.85107068,-88.19386482,Bombus pensylvanicus,Bombus auricomus,,f,f,female,https://beespotter.org/bee/3087
3088,meist99,7/18/2013,2013,7,18,2109,Monarda20130718e,7/18/2013,2013,7,18,2109,0,41.85105469,-88.19401503,Bombus bimaculatus,Bombus bimaculatus,,f,f,female,https://beespotter.org/bee/3088
3090,peterwchen,7/18/2013,2013,7,18,2109,Bombus auricomus?,7/18/2013,2013,7,18,2109,0,41.84139198,-88.07488739,Bombus auricomus,Bombus auricomus,Bombus pensylvanicus,f,f,female,https://beespotter.org/bee/3090
3091,peterwchen,7/18/2013,2013,7,18,2109,Bombus impatiens?,7/18/2013,2013,7,18,2109,0,41.84130406,-88.07560623,Bombus impatiens,Bombus griseocollis,,f,f,female,https://beespotter.org/bee/3091
3093,tvelat,7/19/2013,2013,7,19,2110,8,7/18/2013,2013,7,18,2109,1,41.7988955,-88.04769516,Bombus bimaculatus,Bombus bimaculatus,,f,f,female,https://beespotter.org/bee/3093
3094,tvelat,7/19/2013,2013,7,19,2110,9,7/18/2013,2013,7,18,2109,1,41.79895949,-88.04760933,Bombus bimaculatus,Bombus bimaculatus,,f,f,female,https://beespotter.org/bee/3094
3095,tvelat,7/19/2013,2013,7,19,2110,10,7/18/2013,2013,7,18,2109,1,41.79908746,-88.04760933,Bombus impatiens,Bombus impatiens,,f,f,female,https://beespotter.org/bee/3095
3096,tvelat,7/19/2013,2013,7,19,2110,11,7/18/2013,2013,7,18,2109,1,41.79895949,-88.04760933,Bombus auricomus,Bombus auricomus,,f,f,female,https://beespotter.org/bee/3096
3097,tvelat,7/19/2013,2013,7,19,2110,12,7/18/2013,2013,7,18,2109,1,41.60170877,-87.68909454,Bombus griseocollis,Bombus griseocollis,,f,f,female,https://beespotter.org/bee/3097
3098,tvelat,7/19/2013,2013,7,19,2110,13,7/18/2013,2013,7,18,2109,1,41.60170877,-87.68909454,Bombus bimaculatus,Bombus bimaculatus,,f,f,female,https://beespotter.org/bee/3098
3092,twotringas,7/19/2013,2013,7,19,2110,vagans on Bergamot,7/19/2013,2013,7,19,2110,0,42.304981,-89.156791,Bombus vagans,Bombus vagans,,f,f,female,https://beespotter.org/bee/3092
3099,meist99,7/19/2013,2013,7,19,2110,Monarda20130719,7/19/2013,2013,7,19,2110,0,41.82477134,-88.52868229,Bombus auricomus,Bombus auricomus,,f,f,female,https://beespotter.org/bee/3099
3101,gaem,7/20/2013,2013,7,20,2111,Bee on river otter scat,7/20/2013,2013,7,20,2111,0,37.30723909,-89.00093079,Bombus pensylvanicus,Bombus impatiens,,f,f,,https://beespotter.org/bee/3101
3102,mjaffe,7/20/2013,2013,7,20,2111,compost pile,7/20/2013,2013,7,20,2111,0,42.35113873,-87.98531771,Bombus bimaculatus,Bombus impatiens,,f,f,female,https://beespotter.org/bee/3102
3394,WendyJG,8/29/2013,2013,8,29,2151,Bumblebee 1,7/20/2013,2013,7,20,2111,40,42.2447609,-89.113131,Bombus bimaculatus,Bombus bimaculatus,,f,f,female,https://beespotter.org/bee/3394
3395,WendyJG,8/29/2013,2013,8,29,2151,Bumblebee 2,7/20/2013,2013,7,20,2111,40,42.32346874,-89.05666624,Bombus affinis,Bombus affinis,,t,t,female,https://beespotter.org/bee/3395
3397,WendyJG,8/29/2013,2013,8,29,2151,Bumblebee,7/20/2013,2013,7,20,2111,40,42.2447609,-89.113131,Bombus impatiens,Bombus bimaculatus,,f,f,female,https://beespotter.org/bee/3397
3122,twotringas,7/23/2013,2013,7,23,2114,auricomus near Purple Prairie Clover,7/21/2013,2013,7,21,2112,2,42.45918049,-89.10804749,Bombus auricomus,Bombus auricomus,,f,f,female,https://beespotter.org/bee/3122
3123,twotringas,7/23/2013,2013,7,23,2114,auricomus on Wild Senna,7/21/2013,2013,7,21,2112,2,42.45918049,-89.10804749,Bombus auricomus,Bombus auricomus,,f,f,female,https://beespotter.org/bee/3123
3106,celestia,7/22/2013,2013,7,22,2113,Bee on obedient plant,7/22/2013,2013,7,22,2113,0,41.8165735,-88.0690224,,Bombus impatiens,,f,f,female,https://beespotter.org/bee/3106
3107,celestia,7/22/2013,2013,7,22,2113,bee on coneflower (a),7/22/2013,2013,7,22,2113,0,41.8165735,-88.0690224,,Bombus bimaculatus,Bombus griseocollis,f,f,female,https://beespotter.org/bee/3107
3108,celestia,7/22/2013,2013,7,22,2113,Bee on coneflower (b),7/22/2013,2013,7,22,2113,0,41.8165735,-88.0690224,,Bombus impatiens,,f,f,female,https://beespotter.org/bee/3108
3109,celestia,7/22/2013,2013,7,22,2113,Bee on hosta,7/22/2013,2013,7,22,2113,0,41.8165735,-88.0690224,,Bombus bimaculatus,,f,f,female,https://beespotter.org/bee/3109
3110,animalfreak22,7/22/2013,2013,7,22,2113,Bumblebee on milkweed,7/22/2013,2013,7,22,2113,0,30.7591685,-97.6982272,Bombus affinis,Bombus griseocollis,,f,f,male,https://beespotter.org/bee/3110
3114,twotringas,7/23/2013,2013,7,23,2114,honey bee on Mountain Mint,7/22/2013,2013,7,22,2113,1,42.304981,-89.156791,Apis mellifera,Apis mellifera,,f,f,female,https://beespotter.org/bee/3114
3111,meist99,7/23/2013,2013,7,23,2114,Monarda20130723,7/23/2013,2013,7,23,2114,0,41.81930373,-88.11313033,Bombus fervidus,Bombus fervidus,,f,f,female,https://beespotter.org/bee/3111
3112,tvelat,7/23/2013,2013,7,23,2114,14,7/23/2013,2013,7,23,2114,0,41.69944849,-87.99748421,Bombus bimaculatus,Bombus bimaculatus,,f,f,female,https://beespotter.org/bee/3112
3115,twotringas,7/23/2013,2013,7,23,2114,vagans on Bergamot,7/23/2013,2013,7,23,2114,0,42.304981,-89.156791,Bombus vagans,Bombus vagans,,f,f,male,https://beespotter.org/bee/3115
3116,twotringas,7/23/2013,2013,7,23,2114,rufocinctus on Purple Prairie Clover,7/23/2013,2013,7,23,2114,0,41.88834914,-89.37051773,,Bombus rufocinctus,,f,f,female,https://beespotter.org/bee/3116
3117,twotringas,7/23/2013,2013,7,23,2114,Dan's rufocinctus on Purple Prairie Clover,7/23/2013,2013,7,23,2114,0,41.89001042,-89.36133385,,Bombus rufocinctus,,f,f,female,https://beespotter.org/bee/3117
3118,twotringas,7/23/2013,2013,7,23,2114,fervidus on Purple Prairie Clover,7/23/2013,2013,7,23,2114,0,41.890266,-89.35832977,Bombus fervidus,Bombus fervidus,,f,f,male,https://beespotter.org/bee/3118
3119,twotringas,7/23/2013,2013,7,23,2114,griseocollis on Purple Prairie Clover,7/23/2013,2013,7,23,2114,0,41.88949926,-89.35438156,Bombus griseocollis,Bombus griseocollis,,f,f,female,https://beespotter.org/bee/3119
3120,twotringas,7/23/2013,2013,7,23,2114,Dan's fervidus on Purple Prairie Clover,7/23/2013,2013,7,23,2114,0,41.88873252,-89.35541153,Bombus fervidus,Bombus fervidus,,f,f,male,https://beespotter.org/bee/3120
3121,twotringas,7/23/2013,2013,7,23,2114,Dan's impatiens on Purple Prairie Clover,7/23/2013,2013,7,23,2114,0,41.88994653,-89.35807228,Bombus impatiens,Bombus impatiens,,f,f,female,https://beespotter.org/bee/3121
3150,twotringas,7/26/2013,2013,7,26,2117,affinis on Purple Prairie Clover,7/23/2013,2013,7,23,2114,3,41.91763953,-89.31745478,Bombus affinis,Bombus affinis,,t,t,female,https://beespotter.org/bee/3150
3124,meist99,7/24/2013,2013,7,24,2115,Monarda20130724a,7/24/2013,2013,7,24,2115,0,41.82179833,-88.11118841,Bombus griseocollis,Bombus impatiens,,f,f,female,https://beespotter.org/bee/3124
3125,meist99,7/24/2013,2013,7,24,2115,Monarda20130724b,7/24/2013,2013,7,24,2115,0,41.82183831,-88.11118841,Bombus auricomus,Bombus auricomus,,f,f,female,https://beespotter.org/bee/3125
3126,jerr17,7/24/2013,2013,7,24,2115,Honey B,7/24/2013,2013,7,24,2115,0,41.63212402,-87.97525406,Apis mellifera,Apis mellifera,,f,f,female,https://beespotter.org/bee/3126
3127,jerr17,7/24/2013,2013,7,24,2115,BumbleB,7/24/2013,2013,7,24,2115,0,41.63969352,-87.98074722,Bombus vagans,Bombus bimaculatus,Bombus griseocollis,f,f,female,https://beespotter.org/bee/3127
3129,John Dahlstedt,7/25/2013,2013,7,25,2116,Bee 717 Champaign Cty,7/24/2013,2013,7,24,2115,1,40.08220472,-88.20254445,Bombus pensylvanicus,Bombus pensylvanicus,,f,f,female,https://beespotter.org/bee/3129
3130,John Dahlstedt,7/25/2013,2013,7,25,2116,Bee 718 Champaign Cty,7/24/2013,2013,7,24,2115,1,40.08201181,-88.20253372,Apis mellifera,Apis mellifera,,f,f,female,https://beespotter.org/bee/3130
3131,John Dahlstedt,7/25/2013,2013,7,25,2116,Bee 719 Champaign Cty,7/24/2013,2013,7,24,2115,1,40.08122375,-88.20283413,Bombus auricomus,Bombus auricomus,,f,f,female,https://beespotter.org/bee/3131
3132,John Dahlstedt,7/25/2013,2013,7,25,2116,Bee 720 Champaign Cty,7/24/2013,2013,7,24,2115,1,40.08070658,-88.20471168,Apis mellifera,Apis mellifera,,f,f,female,https://beespotter.org/bee/3132
3133,John Dahlstedt,7/25/2013,2013,7,25,2116,Bee 721 Champaign Cty,7/24/2013,2013,7,24,2115,1,40.08082151,-88.20474386,Apis mellifera,Apis mellifera,,f,f,female,https://beespotter.org/bee/3133
3134,John Dahlstedt,7/25/2013,2013,7,25,2116,Bee 722 Champaign Cty,7/24/2013,2013,7,24,2115,1,40.0809077,-88.20487261,Apis mellifera,Apis mellifera,,f,f,female,https://beespotter.org/bee/3134
3135,John Dahlstedt,7/25/2013,2013,7,25,2116,Bee 723 Champaign Cty,7/24/2013,2013,7,24,2115,1,40.08089128,-88.20487261,Bombus griseocollis,Bombus griseocollis,,f,f,male,https://beespotter.org/bee/3135
3136,John Dahlstedt,7/25/2013,2013,7,25,2116,Bee 724 Champaign Cty,7/24/2013,2013,7,24,2115,1,40.07986104,-88.20841312,Apis mellifera,Apis mellifera,,f,f,female,https://beespotter.org/bee/3136
3137,John Dahlstedt,7/25/2013,2013,7,25,2116,Bee 725 Champaign Cty,7/24/2013,2013,7,24,2115,1,40.07984976,-88.20841581,Apis mellifera,Apis mellifera,,f,f,female,https://beespotter.org/bee/3137
3138,John Dahlstedt,7/25/2013,2013,7,25,2116,Bee 726 Champaign Cty,7/24/2013,2013,7,24,2115,1,40.07980769,-88.20842117,Apis mellifera,Apis mellifera,,f,f,female,https://beespotter.org/bee/3138
3139,John Dahlstedt,7/25/2013,2013,7,25,2116,Bee 727 Champaign Cty,7/24/2013,2013,7,24,2115,1,40.0798241,-88.20836484,Apis mellifera,Apis mellifera,,f,f,female,https://beespotter.org/bee/3139
3140,John Dahlstedt,7/25/2013,2013,7,25,2116,Bee 728 Champaign Cty,7/24/2013,2013,7,24,2115,1,40.079506,-88.20845336,Apis mellifera,Apis mellifera,,f,f,female,https://beespotter.org/bee/3140
3141,John Dahlstedt,7/25/2013,2013,7,25,2116,Bee 729 Champaign Cty,7/24/2013,2013,7,24,2115,1,40.07716839,-88.20463657,Apis mellifera,Apis mellifera,,f,f,female,https://beespotter.org/bee/3141
3142,John Dahlstedt,7/25/2013,2013,7,25,2116,Bee 730 Champaign Cty,7/24/2013,2013,7,24,2115,1,40.07720944,-88.20405722,Apis mellifera,Apis mellifera,,f,f,female,https://beespotter.org/bee/3142
3274,janher,8/10/2013,2013,8,10,2132,facebookbee,7/24/2013,2013,7,24,2115,17,41.793779,-87.583259,Bombus griseocollis,Bombus griseocollis,,f,f,female,https://beespotter.org/bee/3274
3143,jerr17,7/25/2013,2013,7,25,2116,BumbleBe,7/25/2013,2013,7,25,2116,0,41.63225232,-87.97662735,Bombus citrinus,Bombus bimaculatus,,f,f,female,https://beespotter.org/bee/3143
3144,jjames,7/25/2013,2013,7,25,2116,2013-07-25,7/25/2013,2013,7,25,2116,0,40.69382622,-89.4543792,Bombus affinis,Bombus affinis,,t,t,female,https://beespotter.org/bee/3144
3145,jerr17,7/25/2013,2013,7,25,2116,bpm,7/25/2013,2013,7,25,2116,0,41.63212402,-87.97748566,Bombus affinis,Bombus vagans,,f,f,female,https://beespotter.org/bee/3145
3146,jerr17,7/25/2013,2013,7,25,2116,B3,7/25/2013,2013,7,25,2116,0,41.63725598,-87.97525406,Bombus pensylvanicus,Bombus bimaculatus,,f,f,female,https://beespotter.org/bee/3146
3147,lora1987,7/25/2013,2013,7,25,2116,Bumblebee II,7/25/2013,2013,7,25,2116,0,39.8995617,-88.8696378,Bombus griseocollis,Bombus impatiens,,f,f,female,https://beespotter.org/bee/3147
3148,jerr17,7/25/2013,2013,7,25,2116,B4,7/25/2013,2013,7,25,2116,0,41.637421,-87.975512,Bombus vagans,Bombus bimaculatus,,f,f,male,https://beespotter.org/bee/3148
3149,jerr17,7/25/2013,2013,7,25,2116,B5,7/25/2013,2013,7,25,2116,0,41.637421,-87.975512,Bombus vagans,Bombus bimaculatus,,f,f,male,https://beespotter.org/bee/3149
3151,twotringas,7/26/2013,2013,7,26,2117,affinis on Bergamot,7/25/2013,2013,7,25,2116,1,42.16454267,-89.09310381,Bombus affinis,Bombus affinis,,t,t,male,https://beespotter.org/bee/3151
3152,twotringas,7/26/2013,2013,7,26,2117,fervidus on Bergamot,7/25/2013,2013,7,25,2116,1,42.304981,-89.156791,Bombus fervidus,Bombus fervidus,,f,f,male,https://beespotter.org/bee/3152
3153,twotringas,7/26/2013,2013,7,26,2117,griseocollis on Purple Coneflower,7/25/2013,2013,7,25,2116,1,42.304981,-89.156791,Bombus griseocollis,Bombus griseocollis,,f,f,male,https://beespotter.org/bee/3153
3154,twotringas,7/26/2013,2013,7,26,2117,griseocollis on Purple Coneflower,7/25/2013,2013,7,25,2116,1,42.304981,-89.156791,Bombus griseocollis,Bombus griseocollis,,f,f,female,https://beespotter.org/bee/3154
3162,twotringas,7/27/2013,2013,7,27,2118,vagans with mites,7/25/2013,2013,7,25,2116,2,42.304981,-89.156791,Bombus vagans,Bombus vagans,,f,f,female,https://beespotter.org/bee/3162
3163,twotringas,7/27/2013,2013,7,27,2118,impatiens on Purple Coneflower,7/25/2013,2013,7,25,2116,2,42.304981,-89.156791,Bombus impatiens,Bombus impatiens,,f,f,female,https://beespotter.org/bee/3163
3164,twotringas,7/27/2013,2013,7,27,2118,citrinus on Purple Coneflower,7/25/2013,2013,7,25,2116,2,42.30426127,-89.15646672,Bombus citrinus,Bombus citrinus,,f,f,female,https://beespotter.org/bee/3164
3156,lora1987,7/26/2013,2013,7,26,2117,Honey Bee,7/26/2013,2013,7,26,2117,0,39.80992064,-88.87887955,Apis mellifera,Apis mellifera,,f,f,female,https://beespotter.org/bee/3156
3157,janher,7/26/2013,2013,7,26,2117,51street,7/26/2013,2013,7,26,2117,0,41.80401416,-87.58107662,Apis mellifera,Apis mellifera,,f,f,female,https://beespotter.org/bee/3157
3158,janher,7/26/2013,2013,7,26,2117,54lake,7/26/2013,2013,7,26,2117,0,41.79811167,-87.57989645,Bombus griseocollis,Bombus griseocollis,,f,f,female,https://beespotter.org/bee/3158
3159,jerr17,7/26/2013,2013,7,26,2117,b1,7/26/2013,2013,7,26,2117,0,41.637421,-87.975512,Bombus bimaculatus,Bombus bimaculatus,,f,f,female,https://beespotter.org/bee/3159
3160,jerr17,7/26/2013,2013,7,26,2117,b2,7/26/2013,2013,7,26,2117,0,41.637421,-87.975512,Bombus vagans,Bombus impatiens,,f,f,male,https://beespotter.org/bee/3160
3161,jerr17,7/26/2013,2013,7,26,2117,bb3,7/26/2013,2013,7,26,2117,0,41.637421,-87.975512,Bombus vagans,Bombus bimaculatus,,f,f,male,https://beespotter.org/bee/3161
3170,twotringas,7/27/2013,2013,7,27,2118,citrinus on Purple Coneflower,7/26/2013,2013,7,26,2117,1,42.304981,-89.156791,Bombus citrinus,Bombus citrinus,,f,f,female,https://beespotter.org/bee/3170
3165,twotringas,7/27/2013,2013,7,27,2118,vagans on Purple Coneflower,7/27/2013,2013,7,27,2118,0,42.304981,-89.156791,Bombus vagans,Bombus vagans,,f,f,male,https://beespotter.org/bee/3165
3166,twotringas,7/27/2013,2013,7,27,2118,auricomus on bergamot,7/27/2013,2013,7,27,2118,0,42.304981,-89.156791,Bombus auricomus,Bombus auricomus,,f,f,female,https://beespotter.org/bee/3166
3167,twotringas,7/27/2013,2013,7,27,2118,affinis on Mountain Mint,7/27/2013,2013,7,27,2118,0,42.24892537,-89.26711256,Bombus affinis,Bombus affinis,,t,t,female,https://beespotter.org/bee/3167
3168,twotringas,7/27/2013,2013,7,27,2118,affinis on Mountain Mint,7/27/2013,2013,7,27,2118,0,42.28466292,-89.29518894,Bombus affinis,Bombus affinis,,t,t,female,https://beespotter.org/bee/3168
3169,twotringas,7/27/2013,2013,7,27,2118,bimaculatus on bergamot,7/27/2013,2013,7,27,2118,0,42.304981,-89.156791,Bombus bimaculatus,Bombus bimaculatus,,f,f,female,https://beespotter.org/bee/3169
3172,lora1987,7/27/2013,2013,7,27,2118,Honey Bee II,7/27/2013,2013,7,27,2118,0,39.7117874,-89.6269968,Apis mellifera,Apis mellifera,,f,f,female,https://beespotter.org/bee/3172
3173,lora1987,7/27/2013,2013,7,27,2118,bumblebee III,7/27/2013,2013,7,27,2118,0,39.7117874,-89.6269968,Bombus citrinus,Bombus impatiens,,f,f,female,https://beespotter.org/bee/3173
3174,jerr17,7/27/2013,2013,7,27,2118,Lily,7/27/2013,2013,7,27,2118,0,41.637421,-87.975512,Bombus griseocollis,Bombus bimaculatus,,f,f,male,https://beespotter.org/bee/3174
3398,WendyJG,8/29/2013,2013,8,29,2151,Bumblebee,7/27/2013,2013,7,27,2118,33,42.3286131,-89.0206884,Bombus pensylvanicus,Bombus pensylvanicus,,f,f,female,https://beespotter.org/bee/3398
3399,WendyJG,8/29/2013,2013,8,29,2151,Bumblebee,7/27/2013,2013,7,27,2118,33,42.3286131,-89.0206884,Bombus impatiens,Bombus impatiens,,f,f,female,https://beespotter.org/bee/3399
3175,twotringas,7/28/2013,2013,7,28,2119,affinis on Mountain Mint,7/28/2013,2013,7,28,2119,0,42.20664321,-89.21065683,Bombus affinis,Bombus affinis,,t,t,female,https://beespotter.org/bee/3175
3176,twotringas,7/28/2013,2013,7,28,2119,Honey bee on mountain mint,7/28/2013,2013,7,28,2119,0,42.304981,-89.156791,Apis mellifera,Apis mellifera,,f,f,female,https://beespotter.org/bee/3176
3177,twotringas,7/28/2013,2013,7,28,2119,rufocinctus on Mountain Mint,7/28/2013,2013,7,28,2119,0,42.304981,-89.156791,,Bombus rufocinctus,,f,f,female,https://beespotter.org/bee/3177
3178,twotringas,7/28/2013,2013,7,28,2119,citrinus on Purple Coneflower,7/28/2013,2013,7,28,2119,0,42.304981,-89.156791,Bombus citrinus,Bombus citrinus,,f,f,male,https://beespotter.org/bee/3178
3179,twotringas,7/28/2013,2013,7,28,2119,vagans on Purple Coneflower,7/28/2013,2013,7,28,2119,0,42.304981,-89.156791,Bombus vagans,Bombus vagans,,f,f,male,https://beespotter.org/bee/3179
3180,janher,7/28/2013,2013,7,28,2119,uni1,7/28/2013,2013,7,28,2119,0,41.78761701,-87.59898305,Bombus griseocollis,Bombus griseocollis,,f,f,male,https://beespotter.org/bee/3180
3182,jerr17,7/28/2013,2013,7,28,2119,bb,7/28/2013,2013,7,28,2119,0,41.637421,-87.975512,Bombus griseocollis,Bombus griseocollis,,f,f,female,https://beespotter.org/bee/3182
3188,Travis_Mahan,7/28/2013,2013,7,28,2119,Starved Rock State Park (LaSalle Co) Eupatoriadelphus,7/28/2013,2013,7,28,2119,0,41.40155777,-88.85327999,Bombus affinis,Bombus affinis,,t,t,female,https://beespotter.org/bee/3188
3189,Travis_Mahan,7/28/2013,2013,7,28,2119,Starved Rock State Park Visitor Center (LaSalle Co),7/28/2013,2013,7,28,2119,0,41.30649178,-89.00906234,Bombus affinis,Bombus affinis,,t,t,male,https://beespotter.org/bee/3189
3190,Travis_Mahan,7/28/2013,2013,7,28,2119,Starved Rock State Park Visitor Center (LaSalle Co),7/28/2013,2013,7,28,2119,0,41.32061634,-88.99273798,Bombus affinis,Bombus citrinus,,f,f,male,https://beespotter.org/bee/3190
3191,Travis_Mahan,7/28/2013,2013,7,28,2119,Starved Rock State Park Visitor Center (LaSalle Co),7/28/2013,2013,7,28,2119,0,41.32062758,-88.99272121,Bombus griseocollis,Bombus griseocollis,,f,f,,https://beespotter.org/bee/3191
3384,WendyJG,8/29/2013,2013,8,29,2151,Honeybee with Jagged Ambush Bug,7/28/2013,2013,7,28,2119,32,42.206962,-89.2021352,Apis mellifera,Apis mellifera,,f,f,female,https://beespotter.org/bee/3384
3385,WendyJG,8/29/2013,2013,8,29,2151,Honeybee,7/28/2013,2013,7,28,2119,32,42.206962,-89.2021352,,Apis mellifera,,f,f,female,https://beespotter.org/bee/3385
3386,WendyJG,8/29/2013,2013,8,29,2151,Bumblebee 1,7/28/2013,2013,7,28,2119,32,42.206962,-89.2021352,Bombus bimaculatus,Bombus bimaculatus,,f,f,male,https://beespotter.org/bee/3386
3387,WendyJG,8/29/2013,2013,8,29,2151,Bumblebee 2,7/28/2013,2013,7,28,2119,32,42.269608,-89.070731,Bombus bimaculatus,Bombus griseocollis,,f,f,male,https://beespotter.org/bee/3387
3193,WillBDunn,7/29/2013,2013,7,29,2120,BeeSpot72913,7/29/2013,2013,7,29,2120,0,42.38387162,-88.23682308,Bombus impatiens,Bombus impatiens,,f,f,male,https://beespotter.org/bee/3193
3196,twotringas,7/29/2013,2013,7,29,2120,affinis on Mountain Mint,7/29/2013,2013,7,29,2120,0,42.26672784,-89.19546596,Bombus affinis,Bombus affinis,,t,t,female,https://beespotter.org/bee/3196
3197,twotringas,7/30/2013,2013,7,30,2121,bimaculatus on Bergamot,7/29/2013,2013,7,29,2120,1,42.304981,-89.156791,Bombus bimaculatus,Bombus bimaculatus,,f,f,male,https://beespotter.org/bee/3197
3199,janher,7/30/2013,2013,7,30,2121,Kenwood,7/30/2013,2013,7,30,2121,0,41.79302453,-87.59352207,Bombus fervidus,Bombus fervidus,,f,f,male,https://beespotter.org/bee/3199
3200,janher,7/30/2013,2013,7,30,2121,Madison Park,7/30/2013,2013,7,30,2121,0,41.80312043,-87.59473711,Bombus griseocollis,Bombus griseocollis,,f,f,male,https://beespotter.org/bee/3200
3201,levernier,7/30/2013,2013,7,30,2121,2_rusty on Mondarda fistulosa,7/30/2013,2013,7,30,2121,0,42.34520642,-88.25963302,Bombus affinis,Bombus affinis,,t,t,female,https://beespotter.org/bee/3201
3202,levernier,7/30/2013,2013,7,30,2121,3_yellow on Monarda fistulosa,7/30/2013,2013,7,30,2121,0,42.429707,-88.1745399,Bombus fervidus,Bombus fervidus,,f,f,male,https://beespotter.org/bee/3202
3203,levernier,7/30/2013,2013,7,30,2121,4_common on Monarda fistulosa,7/30/2013,2013,7,30,2121,0,42.429707,-88.1745399,Bombus impatiens,Bombus impatiens,,f,f,female,https://beespotter.org/bee/3203
3204,levernier,7/30/2013,2013,7,30,2121,5_hairy American,7/30/2013,2013,7,30,2121,0,42.429707,-88.1745399,Bombus vagans,Bombus vagans,,f,f,male,https://beespotter.org/bee/3204
3207,twotringas,7/31/2013,2013,7,31,2122,bimaculatus on Bergamot,7/30/2013,2013,7,30,2121,1,42.304981,-89.156791,Bombus bimaculatus,Bombus bimaculatus,,f,f,male,https://beespotter.org/bee/3207
3230,jerr17,8/1/2013,2013,8,1,2123,BB,7/30/2013,2013,7,30,2121,2,41.637421,-87.975512,Bombus griseocollis,Bombus impatiens,,f,f,female,https://beespotter.org/bee/3230
3208,jbates,7/31/2013,2013,7,31,2122,Northerly Island,7/31/2013,2013,7,31,2122,0,41.86193049,-87.60678291,Bombus affinis,Bombus impatiens,,f,f,female,https://beespotter.org/bee/3208
3209,jbates,7/31/2013,2013,7,31,2122,Northerly Island,7/31/2013,2013,7,31,2122,0,41.86199442,-87.60661125,Bombus affinis,Bombus impatiens,,f,f,female,https://beespotter.org/bee/3209
3210,jbates,7/31/2013,2013,7,31,2122,Northerly Island,7/31/2013,2013,7,31,2122,0,41.86177868,-87.60686874,Bombus griseocollis,Bombus impatiens,,f,f,female,https://beespotter.org/bee/3210
3211,TER_OR,7/31/2013,2013,7,31,2122,B. Penn 073113,7/31/2013,2013,7,31,2122,0,42.1013019,-88.277347,Bombus pensylvanicus,Bombus pensylvanicus,,f,f,female,https://beespotter.org/bee/3211
3212,TER_OR,7/31/2013,2013,7,31,2122,B Gris 073113,7/31/2013,2013,7,31,2122,0,42.1013019,-88.277347,Bombus griseocollis,Bombus griseocollis,,f,f,male,https://beespotter.org/bee/3212
3213,TER_OR,7/31/2013,2013,7,31,2122,B fervidus 072813,7/31/2013,2013,7,31,2122,0,42.1013019,-88.277347,Bombus fervidus,Bombus citrinus,,f,f,,https://beespotter.org/bee/3213
3214,TER_OR,7/31/2013,2013,7,31,2122,B Vagans 072813,7/31/2013,2013,7,31,2122,0,42.1013019,-88.277347,Bombus vagans,Bombus vagans,,f,f,male,https://beespotter.org/bee/3214
3215,peterwchen,7/31/2013,2013,7,31,2122,Bombus auricomus?,7/31/2013,2013,7,31,2122,0,41.84074855,-88.07593614,Bombus auricomus,Bombus auricomus,,f,f,female,https://beespotter.org/bee/3215
3216,jjames,8/1/2013,2013,8,1,2123,2013-08-01,8/1/2013,2013,8,1,2123,0,40.81414654,-89.69642993,Bombus affinis,Bombus affinis,,t,t,female,https://beespotter.org/bee/3216
3217,jjames,8/1/2013,2013,8,1,2123,2013-08-01 bee 2,8/1/2013,2013,8,1,2123,0,40.7826662,-89.60308892,Bombus affinis,Bombus affinis,,t,t,female,https://beespotter.org/bee/3217
3218,jjames,8/1/2013,2013,8,1,2123,2013-08-01 bee 3,8/1/2013,2013,8,1,2123,0,40.86545812,-89.61893444,Bombus affinis,Bombus affinis,,t,t,female,https://beespotter.org/bee/3218
3220,jjames,8/1/2013,2013,8,1,2123,2013-08-01 bee 4,8/1/2013,2013,8,1,2123,0,40.67157048,-89.48455611,Bombus affinis,Bombus affinis,,t,t,female,https://beespotter.org/bee/3220
3221,jjames,8/1/2013,2013,8,1,2123,2013-08-01 bee 5,8/1/2013,2013,8,1,2123,0,40.82107622,-89.59758282,Bombus citrinus,Bombus citrinus,,f,f,male,https://beespotter.org/bee/3221
3222,jjames,8/1/2013,2013,8,1,2123,2013-08-01 affinis pair,8/1/2013,2013,8,1,2123,0,40.899356,-89.55313734,Bombus affinis,Bombus affinis,,t,t,female,https://beespotter.org/bee/3222
3223,jjames,8/1/2013,2013,8,1,2123,2013-08-01 bee 7,8/1/2013,2013,8,1,2123,0,40.69459636,-89.7321382,Bombus affinis,Bombus affinis,,t,t,female,https://beespotter.org/bee/3223
3224,jjames,8/1/2013,2013,8,1,2123,2013-08-01 bee 8,8/1/2013,2013,8,1,2123,0,40.93881345,-89.73488069,,Bombus affinis,,t,t,male,https://beespotter.org/bee/3224
3225,twotringas,8/1/2013,2013,8,1,2123,affinis on Mountain Mint,8/1/2013,2013,8,1,2123,0,42.44883626,-89.08522997,Bombus affinis,Bombus affinis,,t,t,female,https://beespotter.org/bee/3225
3226,twotringas,8/1/2013,2013,8,1,2123,rufocinctus on Mountain Mint,8/1/2013,2013,8,1,2123,0,42.304981,-89.156791,,Bombus rufocinctus,,f,f,female,https://beespotter.org/bee/3226
3227,Travis_Mahan,8/1/2013,2013,8,1,2123,Backyard Butterfly Bush,8/1/2013,2013,8,1,2123,0,39.81170674,-88.90228182,Bombus auricomus,Bombus auricomus,,f,f,female,https://beespotter.org/bee/3227
3228,Travis_Mahan,8/1/2013,2013,8,1,2123,Backyard Butterfly Bush,8/1/2013,2013,8,1,2123,0,39.81169191,-88.90229791,Bombus griseocollis,Bombus griseocollis,,f,f,male,https://beespotter.org/bee/3228
3229,Travis_Mahan,8/1/2013,2013,8,1,2123,Backyard Butterfly Bush,8/1/2013,2013,8,1,2123,0,39.81171597,-88.9022845,Bombus griseocollis,Bombus griseocollis,,f,f,male,https://beespotter.org/bee/3229
3232,jerr17,8/1/2013,2013,8,1,2123,BB,8/1/2013,2013,8,1,2123,0,41.637421,-87.975512,Bombus auricomus,Bombus impatiens,,f,f,female,https://beespotter.org/bee/3232
3233,jerr17,8/2/2013,2013,8,2,2124,BB!,8/1/2013,2013,8,1,2123,1,41.637421,-87.975512,Bombus vagans,Bombus bimaculatus,,f,f,female,https://beespotter.org/bee/3233
3237,samanthakorrinn,8/4/2013,2013,8,4,2126,Zoo (1),8/1/2013,2013,8,1,2123,3,38.6366451,-90.292514,Bombus affinis,Apis mellifera,,f,f,female,https://beespotter.org/bee/3237
3234,twotringas,8/3/2013,2013,8,3,2125,rufocinctus at nusery,8/3/2013,2013,8,3,2125,0,42.31825678,-88.99577022,,Bombus rufocinctus,,f,f,male,https://beespotter.org/bee/3234
3238,jjames,8/5/2013,2013,8,5,2127,2013-08-03 a,8/3/2013,2013,8,3,2125,2,40.8252696,-89.80269402,Bombus auricomus,Bombus auricomus,,f,f,female,https://beespotter.org/bee/3238
3239,jjames,8/5/2013,2013,8,5,2127,2013-08-03 b,8/3/2013,2013,8,3,2125,2,40.82511535,-89.80277181,Bombus auricomus,Bombus auricomus,,f,f,female,https://beespotter.org/bee/3239
3253,Barrs,8/8/2013,2013,8,8,2130,rock cut bee 1,8/3/2013,2013,8,3,2125,5,42.35182061,-88.98788452,Bombus rufocinctus,Bombus rufocinctus,,f,f,male,https://beespotter.org/bee/3253
3254,Barrs,8/8/2013,2013,8,8,2130,Rock Cut bee 9,8/3/2013,2013,8,3,2125,5,42.3628566,-88.97724152,Bombus rufocinctus,Bombus rufocinctus,,f,f,female,https://beespotter.org/bee/3254
3235,TER_OR,8/4/2013,2013,8,4,2126,B. Affinis 080313 B,8/4/2013,2013,8,4,2126,0,41.97508917,-88.31897429,Bombus affinis,Bombus affinis,,t,t,female,https://beespotter.org/bee/3235
3236,TER_OR,8/4/2013,2013,8,4,2126,B Affinis 081313 A,8/4/2013,2013,8,4,2126,0,42.22626397,-88.21774038,Bombus affinis,Bombus affinis,,t,t,female,https://beespotter.org/bee/3236
3241,jerr17,8/5/2013,2013,8,5,2127,BB,8/4/2013,2013,8,4,2126,1,41.637421,-87.975512,Bombus bimaculatus,Bombus bimaculatus,Bombus griseocollis,f,f,female,https://beespotter.org/bee/3241
3251,urbanbee,8/8/2013,2013,8,8,2130,rogers park bee,8/4/2013,2013,8,4,2126,4,42.0115111,-87.6679922,Bombus griseocollis,Bombus griseocollis,,f,f,female,https://beespotter.org/bee/3251
3388,WendyJG,8/29/2013,2013,8,29,2151,Honeybee,8/4/2013,2013,8,4,2126,25,42.2447609,-89.113131,Apis mellifera,Apis mellifera,,f,f,female,https://beespotter.org/bee/3388
3389,WendyJG,8/29/2013,2013,8,29,2151,Long Bumblebee,8/4/2013,2013,8,4,2126,25,42.2447609,-89.113131,Bombus fervidus,Bombus fervidus,,f,f,male,https://beespotter.org/bee/3389
3390,WendyJG,8/29/2013,2013,8,29,2151,Bumblebee1,8/4/2013,2013,8,4,2126,25,42.2447609,-89.113131,Bombus fervidus,Bombus fervidus,,f,f,,https://beespotter.org/bee/3390
3391,WendyJG,8/29/2013,2013,8,29,2151,Bumblebee 2,8/4/2013,2013,8,4,2126,25,42.2447609,-89.113131,Bombus auricomus,Bombus auricomus,,f,f,female,https://beespotter.org/bee/3391
3392,WendyJG,8/29/2013,2013,8,29,2151,Bumblebee 3,8/4/2013,2013,8,4,2126,25,42.2447609,-89.113131,Bombus pensylvanicus,Bombus auricomus,,f,f,male,https://beespotter.org/bee/3392
3393,WendyJG,8/29/2013,2013,8,29,2151,Bumblebee 4,8/4/2013,2013,8,4,2126,25,42.2447609,-89.113131,Bombus pensylvanicus,Bombus auricomus,,f,f,female,https://beespotter.org/bee/3393
3240,jjames,8/5/2013,2013,8,5,2127,2013-08-03 c,8/5/2013,2013,8,5,2127,0,40.82520059,-89.80272889,Bombus citrinus,Bombus citrinus,,f,f,male,https://beespotter.org/bee/3240
3242,jerr17,8/5/2013,2013,8,5,2127,bb,8/5/2013,2013,8,5,2127,0,41.637421,-87.975512,Bombus bimaculatus,Bombus impatiens,,f,f,male,https://beespotter.org/bee/3242
3244,joshuallen,8/6/2013,2013,8,6,2128,Big mama,8/6/2013,2013,8,6,2128,0,40.08974414,-88.23984861,Bombus griseocollis,Bombus griseocollis,,f,f,female,https://beespotter.org/bee/3244
3245,tvelat,8/7/2013,2013,8,7,2129,15,8/6/2013,2013,8,6,2128,1,41.74531699,-88.18253517,Bombus impatiens,Bombus impatiens,,f,f,female,https://beespotter.org/bee/3245
3246,tvelat,8/7/2013,2013,8,7,2129,16,8/6/2013,2013,8,6,2128,1,41.74550911,-88.18202019,Bombus auricomus,Bombus auricomus,,f,f,female,https://beespotter.org/bee/3246
3247,tvelat,8/7/2013,2013,8,7,2129,17,8/6/2013,2013,8,6,2128,1,41.74557315,-88.18202019,Bombus impatiens,Bombus impatiens,,f,f,female,https://beespotter.org/bee/3247
3248,tvelat,8/7/2013,2013,8,7,2129,18,8/6/2013,2013,8,6,2128,1,41.74576527,-88.18159103,Bombus vagans,Bombus impatiens,,f,f,female,https://beespotter.org/bee/3248
3249,tvelat,8/7/2013,2013,8,7,2129,19,8/6/2013,2013,8,6,2128,1,41.74557315,-88.18116188,Bombus bimaculatus,Bombus griseocollis,,f,f,male,https://beespotter.org/bee/3249
3292,John Dahlstedt,8/12/2013,2013,8,12,2134,Bee 731 Champaign Cty,8/6/2013,2013,8,6,2128,6,40.07985899,-88.20842117,Apis mellifera,Apis mellifera,,f,f,female,https://beespotter.org/bee/3292
3293,John Dahlstedt,8/12/2013,2013,8,12,2134,Bee 732 Champaign Cty,8/6/2013,2013,8,6,2128,6,40.07990619,-88.20842385,Bombus impatiens,Bombus impatiens,,f,f,female,https://beespotter.org/bee/3293
3294,John Dahlstedt,8/12/2013,2013,8,12,2134,Bee 733 Champaign Cty,8/6/2013,2013,8,6,2128,6,40.07980871,-88.20845202,Apis mellifera,Apis mellifera,,f,f,female,https://beespotter.org/bee/3294
3295,John Dahlstedt,8/12/2013,2013,8,12,2134,Bee 734 Champaign Cty,8/6/2013,2013,8,6,2128,6,40.07996571,-88.20826292,Apis mellifera,Apis mellifera,,f,f,female,https://beespotter.org/bee/3295
3296,John Dahlstedt,8/12/2013,2013,8,12,2134,Bee 735 Champaign Cty,8/6/2013,2013,8,6,2128,6,40.07760349,-88.20761919,Bombus impatiens,Bombus impatiens,,f,f,female,https://beespotter.org/bee/3296
3297,John Dahlstedt,8/12/2013,2013,8,12,2134,Bee 736 Champaign Cty,8/6/2013,2013,8,6,2128,6,40.07721765,-88.20536613,Apis mellifera,Apis mellifera,,f,f,female,https://beespotter.org/bee/3297
3298,John Dahlstedt,8/12/2013,2013,8,12,2134,Bee 737 Champaign Cty,8/6/2013,2013,8,6,2128,6,40.077349,-88.20510864,Bombus pensylvanicus,Bombus auricomus,,f,f,female,https://beespotter.org/bee/3298
3299,John Dahlstedt,8/12/2013,2013,8,12,2134,Bee 738 Champaign Cty,8/6/2013,2013,8,6,2128,6,40.07732437,-88.20473313,Bombus auricomus,Bombus auricomus,,f,f,female,https://beespotter.org/bee/3299
3300,John Dahlstedt,8/12/2013,2013,8,12,2134,Bee 739 Champaign Cty,8/6/2013,2013,8,6,2128,6,40.0772587,-88.20392847,Bombus impatiens,Bombus impatiens,,f,f,female,https://beespotter.org/bee/3300
3301,John Dahlstedt,8/12/2013,2013,8,12,2134,Bee 740 Champaign Cty,8/6/2013,2013,8,6,2128,6,40.07706577,-88.20210457,Bombus auricomus,Bombus auricomus,,f,f,female,https://beespotter.org/bee/3301
3265,DavidHarley,8/9/2013,2013,8,9,2131,Bee2_7Aug13,8/7/2013,2013,8,7,2129,2,40.09641633,-88.21807194,,Apis mellifera,,f,f,female,https://beespotter.org/bee/3265
3252,urbanbee,8/8/2013,2013,8,8,2130,Englewood bee on red clover,8/8/2013,2013,8,8,2130,0,41.75863578,-87.63321877,Bombus fervidus,Bombus fervidus,Bombus pensylvanicus,f,f,male,https://beespotter.org/bee/3252
3256,meist99,8/9/2013,2013,8,9,2131,Monarda20130808a,8/8/2013,2013,8,8,2130,1,41.95184657,-88.23615789,Bombus impatiens,Bombus impatiens,,f,f,female,https://beespotter.org/bee/3256
3257,meist99,8/9/2013,2013,8,9,2131,Monarda20130808b,8/8/2013,2013,8,8,2130,1,41.95116036,-88.2364583,Bombus griseocollis,Bombus bimaculatus,Bombus griseocollis,f,f,female,https://beespotter.org/bee/3257
3258,meist99,8/9/2013,2013,8,9,2131,Monarda20130808c,8/8/2013,2013,8,8,2130,1,41.95082524,-88.23669434,Bombus fervidus,Bombus fervidus,,f,f,female,https://beespotter.org/bee/3258
3261,meist99,8/9/2013,2013,8,9,2131,Monarda20130808e,8/8/2013,2013,8,8,2130,1,41.96138887,-88.18293214,Bombus auricomus,Bombus auricomus,Bombus pensylvanicus,f,f,female,https://beespotter.org/bee/3261
3263,sbaker68,8/9/2013,2013,8,9,2131,Bee on Zinnias,8/8/2013,2013,8,8,2130,1,41.01708106,-87.92598724,Bombus auricomus,Bombus auricomus,,f,f,female,https://beespotter.org/bee/3263
3262,TER_OR,8/9/2013,2013,8,9,2131,B Citrinus 080913,8/9/2013,2013,8,9,2131,0,42.1013019,-88.277347,Bombus citrinus,Bombus citrinus,,f,f,female,https://beespotter.org/bee/3262
3280,TER_OR,8/11/2013,2013,8,11,2133,B Gris 080913a,8/9/2013,2013,8,9,2131,2,42.10430414,-88.27969551,Bombus griseocollis,Bombus griseocollis,,f,f,male,https://beespotter.org/bee/3280
3282,TER_OR,8/11/2013,2013,8,11,2133,B bimiculatus 080913b,8/9/2013,2013,8,9,2131,2,42.10454294,-88.27971697,Bombus bimaculatus,Bombus bimaculatus,,f,f,,https://beespotter.org/bee/3282
3267,apjasper,8/10/2013,2013,8,10,2132,Impatient,8/10/2013,2013,8,10,2132,0,42.217214,-88.235933,Bombus auricomus,Bombus impatiens,,f,f,female,https://beespotter.org/bee/3267
3268,apjasper,8/10/2013,2013,8,10,2132,Sunflower,8/10/2013,2013,8,10,2132,0,42.217214,-88.235933,Apis mellifera,Apis mellifera,,f,f,female,https://beespotter.org/bee/3268
3270,apjasper,8/10/2013,2013,8,10,2132,Radish,8/10/2013,2013,8,10,2132,0,42.217214,-88.235933,Bombus griseocollis,Bombus impatiens,,f,f,female,https://beespotter.org/bee/3270
3271,apjasper,8/10/2013,2013,8,10,2132,Begonia,8/10/2013,2013,8,10,2132,0,42.217214,-88.235933,Bombus affinis,Bombus impatiens,,f,f,female,https://beespotter.org/bee/3271
3273,dave,8/10/2013,2013,8,10,2132,dal,8/10/2013,2013,8,10,2132,0,39.8355833,-88.4903779,Apis mellifera,Apis mellifera,,f,f,female,https://beespotter.org/bee/3273
3275,celestia,8/10/2013,2013,8,10,2132,Bee on butterfly plant,8/10/2013,2013,8,10,2132,0,41.8165735,-88.0690224,,Bombus impatiens,,f,f,female,https://beespotter.org/bee/3275
3285,Tiny Bungalow,8/12/2013,2013,8,12,2134,On Bee Balm,8/10/2013,2013,8,10,2132,2,41.8850317,-87.7845025,Bombus griseocollis,Bombus impatiens,,f,f,female,https://beespotter.org/bee/3285
3303,sbaker68,8/14/2013,2013,8,14,2136,1:30 p.m,8/10/2013,2013,8,10,2132,4,41.017634,-87.925287,Apis mellifera,Apis mellifera,,f,f,female,https://beespotter.org/bee/3303
3305,sbaker68,8/14/2013,2013,8,14,2136,1:30 p.m,8/10/2013,2013,8,10,2132,4,41.017634,-87.925287,Apis mellifera,Apis mellifera,,f,f,female,https://beespotter.org/bee/3305
3306,sbaker68,8/14/2013,2013,8,14,2136,1:30 p.m,8/10/2013,2013,8,10,2132,4,41.017634,-87.925287,Apis mellifera,Apis mellifera,,f,f,female,https://beespotter.org/bee/3306
3527,levernier,1/16/2014,2014,1,16,2291,B. auricomus_McHenry,8/10/2013,2013,8,10,2132,159,42.448442,-88.457466,Bombus auricomus,Bombus auricomus,,f,f,female,https://beespotter.org/bee/3527
3278,TER_OR,8/11/2013,2013,8,11,2133,B Impatiens 081113,8/11/2013,2013,8,11,2133,0,42.10495686,-88.28263521,Bombus impatiens,Bombus impatiens,,f,f,female,https://beespotter.org/bee/3278
3279,TER_OR,8/11/2013,2013,8,11,2133,B Impatiens 080913a,8/11/2013,2013,8,11,2133,0,42.10417678,-88.27480316,Bombus impatiens,Bombus bimaculatus,,f,f,female,https://beespotter.org/bee/3279
3283,dave,8/11/2013,2013,8,11,2133,apple,8/11/2013,2013,8,11,2133,0,39.8355833,-88.4903779,,Bombus griseocollis,,f,f,,https://beespotter.org/bee/3283
3286,Tiny Bungalow,8/12/2013,2013,8,12,2134,On Snakeroot,8/11/2013,2013,8,11,2133,1,41.8850317,-87.7845025,Apis mellifera,Apis mellifera,,f,f,female,https://beespotter.org/bee/3286
3287,Tiny Bungalow,8/12/2013,2013,8,12,2134,On Cone Flower 1,8/11/2013,2013,8,11,2133,1,41.8850317,-87.7845025,Bombus vagans,Bombus impatiens,,f,f,female,https://beespotter.org/bee/3287
3288,Tiny Bungalow,8/12/2013,2013,8,12,2134,On Cone Flower 2,8/11/2013,2013,8,11,2133,1,41.8850317,-87.7845025,Bombus vagans,Bombus griseocollis,,f,f,female,https://beespotter.org/bee/3288
3289,Tiny Bungalow,8/12/2013,2013,8,12,2134,On Brown-eyed Susan,8/11/2013,2013,8,11,2133,1,41.8850317,-87.7845025,Bombus vagans,Bombus impatiens,,f,f,female,https://beespotter.org/bee/3289
3445,mmckelve,9/13/2013,2013,9,13,2166,Bee at IL State Fair on Autumn Joy,8/11/2013,2013,8,11,2133,33,39.83767274,-89.64535564,Apis mellifera,Apis mellifera,,f,f,female,https://beespotter.org/bee/3445
3418,janher,9/4/2013,2013,9,4,2157,Possibleborealis,8/12/2013,2013,8,12,2134,23,41.80772494,-87.58566856,,Bombus fervidus,,f,f,male,https://beespotter.org/bee/3418
3342,Caroline,8/19/2013,2013,8,19,2141,Yellow Bumble Bee?,8/13/2013,2013,8,13,2135,6,41.807931,-87.999201,Bombus fervidus,Bombus fervidus,,f,f,female,https://beespotter.org/bee/3342
3302,janher,8/14/2013,2013,8,14,2136,47thS,8/14/2013,2013,8,14,2136,0,41.81002807,-87.58704185,Apis mellifera,Apis mellifera,,f,f,female,https://beespotter.org/bee/3302
3307,peterwchen,8/14/2013,2013,8,14,2136,Winfield,8/14/2013,2013,8,14,2136,0,41.80053512,-88.17345321,Bombus impatiens,Bombus griseocollis,,f,f,male,https://beespotter.org/bee/3307
3308,peterwchen,8/14/2013,2013,8,14,2136,Winfield,8/14/2013,2013,8,14,2136,0,41.80056711,-88.17351758,Bombus fervidus,Bombus fervidus,,f,f,female,https://beespotter.org/bee/3308
3324,Dave_K,8/18/2013,2013,8,18,2140,Bumble on Sunflower,8/15/2013,2013,8,15,2137,3,41.93804122,-88.0777359,,Bombus impatiens,,f,f,female,https://beespotter.org/bee/3324
3310,peterwchen,8/16/2013,2013,8,16,2138,COD campus,8/16/2013,2013,8,16,2138,0,41.84144793,-88.07383597,Bombus griseocollis,Bombus impatiens,,f,f,female,https://beespotter.org/bee/3310
3312,janher,8/17/2013,2013,8,17,2139,Bobolink1,8/16/2013,2013,8,16,2138,1,41.78651305,-87.58047581,Bombus citrinus,Bombus citrinus,,f,f,,https://beespotter.org/bee/3312
3313,John Dahlstedt,8/17/2013,2013,8,17,2139,Bee 741 Champaign Cty,8/16/2013,2013,8,16,2138,1,40.07988772,-88.20840374,Apis mellifera,Apis mellifera,,f,f,female,https://beespotter.org/bee/3313
3314,John Dahlstedt,8/17/2013,2013,8,17,2139,Bee 742 Champaign Cty,8/16/2013,2013,8,16,2138,1,40.07985591,-88.20841581,Apis mellifera,Apis mellifera,,f,f,female,https://beespotter.org/bee/3314
3315,John Dahlstedt,8/17/2013,2013,8,17,2139,Bee 743 Champaign Cty,8/16/2013,2013,8,16,2138,1,40.0798082,-88.20845872,Apis mellifera,Apis mellifera,,f,f,female,https://beespotter.org/bee/3315
3316,John Dahlstedt,8/17/2013,2013,8,17,2139,Bee 744 Champaign Cty,8/16/2013,2013,8,16,2138,1,40.07980204,-88.20845202,Apis mellifera,Apis mellifera,,f,f,female,https://beespotter.org/bee/3316
3317,John Dahlstedt,8/17/2013,2013,8,17,2139,Bee 745 Champaign Cty,8/16/2013,2013,8,16,2138,1,40.07977536,-88.208334,Bombus impatiens,Bombus impatiens,,f,f,female,https://beespotter.org/bee/3317
3318,John Dahlstedt,8/17/2013,2013,8,17,2139,Bee 746 Champaign Cty,8/16/2013,2013,8,16,2138,1,40.07984257,-88.20833266,Apis mellifera,Apis mellifera,,f,f,female,https://beespotter.org/bee/3318
3319,John Dahlstedt,8/17/2013,2013,8,17,2139,Bee 747 Champaign Cty,8/16/2013,2013,8,16,2138,1,40.07716839,-88.20565581,Apis mellifera,Apis mellifera,,f,f,female,https://beespotter.org/bee/3319
3320,John Dahlstedt,8/17/2013,2013,8,17,2139,Bee 748 Champaign Cty,8/16/2013,2013,8,16,2138,1,40.07727101,-88.20484042,Apis mellifera,Apis mellifera,,f,f,female,https://beespotter.org/bee/3320
3323,Dave_K,8/18/2013,2013,8,18,2140,Bumble on Hyssop,8/16/2013,2013,8,16,2138,2,41.93791352,-88.07739258,,Bombus griseocollis,,f,f,female,https://beespotter.org/bee/3323
3346,flylow,8/21/2013,2013,8,21,2143,Bumble bee--red clover,8/16/2013,2013,8,16,2138,5,37.60824808,-89.3164444,Bombus griseocollis,Bombus impatiens,,f,f,female,https://beespotter.org/bee/3346
3347,flylow,8/21/2013,2013,8,21,2143,Bumble bee--yellow lantana,8/16/2013,2013,8,16,2138,5,37.6190727,-89.3232507,Bombus griseocollis,Bombus impatiens,,f,f,female,https://beespotter.org/bee/3347
3348,flylow,8/21/2013,2013,8,21,2143,Honey bee--ornamental sunflower,8/16/2013,2013,8,16,2138,5,37.6190727,-89.3232507,Apis mellifera,Apis mellifera,,f,f,female,https://beespotter.org/bee/3348
3376,flylow,8/29/2013,2013,8,29,2151,Bumble bee--Ornamental sunflower 1,8/16/2013,2013,8,16,2138,13,37.6190727,-89.3232507,Bombus griseocollis,Bombus impatiens,,f,f,female,https://beespotter.org/bee/3376
3377,flylow,8/29/2013,2013,8,29,2151,Bumble bee--Orn sunflower 2,8/16/2013,2013,8,16,2138,13,37.6190727,-89.3232507,Bombus griseocollis,Bombus impatiens,,f,f,female,https://beespotter.org/bee/3377
3378,flylow,8/29/2013,2013,8,29,2151,Bumble bee--Orn sunflower 3,8/16/2013,2013,8,16,2138,13,37.6190727,-89.3232507,Bombus griseocollis,Bombus impatiens,,f,f,female,https://beespotter.org/bee/3378
3379,flylow,8/29/2013,2013,8,29,2151,Bumble bee--Orn sunflower 4,8/16/2013,2013,8,16,2138,13,37.6190727,-89.3232507,Bombus griseocollis,Bombus impatiens,,f,f,male,https://beespotter.org/bee/3379
3380,flylow,8/29/2013,2013,8,29,2151,Bumble bee--Orn sunflower 5,8/16/2013,2013,8,16,2138,13,37.6190727,-89.3232507,Bombus griseocollis,Bombus impatiens,,f,f,female,https://beespotter.org/bee/3380
3381,flylow,8/29/2013,2013,8,29,2151,Bumble bee--Orn sunflower 6,8/16/2013,2013,8,16,2138,13,37.6190727,-89.3232507,Bombus griseocollis,Bombus impatiens,,f,f,female,https://beespotter.org/bee/3381
3321,tkdesign,8/17/2013,2013,8,17,2139,yellowbee8-17,8/17/2013,2013,8,17,2139,0,41.110841,-87.859022,Bombus fervidus,Bombus fervidus,,f,f,female,https://beespotter.org/bee/3321
3325,Dave_K,8/18/2013,2013,8,18,2140,Bumble on Linaria,8/18/2013,2013,8,18,2140,0,41.9382966,-88.07722092,,Bombus fervidus,,f,f,female,https://beespotter.org/bee/3325
3326,Dave_K,8/18/2013,2013,8,18,2140,Bumble on Lobelia,8/18/2013,2013,8,18,2140,0,41.9382966,-88.07756424,,Bombus impatiens,,f,f,female,https://beespotter.org/bee/3326
3331,Tiny Bungalow,8/18/2013,2013,8,18,2140,On Red Sunflower,8/18/2013,2013,8,18,2140,0,41.8850317,-87.7845025,Bombus griseocollis,Bombus impatiens,,f,f,female,https://beespotter.org/bee/3331
3333,Tiny Bungalow,8/18/2013,2013,8,18,2140,On Orange Sunflower,8/18/2013,2013,8,18,2140,0,41.8850317,-87.7845025,Bombus griseocollis,Bombus impatiens,,f,f,female,https://beespotter.org/bee/3333
3334,Tiny Bungalow,8/18/2013,2013,8,18,2140,On Cone Cutleaf Flower,8/18/2013,2013,8,18,2140,0,41.8850317,-87.7845025,Bombus griseocollis,Bombus impatiens,,f,f,female,https://beespotter.org/bee/3334
3335,Tiny Bungalow,8/18/2013,2013,8,18,2140,On Cutleaf Coneflower,8/18/2013,2013,8,18,2140,0,41.8850317,-87.7845025,Bombus impatiens,Bombus impatiens,,f,f,female,https://beespotter.org/bee/3335
3336,Tiny Bungalow,8/18/2013,2013,8,18,2140,On Orange Sunflower,8/18/2013,2013,8,18,2140,0,41.8850317,-87.7845025,Bombus griseocollis,Bombus impatiens,,f,f,female,https://beespotter.org/bee/3336
3337,Tiny Bungalow,8/18/2013,2013,8,18,2140,On Cutleaf Coneflower,8/18/2013,2013,8,18,2140,0,41.8850317,-87.7845025,Bombus griseocollis,Bombus impatiens,,f,f,female,https://beespotter.org/bee/3337
3338,Tiny Bungalow,8/18/2013,2013,8,18,2140,On Red Sunflower,8/18/2013,2013,8,18,2140,0,41.8850317,-87.7845025,Bombus griseocollis,Bombus impatiens,,f,f,female,https://beespotter.org/bee/3338
3341,Llamma2,8/19/2013,2013,8,19,2141,Butterfly Bush,8/19/2013,2013,8,19,2141,0,42.291132,-89.014257,Bombus griseocollis,Bombus griseocollis,,f,f,male,https://beespotter.org/bee/3341
3344,twotringas,8/20/2013,2013,8,20,2142,citrinus on Cup Plant,8/19/2013,2013,8,19,2141,1,42.304981,-89.156791,Bombus citrinus,Bombus citrinus,,f,f,female,https://beespotter.org/bee/3344
3350,twotringas,8/23/2013,2013,8,23,2145,impatiens on Cup Plant,8/19/2013,2013,8,19,2141,4,42.304981,-89.156791,Bombus impatiens,Bombus impatiens,,f,f,,https://beespotter.org/bee/3350
3352,twotringas,8/23/2013,2013,8,23,2145,affinis on Prairie Dock,8/19/2013,2013,8,19,2141,4,42.28725949,-89.29502175,Bombus affinis,Bombus affinis,,t,t,female,https://beespotter.org/bee/3352
3353,twotringas,8/23/2013,2013,8,23,2145,affinis on Pairie Dock,8/19/2013,2013,8,19,2141,4,42.20974587,-89.10851437,Bombus affinis,Bombus affinis,,t,t,female,https://beespotter.org/bee/3353
3345,Llamma2,8/20/2013,2013,8,20,2142,Bb coneflower,8/20/2013,2013,8,20,2142,0,42.291132,-89.014257,Bombus bimaculatus,Bombus bimaculatus,Bombus griseocollis,f,f,female,https://beespotter.org/bee/3345
3351,twotringas,8/23/2013,2013,8,23,2145,griseocollis on Prairie Thistle,8/23/2013,2013,8,23,2145,0,42.304981,-89.156791,Bombus griseocollis,Bombus griseocollis,,f,f,male,https://beespotter.org/bee/3351
3354,tkdesign,8/23/2013,2013,8,23,2145,perryfarm8-23,8/23/2013,2013,8,23,2145,0,41.14508497,-87.88820028,Bombus auricomus,Bombus auricomus,,f,f,female,https://beespotter.org/bee/3354
3355,twotringas,8/24/2013,2013,8,24,2146,auricomus on Prairie Thistle,8/23/2013,2013,8,23,2145,1,42.304981,-89.156791,Bombus auricomus,Bombus auricomus,,f,f,female,https://beespotter.org/bee/3355
3356,twotringas,8/24/2013,2013,8,24,2146,citrinus on Purple Coneflower,8/23/2013,2013,8,23,2145,1,42.304981,-89.156791,Bombus citrinus,Bombus citrinus,,f,f,male,https://beespotter.org/bee/3356
3359,surgesca,8/26/2013,2013,8,26,2148,Tithonia,8/23/2013,2013,8,23,2145,3,43.086216,-88.108755,Bombus fervidus,Bombus fervidus,,f,f,female,https://beespotter.org/bee/3359
3357,twotringas,8/26/2013,2013,8,26,2148,honeybee,8/24/2013,2013,8,24,2146,2,42.304981,-89.156791,Apis mellifera,Apis mellifera,,f,f,female,https://beespotter.org/bee/3357
3360,Tiny Bungalow,8/27/2013,2013,8,27,2149,on red sunflower,8/24/2013,2013,8,24,2146,3,41.8850317,-87.7845025,Bombus impatiens,Bombus impatiens,,f,f,female,https://beespotter.org/bee/3360
3361,Tiny Bungalow,8/27/2013,2013,8,27,2149,on cutleaf coneflower,8/24/2013,2013,8,24,2146,3,41.8850317,-87.7845025,Bombus impatiens,Bombus impatiens,,f,f,female,https://beespotter.org/bee/3361
3362,Tiny Bungalow,8/27/2013,2013,8,27,2149,on brown-eyed susan,8/24/2013,2013,8,24,2146,3,41.8850317,-87.7845025,Apis mellifera,Apis mellifera,,f,f,female,https://beespotter.org/bee/3362
3363,Tiny Bungalow,8/27/2013,2013,8,27,2149,on beebalm,8/24/2013,2013,8,24,2146,3,41.8850317,-87.7845025,Bombus impatiens,Bombus impatiens,,f,f,female,https://beespotter.org/bee/3363
3358,surgesca,8/26/2013,2013,8,26,2148,Heliopterus,8/26/2013,2013,8,26,2148,0,43.086216,-88.108755,Bombus impatiens,Bombus impatiens,,f,f,female,https://beespotter.org/bee/3358
3365,juliekulak,8/27/2013,2013,8,27,2149,Smaller bee,8/26/2013,2013,8,26,2148,1,41.76979,-88.14122,Bombus impatiens,Bombus impatiens,,f,f,female,https://beespotter.org/bee/3365
3366,juliekulak,8/27/2013,2013,8,27,2149,honeybee,8/26/2013,2013,8,26,2148,1,41.76979,-88.14122,Apis mellifera,Apis mellifera,,f,f,female,https://beespotter.org/bee/3366
3439,mmckelve,9/13/2013,2013,9,13,2166,Bee on Rose of Sharon,8/26/2013,2013,8,26,2148,18,40.10790489,-88.25179115,Bombus griseocollis,Bombus griseocollis,,f,f,female,https://beespotter.org/bee/3439
3401,John Dahlstedt,9/1/2013,2013,9,1,2154,Bee 749 Champaign Cty,8/27/2013,2013,8,27,2149,5,40.08092823,-88.20025921,Bombus bimaculatus,Bombus bimaculatus,,f,f,female,https://beespotter.org/bee/3401
3402,John Dahlstedt,9/1/2013,2013,9,1,2154,Bee 750 Champaign Cty,8/27/2013,2013,8,27,2149,5,40.07720123,-88.20410013,Bombus griseocollis,Bombus griseocollis,,f,f,male,https://beespotter.org/bee/3402
3404,John Dahlstedt,9/1/2013,2013,9,1,2154,Bee 751 Champaign Cty,8/27/2013,2013,8,27,2149,5,40.07729153,-88.20448637,Bombus griseocollis,Bombus griseocollis,,f,f,female,https://beespotter.org/bee/3404
3405,John Dahlstedt,9/1/2013,2013,9,1,2154,Bee 752 Champaign Cty,8/27/2013,2013,8,27,2149,5,40.07723407,-88.20540905,Bombus griseocollis,Bombus griseocollis,,f,f,female,https://beespotter.org/bee/3405
3406,John Dahlstedt,9/1/2013,2013,9,1,2154,Bee 753 Champaign Cty,8/27/2013,2013,8,27,2149,5,,,Bombus griseocollis,Bombus griseocollis,,f,f,female,https://beespotter.org/bee/3406
3407,John Dahlstedt,9/1/2013,2013,9,1,2154,Bee 754 Champaign Cty,8/27/2013,2013,8,27,2149,5,40.07729153,-88.20635319,Bombus pensylvanicus,Bombus pensylvanicus,Bombus auricomus,f,f,female,https://beespotter.org/bee/3407
3408,John Dahlstedt,9/1/2013,2013,9,1,2154,Bee 755 Champaign Cty,8/27/2013,2013,8,27,2149,5,40.07982,-88.20845872,Bombus griseocollis,Bombus griseocollis,,f,f,male,https://beespotter.org/bee/3408
3409,John Dahlstedt,9/1/2013,2013,9,1,2154,Bee 756 Champaign Cty,8/27/2013,2013,8,27,2149,5,40.07985694,-88.20841849,Apis mellifera,Apis mellifera,,f,f,female,https://beespotter.org/bee/3409
3410,John Dahlstedt,9/1/2013,2013,9,1,2154,Bee 757 Champaign Cty,8/27/2013,2013,8,27,2149,5,40.07984463,-88.2083863,Apis mellifera,Apis mellifera,,f,f,female,https://beespotter.org/bee/3410
3371,twotringas,8/28/2013,2013,8,28,2150,unknown bee on Showy & Stiff Goldenrod,8/28/2013,2013,8,28,2150,0,42.304981,-89.156791,,Bombus fervidus,,f,f,female,https://beespotter.org/bee/3371
3372,twotringas,8/28/2013,2013,8,28,2150,affinis queen on Prairie Thistle,8/28/2013,2013,8,28,2150,0,42.26866358,-89.11721932,Bombus affinis,Bombus affinis,,t,t,female,https://beespotter.org/bee/3372
3373,twotringas,8/28/2013,2013,8,28,2150,Vagans (?) on Prairie Dock,8/28/2013,2013,8,28,2150,0,42.304981,-89.156791,Bombus vagans,Bombus vagans,,f,f,male,https://beespotter.org/bee/3373
3374,twotringas,8/29/2013,2013,8,29,2151,fervidus on Prairie Thistle,8/28/2013,2013,8,28,2150,1,42.304981,-89.156791,Bombus fervidus,Bombus fervidus,,f,f,female,https://beespotter.org/bee/3374
3375,twotringas,8/29/2013,2013,8,29,2151,citrinus queen on Prairie Dock,8/28/2013,2013,8,28,2150,1,42.304981,-89.156791,Bombus citrinus,Bombus citrinus,,f,f,female,https://beespotter.org/bee/3375
3400,Llamma2,8/30/2013,2013,8,30,2152,HoneybeeOnSedum,8/28/2013,2013,8,28,2150,2,42.291132,-89.014257,,Apis mellifera,,f,f,female,https://beespotter.org/bee/3400
3414,twotringas,9/4/2013,2013,9,4,2157,bimaculatus queen on Prairie Thistle,8/28/2013,2013,8,28,2150,7,42.304981,-89.156791,Bombus bimaculatus,Bombus bimaculatus,,f,f,female,https://beespotter.org/bee/3414
3413,twotringas,9/4/2013,2013,9,4,2157,honeybee on Stiff Goldenrod,8/29/2013,2013,8,29,2151,6,42.304981,-89.156791,Apis mellifera,Apis mellifera,,f,f,female,https://beespotter.org/bee/3413
3411,Llamma2,9/2/2013,2013,9,2,2155,BBonRoseSharon,8/31/2013,2013,8,31,2153,2,42.291132,-89.014257,,Bombus impatiens,,f,f,female,https://beespotter.org/bee/3411
3454,WendyJG,9/17/2013,2013,9,17,2170,Klehm 8-31-13 BB 1,8/31/2013,2013,8,31,2153,17,42.2447609,-89.113131,Bombus impatiens,Bombus impatiens,,f,f,female,https://beespotter.org/bee/3454
3458,WendyJG,9/17/2013,2013,9,17,2170,Klehm 8-31-13 BB 1,8/31/2013,2013,8,31,2153,17,42.2447609,-89.113131,Bombus impatiens,Bombus impatiens,,f,f,female,https://beespotter.org/bee/3458
3459,WendyJG,9/17/2013,2013,9,17,2170,Klehm 8-31-13 BB 2,8/31/2013,2013,8,31,2153,17,42.2447609,-89.113131,Bombus impatiens,Bombus impatiens,,f,f,male,https://beespotter.org/bee/3459
3460,WendyJG,9/17/2013,2013,9,17,2170,Klehm 8-31-13 BB 3,8/31/2013,2013,8,31,2153,17,42.2447609,-89.113131,Bombus impatiens,Bombus impatiens,,f,f,female,https://beespotter.org/bee/3460
3461,WendyJG,9/17/2013,2013,9,17,2170,Klehm 8-31-13 BB 4,8/31/2013,2013,8,31,2153,17,42.2447609,-89.113131,Bombus bimaculatus,Bombus griseocollis,,f,f,male,https://beespotter.org/bee/3461
3462,WendyJG,9/17/2013,2013,9,17,2170,Klehm 8-31-13 BB 5,8/31/2013,2013,8,31,2153,17,42.2447609,-89.113131,Bombus impatiens,Bombus impatiens,,f,f,female,https://beespotter.org/bee/3462
3463,WendyJG,9/17/2013,2013,9,17,2170,Klehm 8-31-13 BB 6,8/31/2013,2013,8,31,2153,17,42.2447609,-89.113131,Bombus impatiens,Bombus impatiens,,f,f,female,https://beespotter.org/bee/3463
3464,WendyJG,9/17/2013,2013,9,17,2170,Klehm 8-31-13 BB 7,8/31/2013,2013,8,31,2153,17,42.2447609,-89.113131,Bombus fervidus,Bombus fervidus,,f,f,female,https://beespotter.org/bee/3464
3465,WendyJG,9/17/2013,2013,9,17,2170,Klehm 8-31-13 BB 8,8/31/2013,2013,8,31,2153,17,42.2447609,-89.113131,Bombus fervidus,Bombus fervidus,,f,f,male,https://beespotter.org/bee/3465
3466,WendyJG,9/17/2013,2013,9,17,2170,Klehm 8-31-13 BB 9,8/31/2013,2013,8,31,2153,17,42.2447609,-89.113131,Bombus impatiens,Bombus impatiens,,f,f,female,https://beespotter.org/bee/3466
3467,WendyJG,9/17/2013,2013,9,17,2170,Klehm 8-31-13 BB 10,8/31/2013,2013,8,31,2153,17,42.2447609,-89.113131,Bombus fervidus,Bombus fervidus,,f,f,male,https://beespotter.org/bee/3467
3468,WendyJG,9/17/2013,2013,9,17,2170,Klehm 8-31-13 BB 11,8/31/2013,2013,8,31,2153,17,42.2447609,-89.113131,Bombus fervidus,Bombus fervidus,,f,f,female,https://beespotter.org/bee/3468
3469,WendyJG,9/17/2013,2013,9,17,2170,Klehm 8-31-13 BB 12,8/31/2013,2013,8,31,2153,17,42.2447609,-89.113131,Bombus fervidus,Bombus fervidus,,f,f,male,https://beespotter.org/bee/3469
3470,WendyJG,9/17/2013,2013,9,17,2170,Klehm 8-31-13 BB 13,8/31/2013,2013,8,31,2153,17,42.2447609,-89.113131,Bombus bimaculatus,Bombus bimaculatus,,f,f,male,https://beespotter.org/bee/3470
3471,WendyJG,9/17/2013,2013,9,17,2170,Klehm 8-31-13 BB 14,8/31/2013,2013,8,31,2153,17,42.2447609,-89.113131,Bombus griseocollis,Bombus griseocollis,,f,f,female,https://beespotter.org/bee/3471
3472,WendyJG,9/17/2013,2013,9,17,2170,Klehm 8-31-13 BB 15,8/31/2013,2013,8,31,2153,17,42.2447609,-89.113131,Bombus griseocollis,Bombus griseocollis,,f,f,male,https://beespotter.org/bee/3472
3473,WendyJG,9/17/2013,2013,9,17,2170,Klehm 8-31-13 BB 16,8/31/2013,2013,8,31,2153,17,42.2447609,-89.113131,Bombus griseocollis,Bombus griseocollis,,f,f,male,https://beespotter.org/bee/3473
3474,WendyJG,9/17/2013,2013,9,17,2170,Klehm 8-31-13 BB 17,8/31/2013,2013,8,31,2153,17,42.2447609,-89.113131,Bombus citrinus,Bombus citrinus,,f,f,female,https://beespotter.org/bee/3474
5182,mmckelve,8/12/2016,2016,8,12,3230,2013-08-31 #1,8/31/2013,2013,8,31,2153,1077,40.10747328,-88.25174153,Bombus griseocollis,Bombus griseocollis,,f,f,female,https://beespotter.org/bee/5182
5183,mmckelve,8/12/2016,2016,8,12,3230,2013-08-31 #2,8/31/2013,2013,8,31,2153,1077,40.10745587,-88.25169057,Apis mellifera,Apis mellifera,,f,f,female,https://beespotter.org/bee/5183
5184,mmckelve,8/12/2016,2016,8,12,3230,2013-08-31 #3,8/31/2013,2013,8,31,2153,1077,40.10738915,-88.25169325,Apis mellifera,Apis mellifera,,f,f,female,https://beespotter.org/bee/5184
5185,mmckelve,8/12/2016,2016,8,12,3230,2013-08-31 #4 (10 bees on 6 flowers!),8/31/2013,2013,8,31,2153,1077,40.10745152,-88.25168923,Apis mellifera,Apis mellifera,,f,f,female,https://beespotter.org/bee/5185
5186,mmckelve,8/12/2016,2016,8,12,3230,2013-08-31 #5,8/31/2013,2013,8,31,2153,1077,40.10845098,-88.25169593,Bombus impatiens,Bombus impatiens,,f,f,male,https://beespotter.org/bee/5186
3403,terragyrl3,9/1/2013,2013,9,1,2154,Honey bee on ground,9/1/2013,2013,9,1,2154,0,41.8050282,-87.8719219,Apis mellifera,Apis mellifera,,f,f,female,https://beespotter.org/bee/3403
3415,twotringas,9/4/2013,2013,9,4,2157,impatiens queen on Cream Gentian,9/1/2013,2013,9,1,2154,3,42.304981,-89.156791,Bombus impatiens,Bombus impatiens,,f,f,female,https://beespotter.org/bee/3415
3416,twotringas,9/4/2013,2013,9,4,2157,citrinus male on Stiff Goldenrod,9/1/2013,2013,9,1,2154,3,42.304981,-89.156791,Bombus citrinus,Bombus citrinus,,f,f,male,https://beespotter.org/bee/3416
3417,janher,9/4/2013,2013,9,4,2157,lagoon1,9/2/2013,2013,9,2,2155,2,41.78976088,-87.5814414,Apis mellifera,Apis mellifera,,f,f,female,https://beespotter.org/bee/3417
3475,WendyJG,9/17/2013,2013,9,17,2170,Nieman Marsh 9-2-13 BB 1,9/2/2013,2013,9,2,2155,15,42.328518,-89.3203376,Bombus impatiens,Bombus impatiens,,f,f,female,https://beespotter.org/bee/3475
3476,WendyJG,9/17/2013,2013,9,17,2170,Nieman Marsh 9-2-13 BB 2,9/2/2013,2013,9,2,2155,15,42.328518,-89.3203376,Bombus impatiens,Bombus impatiens,,f,f,female,https://beespotter.org/bee/3476
3477,WendyJG,9/17/2013,2013,9,17,2170,Nieman Marsh 9-2-13 HB 1,9/2/2013,2013,9,2,2155,15,42.328518,-89.3203376,Apis mellifera,Apis mellifera,,f,f,female,https://beespotter.org/bee/3477
3478,WendyJG,9/17/2013,2013,9,17,2170,Nieman Marsh 9-2-13 HB 2,9/2/2013,2013,9,2,2155,15,42.328518,-89.3203376,Apis mellifera,Apis mellifera,,f,f,female,https://beespotter.org/bee/3478
3479,WendyJG,9/17/2013,2013,9,17,2170,Nieman Marsh 9-2-13 HB 3,9/2/2013,2013,9,2,2155,15,42.328518,-89.3203376,Apis mellifera,Apis mellifera,,f,f,female,https://beespotter.org/bee/3479
3480,WendyJG,9/17/2013,2013,9,17,2170,Nieman Marsh 9-2-13 HB 4,9/2/2013,2013,9,2,2155,15,42.328518,-89.3203376,Apis mellifera,Apis mellifera,,f,f,female,https://beespotter.org/bee/3480
3481,WendyJG,9/17/2013,2013,9,17,2170,Nieman Marsh 9-2-13 HB 5,9/2/2013,2013,9,2,2155,15,42.328518,-89.3203376,Apis mellifera,Apis mellifera,,f,f,female,https://beespotter.org/bee/3481
3482,WendyJG,9/17/2013,2013,9,17,2170,Nieman Marsh 9-2-13 HB 6,9/2/2013,2013,9,2,2155,15,42.328518,-89.3203376,Apis mellifera,Apis mellifera,,f,f,female,https://beespotter.org/bee/3482
3483,WendyJG,9/17/2013,2013,9,17,2170,Nieman Marsh 9-2-13 HB 7,9/2/2013,2013,9,2,2155,15,42.328518,-89.3203376,Apis mellifera,Apis mellifera,,f,f,female,https://beespotter.org/bee/3483
3484,WendyJG,9/17/2013,2013,9,17,2170,Nieman Marsh 9-2-13 HB 8,9/2/2013,2013,9,2,2155,15,42.328518,-89.3203376,Apis mellifera,Apis mellifera,,f,f,female,https://beespotter.org/bee/3484
3485,WendyJG,9/17/2013,2013,9,17,2170,Nieman Marsh 9-2-13 HB 9,9/2/2013,2013,9,2,2155,15,42.328518,-89.3203376,Apis mellifera,Apis mellifera,,f,f,female,https://beespotter.org/bee/3485
3486,WendyJG,9/17/2013,2013,9,17,2170,Nieman Marsh 9-2-13 HB 10,9/2/2013,2013,9,2,2155,15,42.328518,-89.3203376,Apis mellifera,Apis mellifera,,f,f,female,https://beespotter.org/bee/3486
3423,tvelat,9/5/2013,2013,9,5,2158,20,9/3/2013,2013,9,3,2156,2,41.74624556,-88.19045305,Bombus fervidus,Bombus pensylvanicus,,f,f,male,https://beespotter.org/bee/3423
3424,tvelat,9/5/2013,2013,9,5,2158,21,9/3/2013,2013,9,3,2156,2,41.74630959,-88.19212675,Bombus vagans,Bombus impatiens,,f,f,female,https://beespotter.org/bee/3424
3425,tvelat,9/5/2013,2013,9,5,2158,22,9/3/2013,2013,9,3,2156,2,41.74643767,-88.19165468,Bombus auricomus,Bombus auricomus,,f,f,female,https://beespotter.org/bee/3425
3430,John Dahlstedt,9/7/2013,2013,9,7,2160,Bee 758 Champaign Cty,9/3/2013,2013,9,3,2156,4,40.12693037,-88.20931703,Apis mellifera,Apis mellifera,,f,f,female,https://beespotter.org/bee/3430
3431,John Dahlstedt,9/7/2013,2013,9,7,2160,Bee 759 Champaign Cty,9/3/2013,2013,9,3,2156,4,40.12696831,-88.20926338,Apis mellifera,Apis mellifera,,f,f,female,https://beespotter.org/bee/3431
3426,Llamma2,9/6/2013,2013,9,6,2159,HoneybeeSedum9_5,9/5/2013,2013,9,5,2158,1,42.291132,-89.014257,Apis mellifera,Apis mellifera,,f,f,female,https://beespotter.org/bee/3426
3427,twotringas,9/6/2013,2013,9,6,2159,griseocollis (?) on Prairie Thistle,9/5/2013,2013,9,5,2158,1,42.304981,-89.156791,Bombus griseocollis,Bombus auricomus,,f,f,male,https://beespotter.org/bee/3427
3429,jbates,9/6/2013,2013,9,6,2159,1207 Dobson,9/6/2013,2013,9,6,2159,0,42.020806,-87.689016,Apis mellifera,Apis mellifera,,f,f,female,https://beespotter.org/bee/3429
3432,terragyrl3,9/7/2013,2013,9,7,2160,Bee on sedum 2:30 pm,9/7/2013,2013,9,7,2160,0,41.801203,-87.872103,Apis mellifera,Apis mellifera,,f,f,female,https://beespotter.org/bee/3432
3436,twotringas,9/9/2013,2013,9,9,2162,citrinus queen with accidental tourist,9/8/2013,2013,9,8,2161,1,42.304981,-89.156791,Bombus citrinus,Bombus citrinus,,f,f,female,https://beespotter.org/bee/3436
3437,twotringas,9/9/2013,2013,9,9,2162,citrinus high-five,9/8/2013,2013,9,8,2161,1,42.304981,-89.156791,Bombus citrinus,Bombus citrinus,,f,f,female,https://beespotter.org/bee/3437
3487,WendyJG,9/17/2013,2013,9,17,2170,Klehm 9-8-13 BB 1,9/8/2013,2013,9,8,2161,9,42.34039303,-89.13519722,Bombus vagans,Bombus affinis,,t,t,female,https://beespotter.org/bee/3487
3488,WendyJG,9/17/2013,2013,9,17,2170,Klehm 9-8-13 BB 2,9/8/2013,2013,9,8,2161,9,42.2447609,-89.113131,Bombus impatiens,Bombus impatiens,,f,f,female,https://beespotter.org/bee/3488
3489,WendyJG,9/17/2013,2013,9,17,2170,Klehm 9-8-13 BB 3,9/8/2013,2013,9,8,2161,9,42.2447609,-89.113131,Bombus fervidus,Bombus fervidus,,f,f,female,https://beespotter.org/bee/3489
3490,WendyJG,9/17/2013,2013,9,17,2170,Klehm 9-8-13 BB 4 (found dead on flower),9/8/2013,2013,9,8,2161,9,42.2447609,-89.113131,Bombus impatiens,Bombus impatiens,,f,f,female,https://beespotter.org/bee/3490
3434,janher,9/9/2013,2013,9,9,2162,bobom,9/9/2013,2013,9,9,2162,0,41.78654505,-87.5801754,Bombus citrinus,Bombus citrinus,,f,f,female,https://beespotter.org/bee/3434
3435,janher,9/9/2013,2013,9,9,2162,Bobol,9/9/2013,2013,9,9,2162,0,41.78652905,-87.58013248,Bombus pensylvanicus,Bombus pensylvanicus,,f,f,male,https://beespotter.org/bee/3435
3455,BeeDavison,9/17/2013,2013,9,17,2170,Garlic Chive Bees,9/10/2013,2013,9,10,2163,7,40.499719,-88.975091,Bombus rufocinctus,Bombus impatiens,,f,f,female,https://beespotter.org/bee/3455
3456,BeeDavison,9/17/2013,2013,9,17,2170,Garlic Chive Bee 2,9/10/2013,2013,9,10,2163,7,40.499719,-88.975091,Apis mellifera,Apis mellifera,,f,f,female,https://beespotter.org/bee/3456
3448,twotringas,9/17/2013,2013,9,17,2170,fraternus on Prairie Thistle,9/13/2013,2013,9,13,2166,4,38.66004582,-89.32657242,Bombus fraternus,Bombus fraternus,,f,f,female,https://beespotter.org/bee/3448
3449,twotringas,9/17/2013,2013,9,17,2170,impatiens on Prairie Thistle,9/13/2013,2013,9,13,2166,4,38.66017986,-89.32640076,Bombus impatiens,Bombus impatiens,,f,f,female,https://beespotter.org/bee/3449
3450,twotringas,9/17/2013,2013,9,17,2170,auricomus on Prairie Thistle,9/13/2013,2013,9,13,2166,4,38.65977773,-89.32674408,Bombus auricomus,Bombus auricomus,,f,f,male,https://beespotter.org/bee/3450
3451,twotringas,9/17/2013,2013,9,17,2170,fervidus on Prairie Thistle,9/13/2013,2013,9,13,2166,4,38.65924155,-89.32674408,Bombus fervidus,Bombus fervidus,,f,f,male,https://beespotter.org/bee/3451
3491,WendyJG,9/17/2013,2013,9,17,2170,Klehm 9-14-13 BB,9/14/2013,2013,9,14,2167,3,42.2447609,-89.113131,Bombus impatiens,Bombus impatiens,,f,f,male,https://beespotter.org/bee/3491
3446,Llamma2,9/16/2013,2013,9,16,2169,BBat,9/16/2013,2013,9,16,2169,0,42.4250827,-89.5565598,Bombus affinis,Bombus impatiens,,f,f,female,https://beespotter.org/bee/3446
3452,twotringas,9/17/2013,2013,9,17,2170,affinis on New England Aster,9/17/2013,2013,9,17,2170,0,42.29746484,-89.20934046,Bombus affinis,Bombus affinis,,t,t,male,https://beespotter.org/bee/3452
3453,twotringas,9/17/2013,2013,9,17,2170,honey bee on New England Aster,9/17/2013,2013,9,17,2170,0,42.304981,-89.156791,Apis mellifera,Apis mellifera,,f,f,female,https://beespotter.org/bee/3453
3492,Llamma2,9/18/2013,2013,9,18,2171,BB on pear leaf,9/18/2013,2013,9,18,2171,0,42.291132,-89.014257,Bombus variabilis,Bombus impatiens,,f,f,,https://beespotter.org/bee/3492
3493,Llamma2,9/18/2013,2013,9,18,2171,HB on Pear,9/18/2013,2013,9,18,2171,0,42.291132,-89.014257,Apis mellifera,Apis mellifera,,f,f,female,https://beespotter.org/bee/3493
3494,Llamma2,9/18/2013,2013,9,18,2171,BB on red flower,9/18/2013,2013,9,18,2171,0,42.291132,-89.014257,,Bombus impatiens,,f,f,female,https://beespotter.org/bee/3494
7614,FPDistrictOfKaneCounty,8/17/2018,2018,8,17,3965,Hannaford Woods Seed Harvest Bee 1,9/18/2013,2013,9,18,2171,1794,41.8043499,-88.4527587,Bombus fervidus,Apis mellifera,,f,f,female,https://beespotter.org/bee/7614
7615,FPDistrictOfKaneCounty,8/17/2018,2018,8,17,3965,Hannaford Woods Seed Harvest Bee 2,9/18/2013,2013,9,18,2171,1794,41.8043499,-88.4527587,Apis mellifera,Apis mellifera,,f,f,female,https://beespotter.org/bee/7615
3497,John Dahlstedt,9/20/2013,2013,9,20,2173,Bee 760 Champaign Cty,9/19/2013,2013,9,19,2172,1,40.07723407,-88.20435762,Bombus griseocollis,Bombus griseocollis,,f,f,female,https://beespotter.org/bee/3497
3498,John Dahlstedt,9/20/2013,2013,9,20,2173,Bee 761 Champaign Cty,9/19/2013,2013,9,19,2172,1,40.08299687,-88.2047224,Apis mellifera,Apis mellifera,,f,f,female,https://beespotter.org/bee/3498
3520,guloguloguy1,11/15/2013,2013,11,15,2230,IMG1476,9/19/2013,2013,9,19,2172,58,42.353516,-89.053274,Bombus griseocollis,Bombus griseocollis,,f,f,female,https://beespotter.org/bee/3520
3496,Llamma2,9/20/2013,2013,9,20,2173,BB on pear,9/20/2013,2013,9,20,2173,0,42.291132,-89.014257,Bombus variabilis,Bombus impatiens,,f,f,female,https://beespotter.org/bee/3496
3499,twotringas,9/20/2013,2013,9,20,2173,impatiens queen on Wild Quinine,9/20/2013,2013,9,20,2173,0,42.304981,-89.156791,Bombus impatiens,Bombus impatiens,,f,f,female,https://beespotter.org/bee/3499
3501,bigattichouse,9/23/2013,2013,9,23,2176,Sierra Mist,9/22/2013,2013,9,22,2175,1,40.7405929,-88.718919,,Apis mellifera,,f,f,female,https://beespotter.org/bee/3501
3516,twotringas,10/21/2013,2013,10,21,2204,citrinus on Blanket Flower,9/22/2013,2013,9,22,2175,29,42.304981,-89.156791,Bombus citrinus,Bombus citrinus,,f,f,,https://beespotter.org/bee/3516
3502,peterwchen,9/26/2013,2013,9,26,2179,Lambert Lake,9/25/2013,2013,9,25,2178,1,41.85545398,-88.07941765,Bombus griseocollis,Bombus impatiens,,f,f,,https://beespotter.org/bee/3502
3504,John Dahlstedt,9/27/2013,2013,9,27,2180,Bee 762 Champaign Cty,9/26/2013,2013,9,26,2179,1,40.06309591,-87.98438162,Bombus impatiens,Bombus impatiens,,f,f,female,https://beespotter.org/bee/3504
3505,Dave_K,9/28/2013,2013,9,28,2181,2013 09 28 Honeybee,9/28/2013,2013,9,28,2181,0,41.93893506,-88.07730675,Apis mellifera,Apis mellifera,,f,f,female,https://beespotter.org/bee/3505
3506,terragyrl3,9/30/2013,2013,9,30,2183,Bumble on driveway 3:37 pm,9/30/2013,2013,9,30,2183,0,41.8013724,-87.8717664,Bombus citrinus,Bombus citrinus,,f,f,,https://beespotter.org/bee/3506
3507,John Dahlstedt,10/1/2013,2013,10,1,2184,Bee 763 Champaign Cty,9/30/2013,2013,9,30,2183,1,40.08048494,-88.2029441,Bombus impatiens,Bombus impatiens,,f,f,female,https://beespotter.org/bee/3507
3511,John Dahlstedt,10/15/2013,2013,10,15,2198,Bee 764 Champaign Cty,10/1/2013,2013,10,1,2184,14,40.07994314,-88.20023775,Bombus impatiens,Bombus impatiens,,f,f,male,https://beespotter.org/bee/3511
3512,John Dahlstedt,10/15/2013,2013,10,15,2198,Bee 765 Champaign Cty,10/1/2013,2013,10,1,2184,14,40.07939312,-88.2005167,Bombus impatiens,Bombus impatiens,,f,f,male,https://beespotter.org/bee/3512
3513,John Dahlstedt,10/15/2013,2013,10,15,2198,Bee 766 Champaign Cty,10/1/2013,2013,10,1,2184,14,40.07723407,-88.20478678,Bombus impatiens,Bombus impatiens,,f,f,female,https://beespotter.org/bee/3513
7616,FPDistrictOfKaneCounty,8/17/2018,2018,8,17,3965,Burnidge FP Bee 1,10/2/2013,2013,10,2,2185,1780,42.0752386,-88.3682839,Bombus fervidus,Apis mellifera,,f,f,female,https://beespotter.org/bee/7616
3508,twotringas,10/13/2013,2013,10,13,2196,Vagans on marigold,10/12/2013,2013,10,12,2195,1,42.304981,-89.156791,,Bombus vagans,,f,f,female,https://beespotter.org/bee/3508
3509,twotringas,10/13/2013,2013,10,13,2196,impatiens on marigold,10/12/2013,2013,10,12,2195,1,42.304981,-89.156791,Bombus impatiens,Bombus impatiens,,f,f,female,https://beespotter.org/bee/3509
3510,twotringas,10/13/2013,2013,10,13,2196,Honey Bee on Broccoli,10/13/2013,2013,10,13,2196,0,42.304981,-89.156791,Apis mellifera,Apis mellifera,,f,f,female,https://beespotter.org/bee/3510
3519,janher,11/15/2013,2013,11,15,2229,late bee,11/8/2013,2013,11,8,2222,7,41.79290455,-87.58060455,Bombus bimaculatus,Bombus impatiens,,f,f,female,https://beespotter.org/bee/3519
3541,tharriso,3/18/2014,2014,3,18,2352,Honey_bee_1_2014,3/14/2014,2014,3,14,2348,4,39.50210876,-88.1752922,Apis mellifera,Apis mellifera,,f,f,female,https://beespotter.org/bee/3541
3542,empolion387,3/23/2014,2014,3,23,2357,First Bee Spotting,3/21/2014,2014,3,21,2355,2,29.6925375,-98.3428215,,Apis mellifera,,f,f,female,https://beespotter.org/bee/3542
3545,ruelillian,3/24/2014,2014,3,24,2358,Backyard Cauliflower,3/24/2014,2014,3,24,2358,0,30.019618,-95.600945,Bombus griseocollis,Apis mellifera,,f,f,female,https://beespotter.org/bee/3545
3554,Ktlasers,4/13/2014,2014,4,13,2378,Blue Ridge House,4/6/2014,2014,4,6,2371,7,33.237726,-111.717551,Apis mellifera,Apis mellifera,,f,f,female,https://beespotter.org/bee/3554
3550,John Dahlstedt,4/9/2014,2014,4,9,2374,Bee 767 Champaign Cty,4/9/2014,2014,4,9,2374,0,40.0798933,-88.20842251,Apis mellifera,Apis mellifera,,f,f,female,https://beespotter.org/bee/3550
3551,John Dahlstedt,4/9/2014,2014,4,9,2374,Bee 768 Champaign Cty,4/9/2014,2014,4,9,2374,0,40.07992595,-88.20841447,Apis mellifera,Apis mellifera,,f,f,female,https://beespotter.org/bee/3551
3552,John Dahlstedt,4/11/2014,2014,4,11,2376,Bee 769 Champaign Cty,4/10/2014,2014,4,10,2375,1,40.07988749,-88.20842788,Apis mellifera,Apis mellifera,,f,f,female,https://beespotter.org/bee/3552
3553,Swalquist,4/12/2014,2014,4,12,2377,BumbleBee on ground early spring,4/12/2014,2014,4,12,2377,0,41.883534,-87.780316,Bombus vagans,Bombus bimaculatus,,f,f,female,https://beespotter.org/bee/3553
3559,John Dahlstedt,4/18/2014,2014,4,18,2383,Bee 770 Champaign Cty,4/17/2014,2014,4,17,2382,1,40.08696455,-88.20102096,Apis mellifera,Apis mellifera,,f,f,female,https://beespotter.org/bee/3559
3573,redpigz,4/29/2014,2014,4,29,2394,pollensac,4/17/2014,2014,4,17,2382,12,40.37237819,-88.98543835,Apis mellifera,Apis mellifera,,f,f,female,https://beespotter.org/bee/3573
3560,John Dahlstedt,4/18/2014,2014,4,18,2383,Bee 771 Champaign Cty,4/18/2014,2014,4,18,2383,0,40.07991942,-88.20835948,Apis mellifera,Apis mellifera,,f,f,female,https://beespotter.org/bee/3560
3561,John Dahlstedt,4/18/2014,2014,4,18,2383,Bee 772 Champaign Cty,4/18/2014,2014,4,18,2383,0,40.07984976,-88.20845604,Bombus impatiens,Bombus impatiens,,f,f,female,https://beespotter.org/bee/3561
3562,John Dahlstedt,4/19/2014,2014,4,19,2384,Bee 773 Champaign Cty,4/18/2014,2014,4,18,2383,1,40.07991797,-88.20842654,Bombus impatiens,Bombus impatiens,,f,f,female,https://beespotter.org/bee/3562
3563,John Dahlstedt,4/19/2014,2014,4,19,2384,Bee 774 Champaign Cty,4/18/2014,2014,4,18,2383,1,40.07988894,-88.20842519,Bombus impatiens,Bombus impatiens,,f,f,female,https://beespotter.org/bee/3563
3564,Jone,4/20/2014,2014,4,20,2385,McKinley Park,4/19/2014,2014,4,19,2384,1,41.8230344,-87.6815703,Apis mellifera,Apis mellifera,,f,f,female,https://beespotter.org/bee/3564
3567,John Dahlstedt,4/22/2014,2014,4,22,2387,Bee 775 Champaign Cty,4/22/2014,2014,4,22,2387,0,40.08699067,-88.20081174,Apis mellifera,Apis mellifera,,f,f,female,https://beespotter.org/bee/3567
3568,twotringas,4/28/2014,2014,4,28,2393,bimaculatus on Pansy,4/25/2014,2014,4,25,2390,3,42.30422953,-89.15654182,Bombus bimaculatus,Bombus bimaculatus,,f,f,female,https://beespotter.org/bee/3568
3571,celestia,4/29/2014,2014,4,29,2394,Bumble on pansy,4/25/2014,2014,4,25,2390,4,41.8142316,-88.0713062,,Bombus impatiens,,f,f,female,https://beespotter.org/bee/3571
3582,pgizyn,5/21/2014,2014,5,21,2416,Dan Ryan Woods Honeybee Trout lily,5/5/2014,2014,5,5,2400,16,41.73084248,-87.67132759,Apis mellifera,Apis mellifera,,f,f,female,https://beespotter.org/bee/3582
3671,twotringas,7/7/2014,2014,7,7,2463,bimaculatus queen on Bluebells,5/8/2014,2014,5,8,2403,60,42.304616,-89.15584686,Bombus bimaculatus,Bombus bimaculatus,,f,f,female,https://beespotter.org/bee/3671
3585,pgizyn,5/23/2014,2014,5,23,2418,Backyard Virginia Waterleaf Bee,5/23/2014,2014,5,23,2418,0,41.712344,-87.664477,Bombus bimaculatus,Bombus bimaculatus,,f,f,female,https://beespotter.org/bee/3585
3586,TER_OR,5/23/2014,2014,5,23,2418,B Auricomus 052314,5/23/2014,2014,5,23,2418,0,42.1028156,-88.27999324,Bombus auricomus,Bombus auricomus,,f,f,female,https://beespotter.org/bee/3586
3591,jbates,5/25/2014,2014,5,25,2420,"1207 Dobson, Evasnton",5/25/2014,2014,5,25,2420,0,42.02081854,-87.68907845,Bombus impatiens,Bombus impatiens,,f,f,female,https://beespotter.org/bee/3591
3592,John Dahlstedt,5/27/2014,2014,5,27,2422,Bee 776 Champaign Cty,5/25/2014,2014,5,25,2420,2,40.07142152,-87.98918009,Bombus impatiens,Bombus impatiens,,f,f,female,https://beespotter.org/bee/3592
3593,John Dahlstedt,5/27/2014,2014,5,27,2422,Bee 777 Champaign Cty,5/26/2014,2014,5,26,2421,1,40.08697616,-88.20101961,Apis mellifera,Apis mellifera,,f,f,female,https://beespotter.org/bee/3593
3595,Swalquist,5/27/2014,2014,5,27,2422,Honey Bee drinking,5/26/2014,2014,5,26,2421,1,41.883534,-87.780316,Apis mellifera,Apis mellifera,,f,f,female,https://beespotter.org/bee/3595
3602,elaines,6/10/2014,2014,6,10,2436,back yard clover honeybee,6/5/2014,2014,6,5,2431,5,39.2776787,-89.8795819,Apis mellifera,Apis mellifera,,f,f,female,https://beespotter.org/bee/3602
3600,greenqueen,6/9/2014,2014,6,9,2435,Cool Sunday Salvia,6/8/2014,2014,6,8,2434,1,41.873075,-87.9922069,Apis mellifera,Apis mellifera,,f,f,female,https://beespotter.org/bee/3600
3601,greenqueen,6/9/2014,2014,6,9,2435,Cool Sunday Penstemon,6/8/2014,2014,6,8,2434,1,41.873075,-87.9922069,,Apis mellifera,,f,f,female,https://beespotter.org/bee/3601
4716,lfelliott,2/7/2016,2016,2,7,3043,on Trifolium repens,6/8/2014,2014,6,8,2434,609,38.94613345,-92.44653778,Bombus impatiens,Bombus impatiens,,f,f,female,https://beespotter.org/bee/4716
3603,elaines,6/10/2014,2014,6,10,2436,back yard clover honeybee,6/9/2014,2014,6,9,2435,1,39.2776787,-89.8795819,Apis mellifera,Apis mellifera,,f,f,female,https://beespotter.org/bee/3603
3604,elaines,6/10/2014,2014,6,10,2436,back yard clover B,6/9/2014,2014,6,9,2435,1,39.2776787,-89.8795819,Bombus bimaculatus,Bombus bimaculatus,,f,f,female,https://beespotter.org/bee/3604
3605,elaines,6/10/2014,2014,6,10,2436,back yard clover B bimac,6/9/2014,2014,6,9,2435,1,39.2776787,-89.8795819,Bombus bimaculatus,Bombus bimaculatus,,f,f,female,https://beespotter.org/bee/3605
3609,celestia,6/15/2014,2014,6,15,2441,Bumble on salvia,6/14/2014,2014,6,14,2440,1,41.91156,-87.958727,,Bombus bimaculatus,,f,f,female,https://beespotter.org/bee/3609
3610,celestia,6/15/2014,2014,6,15,2441,Bee on salvia,6/14/2014,2014,6,14,2440,1,41.887061,-87.958958,,Apis mellifera,,f,f,female,https://beespotter.org/bee/3610
3611,veghed6,6/16/2014,2014,6,16,2442,Bee on Borage,6/16/2014,2014,6,16,2442,0,38.45436,-90.096203,,Bombus bimaculatus,,f,f,female,https://beespotter.org/bee/3611
3613,elaines,6/16/2014,2014,6,16,2442,griseocollis,6/16/2014,2014,6,16,2442,0,39.2776787,-89.8795819,Bombus griseocollis,Bombus griseocollis,,f,f,female,https://beespotter.org/bee/3613
3642,elaines,7/5/2014,2014,7,5,2461,B bimaculatus Lysimachia,6/16/2014,2014,6,16,2442,19,39.2776787,-89.8795819,Bombus bimaculatus,Bombus impatiens,,f,f,,https://beespotter.org/bee/3642
3625,TER_OR,6/20/2014,2014,6,20,2446,B Gris 062014 Fermi Int A,6/20/2014,2014,6,20,2446,0,41.84462903,-88.26617718,Bombus griseocollis,Bombus griseocollis,,f,f,female,https://beespotter.org/bee/3625
3626,TER_OR,6/20/2014,2014,6,20,2446,B Auricomus 062014 Fermi NRing,6/20/2014,2014,6,20,2446,0,41.83612443,-88.24888229,Bombus auricomus,Bombus auricomus,,f,f,female,https://beespotter.org/bee/3626
3627,TER_OR,6/20/2014,2014,6,20,2446,B Gris 062014 Fermi Nring A,6/20/2014,2014,6,20,2446,0,41.83868232,-88.24920416,Bombus griseocollis,Bombus griseocollis,,f,f,female,https://beespotter.org/bee/3627
3628,TER_OR,6/20/2014,2014,6,20,2446,Apis 062014 Fermi Int,6/20/2014,2014,6,20,2446,0,41.84341416,-88.26600552,Apis mellifera,Apis mellifera,,f,f,female,https://beespotter.org/bee/3628
3643,elaines,7/5/2014,2014,7,5,2461,B bimaculatus Lysimachia,6/21/2014,2014,6,21,2447,14,39.2776787,-89.8795819,Bombus bimaculatus,Bombus bimaculatus,,f,f,female,https://beespotter.org/bee/3643
3631,John Dahlstedt,6/23/2014,2014,6,23,2449,Bee 778 Champaign Cty,6/23/2014,2014,6,23,2449,0,40.07981929,-88.20679307,Apis mellifera,Apis mellifera,,f,f,female,https://beespotter.org/bee/3631
5481,nmplunkett,4/26/2017,2017,4,26,3487,Bumble Bee on Gentian,6/24/2014,2014,6,24,2450,1037,39.203098,-84.627925,,Bombus pensylvanicus,,f,f,female,https://beespotter.org/bee/5481
3644,elaines,7/5/2014,2014,7,5,2461,A mell Cranesbill Geranium,6/26/2014,2014,6,26,2452,9,39.7647147,-89.6153908,Apis mellifera,Apis mellifera,,f,f,female,https://beespotter.org/bee/3644
3645,elaines,7/5/2014,2014,7,5,2461,A mellifera Cranesbill Geranium,6/26/2014,2014,6,26,2452,9,39.7647147,-89.6153908,Apis mellifera,Apis mellifera,,f,f,female,https://beespotter.org/bee/3645
3675,TER_OR,7/9/2014,2014,7,9,2465,B Gris GRD 062814,6/28/2014,2014,6,28,2454,11,41.84658466,-88.214432,Bombus griseocollis,Bombus griseocollis,,f,f,female,https://beespotter.org/bee/3675
3676,TER_OR,7/9/2014,2014,7,9,2465,B Gris RRPP 062814,6/28/2014,2014,6,28,2454,11,41.85779321,-88.25245768,Bombus griseocollis,Bombus impatiens,,f,f,female,https://beespotter.org/bee/3676
3677,TER_OR,7/9/2014,2014,7,9,2465,Honeybee GRD 062814,6/28/2014,2014,6,28,2454,11,41.84659314,-88.21454331,Apis mellifera,Apis mellifera,,f,f,female,https://beespotter.org/bee/3677
3635,John Dahlstedt,7/1/2014,2014,7,1,2457,Bee 779 Champaign Cty,7/1/2014,2014,7,1,2457,0,40.08003987,-88.20839971,Bombus bimaculatus,Bombus bimaculatus,,f,f,male,https://beespotter.org/bee/3635
3636,John Dahlstedt,7/1/2014,2014,7,1,2457,Bee 780 Champaign Cty,7/1/2014,2014,7,1,2457,0,40.07998182,-88.20838764,Apis mellifera,Apis mellifera,,f,f,female,https://beespotter.org/bee/3636
3637,John Dahlstedt,7/1/2014,2014,7,1,2457,Bee 781 Champaign Cty,7/1/2014,2014,7,1,2457,0,40.08022997,-88.20820928,Bombus griseocollis,Bombus griseocollis,,f,f,male,https://beespotter.org/bee/3637
3646,elaines,7/5/2014,2014,7,5,2461,B griseocollis Concordia,7/2/2014,2014,7,2,2458,3,39.77437369,-89.72521305,Bombus griseocollis,Bombus griseocollis,,f,f,male,https://beespotter.org/bee/3646
3641,twotringas,7/4/2014,2014,7,4,2460,griseocollis on rose,7/3/2014,2014,7,3,2459,1,42.3027695,-89.15679932,Bombus griseocollis,Bombus griseocollis,,f,f,female,https://beespotter.org/bee/3641
3647,elaines,7/5/2014,2014,7,5,2461,B bimaculatus Salvia,7/3/2014,2014,7,3,2459,2,39.2776787,-89.8795819,Bombus bimaculatus,Bombus bimaculatus,,f,f,female,https://beespotter.org/bee/3647
3648,John Dahlstedt,7/5/2014,2014,7,5,2461,Bee 782 Champaign Cty,7/3/2014,2014,7,3,2459,2,40.07948342,-88.20025921,Bombus auricomus,Bombus auricomus,,f,f,female,https://beespotter.org/bee/3648
3649,John Dahlstedt,7/5/2014,2014,7,5,2461,Bee 783 Champaign Cty,7/3/2014,2014,7,3,2459,2,40.07958193,-88.20004463,,Bombus auricomus,,f,f,female,https://beespotter.org/bee/3649
3661,twotringas,7/6/2014,2014,7,6,2462,honey bee on Purple Coneflower,7/3/2014,2014,7,3,2459,3,42.304981,-89.156791,Apis mellifera,Apis mellifera,,f,f,female,https://beespotter.org/bee/3661
3662,twotringas,7/6/2014,2014,7,6,2462,impatiens on rose,7/3/2014,2014,7,3,2459,3,42.304981,-89.156791,Bombus impatiens,Bombus impatiens,,f,f,female,https://beespotter.org/bee/3662
3663,twotringas,7/6/2014,2014,7,6,2462,impatiens on rose,7/3/2014,2014,7,3,2459,3,42.30486432,-89.15662766,Bombus impatiens,Bombus impatiens,,f,f,female,https://beespotter.org/bee/3663
3650,John Dahlstedt,7/5/2014,2014,7,5,2461,Bee 784 Champaign Cty,7/4/2014,2014,7,4,2460,1,40.07999053,-88.20839971,Apis mellifera,Apis mellifera,,f,f,female,https://beespotter.org/bee/3650
3651,John Dahlstedt,7/5/2014,2014,7,5,2461,Bee 785 Champaign Cty,7/4/2014,2014,7,4,2460,1,40.0798933,-88.20841849,Apis mellifera,Apis mellifera,,f,f,female,https://beespotter.org/bee/3651
3652,John Dahlstedt,7/5/2014,2014,7,5,2461,Bee 786 Champaign Cty,7/4/2014,2014,7,4,2460,1,40.08003116,-88.20839435,Bombus bimaculatus,Bombus bimaculatus,,f,f,female,https://beespotter.org/bee/3652
3653,John Dahlstedt,7/5/2014,2014,7,5,2461,Bee 787 Champaign Cty,7/4/2014,2014,7,4,2460,1,40.0798933,-88.20841581,Apis mellifera,Apis mellifera,,f,f,female,https://beespotter.org/bee/3653
3654,John Dahlstedt,7/5/2014,2014,7,5,2461,Bee 788 Champaign Cty,7/4/2014,2014,7,4,2460,1,40.07981784,-88.2083407,Apis mellifera,Apis mellifera,,f,f,female,https://beespotter.org/bee/3654
3655,John Dahlstedt,7/5/2014,2014,7,5,2461,Bee 789 Champaign Cty,7/4/2014,2014,7,4,2460,1,40.0798933,-88.20841849,Apis mellifera,Apis mellifera,,f,f,female,https://beespotter.org/bee/3655
3656,John Dahlstedt,7/5/2014,2014,7,5,2461,Bee 790 Champaign Cty,7/4/2014,2014,7,4,2460,1,40.07992667,-88.20836619,Apis mellifera,Apis mellifera,,f,f,female,https://beespotter.org/bee/3656
3657,John Dahlstedt,7/5/2014,2014,7,5,2461,Bee 791 Champaign Cty,7/4/2014,2014,7,4,2460,1,40.07992522,-88.20836484,Apis mellifera,Apis mellifera,,f,f,female,https://beespotter.org/bee/3657
3658,John Dahlstedt,7/5/2014,2014,7,5,2461,Bee 792 Champaign Cty,7/4/2014,2014,7,4,2460,1,40.07992087,-88.2084091,Apis mellifera,Apis mellifera,,f,f,female,https://beespotter.org/bee/3658
3659,John Dahlstedt,7/5/2014,2014,7,5,2461,Bee 793 Champaign Cty,7/4/2014,2014,7,4,2460,1,40.08017338,-88.20823342,Bombus griseocollis,Bombus griseocollis,,f,f,male,https://beespotter.org/bee/3659
3669,Travis_Mahan,7/7/2014,2014,7,7,2463,Hitt's Siding Prairie Nature Preserve,7/4/2014,2014,7,4,2460,3,41.30128859,-88.17125916,Bombus fervidus,Bombus fervidus,,f,f,female,https://beespotter.org/bee/3669
3665,twotringas,7/7/2014,2014,7,7,2463,bimaculatus on Leadplant,7/6/2014,2014,7,6,2462,1,42.304981,-89.156791,Bombus bimaculatus,Bombus bimaculatus,,f,f,female,https://beespotter.org/bee/3665
3666,twotringas,7/7/2014,2014,7,7,2463,griseocollis on Purple Coneflower,7/6/2014,2014,7,6,2462,1,42.304981,-89.156791,Bombus griseocollis,Bombus griseocollis,,f,f,male,https://beespotter.org/bee/3666
3667,twotringas,7/7/2014,2014,7,7,2463,griseocollis on rose,7/7/2014,2014,7,7,2463,0,42.30510796,-89.15546062,Bombus griseocollis,Bombus griseocollis,,f,f,female,https://beespotter.org/bee/3667
3668,twotringas,7/7/2014,2014,7,7,2463,impatiens searching for nest site,7/7/2014,2014,7,7,2463,0,42.30510796,-89.15610435,Bombus impatiens,Bombus impatiens,,f,f,female,https://beespotter.org/bee/3668
3670,wscovill,7/7/2014,2014,7,7,2463,TrainStation,7/7/2014,2014,7,7,2463,0,41.7777778,-88.2086111,Bombus auricomus,Bombus auricomus,,f,f,female,https://beespotter.org/bee/3670
3679,maryg193,7/10/2014,2014,7,10,2466,Coneflower patio bee,7/7/2014,2014,7,7,2463,3,41.8994744,-87.9403418,Bombus griseocollis,Bombus griseocollis,,f,f,female,https://beespotter.org/bee/3679
3673,twotringas,7/9/2014,2014,7,9,2465,affinis on rose,7/9/2014,2014,7,9,2465,0,42.28685899,-89.16964071,Bombus affinis,Bombus affinis,,t,t,female,https://beespotter.org/bee/3673
3674,TER_OR,7/9/2014,2014,7,9,2465,B Bim EPP 062814,7/9/2014,2014,7,9,2465,0,41.84535971,-88.21634039,Bombus bimaculatus,Bombus bimaculatus,,f,f,female,https://beespotter.org/bee/3674
3683,twotringas,7/13/2014,2014,7,13,2469,vagans on Purple Coneflower,7/9/2014,2014,7,9,2465,4,42.304981,-89.156791,Bombus vagans,Bombus vagans,,f,f,female,https://beespotter.org/bee/3683
3688,twotringas,7/14/2014,2014,7,14,2470,griseocollis on rose,7/10/2014,2014,7,10,2466,4,42.304981,-89.156791,Bombus griseocollis,Bombus griseocollis,,f,f,female,https://beespotter.org/bee/3688
3680,maryg193,7/11/2014,2014,7,11,2467,Cone flowers front yard,7/11/2014,2014,7,11,2467,0,41.8994744,-87.9403418,Apis mellifera,Apis mellifera,,f,f,female,https://beespotter.org/bee/3680
3682,twotringas,7/13/2014,2014,7,13,2469,vagans on Bergamot,7/11/2014,2014,7,11,2467,2,42.304981,-89.156791,Bombus vagans,Bombus vagans,,f,f,female,https://beespotter.org/bee/3682
3684,twotringas,7/13/2014,2014,7,13,2469,affinis on rose,7/11/2014,2014,7,11,2467,2,42.35076629,-89.07250407,Bombus affinis,Bombus affinis,,t,t,female,https://beespotter.org/bee/3684
3685,twotringas,7/13/2014,2014,7,13,2469,impatiens at nest,7/11/2014,2014,7,11,2467,2,42.304981,-89.156791,Bombus impatiens,Bombus impatiens,,f,f,female,https://beespotter.org/bee/3685
3698,TER_OR,7/16/2014,2014,7,16,2472,Bimiculatus C 071114a,7/11/2014,2014,7,11,2467,5,41.84348609,-88.26721787,Bombus bimaculatus,Bombus bimaculatus,,f,f,female,https://beespotter.org/bee/3698
3699,TER_OR,7/16/2014,2014,7,16,2472,B fervidus C 071114,7/11/2014,2014,7,11,2467,5,41.84418545,-88.26681018,Bombus fervidus,Bombus fervidus,,f,f,female,https://beespotter.org/bee/3699
3700,TER_OR,7/16/2014,2014,7,16,2472,B rufocinctus 071114,7/11/2014,2014,7,11,2467,5,41.84362197,-88.26569974,Bombus rufocinctus,Bombus rufocinctus,,f,f,female,https://beespotter.org/bee/3700
3701,TER_OR,7/16/2014,2014,7,16,2472,B Gris INT A 071114,7/11/2014,2014,7,11,2467,5,41.84357801,-88.26550663,Bombus griseocollis,Bombus griseocollis,,f,f,female,https://beespotter.org/bee/3701
3702,TER_OR,7/16/2014,2014,7,16,2472,B Fervidus INT A 071114,7/11/2014,2014,7,11,2467,5,41.84361797,-88.26559782,Bombus fervidus,Bombus fervidus,,f,f,female,https://beespotter.org/bee/3702
3703,TER_OR,7/16/2014,2014,7,16,2472,B Auricomus A INT 071114,7/11/2014,2014,7,11,2467,5,41.84271879,-88.26602697,Bombus auricomus,Bombus auricomus,,f,f,female,https://beespotter.org/bee/3703
3704,TER_OR,7/16/2014,2014,7,16,2472,B Impatiens INT 071114,7/11/2014,2014,7,11,2467,5,41.84275076,-88.26616645,Bombus impatiens,Bombus impatiens,,f,f,female,https://beespotter.org/bee/3704
3705,TER_OR,7/16/2014,2014,7,16,2472,B bimiculatus B INT 071114,7/11/2014,2014,7,11,2467,5,41.84271879,-88.26626837,Bombus bimaculatus,Bombus bimaculatus,,f,f,female,https://beespotter.org/bee/3705
3706,TER_OR,7/16/2014,2014,7,16,2472,B auricomus B INT 071114,7/11/2014,2014,7,11,2467,5,41.84200743,-88.26638103,Bombus auricomus,Bombus auricomus,,f,f,female,https://beespotter.org/bee/3706
3707,TER_OR,7/16/2014,2014,7,16,2472,B Gris WH A 071114,7/11/2014,2014,7,11,2467,5,41.83950562,-88.26195002,Bombus griseocollis,Bombus griseocollis,,f,f,female,https://beespotter.org/bee/3707
3708,TER_OR,7/16/2014,2014,7,16,2472,B bimiculatus NR 071114,7/11/2014,2014,7,11,2467,5,41.83759523,-88.24931145,Bombus bimaculatus,Bombus bimaculatus,,f,f,female,https://beespotter.org/bee/3708
3686,twotringas,7/13/2014,2014,7,13,2469,bimaculatus on Bergamot,7/12/2014,2014,7,12,2468,1,42.45785071,-89.10375595,Bombus bimaculatus,Bombus bimaculatus,,f,f,female,https://beespotter.org/bee/3686
3692,Ravenb2,7/14/2014,2014,7,14,2470,Bumblebee1,7/12/2014,2014,7,12,2468,2,38.583819,-89.886252,Bombus bimaculatus,Bombus impatiens,,f,f,,https://beespotter.org/bee/3692
3693,Ravenb2,7/14/2014,2014,7,14,2470,Bumblebee2,7/12/2014,2014,7,12,2468,2,38.583819,-89.886252,Bombus affinis,Bombus griseocollis,,f,f,female,https://beespotter.org/bee/3693
3687,twotringas,7/13/2014,2014,7,13,2469,vagans on Purple Coneflower,7/13/2014,2014,7,13,2469,0,42.304981,-89.156791,Bombus vagans,Bombus vagans,,f,f,female,https://beespotter.org/bee/3687
3689,twotringas,7/14/2014,2014,7,14,2470,bimaculatus on Bergamot,7/13/2014,2014,7,13,2469,1,42.304981,-89.156791,Bombus bimaculatus,Bombus bimaculatus,,f,f,female,https://beespotter.org/bee/3689
3690,twotringas,7/14/2014,2014,7,14,2470,affinis on Bergamot,7/13/2014,2014,7,13,2469,1,42.29464603,-89.22272723,Bombus affinis,Bombus affinis,,t,t,female,https://beespotter.org/bee/3690
3691,twotringas,7/14/2014,2014,7,14,2470,griseocollis on Bergamot,7/13/2014,2014,7,13,2469,1,42.30451518,-89.15538311,Bombus griseocollis,Bombus griseocollis,,f,f,female,https://beespotter.org/bee/3691
3696,twotringas,7/15/2014,2014,7,15,2471,auricomus on Purple Coneflower,7/13/2014,2014,7,13,2469,2,42.30397562,-89.15568352,Bombus auricomus,Bombus auricomus,,f,f,female,https://beespotter.org/bee/3696
3697,twotringas,7/15/2014,2014,7,15,2471,auricomus on Bergamot,7/15/2014,2014,7,15,2471,0,42.30473736,-89.15594101,Bombus auricomus,Bombus auricomus,,f,f,female,https://beespotter.org/bee/3697
3927,poppe72,9/10/2014,2014,9,10,2528,bombus vagans on echinacea,7/15/2014,2014,7,15,2471,57,41.546721,-87.654319,Bombus vagans,Bombus vagans,,f,f,,https://beespotter.org/bee/3927
3710,tkdesign,7/16/2014,2014,7,16,2472,7-14-14bee,7/16/2014,2014,7,16,2472,0,41.110841,-87.859022,Bombus griseocollis,Bombus griseocollis,,f,f,female,https://beespotter.org/bee/3710
3712,peterwchen,7/16/2014,2014,7,16,2472,Danada,7/16/2014,2014,7,16,2472,0,41.82694714,-88.09544921,Bombus impatiens,Bombus impatiens,,f,f,female,https://beespotter.org/bee/3712
3713,peterwchen,7/16/2014,2014,7,16,2472,Kirt,7/16/2014,2014,7,16,2472,0,41.84041684,-88.07520926,Bombus auricomus,Bombus auricomus,,f,f,female,https://beespotter.org/bee/3713
3714,annerem,7/16/2014,2014,7,16,2472,#1,7/16/2014,2014,7,16,2472,0,42.275127,-89.07354,Bombus griseocollis,Bombus griseocollis,,f,f,female,https://beespotter.org/bee/3714
3715,annerem,7/16/2014,2014,7,16,2472,#2,7/16/2014,2014,7,16,2472,0,42.275127,-89.07354,Bombus auricomus,Bombus auricomus,,f,f,female,https://beespotter.org/bee/3715
3717,laceykim22,7/17/2014,2014,7,17,2473,Southwind Park,7/17/2014,2014,7,17,2473,0,39.73032672,-89.65616226,Bombus impatiens,Bombus griseocollis,,f,f,female,https://beespotter.org/bee/3717
3724,twotringas,7/20/2014,2014,7,20,2476,pennsylvanicus (?) on Bergamot,7/17/2014,2014,7,17,2473,3,42.304981,-89.156791,Bombus pensylvanicus,Bombus pensylvanicus,,f,f,female,https://beespotter.org/bee/3724
3742,twotringas,7/23/2014,2014,7,23,2479,Bimaculatus on Bergamot,7/17/2014,2014,7,17,2473,6,42.30426127,-89.15606976,Bombus bimaculatus,Bombus bimaculatus,,f,f,male,https://beespotter.org/bee/3742
3746,levernier,7/24/2014,2014,7,24,2480,bee #2,7/18/2014,2014,7,18,2474,6,42.42980995,-88.17436824,Bombus griseocollis,Bombus griseocollis,,f,f,,https://beespotter.org/bee/3746
3755,TER_OR,7/28/2014,2014,7,28,2484,Fervidus A 071814,7/18/2014,2014,7,18,2474,10,42.1013019,-88.277347,Bombus fervidus,Bombus fervidus,,f,f,female,https://beespotter.org/bee/3755
3756,TER_OR,7/28/2014,2014,7,28,2484,Rufocinctus 071814,7/18/2014,2014,7,18,2474,10,42.1013019,-88.277347,Bombus rufocinctus,Bombus rufocinctus,,f,f,female,https://beespotter.org/bee/3756
3814,levernier,8/11/2014,2014,8,11,2498,bee #1,7/18/2014,2014,7,18,2474,24,42.42977035,-88.17432532,Bombus vagans,Bombus bimaculatus,,f,f,female,https://beespotter.org/bee/3814
3721,twotringas,7/20/2014,2014,7,20,2476,affinis on Bergamot,7/19/2014,2014,7,19,2475,1,42.41331985,-89.1202147,Bombus affinis,Bombus affinis,,t,t,male,https://beespotter.org/bee/3721
3722,twotringas,7/20/2014,2014,7,20,2476,rufocinctus on Mountain Mint,7/19/2014,2014,7,19,2475,1,42.30397562,-89.15615559,Bombus rufocinctus,Bombus rufocinctus,,f,f,male,https://beespotter.org/bee/3722
3723,twotringas,7/20/2014,2014,7,20,2476,citrinus on Mountain Mint,7/19/2014,2014,7,19,2475,1,42.304981,-89.156791,Bombus citrinus,Bombus citrinus,,f,f,,https://beespotter.org/bee/3723
3738,twotringas,7/23/2014,2014,7,23,2479,Griseocollis on Bergamot,7/19/2014,2014,7,19,2475,4,42.45842062,-89.1097641,Bombus griseocollis,Bombus griseocollis,,f,f,,https://beespotter.org/bee/3738
3739,twotringas,7/23/2014,2014,7,23,2479,auricomus on Bergamot,7/19/2014,2014,7,19,2475,4,42.45930713,-89.10839081,Bombus auricomus,Bombus auricomus,,f,f,female,https://beespotter.org/bee/3739
3740,twotringas,7/23/2014,2014,7,23,2479,griseocollis on Purple Prairie Clover,7/19/2014,2014,7,19,2475,4,42.45842062,-89.10993576,Bombus griseocollis,Bombus griseocollis,,f,f,female,https://beespotter.org/bee/3740
3741,twotringas,7/23/2014,2014,7,23,2479,impatiens on Bergamot,7/19/2014,2014,7,19,2475,4,42.45842062,-89.10924911,Bombus impatiens,Bombus impatiens,,f,f,,https://beespotter.org/bee/3741
3725,tkdesign,7/20/2014,2014,7,20,2476,7-20-14fembee,7/20/2014,2014,7,20,2476,0,41.110841,-87.859022,Bombus auricomus,Bombus auricomus,,f,f,female,https://beespotter.org/bee/3725
3726,twotringas,7/21/2014,2014,7,21,2477,rufocinctus on Culver's Root,7/20/2014,2014,7,20,2476,1,42.304981,-89.156791,Bombus rufocinctus,Bombus rufocinctus,,f,f,female,https://beespotter.org/bee/3726
3730,twotringas,7/21/2014,2014,7,21,2477,Honey Bee on Mountain Mint,7/20/2014,2014,7,20,2476,1,42.304981,-89.156791,Apis mellifera,Apis mellifera,,f,f,female,https://beespotter.org/bee/3730
3731,twotringas,7/21/2014,2014,7,21,2477,vagans on Purple Coneflower,7/20/2014,2014,7,20,2476,1,42.30415018,-89.15561914,Bombus vagans,Bombus vagans,,f,f,female,https://beespotter.org/bee/3731
3732,twotringas,7/21/2014,2014,7,21,2477,Honey Bee on Mountain Mint,7/20/2014,2014,7,20,2476,1,42.30435649,-89.15611267,Apis mellifera,Apis mellifera,,f,f,female,https://beespotter.org/bee/3732
3733,esdimas,7/21/2014,2014,7,21,2477,20-Jul,7/20/2014,2014,7,20,2476,1,41.92343979,-87.70672539,Bombus griseocollis,Bombus griseocollis,,f,f,female,https://beespotter.org/bee/3733
3727,twotringas,7/21/2014,2014,7,21,2477,impatiens on Purple Coneflower,7/21/2014,2014,7,21,2477,0,42.304981,-89.156791,Bombus impatiens,Bombus impatiens,,f,f,female,https://beespotter.org/bee/3727
3728,twotringas,7/21/2014,2014,7,21,2477,griseocollis on Purple Coneflower,7/21/2014,2014,7,21,2477,0,42.304981,-89.156791,Bombus griseocollis,Bombus griseocollis,,f,f,female,https://beespotter.org/bee/3728
3729,twotringas,7/21/2014,2014,7,21,2477,bimaculatus on Bergamot,7/21/2014,2014,7,21,2477,0,42.304981,-89.156791,Bombus bimaculatus,Bombus bimaculatus,,f,f,female,https://beespotter.org/bee/3729
3743,twotringas,7/23/2014,2014,7,23,2479,rufocinctus onn Mountain Mint,7/23/2014,2014,7,23,2479,0,42.30441997,-89.15585518,Bombus rufocinctus,Bombus rufocinctus,,f,f,,https://beespotter.org/bee/3743
3747,Mark Allen,7/25/2014,2014,7,25,2481,Decessed,7/25/2014,2014,7,25,2481,0,41.844983,-88.314337,Bombus griseocollis,Bombus impatiens,,f,f,male,https://beespotter.org/bee/3747
3749,Mark Allen,7/25/2014,2014,7,25,2481,Bee 1,7/25/2014,2014,7,25,2481,0,41.844983,-88.314337,Apis mellifera,Apis mellifera,,f,f,female,https://beespotter.org/bee/3749
3750,bjverano,7/25/2014,2014,7,25,2481,red clover,7/25/2014,2014,7,25,2481,0,38.41737312,-90.04880906,Bombus auricomus,Bombus auricomus,,f,f,female,https://beespotter.org/bee/3750
3752,rdlp18,7/26/2014,2014,7,26,2482,Bumblebee on Ratibida pinnata,7/26/2014,2014,7,26,2482,0,41.9579778,-87.7004466,Bombus griseocollis,Bombus griseocollis,,f,f,male,https://beespotter.org/bee/3752
3753,rdlp18,7/26/2014,2014,7,26,2482,Bumblebee on Monarda,7/26/2014,2014,7,26,2482,0,41.9579778,-87.7004466,Bombus bimaculatus,Bombus bimaculatus,,f,f,female,https://beespotter.org/bee/3753
3926,poppe72,9/10/2014,2014,9,10,2528,honeybee,7/27/2014,2014,7,27,2483,45,41.546721,-87.654319,Apis mellifera,Apis mellifera,,f,f,female,https://beespotter.org/bee/3926
3761,twotringas,7/31/2014,2014,7,31,2487,vagans on Purple Prairie Clover,7/28/2014,2014,7,28,2484,3,42.45835729,-89.10615921,Bombus vagans,Bombus vagans,,f,f,female,https://beespotter.org/bee/3761
3765,twotringas,7/31/2014,2014,7,31,2487,Honey Bee on Mountain Mint,7/28/2014,2014,7,28,2484,3,42.30405496,-89.15536165,Apis mellifera,Apis mellifera,,f,f,female,https://beespotter.org/bee/3765
3818,TER_OR,8/12/2014,2014,8,12,2499,auricomus GP1 072814,7/28/2014,2014,7,28,2484,15,41.84688288,-88.21716785,Bombus auricomus,Bombus auricomus,,f,f,female,https://beespotter.org/bee/3818
3819,TER_OR,8/12/2014,2014,8,12,2499,auricomus IT1 072814,7/28/2014,2014,7,28,2484,15,41.84357401,-88.26661706,Bombus auricomus,Bombus auricomus,,f,f,female,https://beespotter.org/bee/3819
3821,TER_OR,8/12/2014,2014,8,12,2499,Fervidus 1 RRP 072814,7/28/2014,2014,7,28,2484,15,41.85978904,-88.25255156,Bombus fervidus,Bombus fervidus,,f,f,female,https://beespotter.org/bee/3821
3822,TER_OR,8/12/2014,2014,8,12,2499,honeybee IT 072814,7/28/2014,2014,7,28,2484,15,41.84275076,-88.26673508,Apis mellifera,Apis mellifera,,f,f,female,https://beespotter.org/bee/3822
3823,TER_OR,8/12/2014,2014,8,12,2499,impatiens 1 GP 072814,7/28/2014,2014,7,28,2484,15,41.84679376,-88.21441054,Bombus impatiens,Bombus impatiens,,f,f,female,https://beespotter.org/bee/3823
3824,TER_OR,8/12/2014,2014,8,12,2499,impatiens 1 IT 072814,7/28/2014,2014,7,28,2484,15,41.84295858,-88.26637566,Bombus impatiens,Bombus impatiens,,f,f,female,https://beespotter.org/bee/3824
3826,TER_OR,8/12/2014,2014,8,12,2499,impatiens 2 GP 072814,7/28/2014,2014,7,28,2484,15,41.84648327,-88.21427107,Bombus impatiens,Bombus impatiens,,f,f,female,https://beespotter.org/bee/3826
3827,TER_OR,8/12/2014,2014,8,12,2499,impatiens 2 RRP 072814,7/28/2014,2014,7,28,2484,15,41.86041231,-88.25237989,Bombus impatiens,Bombus impatiens,,f,f,female,https://beespotter.org/bee/3827
3828,TER_OR,8/12/2014,2014,8,12,2499,impatiens 3 GP 072814,7/28/2014,2014,7,28,2484,15,41.84548828,-88.21572483,,Bombus impatiens,,f,f,female,https://beespotter.org/bee/3828
3829,TER_OR,8/12/2014,2014,8,12,2499,impatiens 4 GP 072814,7/28/2014,2014,7,28,2484,15,41.84409353,-88.21747899,Bombus impatiens,Bombus impatiens,,f,f,female,https://beespotter.org/bee/3829
3830,TER_OR,8/12/2014,2014,8,12,2499,Rufocinctus IT 072814,7/28/2014,2014,7,28,2484,15,41.8430465,-88.26589823,Bombus rufocinctus,Bombus rufocinctus,,f,f,female,https://beespotter.org/bee/3830
3891,beach820,8/26/2014,2014,8,26,2513,Nature Museum,7/28/2014,2014,7,28,2484,29,41.9268032,-87.6353216,Bombus variabilis,Bombus bimaculatus,,f,f,female,https://beespotter.org/bee/3891
3762,twotringas,7/31/2014,2014,7,31,2487,rufocinctus on Purple Prairie Clover,7/29/2014,2014,7,29,2485,2,42.45895886,-89.10564423,Bombus rufocinctus,Bombus rufocinctus,,f,f,female,https://beespotter.org/bee/3762
3763,twotringas,7/31/2014,2014,7,31,2487,fervidus on Purple Prairie Clover,7/29/2014,2014,7,29,2485,2,42.45848394,-89.10581589,Bombus fervidus,Bombus fervidus,,f,f,female,https://beespotter.org/bee/3763
3764,twotringas,7/31/2014,2014,7,31,2487,rufocinctus on Purple Prairie Clover,7/29/2014,2014,7,29,2485,2,,,Bombus rufocinctus,Bombus rufocinctus,,f,f,male,https://beespotter.org/bee/3764
3769,twotringas,8/1/2014,2014,8,1,2488,affinis sleeping on Black-eyed Susan,7/29/2014,2014,7,29,2485,3,42.17476757,-89.08802085,Bombus affinis,Bombus affinis,,t,t,female,https://beespotter.org/bee/3769
3770,twotringas,8/1/2014,2014,8,1,2488,honey bee on Mountain Mint,7/29/2014,2014,7,29,2485,3,42.30422953,-89.15628433,Apis mellifera,Apis mellifera,,f,f,female,https://beespotter.org/bee/3770
3771,twotringas,8/1/2014,2014,8,1,2488,honey bee on Culver's Root,7/29/2014,2014,7,29,2485,3,42.30454692,-89.15624142,Apis mellifera,Apis mellifera,,f,f,female,https://beespotter.org/bee/3771
3772,twotringas,8/1/2014,2014,8,1,2488,Honey Bee on Mountain Mint,7/29/2014,2014,7,29,2485,3,42.30480084,-89.1561985,Apis mellifera,Apis mellifera,,f,f,female,https://beespotter.org/bee/3772
3773,twotringas,8/1/2014,2014,8,1,2488,Honey Bee on Mountain Mint,7/29/2014,2014,7,29,2485,3,42.30422953,-89.15576935,Apis mellifera,Apis mellifera,,f,f,female,https://beespotter.org/bee/3773
3774,twotringas,8/1/2014,2014,8,1,2488,Honey Bee on Mountain Mint,7/29/2014,2014,7,29,2485,3,42.3042454,-89.15574789,Apis mellifera,Apis mellifera,,f,f,female,https://beespotter.org/bee/3774
3775,twotringas,8/1/2014,2014,8,1,2488,Honey Bee on Mountain Mint,7/29/2014,2014,7,29,2485,3,42.30429301,-89.15589809,Apis mellifera,Apis mellifera,,f,f,female,https://beespotter.org/bee/3775
3767,cariferg,8/1/2014,2014,8,1,2488,01-Aug-14,8/1/2014,2014,8,1,2488,0,42.27527407,-88.30526244,Bombus impatiens,Bombus impatiens,,f,f,female,https://beespotter.org/bee/3767
3768,twotringas,8/1/2014,2014,8,1,2488,rufocinctus on Mountain Mint,8/1/2014,2014,8,1,2488,0,42.30415018,-89.15637016,Bombus rufocinctus,Bombus rufocinctus,,f,f,male,https://beespotter.org/bee/3768
3893,beach820,8/26/2014,2014,8,26,2513,Uncommon Ground,8/1/2014,2014,8,1,2488,25,41.8781136,-87.6297982,Bombus griseocollis,Bombus griseocollis,,f,f,female,https://beespotter.org/bee/3893
3782,Dave_K,8/6/2014,2014,8,6,2493,first bumble on Agastache,8/2/2014,2014,8,2,2489,4,41.9283761,-88.0754188,,Bombus impatiens,,f,f,female,https://beespotter.org/bee/3782
3783,Dave_K,8/6/2014,2014,8,6,2493,second bumble on Agastache,8/2/2014,2014,8,2,2489,4,41.93867968,-88.07825089,,Bombus bimaculatus,,f,f,female,https://beespotter.org/bee/3783
3784,Dave_K,8/6/2014,2014,8,6,2493,Third bumble on Agastache,8/2/2014,2014,8,2,2489,4,41.93842429,-88.07842255,,Bombus impatiens,,f,f,female,https://beespotter.org/bee/3784
3785,twotringas,8/6/2014,2014,8,6,2493,citrinus (?) on Mountain Mint,8/2/2014,2014,8,2,2489,4,42.30391214,-89.15594101,Bombus citrinus,Bombus citrinus,,f,f,,https://beespotter.org/bee/3785
3786,twotringas,8/6/2014,2014,8,6,2493,Rufocinctus on Mountain Mint,8/2/2014,2014,8,2,2489,4,42.30438823,-89.1556406,Bombus rufocinctus,Bombus rufocinctus,,f,f,,https://beespotter.org/bee/3786
4722,twotringas,2/17/2016,2016,2,17,3053,male Cuckoo Bee sp.?,8/2/2014,2014,8,2,2489,564,42.304981,-89.156791,,Bombus bimaculatus,,f,f,male,https://beespotter.org/bee/4722
3776,pgizyn,8/3/2014,2014,8,3,2490,Backyard Bergamot,8/3/2014,2014,8,3,2490,0,41.712344,-87.664477,Bombus pensylvanicus,Bombus pensylvanicus,,f,f,female,https://beespotter.org/bee/3776
3789,wscovill,8/8/2014,2014,8,8,2495,Clover,8/3/2014,2014,8,3,2490,5,41.726962,-88.266828,Bombus bimaculatus,Bombus griseocollis,,f,f,female,https://beespotter.org/bee/3789
3890,beach820,8/26/2014,2014,8,26,2513,Just SE of Apt.,8/3/2014,2014,8,3,2490,23,41.9551177,-87.676356,Bombus bimaculatus,Bombus bimaculatus,,f,f,female,https://beespotter.org/bee/3890
3815,lamtyug2,8/12/2014,2014,8,12,2499,Bumblebee 1,8/4/2014,2014,8,4,2491,8,39.77422777,-89.74567833,,Bombus bimaculatus,Bombus griseocollis,f,f,female,https://beespotter.org/bee/3815
3816,lamtyug2,8/12/2014,2014,8,12,2499,bumblebee 1,8/4/2014,2014,8,4,2491,8,39.77395566,-89.7455174,Bombus griseocollis,Bombus bimaculatus,Bombus griseocollis,f,f,female,https://beespotter.org/bee/3816
3778,hum3bd,8/5/2014,2014,8,5,2492,patio pot,8/5/2014,2014,8,5,2492,0,42.287131,-89.033415,Bombus affinis,Bombus impatiens,,f,f,female,https://beespotter.org/bee/3778
3779,tvelat,8/5/2014,2014,8,5,2492,23,8/5/2014,2014,8,5,2492,0,42.06982816,-88.19470357,Bombus affinis,Bombus affinis,,t,t,female,https://beespotter.org/bee/3779
3780,tkdesign,8/5/2014,2014,8,5,2492,bee8-5-14,8/5/2014,2014,8,5,2492,0,41.110841,-87.859022,Bombus citrinus,Bombus citrinus,,f,f,male,https://beespotter.org/bee/3780
3787,twotringas,8/6/2014,2014,8,6,2493,griseocollis on Gray-headed Coneflower,8/5/2014,2014,8,5,2492,1,42.30441997,-89.15589809,Bombus griseocollis,Bombus griseocollis,,f,f,male,https://beespotter.org/bee/3787
3804,twotringas,8/9/2014,2014,8,9,2496,auricomus on Purple Coneflower,8/5/2014,2014,8,5,2492,4,,,Bombus auricomus,Bombus auricomus,,f,f,female,https://beespotter.org/bee/3804
3788,dhale,8/7/2014,2014,8,7,2494,unknown bee,8/6/2014,2014,8,6,2493,1,40.29356774,-87.86072759,,Bombus griseocollis,,f,f,male,https://beespotter.org/bee/3788
3790,twotringas,8/8/2014,2014,8,8,2495,griseocollis on Purple Coneflower,8/7/2014,2014,8,7,2494,1,42.2447609,-89.113131,Bombus griseocollis,Bombus griseocollis,,f,f,,https://beespotter.org/bee/3790
3791,twotringas,8/8/2014,2014,8,8,2495,citrinus on Purple Coneflower,8/7/2014,2014,8,7,2494,1,42.2447609,-89.113131,Bombus citrinus,Bombus citrinus,,f,f,,https://beespotter.org/bee/3791
3792,twotringas,8/8/2014,2014,8,8,2495,rufocinctus on Purple Coneflower,8/7/2014,2014,8,7,2494,1,42.2447609,-89.113131,Bombus rufocinctus,Bombus rufocinctus,,f,f,,https://beespotter.org/bee/3792
3802,twotringas,8/9/2014,2014,8,9,2496,auricomus on Mountain Mint,8/7/2014,2014,8,7,2494,2,42.30386453,-89.15583372,Bombus auricomus,Bombus auricomus,,f,f,male,https://beespotter.org/bee/3802
4084,knobren,5/29/2015,2015,5,29,2789,bee on coreopsis?,8/7/2014,2014,8,7,2494,295,40.105089,-88.290995,Bombus bimaculatus,Bombus impatiens,,f,f,female,https://beespotter.org/bee/4084
3793,Kwilk,8/8/2014,2014,8,8,2495,Aug-14,8/8/2014,2014,8,8,2495,0,40.430495,-88.9324265,Apis mellifera,Apis mellifera,,f,f,female,https://beespotter.org/bee/3793
3797,MyBeeGarden,8/9/2014,2014,8,9,2496,Blondie the Bombus,8/8/2014,2014,8,8,2495,1,41.6122068,-87.8626928,Bombus fervidus,Bombus fervidus,,f,f,female,https://beespotter.org/bee/3797
3799,twotringas,8/9/2014,2014,8,9,2496,citrinus on Purple Coneflower,8/8/2014,2014,8,8,2495,1,42.3038804,-89.15568352,Bombus citrinus,Bombus citrinus,,f,f,,https://beespotter.org/bee/3799
3800,twotringas,8/9/2014,2014,8,9,2496,griseocollis on Purple Coneflower,8/8/2014,2014,8,8,2495,1,42.30391214,-89.15594101,Bombus griseocollis,Bombus griseocollis,,f,f,female,https://beespotter.org/bee/3800
3801,twotringas,8/9/2014,2014,8,9,2496,Honey Bee on Mountain Mint,8/8/2014,2014,8,8,2495,1,42.30416605,-89.15594101,Apis mellifera,Apis mellifera,,f,f,female,https://beespotter.org/bee/3801
3803,MyBeeGarden,8/9/2014,2014,8,9,2496,Busy Blondie the Bombus,8/8/2014,2014,8,8,2495,1,41.6122068,-87.8626928,Bombus fervidus,Bombus fervidus,,f,f,female,https://beespotter.org/bee/3803
3846,TER_OR,8/18/2014,2014,8,18,2505,affinis TM 080814,8/8/2014,2014,8,8,2495,10,42.04578849,-88.25432783,Bombus affinis,Bombus affinis,,t,t,male,https://beespotter.org/bee/3846
3847,TER_OR,8/18/2014,2014,8,18,2505,auricomus 1 IT 080814,8/8/2014,2014,8,8,2495,10,41.84252697,-88.26641858,Bombus auricomus,Bombus auricomus,,f,f,female,https://beespotter.org/bee/3847
3848,TER_OR,8/18/2014,2014,8,18,2505,griseocolis 1 NR 080814,8/8/2014,2014,8,8,2495,10,41.8370197,-88.24993372,Bombus griseocollis,Bombus griseocollis,,f,f,female,https://beespotter.org/bee/3848
3849,TER_OR,8/18/2014,2014,8,18,2505,honeybee 1 NR 080814,8/8/2014,2014,8,8,2495,10,41.83658806,-88.25052381,Apis mellifera,Apis mellifera,,f,f,female,https://beespotter.org/bee/3849
3850,TER_OR,8/18/2014,2014,8,18,2505,honeybee 1 IT 080814,8/8/2014,2014,8,8,2495,10,41.84289463,-88.26705962,Apis mellifera,Apis mellifera,,f,f,female,https://beespotter.org/bee/3850
3851,TER_OR,8/18/2014,2014,8,18,2505,honeybee 2 IT 080814,8/8/2014,2014,8,8,2495,10,41.84285467,-88.26727688,Apis mellifera,Apis mellifera,,f,f,female,https://beespotter.org/bee/3851
3852,TER_OR,8/18/2014,2014,8,18,2505,honeybee 3 IT 080814,8/8/2014,2014,8,8,2495,10,41.8430385,-88.26771677,Apis mellifera,Apis mellifera,,f,f,female,https://beespotter.org/bee/3852
3853,TER_OR,8/18/2014,2014,8,18,2505,impatiens 1 IT 080814,8/8/2014,2014,8,8,2495,10,41.84279872,-88.26706231,Bombus impatiens,Bombus impatiens,,f,f,female,https://beespotter.org/bee/3853
3854,TER_OR,8/18/2014,2014,8,18,2505,impatiens 1 NR 080814,8/8/2014,2014,8,8,2495,10,41.83681187,-88.24985862,Bombus impatiens,Bombus impatiens,,f,f,female,https://beespotter.org/bee/3854
3855,TER_OR,8/18/2014,2014,8,18,2505,impatiens 2 IT 080814,8/8/2014,2014,8,8,2495,10,41.84309445,-88.26794744,Bombus impatiens,Bombus impatiens,,f,f,female,https://beespotter.org/bee/3855
3856,TER_OR,8/18/2014,2014,8,18,2505,impatiens 2 NR 080814,8/8/2014,2014,8,8,2495,10,41.83634825,-88.25049162,Bombus impatiens,Bombus impatiens,,f,f,female,https://beespotter.org/bee/3856
3857,TER_OR,8/18/2014,2014,8,18,2505,Impatiens 3 NR 080814,8/8/2014,2014,8,8,2495,10,41.83890613,-88.25006247,Bombus impatiens,Bombus impatiens,,f,f,female,https://beespotter.org/bee/3857
3858,TER_OR,8/18/2014,2014,8,18,2505,impatiens 4 IT 080814,8/8/2014,2014,8,8,2495,10,41.84346211,-88.2682693,Bombus impatiens,Bombus impatiens,,f,f,female,https://beespotter.org/bee/3858
3859,TER_OR,8/18/2014,2014,8,18,2505,impatiens 5 IT 080814,8/8/2014,2014,8,8,2495,10,41.84265485,-88.26642931,Bombus impatiens,Bombus impatiens,,f,f,female,https://beespotter.org/bee/3859
3794,twotringas,8/9/2014,2014,8,9,2496,affinis on Cup Plant,8/9/2014,2014,8,9,2496,0,42.12847669,-89.15292698,Bombus affinis,Bombus affinis,,t,t,female,https://beespotter.org/bee/3794
3795,twotringas,8/9/2014,2014,8,9,2496,impatiens on Sweet Joe-pye-weed,8/9/2014,2014,8,9,2496,0,42.21300802,-89.20555115,Bombus impatiens,Bombus impatiens,,f,f,female,https://beespotter.org/bee/3795
3796,twotringas,8/9/2014,2014,8,9,2496,rufocinctus on Cup Plant,8/9/2014,2014,8,9,2496,0,42.21345301,-89.2040062,Bombus rufocinctus,Bombus rufocinctus,,f,f,,https://beespotter.org/bee/3796
3798,twotringas,8/9/2014,2014,8,9,2496,vagans on Purple Coneflower,8/9/2014,2014,8,9,2496,0,42.30400735,-89.15602684,Bombus vagans,Bombus vagans,,f,f,,https://beespotter.org/bee/3798
3884,twotringas,8/25/2014,2014,8,25,2512,bimaculatus on Bergamot,8/9/2014,2014,8,9,2496,16,42.30437236,-89.15646672,Bombus bimaculatus,Bombus bimaculatus,,f,f,female,https://beespotter.org/bee/3884
3805,twotringas,8/10/2014,2014,8,10,2497,Vagans on Marigold,8/10/2014,2014,8,10,2497,0,42.30403909,-89.15559769,Bombus vagans,Bombus vagans,,f,f,female,https://beespotter.org/bee/3805
3806,twotringas,8/10/2014,2014,8,10,2497,vagans on Purple Coneflower,8/10/2014,2014,8,10,2497,0,42.30426127,-89.15551186,Bombus vagans,Bombus vagans,,f,f,female,https://beespotter.org/bee/3806
3807,twotringas,8/10/2014,2014,8,10,2497,Honey Bee on Prairie Onion,8/10/2014,2014,8,10,2497,0,42.30391214,-89.15559769,Apis mellifera,Apis mellifera,,f,f,female,https://beespotter.org/bee/3807
3808,twotringas,8/10/2014,2014,8,10,2497,citrinus captured by Assassin Bug,8/10/2014,2014,8,10,2497,0,42.35912363,-89.16642845,Bombus citrinus,Bombus citrinus,,f,f,,https://beespotter.org/bee/3808
3809,twotringas,8/10/2014,2014,8,10,2497,griseocollis on Purple Coneflower,8/10/2014,2014,8,10,2497,0,42.35895617,-89.16641235,Bombus griseocollis,Bombus griseocollis,,f,f,male,https://beespotter.org/bee/3809
3810,twotringas,8/10/2014,2014,8,10,2497,impatiens on Sunflower,8/10/2014,2014,8,10,2497,0,42.35879761,-89.16675568,Bombus impatiens,Bombus impatiens,,f,f,female,https://beespotter.org/bee/3810
3812,twotringas,8/11/2014,2014,8,11,2498,fervidus on Prairie Thistle,8/11/2014,2014,8,11,2498,0,42.30413431,-89.15568352,Bombus fervidus,Bombus fervidus,,f,f,male,https://beespotter.org/bee/3812
3813,rdlp18,8/11/2014,2014,8,11,2498,Bumblebees on Monarda,8/11/2014,2014,8,11,2498,0,41.9579778,-87.7004466,Bombus fervidus,Bombus fervidus,,f,f,female,https://beespotter.org/bee/3813
3817,lamtyug2,8/12/2014,2014,8,12,2499,bumblebee 2,8/12/2014,2014,8,12,2499,0,39.77395154,-89.74553081,Bombus fervidus,Bombus fervidus,,f,f,male,https://beespotter.org/bee/3817
3820,TER_OR,8/12/2014,2014,8,12,2499,auricomus RRPP 072814,8/12/2014,2014,8,12,2499,0,41.86010068,-88.25274467,Bombus auricomus,Bombus auricomus,,f,f,female,https://beespotter.org/bee/3820
3825,TER_OR,8/12/2014,2014,8,12,2499,impatiens 1 RRP 072814,8/12/2014,2014,8,12,2499,0,41.85998082,-88.25243354,Bombus impatiens,Bombus impatiens,,f,f,female,https://beespotter.org/bee/3825
3837,twotringas,8/18/2014,2014,8,18,2505,rufocinctus on vervain,8/14/2014,2014,8,14,2501,4,42.45978205,-89.10546184,Bombus rufocinctus,Bombus rufocinctus,,f,f,female,https://beespotter.org/bee/3837
3838,twotringas,8/18/2014,2014,8,18,2505,citrinus on Rosinweed,8/14/2014,2014,8,14,2501,4,42.4594971,-89.10521507,Bombus rufocinctus,Bombus citrinus,,f,f,male,https://beespotter.org/bee/3838
3839,twotringas,8/18/2014,2014,8,18,2505,rufocinctus on Rosinweed,8/14/2014,2014,8,14,2501,4,42.45933879,-89.10669565,Bombus rufocinctus,Bombus rufocinctus,,f,f,female,https://beespotter.org/bee/3839
3840,twotringas,8/18/2014,2014,8,18,2505,vagans on Bergamot,8/14/2014,2014,8,14,2501,4,42.45968707,-89.10547256,Bombus vagans,Bombus vagans,,f,f,,https://beespotter.org/bee/3840
3841,twotringas,8/18/2014,2014,8,18,2505,auricomus on Bergamot,8/14/2014,2014,8,14,2501,4,42.45943378,-89.1064167,Bombus auricomus,Bombus auricomus,,f,f,male,https://beespotter.org/bee/3841
3843,twotringas,8/18/2014,2014,8,18,2505,impatiens on vervain,8/14/2014,2014,8,14,2501,4,42.45975039,-89.10465717,,Bombus impatiens,,f,f,female,https://beespotter.org/bee/3843
3842,twotringas,8/18/2014,2014,8,18,2505,citrinus on Rosinweed,8/15/2014,2014,8,15,2502,3,42.30448345,-89.15633798,Bombus citrinus,Bombus citrinus,,f,f,male,https://beespotter.org/bee/3842
3844,twotringas,8/18/2014,2014,8,18,2505,affinis on Purple Coneflower,8/16/2014,2014,8,16,2503,2,42.39099676,-89.16046719,Bombus affinis,Bombus affinis,,t,t,male,https://beespotter.org/bee/3844
3845,twotringas,8/18/2014,2014,8,18,2505,affinis on Rosinweed,8/17/2014,2014,8,17,2504,1,42.31375301,-89.23890174,Bombus affinis,Bombus affinis,,t,t,female,https://beespotter.org/bee/3845
3860,arebee,8/18/2014,2014,8,18,2505,church,8/17/2014,2014,8,17,2504,1,40.09178182,-88.29354376,Apis mellifera,Apis mellifera,,f,f,female,https://beespotter.org/bee/3860
3863,twotringas,8/20/2014,2014,8,20,2507,vagans on Rosinweed,8/17/2014,2014,8,17,2504,3,42.30455486,-89.1560483,Bombus vagans,Bombus vagans,,f,f,male,https://beespotter.org/bee/3863
3864,twotringas,8/20/2014,2014,8,20,2507,griseocollis on Purple Coneflower,8/18/2014,2014,8,18,2505,2,42.3044041,-89.15662766,Bombus griseocollis,Bombus griseocollis,,f,f,male,https://beespotter.org/bee/3864
3862,samlindgren,8/19/2014,2014,8,19,2506,Homer Lake 1,8/19/2014,2014,8,19,2506,0,40.0667195,-87.9876784,Bombus variabilis,Bombus griseocollis,,f,f,male,https://beespotter.org/bee/3862
3866,twotringas,8/20/2014,2014,8,20,2507,citrinus on hydrangea,8/19/2014,2014,8,19,2506,1,42.24481713,-89.11195278,Bombus citrinus,Bombus citrinus,,f,f,,https://beespotter.org/bee/3866
3867,twotringas,8/20/2014,2014,8,20,2507,rufocinctus on Purple Coneflower,8/19/2014,2014,8,19,2506,1,42.24500774,-89.11216736,Bombus rufocinctus,Bombus rufocinctus,,f,f,male,https://beespotter.org/bee/3867
3868,twotringas,8/20/2014,2014,8,20,2507,fervidus on Butterfly Bush,8/19/2014,2014,8,19,2506,1,42.2453572,-89.11242485,Bombus fervidus,Bombus fervidus,,f,f,male,https://beespotter.org/bee/3868
3869,twotringas,8/21/2014,2014,8,21,2508,affinis on goldenrod,8/19/2014,2014,8,19,2506,2,42.27311623,-89.00547413,Bombus affinis,Bombus affinis,,t,t,female,https://beespotter.org/bee/3869
3870,twotringas,8/21/2014,2014,8,21,2508,vagans on Purple Coneflower,8/19/2014,2014,8,19,2506,2,42.24523013,-89.11225319,Bombus vagans,Bombus vagans,,f,f,female,https://beespotter.org/bee/3870
3871,twotringas,8/21/2014,2014,8,21,2508,griseocollis on Purple Coneflower,8/19/2014,2014,8,19,2506,2,42.2453572,-89.11259651,Bombus griseocollis,Bombus griseocollis,,f,f,,https://beespotter.org/bee/3871
4509,twotringas,8/20/2015,2015,8,20,2872,Possible perplexus from last year on Butterfly Bush,8/19/2014,2014,8,19,2506,366,42.2447959,-89.1130122,Bombus perplexus,Bombus perplexus,,f,f,male,https://beespotter.org/bee/4509
3872,twotringas,8/21/2014,2014,8,21,2508,bimaculatus on sedum,8/20/2014,2014,8,20,2507,1,42.30434845,-89.15661693,Bombus bimaculatus,Bombus bimaculatus,,f,f,female,https://beespotter.org/bee/3872
3877,twotringas,8/25/2014,2014,8,25,2512,affinis on Joe-pye Weed,8/22/2014,2014,8,22,2509,3,42.52087604,-89.03984012,Bombus affinis,Bombus affinis,,t,t,female,https://beespotter.org/bee/3877
3878,twotringas,8/25/2014,2014,8,25,2512,citrinus on Vervain,8/22/2014,2014,8,22,2509,3,42.38936042,-88.99904251,Bombus citrinus,Bombus citrinus,,f,f,,https://beespotter.org/bee/3878
3879,twotringas,8/25/2014,2014,8,25,2512,rufocinctus on Joe-pye Weed,8/22/2014,2014,8,22,2509,3,42.38917024,-88.99869919,Bombus rufocinctus,Bombus rufocinctus,,f,f,male,https://beespotter.org/bee/3879
3880,twotringas,8/25/2014,2014,8,25,2512,impatiens on Joe-pye Weed,8/22/2014,2014,8,22,2509,3,42.38943966,-88.99850607,Bombus impatiens,Bombus impatiens,,f,f,male,https://beespotter.org/bee/3880
3881,twotringas,8/25/2014,2014,8,25,2512,fervidus on Prairie Thistle,8/22/2014,2014,8,22,2509,3,42.38959814,-88.99927855,Bombus fervidus,Bombus fervidus,,f,f,male,https://beespotter.org/bee/3881
3882,twotringas,8/25/2014,2014,8,25,2512,auricomus on Prairie Thistle,8/22/2014,2014,8,22,2509,3,42.38888497,-88.99925709,Bombus auricomus,Bombus auricomus,,f,f,male,https://beespotter.org/bee/3882
3883,twotringas,8/25/2014,2014,8,25,2512,griseocollis on Prairie Thistle,8/22/2014,2014,8,22,2509,3,42.38898006,-88.99904251,Bombus griseocollis,Bombus griseocollis,,f,f,male,https://beespotter.org/bee/3883
3897,jpatric694,8/29/2014,2014,8,29,2516,Bombus affinis,8/23/2014,2014,8,23,2510,6,42.0747149,-88.26706745,Bombus affinis,Bombus affinis,,t,t,male,https://beespotter.org/bee/3897
3876,peterwchen,8/25/2014,2014,8,25,2512,Herrick Lake,8/24/2014,2014,8,24,2511,1,41.81760862,-88.14449072,Bombus auricomus,Bombus auricomus,,f,f,female,https://beespotter.org/bee/3876
3885,maribel,8/25/2014,2014,8,25,2512,Bees living under my stoop,8/25/2014,2014,8,25,2512,0,42.16238549,-88.42552185,,Bombus impatiens,,f,f,female,https://beespotter.org/bee/3885
3886,arebee,8/25/2014,2014,8,25,2512,yard,8/25/2014,2014,8,25,2512,0,40.0919095,-88.28841202,Apis mellifera,Apis mellifera,,f,f,female,https://beespotter.org/bee/3886
3899,twotringas,8/30/2014,2014,8,30,2517,bimaculatus on Prairie Thistle,8/26/2014,2014,8,26,2513,4,42.21288087,-89.20426369,Bombus bimaculatus,Bombus bimaculatus,,f,f,female,https://beespotter.org/bee/3899
3900,twotringas,8/30/2014,2014,8,30,2517,citrinus on Prairie Thistle,8/26/2014,2014,8,26,2513,4,42.21319873,-89.20439243,Bombus citrinus,Bombus citrinus,,f,f,,https://beespotter.org/bee/3900
3901,twotringas,8/30/2014,2014,8,30,2517,affinis on Prairie Thistle,8/26/2014,2014,8,26,2513,4,42.29351125,-89.13714089,Bombus affinis,Bombus affinis,,t,t,female,https://beespotter.org/bee/3901
3902,twotringas,8/30/2014,2014,8,30,2517,griseocollis on Prairie Thistle,8/26/2014,2014,8,26,2513,4,42.21307159,-89.2043066,Bombus griseocollis,Bombus griseocollis,,f,f,,https://beespotter.org/bee/3902
3903,twotringas,8/30/2014,2014,8,30,2517,vagans on Prairie Thistle,8/26/2014,2014,8,26,2513,4,42.21269016,-89.20392036,Bombus vagans,Bombus vagans,,f,f,male,https://beespotter.org/bee/3903
3904,twotringas,8/30/2014,2014,8,30,2517,fervidus on Prairie Thistle,8/26/2014,2014,8,26,2513,4,42.21294444,-89.20392036,Bombus fervidus,Bombus fervidus,,f,f,,https://beespotter.org/bee/3904
3906,twotringas,8/30/2014,2014,8,30,2517,rufocinctus on Goldenrod,8/26/2014,2014,8,26,2513,4,42.21262659,-89.2037487,Bombus rufocinctus,Bombus rufocinctus,,f,f,male,https://beespotter.org/bee/3906
3907,twotringas,8/30/2014,2014,8,30,2517,impatiens on Prairie Thistle,8/26/2014,2014,8,26,2513,4,42.21313516,-89.20456409,Bombus impatiens,Bombus impatiens,,f,f,female,https://beespotter.org/bee/3907
3908,twotringas,8/30/2014,2014,8,30,2517,auricomus on Prairie THistle,8/26/2014,2014,8,26,2513,4,42.21294444,-89.20392036,Bombus auricomus,Bombus auricomus,,f,f,female,https://beespotter.org/bee/3908
3948,twotringas,9/27/2014,2014,9,27,2545,Queen fervidus on Cream Gentian,8/27/2014,2014,8,27,2514,31,42.30362251,-89.15611804,Bombus fervidus,Bombus fervidus,,f,f,female,https://beespotter.org/bee/3948
3898,maybee,8/29/2014,2014,8,29,2516,Campus Bombus impatiens,8/29/2014,2014,8,29,2516,0,40.1043117,-88.22304726,Bombus impatiens,Bombus impatiens,,f,f,female,https://beespotter.org/bee/3898
5121,mmckelve,8/10/2016,2016,8,10,3228,Home Depot bee,8/30/2014,2014,8,30,2517,711,40.13301289,-88.25714277,Apis mellifera,Apis mellifera,,f,f,female,https://beespotter.org/bee/5121
3914,wscovill,9/2/2014,2014,9,2,2520,Agastache,8/31/2014,2014,8,31,2518,2,41.726962,-88.266828,Bombus fervidus,Bombus fervidus,,f,f,,https://beespotter.org/bee/3914
3922,hum3bd,9/9/2014,2014,9,9,2527,Rebecca bee,8/31/2014,2014,8,31,2518,9,42.2864516,-89.0321464,,Bombus fervidus,,f,f,,https://beespotter.org/bee/3922
3915,margeryosborne,9/2/2014,2014,9,2,2520,in clematis,9/2/2014,2014,9,2,2520,0,40.094685,-88.256461,Apis mellifera,Apis mellifera,,f,f,female,https://beespotter.org/bee/3915
5120,mmckelve,8/10/2016,2016,8,10,3228,Bees appreciate the Blind Pig Brewery fountain,9/2/2014,2014,9,2,2520,708,40.117134,-88.24301946,Apis mellifera,Apis mellifera,,f,f,female,https://beespotter.org/bee/5120
3920,peterwchen,9/3/2014,2014,9,3,2521,COD,9/3/2014,2014,9,3,2521,0,41.84071258,-88.07596028,Bombus griseocollis,Bombus griseocollis,,f,f,female,https://beespotter.org/bee/3920
3924,poppe72,9/10/2014,2014,9,10,2528,bombus vagans on joe pye weed,9/4/2014,2014,9,4,2522,6,41.546721,-87.654319,Bombus vagans,Bombus vagans,,f,f,female,https://beespotter.org/bee/3924
3925,poppe72,9/10/2014,2014,9,10,2528,bombus griseocollis on aster and joe pye,9/9/2014,2014,9,9,2527,1,41.546721,-87.654319,Bombus griseocollis,Bombus griseocollis,,f,f,male,https://beespotter.org/bee/3925
3952,TER_OR,10/1/2014,2014,10,1,2549,Impatiens 1 IT 090914,9/9/2014,2014,9,9,2527,22,41.84268682,-88.26684237,Bombus impatiens,Bombus griseocollis,,f,f,male,https://beespotter.org/bee/3952
3953,TER_OR,10/1/2014,2014,10,1,2549,honeybee 1 IT 090914,9/9/2014,2014,9,9,2527,22,41.84265485,-88.26627374,Apis mellifera,Apis mellifera,,f,f,female,https://beespotter.org/bee/3953
3954,TER_OR,10/1/2014,2014,10,1,2549,impatiens 3 IT 090914,9/9/2014,2014,9,9,2527,22,41.84263087,-88.26622009,Bombus impatiens,Bombus impatiens,,f,f,female,https://beespotter.org/bee/3954
3955,TER_OR,10/1/2014,2014,10,1,2549,impatiens 4 IT 090914,9/9/2014,2014,9,9,2527,22,41.84275876,-88.26544762,Bombus impatiens,Bombus impatiens,,f,f,female,https://beespotter.org/bee/3955
3956,TER_OR,10/1/2014,2014,10,1,2549,affinis 1 IT 090914,9/9/2014,2014,9,9,2527,22,41.73228354,-88.24051877,Bombus affinis,Bombus affinis,,t,t,female,https://beespotter.org/bee/3956
3958,TER_OR,10/1/2014,2014,10,1,2549,impatiens 1 NR 090914,9/9/2014,2014,9,9,2527,22,41.83757924,-88.25145721,Bombus impatiens,Bombus impatiens,,f,f,female,https://beespotter.org/bee/3958
3959,TER_OR,10/1/2014,2014,10,1,2549,impatiens 2 NR 090914,9/9/2014,2014,9,9,2527,22,41.83903403,-88.25102806,Bombus impatiens,Bombus impatiens,,f,f,female,https://beespotter.org/bee/3959
3928,poppe72,9/10/2014,2014,9,10,2528,bee 6:00 pm joe pye,9/10/2014,2014,9,10,2528,0,41.546721,-87.654319,Bombus impatiens,Bombus impatiens,,f,f,female,https://beespotter.org/bee/3928
3929,poppe72,9/10/2014,2014,9,10,2528,another evening bee,9/10/2014,2014,9,10,2528,0,41.546721,-87.654319,Bombus bimaculatus,Bombus bimaculatus,,f,f,female,https://beespotter.org/bee/3929
3931,peterwchen,9/13/2014,2014,9,13,2531,Seed Collecting,9/13/2014,2014,9,13,2531,0,41.8387143,-88.07466745,Bombus griseocollis,Bombus impatiens,,f,f,female,https://beespotter.org/bee/3931
4131,lfelliott,6/21/2015,2015,6,21,2812,spider caught,9/13/2014,2014,9,13,2531,281,38.9467895,-92.4462802,Bombus impatiens,Bombus impatiens,,f,f,female,https://beespotter.org/bee/4131
3933,arebee,9/16/2014,2014,9,16,2534,backfence,9/14/2014,2014,9,14,2532,2,40.09291233,-88.28909129,Bombus affinis,Bombus griseocollis,,f,f,female,https://beespotter.org/bee/3933
3934,peterwchen,9/16/2014,2014,9,16,2534,Danada,9/16/2014,2014,9,16,2534,0,41.8265474,-88.09550285,Bombus impatiens,Bombus impatiens,,f,f,female,https://beespotter.org/bee/3934
3935,twotringas,9/18/2014,2014,9,18,2536,impatiens on sedum,9/16/2014,2014,9,16,2534,2,42.30435649,-89.15656865,Bombus impatiens,Bombus impatiens,,f,f,male,https://beespotter.org/bee/3935
3940,poppe72,9/22/2014,2014,9,22,2540,common eastern bumblebee on asters,9/16/2014,2014,9,16,2534,6,41.546721,-87.654319,Bombus impatiens,Bombus impatiens,,f,f,female,https://beespotter.org/bee/3940
3936,twotringas,9/18/2014,2014,9,18,2536,citrinus on New England Aster,9/17/2014,2014,9,17,2535,1,42.30432475,-89.15649891,Bombus citrinus,Bombus citrinus,,f,f,,https://beespotter.org/bee/3936
3961,TER_OR,10/6/2014,2014,10,6,2554,impatiens 1 RRPP 092014,9/20/2014,2014,9,20,2538,16,41.85505043,-88.2536459,Bombus impatiens,Bombus impatiens,,f,f,female,https://beespotter.org/bee/3961
3962,TER_OR,10/6/2014,2014,10,6,2554,auricomus 1 RRP 092014,9/20/2014,2014,9,20,2538,16,41.85863039,-88.25263739,Bombus auricomus,Bombus auricomus,,f,f,female,https://beespotter.org/bee/3962
3963,TER_OR,10/6/2014,2014,10,6,2554,impatiens 2 RRPP 092014,9/20/2014,2014,9,20,2538,16,41.85837469,-88.25336695,Bombus impatiens,Bombus impatiens,,f,f,female,https://beespotter.org/bee/3963
3964,TER_OR,10/6/2014,2014,10,6,2554,impatiens 2 RRPP 092014,9/20/2014,2014,9,20,2538,16,41.85958928,-88.25059891,Bombus impatiens,Bombus impatiens,,f,f,male,https://beespotter.org/bee/3964
3965,TER_OR,10/6/2014,2014,10,6,2554,impatiens 4 RRP 092014,9/20/2014,2014,9,20,2538,16,41.85815094,-88.25291634,Bombus impatiens,Bombus impatiens,,f,f,female,https://beespotter.org/bee/3965
3967,TER_OR,10/6/2014,2014,10,6,2554,impatiens 3 RRP 092014,9/20/2014,2014,9,20,2538,16,41.85981301,-88.2536459,Bombus impatiens,Bombus impatiens,,f,f,male,https://beespotter.org/bee/3967
3968,TER_OR,10/6/2014,2014,10,6,2554,honeybee 1 GP 092014,9/20/2014,2014,9,20,2538,16,41.84400561,-88.21766138,Apis mellifera,Apis mellifera,,f,f,female,https://beespotter.org/bee/3968
3969,TER_OR,10/6/2014,2014,10,6,2554,impatiens 6 GP 092014,9/20/2014,2014,9,20,2538,16,41.84405357,-88.21751118,Bombus impatiens,Bombus impatiens,,f,f,female,https://beespotter.org/bee/3969
3970,TER_OR,10/6/2014,2014,10,6,2554,impatiens 7 GP 092014,9/20/2014,2014,9,20,2538,16,41.84431732,-88.21699619,Bombus impatiens,Bombus impatiens,,f,f,female,https://beespotter.org/bee/3970
3971,TER_OR,10/6/2014,2014,10,6,2554,impatiens 5 GP 092014,9/20/2014,2014,9,20,2538,16,41.84490078,-88.21669579,Bombus impatiens,Bombus impatiens,,f,f,female,https://beespotter.org/bee/3971
3972,TER_OR,10/6/2014,2014,10,6,2554,impatiens 2 GP 072814,9/20/2014,2014,9,20,2538,16,41.84505264,-88.21606278,Bombus impatiens,Bombus impatiens,,f,f,female,https://beespotter.org/bee/3972
3938,arebee,9/21/2014,2014,9,21,2539,park,9/21/2014,2014,9,21,2539,0,40.09133851,-88.29427332,Bombus affinis,Bombus impatiens,,f,f,female,https://beespotter.org/bee/3938
3939,arebee,9/21/2014,2014,9,21,2539,fence,9/21/2014,2014,9,21,2539,0,40.09295337,-88.28908056,Bombus griseocollis,Bombus griseocollis,,f,f,female,https://beespotter.org/bee/3939
3941,poppe72,9/22/2014,2014,9,22,2540,bombus impatien on aster,9/22/2014,2014,9,22,2540,0,41.546721,-87.654319,Bombus impatiens,Bombus impatiens,,f,f,male,https://beespotter.org/bee/3941
3950,twotringas,9/27/2014,2014,9,27,2545,Queen impatiens on marigold,9/22/2014,2014,9,22,2540,5,42.30434062,-89.15656328,Bombus impatiens,Bombus impatiens,,f,f,female,https://beespotter.org/bee/3950
3942,poppe72,9/23/2014,2014,9,23,2541,honey bee on aster,9/23/2014,2014,9,23,2541,0,41.546721,-87.654319,Apis mellifera,Apis mellifera,,f,f,female,https://beespotter.org/bee/3942
3949,twotringas,9/27/2014,2014,9,27,2545,queen auricomus on marigold,9/24/2014,2014,9,24,2542,3,,,Bombus auricomus,Bombus auricomus,,f,f,female,https://beespotter.org/bee/3949
3945,Jenny_Brewer,9/27/2014,2014,9,27,2545,Pollinariam Prairie,9/27/2014,2014,9,27,2545,0,40.0885786,-88.21326256,Bombus impatiens,Bombus impatiens,,f,f,male,https://beespotter.org/bee/3945
3946,Melou88,9/27/2014,2014,9,27,2545,Entice Illinois Pollinators,9/27/2014,2014,9,27,2545,0,40.08657579,-88.21426034,,Bombus impatiens,,f,f,female,https://beespotter.org/bee/3946
3947,cindy87h,9/27/2014,2014,9,27,2545,workshop,9/27/2014,2014,9,27,2545,0,40.08490127,-88.21549416,,Bombus impatiens,,f,f,,https://beespotter.org/bee/3947
3987,sweaver,11/1/2014,2014,11,1,2580,St. Louis Zoo,10/19/2014,2014,10,19,2567,13,38.6350068,-90.2907165,,Apis mellifera,,f,f,female,https://beespotter.org/bee/3987
3980,twotringas,10/28/2014,2014,10,28,2576,impatiens queen on Marigold,10/25/2014,2014,10,25,2573,3,42.30431681,-89.1567564,Bombus impatiens,Bombus impatiens,,f,f,female,https://beespotter.org/bee/3980
3981,twotringas,10/28/2014,2014,10,28,2576,honey bee on Cosmos,10/25/2014,2014,10,25,2573,3,42.30432475,-89.1566813,Apis mellifera,Apis mellifera,,f,f,female,https://beespotter.org/bee/3981
3978,arebee,10/26/2014,2014,10,26,2574,Lake of the Woods,10/26/2014,2014,10,26,2574,0,40.20555404,-88.39505732,Apis mellifera,Apis mellifera,,f,f,female,https://beespotter.org/bee/3978
3979,arebee,10/26/2014,2014,10,26,2574,Lake of the Woods 2,10/26/2014,2014,10,26,2574,0,40.20550897,-88.39516193,Apis mellifera,Apis mellifera,,f,f,female,https://beespotter.org/bee/3979
3982,twotringas,10/28/2014,2014,10,28,2576,honey bee on Marigold,10/27/2014,2014,10,27,2575,1,42.30435252,-89.1567564,Apis mellifera,Apis mellifera,,f,f,female,https://beespotter.org/bee/3982
3983,twotringas,10/28/2014,2014,10,28,2576,honey bee on Marigold,10/27/2014,2014,10,27,2575,1,42.30440013,-89.15673494,Apis mellifera,Apis mellifera,,f,f,female,https://beespotter.org/bee/3983
3984,twotringas,10/28/2014,2014,10,28,2576,honey bee on Broccoli,10/27/2014,2014,10,27,2575,1,42.30437236,-89.15674567,Apis mellifera,Apis mellifera,,f,f,female,https://beespotter.org/bee/3984
3985,twotringas,10/28/2014,2014,10,28,2576,honey bee on Broccoli,10/27/2014,2014,10,27,2575,1,42.30440806,-89.15670276,Apis mellifera,Apis mellifera,,f,f,female,https://beespotter.org/bee/3985
3994,Tmarlin,12/7/2014,2014,12,7,2616,Honey bee with green thorax,12/6/2014,2014,12,6,2615,1,41.60434019,-87.56103516,Apis mellifera,Apis mellifera,,f,f,female,https://beespotter.org/bee/3994
